,titles,category
0,옵티멈뉴트리션 골드 스탠다드      웨이 프로틴 파우더 드링크 믹스 더블 리치 초콜릿       ,Food
1,빨강고구마 황치즈 떡볶이 밀키트 밀떡볶이,Food
2,네슬레 네스퀵 초콜렛파우더        박스   개 초코,Food
3,뉴트리라이트 아세로라  비타민            캡슐,Food
4,동원샘물 무라벨         병  오늘출발 무배  생수    미니생수,Food
5,크라운제과 버터와플     ,Food
6,답례쿠키  종   수제쿠키답례품 결혼 시보해제 승진 퇴사선물 선택안함,Food
7,초신선 자몽 직수입 레드 자몽,Food
8,락토핏 생유산균   대        포,Food
9,뉴트리코스트 크레아틴     ,Food
10,인도미 미고랭라면    ,Food
11,   자연의품격 국산 유기농 양배추즙    포   양배추브로콜리즙,Food
12,삼양 불닭마요 소스     ,Food
13,지리산 천연 토종 벌꿀 아카시아꿀        병,Food
14,특  급 신선도 블랙타이거 새우              미 새우소금구이,Food
15,호랑이굴 한우 대창전골 모츠나베 술안주 캠핑 음식 밀키트 맛집,Food
16,더리틀스 콜라겐부스터        포,Food
17,동서식품 포스트 콘푸라이트      ,Food
18,청송 꿀 세척사과 껍질째먹는 경북 사과         ,Food
19,뉴트리원 정우성 콘드로이친 맥스       박스  개월분 소연골,Food
20,천일식품 천일 사누끼 우동   인분 세트 우동면   개 액상소스   개 건더기스프   개,Food
21,닥터린 슈퍼 글루타치온 맥스           매,Food
22,청송 엔비 부사 얼음골사과 못난이사과 유명한곳 사과  키로             ,Food
23,네오셀 마린 콜라겐    캡슐,Food
24,호그발트 모짜렐라 블럭 치즈      돈까스 튀김 간식,Food
