,titles,category
0,상품명                여자레이스금장버튼반팔블라우스 여자의류 여성의류 블라우스 반팔블라우스 버튼,Fashion
1,상품명       피앤비 로라 브이넥 라운드 티셔츠 블라우스 셔츠 여자민소매 여자블라우스 스트라이프셔츠,Fashion
2,상품명         대 귀여운 여친룩 레이스카라 블라우스 여대생코디 러블리코디   대코디 여친룩 데이트룩   대봄블,Fashion
3,상품명       여자 심플 직장인 학생 데일리 브이넥 반팔 블라우스 깔끔한반팔티 심플한여자반팔티 베이직반팔티,Fashion
4,상품명       데일리  컬러 여성 셔츠 블라우스 여성셔츠 롱셔츠 남방 블라우스 짝꿍닷컴,Fashion
5,상품명       여자 데일리 편한 스트라이프 패턴 나뭇잎 자수 셔츠 여자남방 여자셔츠 여성데님셔츠 블라우스 여자,Fashion
6,상품명       데일리 여성 가오리핏 베이직한 패턴 캐주얼 셔츠 여성상의 여자상의 여자블라우스 여성블라우스 블,Fashion
7,상품명       깔끔한 디자인 큐빅 단추 여성스러운 무지 블라우스 블라우스 여성블라우스 여자블라우스 흰색블라우,Fashion
8,상품명       오버핏 루즈핏 셔츠 이너시스루 이쁜 편안한 블라우스 오버핏 루즈핏 셔츠 이너시스루 이쁜,Fashion
9,상품명       레이스 편안한 오버핏 구김없는 가을 겨울 블라우스 레이스 편안한 오버핏 구김없는 가을,Fashion
10,상품명       여성 골덴 긴팔 셔츠 레드 기본 카라 가벼운 아우터 코듀로이셔츠 여성가을셔츠 여성가을남방 간절기,Fashion
11,상품명       코듀로이 긴팔 롱남방 여성 가을 겨울 간절기 셔츠 여자남방 여자셔츠 캐주얼셔츠 캐쥬얼셔츠 골덴남,Fashion
12,상품명       코듀로이 포켓 긴팔 남방 여성 가을 겨울 간절기 셔츠 여자남방 여자셔츠 캐주얼셔츠 캐쥬얼셔츠 골,Fashion
13,상품명       여성 넥니트 결혼식하객룩 여성복 기본티 가성비티 여성 넥니트 결혼식하객룩 여성복 기본티 가성비,Fashion
14,상품명       여리여리 직장인 오피스 러블리 꾸안꾸 여성 블라우스 여자블라우스 여자코디 여자긴팔 오피스룩 직,Fashion
15,상품명       피앤비 레아 블라우스 브이넥 라운드 티셔츠 셔츠 여자민소매 여자블라우스 스트라이프셔츠,Fashion
16,상품명       엘케이트 여성 셔츠        여자 코듀로이 골덴 남방 브라운 그레이 색 여성의류 여자의류,Fashion
17,상품명       베이직 루즈핏 코듀로이 여성 셔츠 남방 여성셔츠 롱셔츠 남방 블라우스 짝꿍닷컴,Fashion
18,상품명  넥블라우스 반팔        심플 쉬폰블라우스 댄디한,Fashion
19,상품명 여성용 후드 체크 무늬 블라우스 빈티지 의류 긴팔 티셔츠 예쁘고 봄 가을 패션,Fashion
20,상품명        여성 셔츠 프렌치 빈티지 블라우스 화이트 봄 버튼 업 뾰족한 칼라 긴 퍼프 슬리브 진주 솔리드 탑,Fashion
21,상품명           차이나넥 루즈핏 블라우스  색상,Fashion
22,상품명           꼬임포인트 블라우스  색상,Fashion
23,상품명           캐릭터자수 밑단끈 셔츠  색상,Fashion
24,상품명           언발 체크 카라셔츠  색상,Fashion
25,상품명 로미홀리 소매 퍼프 체크 셔츠    ,Fashion
26,상품명 로미홀리 소매 퍼프 체크 셔츠    ,Fashion
27,상품명           볼륨소매 브이넥 셔츠블라우스  색상,Fashion
28,상품명 긴팔 블라우스 셔츠 남방 여자 여성 봄 가을 카라 브이넥 기본 베이직 데일리 오피스 하객,Fashion
29,상품명             레이스 스티치 카라 셔츠,Fashion
30,상품명           브이넥 스트라입 셔츠  색상,Fashion
31,상품명 시크릿송 브이넥 펀칭블라우스          ,Fashion
32,상품명 로미홀리 럭셔리 블링 쉬폰 민소매 나시,Fashion
33,상품명           플라워 프린트 새틴블라우스,Fashion
34,상품명           소매셔링 스트라입 블라우스 색상,Fashion
35,시드마켓 상품명 린넨 버튼 트임 남방          빅사이즈 여성의류,Fashion
36,시드마켓 상품명 오픈 카라 롤업 남방          빅사이즈 여성,Fashion
37,시드마켓 상품명 줄지 레이어드 카라티          빅사이즈 여성,Fashion
38,시드마켓 상품명 주얼 체크 롱 남방          빅사이즈 여성의류,Fashion
39,시드마켓 상품명 발리스트라이프롱셔츠         빅사이즈 여성의류,Fashion
40,시드마켓 상품명 오버핏체크카라셔츠         빅사이즈 여성의류,Fashion
41,로로스키니 상품명 로로비 여성 스트라이프 롱셔츠 여자 오버핏       ,Fashion
42,시드마켓 상품명 오버 롱 스트라이프 셔츠          빅사이즈 여성,Fashion
43,시드마켓 상품명 로제 스트라이프 셔츠          빅사이즈 여성,Fashion
44,시드마켓 상품명 로그 박시 체크 남방          빅사이즈 여성의류,Fashion
45,시드마켓 상품명 브이줄지레이어드남방         빅사이즈 여성의류,Fashion
46,시드마켓 상품명 단추 트임 와이드 롤업 남방          빅사이즈 여성의류,Fashion
47,상품명             컬러 오버핏체크남방,Fashion
48,시드마켓 상품명 애프터 포근 체크 남방          빅사이즈 여성의류,Fashion
49,상품명           자수 차이나카라 롱셔츠  색상,Fashion
50,상품명    여성 가오리핏 체크 셔츠          여자셔츠 여자남방 체크셔츠 체크남방 가오리핏셔츠,Fashion
51,상품명    여성 가을신상 포켓 체크 셔츠          여자셔츠 여자남방 체크셔츠 체크남방 가을셔츠,Fashion
52,상품명    여성 가을신상 오버핏 체크 셔츠          여자셔츠 여자남방 체크셔츠 체크남방 가을셔츠,Fashion
53,상품명    여성 베이직 롱셔츠          여자셔츠 여자남방 롱셔츠 롱남방 데일리셔츠,Fashion
54,상품명    여성 캐주얼 코듀로이 셔츠          여자셔츠 여자남방 긴팔셔츠 코듀로이셔츠 골덴셔츠,Fashion
55,상품명    여성 로브 셔츠 자켓          여자셔츠자켓 여자롱자켓 롱셔츠 로브셔츠 로브자켓,Fashion
56,상품명    차르르 루즈핏 블루 셔츠        차르르셔츠 블루셔츠 레이어드셔츠 데일리셔츠 쨍한블루셔츠,Fashion
57,상품명    데일리 컬러 스트라이프 셔츠        여자셔츠 롱셔츠 스트라이프셔츠 여름셔츠 루즈핏셔츠,Fashion
58,시드마켓 상품명 차르르 새틴 쿨 셔츠          빅사이즈 여성,Fashion
59,상품명    멋스러운 귀여운 유니크 캐주얼 간절기 면 이중지 핀탁 숏 블라우스 티 숏블라우스 핀탁블라우스 유니,Fashion
60,시드마켓 상품명 우디 체크 오버 카라 셔츠          빅사이즈 여성의류,Fashion
61,시드마켓 상품명 코튼 버튼 포켓 셔츠          빅사이즈 여성의류,Fashion
62,시드마켓 상품명 더블 배색 줄지 카라 셔츠          빅사이즈 여성의류,Fashion
63,상품명    베이직 체크 긴팔 셔츠         여자체크셔츠 여성여름셔츠 여성셔츠 얇은긴팔셔츠 체크남방,Fashion
64,상품명    여성 여름 린넨 수영복 커버 티셔츠 린넨티셔츠 여름티셔츠 컬러티셔츠 여성블라우스 패턴티셔츠,Fashion
65,시드마켓 상품명 코튼 블랙 데님 자켓 셔츠          빅사이즈 여성,Fashion
66,시드마켓 상품명 백버튼 롤업 롱 트임 셔츠          빅사이즈 여성,Fashion
67,상품명 소브리노 골지 포켓 캐주얼 스냅 버튼 남방       ,Fashion
68,상품명 아처 가슴 포켓 체리 블라우스       ,Fashion
69,시드마켓 상품명 스트링 포켓  부 셔츠          빅사이즈 여성의류,Fashion
70,상품명 여성 여름 린넨 수영복 커버 티셔츠,Fashion
71,시드마켓 상품명 아사면 주름 롱 남방          빅사이즈 여성의류,Fashion
72,상품명 레이스 차이나 코튼 페이크 블라우스 포인트셔츠 레이어드블라우스 여성미 뿜뿜 페이트셔츠 넥카라 케이프,Fashion
73,상품명 루즈핏 박시핏 데님 셔츠 원피스 청남방        ,Fashion
74,상품명             면 자켓,Fashion
75,상품명             컬러 양면자켓,Fashion
76,상품명             체크남방,Fashion
77,상품명             체크남방,Fashion
78,상품명             컬러셔츠,Fashion
79,상품명             체크셔츠남방,Fashion
80,상품명             체크남방,Fashion
81,상품명             셔츠,Fashion
82,상품명             코듀로이 셔츠,Fashion
83,상품명            스트라이프 박스롱남방,Fashion
84,상품명            스트라이프남방,Fashion
85,상품명            체크 박스롱남방,Fashion
86,상품명            체크 롱 남방,Fashion
87,시드마켓 상품명 데일리 무지 카라 셔츠          빅사이즈 여성의류,Fashion
88,상품명 블라우스코디 셔츠 캐쥬얼 정장블라우스 여성셔츠 봄,Fashion
89,상품명           허리셔링 쉬폰 블라우스  색상,Fashion
90,시드마켓 상품명 체크 루즈 포켓 셔츠          빅사이즈 여성,Fashion
91,상품명 여성 여름 마담 플레어  부소매 플라워 블라우스,Fashion
92,상품명 여자 데일리 스트릿 캐주얼 패션  라인 롱 남방 셔츠,Fashion
93,상품명          여자플라워시스루  긴팔블라우스,Fashion
94,상품명 브이넥 레이스블라우스 반팔셔츠 여름옷 데일리,Fashion
95,상품명 베이직 정장 슬랙스 셔츠 카라 블라우스 출근룩  컬러,Fashion
96,상품명 여자 청셔츠 데이트 패션 코디 긴팔 데님 청남방 코,Fashion
97,상품명 남자 패턴셔츠 카라 소매 데님 포인트 흰색 셔츠 남,Fashion
98,상품명 남자 오버핏 청 데님댄디 스타일 캐주얼 남방 셔츠,Fashion
99,상품명 남자 가을 캐주얼 패션 청 데님 카라 투단추 티셔츠,Fashion
100,상품명 남성 데님 와이드핏 여름 반팔셔츠 캐주얼셔츠  색,Fashion
101,상품명 여자 마느낌 긴팔 셔츠 남방 슬림 여름 캐주얼 홈웨,Fashion
102,상품명 시원한 여름 패션 태양 보호 얇은 블라우스 여성 셔,Fashion
103,상품명 쿨샵 촘촘한 스트라이프 여성셔츠 데일리 봄가을셔,Fashion
104,상품명 배색 스트라이프 여성 셔츠 패션남방 오버핏 루즈핏,Fashion
105,상품명  컬러 루즈핏 슬리브리스 차르르 보들보들 여성 셔,Fashion
106,상품명 체크남방 여성코디 체크무늬셔츠 여성셔츠 남방 깔,Fashion
107,상품명 시원한 소재 라이트 파스텔 컬러 여성 셔츠 가디건,Fashion
108,상품명  컬러 데일리 무지 여성 셔츠형 자켓,Fashion
109,상품명 체크남방 체크무늬셔츠 여성코디 여성셔츠 남방 깔,Fashion
110,상품명 와이드핏 여성셔츠 파스텔컬러 루즈핏 셔츠블라우스,Fashion
111,상품명 블라우스 셔츠블라우스 레이스 여성셔츠 모임 루즈,Fashion
112,상품명 엘케이트 여성 셔츠         카라 코튼 베이직 남방,Fashion
113,상품명 엘케이트 여성 셔츠         카라 오버핏 데일리 남,Fashion
114,상품명 여성 셔츠 롱원피스    나들이 데일리 긴팔 원피스,Fashion
115,상품명 여성 셔츠 맥시원피스    나들이 하객룩 롱드레스,Fashion
116,상품명 시스루 쉬폰  컬러 체크셔츠 여성 루즈핏 블라우스,Fashion
117,상품명 차이나 카라 청남방 남자 데님 셔츠 연청 진청 남방,Fashion
118,상품명          자수라인 해지 연청남방 데님셔츠 데님남,Fashion
119,상품명 여성 루즈핏 섹쉬한 끈나시 원피스 체크 셔츠 세트,Fashion
120,상품명 세련된 여성 롱셔츠 루즈핏 체크 셔츠블라우스,Fashion
121,상품명 남자셔츠 청남방 데님셔츠 오버핏 진청 연청 반팔티,Fashion
122,상품명 차이나넥 데님 포켓 남자셔츠,Fashion
123,상품명 남성 중청 진청 남방 데님셔츠 레이어드셔츠 남친룩,Fashion
124,상품명 여성 데일리 청 데님 남방 셔츠 사계절 데이트룩,Fashion
125,상품명 여성 끈나시 원피스 루즈핏 체크 셔츠 세트 코디,Fashion
126,핫핑 상품명 브릿미 루즈핏 탄탄코튼셔츠,Fashion
127,상품명 투포켓 데님셔츠   미미나나,Fashion
128,상품명 여성 블라우스 정장 루즈핏 오피스룩 칠부 하객룩 소매 노카라  넥 리본  부 셔츠    ,Fashion
129,홈쇼핑 상품      상품명 코지 쉬폰 시스루 프릴넥 스트랩  부 블라우스,Fashion
130,상품명 여름 반팔 블라우스 여성 셔츠 구김없는        ,Fashion
131,상품명 블루 스트라이프 롱 셔츠       ,Fashion
132,상품명 제시 가슴 포켓 청남방       ,Fashion
133,상품명 여성 가을 겨울 기본 셔츠블라우스              ,Fashion
134,상품명 하절기 여성의류 체크 셔츠블라우스              ,Fashion
135,상품명 여자 긴 셔츠 오버핏 롱 후드 셔츠       ,Fashion
136,상품명 여자남방 캐주얼 나뭇잎 셔츠       ,Fashion
137,상품명           진주링 벨로아 블라우스,Fashion
138,상품명 여성 편한 루즈핏셔츠 스웨셔츠 레이어드 데님셔츠,Fashion
139,상품명 여성 편한셔츠 데일리 캐주얼셔츠 스웨셔츠 데님셔츠,Fashion
140,상품명 바둑 패턴 골지 와이드 허리밴딩팬츠          ,Fashion
141,상품명 켓밸 오버핏 뒷 영문 프린팅 남방          ,Fashion
142,상품명 레이어드 셔츠      망사레이스 ,Fashion
143,상품명           화이트카라 블랙체크블라우스,Fashion
144,상품명           네모버클 블라우스  색상,Fashion
145,상품명           야생플라워 블라우스 색상,Fashion
146,상품명            세로물결 블라우스  종,Fashion
147,상품명 반팔 데님 셔츠자켓        ,Fashion
148,리체 상품명        줄무늬 민소매 셔츠 남방 면마 반바지 선택,Fashion
149,상품명 로미홀리 여성남방 여자셔츠 솔리드셔츠 빅사이즈 롱셔츠,Fashion
150,상품명 블라우스 남방 셔츠 여자 여성 여름 기본 베이직 데일리 하객 오피스 데이트 카라,Fashion
151,상품명 여성 베이직 긴팔 여름 셔츠        ,Fashion
152,리스트 상품명 리스트       서핑 백 리본 셔츠,Fashion
153,상품명 로미홀리 프란시스 여성 블라우스,Fashion
154,상품명 로미홀리 빅사이즈 봄 가을 긴팔셔츠 롱티셔츠              ,Fashion
155,상품명 여성블라우스 청남방 루즈핏 데님 셔츠    ,Fashion
156,상품명 로미홀리 여자 롱 남방 셔츠 린넨 간절기 루즈핏 미시룩 학생 데일리룩 롱남방,Fashion
157,상품명 여성용 오버핏 반팔 셔츠    ,Fashion
158,상품명 블랙 브이넥 여자 벌룬 퍼프 소매 셔츠 루즈핏 긴팔 블라우스 러플 시스루 레이스,Fashion
159,상품명           라인카라 블라우스 화이트 한색상,Fashion
160,상품명 여성 여자 카라 셔츠 데일리 간절기 긴팔 캐주얼 빅사이즈 큰사이즈 가을 겨울 베이직 남방         ,Fashion
161,상품명 로미홀리 엔젤 자수레이스 블라우스,Fashion
162,상품명 펀칭 패턴 레이어드 넥케이프 페이크 카라 이너셔츠 이너카라 목만있는 넥카라 차이나카라 레이스카라,Fashion
163,상품명 로미홀리 이건 사야해 도트 블라우스      ,Fashion
164,공식 상품 오엠티 상품명          여성 청남방 박시 빅사이즈여성의류 오버핏 긴팔 데님셔츠,Fashion
165,벤시몽 상품명       벤시몽 남녀 클래식핏 옥스포드 셔츠  종 택 ,Fashion
166,상품명 여성 스트라이프 컬러 셔츠 빅카라 블라우스,Fashion
167,상품명 로미홀리 여성블라우스 블링라인 장식 블라우스 긴팔,Fashion
168,상품명 예쁜 리본 매듭 넓은 카라 여친룩 여성 예쁜 블라우스,Fashion
169,상품명 간절기 코디 코듀로이 포켓 포인트 데일리 여성 남방,Fashion
170,상품명 여성 심플 베이직 새틴 반팔셔츠 상의 캐주얼룩 오피스룩 하객룩 여름남방 무지블라우스 정장블라우스 셔츠,Fashion
171,상품명 러플 리본 하이넥 페이크 넥케이프 페이크 카라 이너셔츠 이너카라 레이어드 목만있는 넥카라 차이나카라,Fashion
172,상품명 로미홀리 청 여성 데님 남방 루즈핏 셔츠 빅사이즈 워싱    ,Fashion
173,상품명           냉감폴리 프린트 블라우스,Fashion
174,상품명            부소매 스트라입셔츠  색상,Fashion
175,상품명 퍼프 소매 카라 스트라이프 셔츠       ,Fashion
176,시드마켓 상품명 무지 카라 루즈 오버 셔츠          빅사이즈 여성의류,Fashion
177,시드마켓 상품명 캐주얼 가을 체크 셔츠          빅사이즈 여성의류,Fashion
178,시드마켓 상품명 크림체크오버셔츠         빅사이즈 여성의류,Fashion
179,시드마켓 상품명 치즈체크크롭후드셔츠         빅사이즈 여성의류,Fashion
180,시드마켓 상품명 빈티지 스트라이프 패치 남방          빅사이즈 여성,Fashion
181,상품명 베이직 체크 긴팔 셔츠        ,Fashion
182,시드마켓 상품명 메이플 체크 남방          빅사이즈 여성,Fashion
183,시드마켓 상품명 포켓 데님 롱셔츠          빅사이즈 여성의류,Fashion
184,시드마켓 상품명 오버로그 체크 남방          빅사이즈 여성,Fashion
185,시드마켓 상품명 투어 스트라이프 셔츠          빅사이즈 여성,Fashion
186,시드마켓 상품명 스탠다드 체크 남방          빅사이즈 여성,Fashion
187,시드마켓 상품명 베이직 스트라이프 셔츠          빅사이즈 여성,Fashion
188,피턴진 상품명            여자코듀로이골덴남방,Fashion
189,시드마켓 상품명 체크 언발 오버핏 셔츠          빅사이즈 여성,Fashion
190,시드마켓 상품명 크롭 반팔 스트라이프 남방          빅사이즈 여성,Fashion
191,시드마켓 상품명 스트링 셔링 후드 남방          빅사이즈 여성,Fashion
192,상품명 여성 로브 셔츠 자켓         ,Fashion
193,상품명 여성 캐주얼 코듀로이 셔츠         ,Fashion
194,시드마켓 상품명 버터 체크 블라우스          빅사이즈 여성의류,Fashion
195,시드마켓 상품명 루즈 시스루 체크 셔츠          빅사이즈 여성,Fashion
196,시드마켓 상품명 스트라이프 코튼 패치 남방          빅사이즈 여성,Fashion
197,시드마켓 상품명 잔줄 라운드 남방          빅사이즈 여성의류,Fashion
198,시드마켓 상품명 프리즌 코튼 체크셔츠          빅사이즈 여성의류,Fashion
199,시드마켓 상품명 이벤트 타탄 체크셔츠          빅사이즈 여성,Fashion
200,시드마켓 상품명 포켓 체크 롱남방          빅사이즈 여성의류,Fashion
201,시드마켓 상품명 체크 수술 카라 블라우스          빅사이즈 여성,Fashion
202,시드마켓 상품명 토르 오버 체크 남방          빅사이즈 여성의류,Fashion
203,로로스키니 상품명 로로비 여성 쉬폰 브이넥 카라 셔츠 블라우스       ,Fashion
204,로로스키니 상품명 로로비 여성 폴카 토트 브이넥 셔츠       ,Fashion
205,시드마켓 상품명 겉기모 체크 롱남방          빅사이즈 여성,Fashion
206,시드마켓 상품명 오픈 카라 체크 남방          빅사이즈 여성의류,Fashion
207,시드마켓 상품명 마카롱체크블라우스         빅사이즈 여성의류,Fashion
208,시드마켓 상품명 체크 주름 포켓 셔츠          빅사이즈 여성,Fashion
209,시드마켓 상품명 썸머 아사면 롱남방          빅사이즈 여성,Fashion
210,시드마켓 상품명 롤업 스트라이프 셔츠          빅사이즈 여성의류,Fashion
211,시드마켓 상품명 롤업 포켓 린넨 셔츠          빅사이즈 여성의류,Fashion
212,상품명     굵은스트박스남방 면롱남방 여성스트남방 남방,Fashion
213,상품명     면체크남방 여성체크남방 체크남방 여성롱남방,Fashion
214,시드마켓 상품명 언발 오버핏 체크 남방          빅사이즈 여성,Fashion
215,시드마켓 상품명 배색 체크 수술 블라우스          빅사이즈 여성,Fashion
216,시드마켓 상품명 패치 스트라이프 포켓 남방          빅사이즈 여성,Fashion
217,시드마켓 상품명 파스텔체크카라남방         빅사이즈 여성의류,Fashion
218,시드마켓 상품명 드로잉 파리 스트라이프 남방          빅사이즈 여성,Fashion
219,로로스키니 상품명 여자 체크 남방 셔츠 기본 블라우스       ,Fashion
220,시드마켓 상품명 헨리넥 체크 롱남방          빅사이즈 여성,Fashion
221,시드마켓 상품명 파리 드로잉 스트라이프 셔츠          빅사이즈 여성,Fashion
222,상품명             셔츠카라 니트스웨터  색상,Fashion
223,시드마켓 상품명 체크 카라 포켓 블라우스          빅사이즈 여성,Fashion
224,시드마켓 상품명 힙 포켓 가오리 오버 셔츠          빅사이즈 여성의류,Fashion
225,시드마켓 상품명 와이드핏 백버튼 롤업 셔츠          빅사이즈 여성,Fashion
226,상품명 노버튼 차이나 카라 언발 기장 블라우스       ,Fashion
227,시드마켓 상품명 스탠다드 체크 롱 남방          빅사이즈 여성,Fashion
228,시드마켓 상품명 어톰 체크 오픈카라 셔츠          빅사이즈 여성의류,Fashion
229,시드마켓 상품명 골덴 오버 포켓 남방          빅사이즈 여성의류,Fashion
230,상품명             자수스티칭 새틴블라우스  색상,Fashion
231,상품명           스트라입 얇은  부 롱셔츠  색상중 택,Fashion
232,상품명 가바바 여성용 반팔 블라우스,Fashion
233,상품명 알미론 도트 패턴 블라우스          ,Fashion
234,시드마켓 상품명 피치 무지 박시 라운딩 남방          빅사이즈 여성,Fashion
235,시드마켓 상품명 체크 패턴 반팔 셔츠          빅사이즈 여성,Fashion
236,상품명 차르르 루즈핏 블루 셔츠       ,Fashion
237,상품명 데일리 컬러 스트라이프 셔츠       ,Fashion
238,시드마켓 상품명 단가라 배색 포인트 셔츠          빅사이즈 여성,Fashion
239,상품명 제너러블셔츠,Fashion
240,상품명 시어러 루즈핏 세로 스트라이프 블라우스          ,Fashion
241,시드마켓 상품명 롱 트임 롤업 와이드 남방          빅사이즈 여성,Fashion
242,시드마켓 상품명 골덴 포켓 크롭 남방          빅사이즈 여성의류,Fashion
243,시드마켓 상품명 포켓 체크 박시 롱 남방          빅사이즈 여성,Fashion
244,시드마켓 상품명 가을 체크 코튼 남방 셔츠          빅사이즈 여성,Fashion
245,시드마켓 상품명 피치 체크 오버 롱셔츠          빅사이즈 여성,Fashion
246,상품명 빅사이즈 오피스룩 레이스 코디 여자셔츠코디 겨울,Fashion
247,상품명 사무실 데이트 여자셔츠코디 여자남방 블라우스 여성,Fashion
248,상품명 블라우스 여성셔츠코디 가을 캐쥬얼 여자옷코디 봄,Fashion
249,상품명 겨울 정장 롱셔츠 오피스룩 셔츠블라우스 데이트 봄,Fashion
250,시드마켓 상품명 도톰 컬러 체크 카라 남방          빅사이즈 여성,Fashion
251,공구우먼 상품명 제작 튜온 루즈핏 코듀로이 셔츠       빅사이즈 여성의류,Fashion
252,시드마켓 상품명 데이 체크 오버 카라 남방          빅사이즈 여성의류,Fashion
253,상품명 가을 여성블라우스 프릴블라우스 캐쥬얼 오버핏 셔츠,Fashion
254,상품명 레이스 정장블라우스 여성남방 사무실 신상 여자셔츠,Fashion
255,상품명 여자남방 여성 쉬폰 봄 블라우스코디 여성남방 가을,Fashion
256,상품명 쉬폰 셔츠 여성블라우스 봄 여자셔츠코디 가을 겨울,Fashion
257,상품명 진주 포인트 레이어드 넥 케이프 이너셔츠 넥케이프 이너카라 레이어드 목만있는 넥카라 차이나카라,Fashion
258,백화점 상품 케네스 레이디 상품명  롯데백화점 클라렛 타이넥 블라우스          ,Fashion
259,백화점 상품 케네스 레이디 상품명  롯데백화점 오픈카라 솔리드 포켓 블라우스          ,Fashion
260,    상품명 긴팔 체크 남방  칼라        여자셔츠 여자티셔츠 여성셔츠 여성티셔츠 여성상의,Fashion
261,상품명 여자 블라우스 심플한 셔츠 자수 브이넥 벌룬 긴팔 블라우스 오피스룩 출근룩 여성상의 자수,Fashion
262,상품명           새틴 리본블라우스  색상 블라우스 브라우스 새틴셔츠 새틴블라우스 새,Fashion
263,상품명 캐주얼 여성용 레이스 업 오프 숄더 블라우스 퍼프 슬리브 화이트 셔츠 빈티지 러플 크롭탑 단색 블랙,Fashion
264,상품명 엘리시아        블라우스 셔츠 남방 하객룩 빅사이즈,Fashion
265,상품명 베베디 쇼스나 여성 롱 긴팔남방 셔츠,Fashion
266,상품명 스페셜모닝 밑단 엣지 남방 고밀도 코튼 루즈핏 박시 언발란스 볼륨 여성 셔츠 와이드핏 남방,Fashion
267,상품명        등레터패치 빈티지 청자켓 청아우터 야상 데님,Fashion
268,상품명 기본스타일 원피스셔츠        루즈핏 롱 화이트셔츠      ,Fashion
