,titles,category
0,에스트라 테라크네    클리어 딥 클렌징 폼      ,Makeup
1,독일          손톱깎이 발톱 정리 세트 미스터그린 레인보우 티타늄        ,Makeup
2,버츠비 틴티드 립밤      ,Makeup
3,클리오 킬 브로우 듀얼 타투 펜     ,Makeup
4,메종마르지엘라 레플리카 재즈클럽 오 드 뚜왈렛,Makeup
5,헤라 멜라솔브 프로그램 딥 클렌징 폼      ,Makeup
6,스틸라 매그니피센트 메탈 글리터 글로우 리퀴드 아이섀도우      ,Makeup
7,에스쁘아 노웨어 립스틱 샤인     ,Makeup
8,일리윤 세라마이드 아토 집중 크림      ,Makeup
9,딥티크 롬브르 단 로 오 드 뚜왈렛,Makeup
10,아론 트리트먼트 크림 염색약      실크 리페어 컬러 미용실 새치커버 셀프 저자극 순한 멋내기 뿌리 흰머리 밝은색 갈색 브라운 세치 바르는 다크 애쉬 블랙 부분 그레이 탈색 ,Makeup
11, 본사정품  인셀덤 비비 크림     아쿠아 데일리,Makeup
12,아미니 플라워 테라피 바디워시 체리 블라썸       ,Makeup
13,반코르 닥터 아크네 바하 폼클렌저,Makeup
14,셀라피 에이리페어 크림     ,Makeup
15,네이밍 레이어드 핏 쿠션            ,Makeup
16,어바웃톤 블러 파우더 팩트   ,Makeup
17,세븐피엠 셀프 스트레이트 남자 다운펌 볼륨 여성 매직펌 약 잔머리펌 헤어팩    ,Makeup
18, 가성비대용량 온더바디 코튼풋 발을씻자 풋샴푸       레몬  개,Makeup
19,마렌 마스카라형 블랙 속눈썹영양제,Makeup
20,비오투름 클렌징 밀크      ,Makeup
21,애경바세린 리프팅 리페어 로션      ,Makeup
22,맥 글로우 플레이 립밤     ,Makeup
23,메디필 레드 락토 콜라겐 클리어      ,Makeup
24,샤넬 바움 에쌍씨엘 글로우 스틱   ,Makeup
