,titles,category
258,엘로엘 상품명 엘로엘  초보정 파데프리 플러스 빅 선쿠션 리필 ,Makeup
259,공식 상품 에뛰드 상품명 에뛰드 선프라이즈 마일드 에어리 피니쉬  개,Makeup
260,상품명 헤라 선메이트 크림 레포츠                    ,Makeup
261,엘로엘 상품명 엘로엘 팡팡 빅 선쿠션       년 최신상 본품  리필  미니 ,Makeup
262,공식 상품 프리메라 상품명 프리메라 리페어링 세라캡슐    프로텍터 더블 구성   추가 증정,Makeup
263,제나벨 상품명 제나벨 레이저 수딩 선스크린         ,Makeup
264,홈쇼핑 상품 제나벨 상품명      톤업 선크림,Makeup
265,백화점 상품 랑콤 상품명 랑콤        엑스퍼트      세트   스킨케어  종 키트 ,Makeup
266,공식 상품 닥터지 상품명 그린 마일드 업 선 스틱     듀오 기획세트,Makeup
267,네이처리퍼블릭 상품명  공식몰  네이처리퍼블릭      캘리포니아 알로에 보송 선스틱              ,Makeup
268,공식 상품 셀퓨전씨 상품명 어드밴스드 클리어 썬스크린       쿠폰가      원 ,Makeup
269,상품명     톤 업 프로텍션 선             썬크림,Makeup
270,상품명 엘로엘  초보정 파데프리 플러스 선쿠션 본품  리필 ,Makeup
271,공식 상품 이니스프리 상품명 유브이 액티브 포어리스 선스크린     ,Makeup
272,더페이스샵 상품명 더페이스샵 파워 롱래스팅 핑크 톤업 선     ,Makeup
273,홈쇼핑 상품 리에노 상품명 장윤정      온가족선쿠션 리에노 수분 듬뿍 빅선쿠션   개,Makeup
274,한국화장품 상품명 릴랙시아 에센셜 모이스처 선크림                    ,Makeup
275,상품명 달바 달바 에어 핏 프레쉬 선 스틱                ,Makeup
276,헤라 상품명 헤라 선 메이트 레포츠 프로 워터프루프               개,Makeup
277,상품명 헤리에타 썬케어 퍼펙트 멀티 선크림            ,Makeup
278,셀퓨전씨 상품명 셀퓨전씨 롯데단독 빠른배송 토닝 썬스크린           체험팩,Makeup
279,    상품명     내추럴 퍼펙션 더블 쉴드 선스틱   개,Makeup
280,라비다 상품명 코리아나 라비다 선 솔루션 프레쉬 선 에센스      ,Makeup
281,라운드어라운드 상품명 라운드어라운드 그린티 시카선로션            기획,Makeup
282,공식 상품 이니스프리 상품명 안티에이징 세럼 선스크린                    ,Makeup
283,상품명 알프레도 선블록 크림      자외선차단 끈적임없는,Makeup
284,상품명 예리나 선스틱 데일리 썬스틱 스틱선크림 썬크림    ,Makeup
285,애터미 상품명 애터미 선크림 베이지 색상       썬크림 정품,Makeup
286,백화점 상품 에스티로더 상품명  신세계강남점 리 뉴트리브 래디언트 유브이 베이스                  ,Makeup
287,공식 상품 닥터지 상품명 베이비 마일드 업 선     ,Makeup
288,이자녹스 상품명 이자녹스 유브이 선 프로     데일리 커버 듀오 기획세트 유브이 선 프로     데일리 커버 듀오 기획세트,Makeup
289,아이오페 상품명 아이오페     쉴드 선 프로텍터         선크림썬블럭,Makeup
290,셀퓨전씨 상품명 토닝 썬스크린             폼     수분크림     증정 ,Makeup
291,한율 상품명 한율 흰감국 광채 선크림             ,Makeup
292,시세이도 상품명 아넷사 퍼펙트    선스크린 스킨케어 밀크          브라이트닝 젤      ,Makeup
293,백화점 상품 에스티로더 상품명  신세계강남점 퍼펙셔니스트 프로 멀티 디펜스 아쿠아    울트라 라이트                  ,Makeup
294,닥터지 상품명 닥터지 그린 마일드 업 선      플러스                    ,Makeup
295,샹프리 상품명 피토 에센스 유브이 선스크린       개     ,Makeup
296,백화점 상품 헤라 상품명 갤러리아 기획헤라   프로텍터 멀티디펜스 듀오   프로텍터 트래블 파우,Makeup
297,니베아 상품명 니베아 선 울트라 센서티브 스킨 선 로션         ,Makeup
298,아넷사 상품명 아넷사 데이세럼        증정 브라이트닝      개,Makeup
299,상품명 헤라 선메이트 크림       개 레포츠      ,Makeup
300,공식 상품 비욘드 상품명 엔젤키즈 이지워시 선크림     ,Makeup
301,공식 상품 닥터지 상품명 블랙스네일 글루타치온 톤업 선         천만 국민 안티에이징 선크림 출시,Makeup
302,상품명 글랜무어 연꽃     알에스비 엑티브 선크림,Makeup
303,아나덴 상품명 아나덴    프로젝트 텐 쉴드 선케어 기획 세트,Makeup
304,달바 상품명 달바 워터풀 톤업 선크림       개,Makeup
305,동인비 상품명 동인비 선크림 멀티퍼펙션             ,Makeup
306,    상품명 온리포맨 올인원 에센스 포어프레쉬 올인원에센스        택  ,Makeup
307,상품명 플라워성분 오일프리 사계절 썬케어 선크림    ,Makeup
308,청미정 상품명 데일리 썬크림,Makeup
309,백화점 상품 시세이도 상품명  신세계강남점 화이트 루센트 데이 에멀전     ,Makeup
310,공식 상품 어퓨 상품명 어퓨 슈퍼에어핏 마일드 선크림 데일리 이엑스         ,Makeup
311,헤라 상품명 헤라 선 메이트 레포츠 프로 워터프루프    ,Makeup
312,백화점 상품 빌리프 상품명  신세계타임스퀘어점패션관          프로텍터 멀티 선스크린 플러스      세트,Makeup
313,아델리오 상품명 아델리오 톤업 프리스티지 홀인원 쿨링 빅 선쿠션    ,Makeup
314,공식 상품 아벤느 상품명 아벤느공식 선 미네랄 크림                 ,Makeup
315,공식 상품 리코셀 상품명 레포츠 썬 크림  개   데일리 썬 크림  개 대용량 선 블록 패밀리 워터프루프 저자극,Makeup
316,공식 상품 에뛰드 상품명 순정 디렉터 무기자차 선크림,Makeup
317,상품명 셀퓨전씨 토닝 썬스크린         ,Makeup
318,엘로엘 상품명 빅 엘로엘  초보정 파데프리  선쿠션 본  리    패치 증정,Makeup
319,공식 상품 에스트라 상품명 더마      장벽수분 무기자차 선크림     ,Makeup
320,백화점 상품 프리메라 상품명  신세계의정부점      리페어링 세라캡슐    프로텍터   유스 래디언스 비타티놀 세럼 세트,Makeup
321,큐어 뷰티  상품명 김정문알로에 큐어 아쿠아 마일드 쿨링 선쿠션     리필 개,Makeup
322,예화담 상품명 더페이스샵 예화담 환생고 진액 선크림     ,Makeup
323,상품명 지고트 화이트닝 유브이 썬 블록 크림      아동겸용      매입  ,Makeup
324,셀퓨전씨 상품명 셀퓨전씨 어드밴스드 클리어 썬스크린                   개  ,Makeup
325,엔프라니 상품명 엔프라니 알로에 워터프루프 선크림            ,Makeup
326,아이오페 상품명 아이오페   쉴드 에센셜 톤업 선     ,Makeup
327,토리든 상품명  토리든  토리든 다이브인 무기자차 마일드 선크림     ,Makeup
328,백화점 상품 헤라 상품명 헤라 기획    프로텍터 톤업 듀오 세트 트래블 파우치 증정,Makeup
329,공식 상품 아이소이 상품명 아이소이 슈퍼 마일드 카밍 선크림                  ,Makeup
330,시드물 상품명 닥터트럽 징크자차              초민감성 진정 장벽,Makeup
331,더페이스샵 상품명 더페이스샵 롱래스팅 선크림        개   톤업  내추럴선,Makeup
332,오휘 상품명 오휘 데이쉴드 퍼펙트 선 블랙 스페셜 세트 신제품,Makeup
333,엔프라니 상품명 엔프라니 실키핏 선블록            톤업 선크림  개,Makeup
334,백화점 상품 빌리프 상품명 갤러리아 빌리프    프로텍터 톤업 선스크린      세트,Makeup
335,백화점 상품 숨    상품명  신세계강남점 혜택 선어웨이 벨벳 선스틱 세트,Makeup
336,더샘 상품명 더샘 에코 어스 페이스 앤 바디 워터프루프 선크림,Makeup
337,빌리프 상품명 빌리프    프로텍터 멀티 선스크린 플러스      자외선차단제,Makeup
338,공식 상품 닥터지 상품명 그린 마일드 업 선 플러스       개         개 증정,Makeup
339,일리윤 상품명    일리윤 세라마이드 아토 수딩 젤         ,Makeup
340,라로슈포제 상품명 유비데아 안뗄리오스 톤업 라이트 크림     ,Makeup
341,인셀덤 상품명 인셀덤썬크림 아쿠아선젤 프로텍션     리뉴얼     년,Makeup
342,상품명 헤라   프로텍터 멀티디펜스                     개,Makeup
343,상품명 아이오페    쉴드 에센셜 선 프로텍터       개,Makeup
344,엘로엘 상품명 엘로엘 파노 빅 테니스 선쿠션 플러스,Makeup
345,김정문알로에 상품명 큐어 쿨링 선스틱      개,Makeup
346,더페이스샵 상품명 더페이스샵 파워 롱래스팅 선 크림     ,Makeup
347,오휘 상품명 오휘 데이쉴드 선 스틱                    ,Makeup
348,어퓨 상품명 어퓨 슈퍼에어핏 마일드 선크림 노세범 이엑스            ,Makeup
349,상품명 김정문알로에 썬크림    ,Makeup
350,공식 상품 케어존 상품명 케어존 데일리패밀리 선 케어 크림               ,Makeup
351,공식 상품 케어존 상품명       케어존 마일드 핑크 톤업 선크림 기획,Makeup
352,라운드랩 상품명 라운드랩 자작나무 수분 선크림 대용량           ,Makeup
353,백화점 상품     상품명  롯데백화점    페이스 프로텍터 어드밴스드     어드밴스드 디럭스   페이스워시 디럭스 ,Makeup
354,백화점 상품 헤라 상품명  신세계강남점 기획  프로텍터 멀티디펜스 듀오   프로텍터 트래블 파우치 카밍 마스크     선         ,Makeup
