,titles,category
0,홈쇼핑 상품 버커루 상품명 버커루 쇼킹초특가     기모셋업  종 여성,Fashion
1,상품명 데이트 편안한 회사원 캐주얼 난방   대 반팔 슬림 시원한 여름 봄 가을 여자 블라우스 와이셔츠 남방,Fashion
2,상품명 하얀 블라우스 흰색 셔츠 남방 카라티 데이트 패션 여성블라우스셔츠 여성셔츠블라우스 여성셔츠,Fashion
3,써스데이아일랜드 상품명  현대         번                 빅카라 니트 원피스              ,Fashion
4,백화점 상품 코데즈컴바인 상품명  현대백화점  코데즈컴바인 세일러 칼라 니트 베스트 원피스 세트           ,Fashion
5,상품명 스트라이프 그레이 셋업수트 베스트 통큰 고무줄바지 정장재킷 조끼 블레이져 와이드 밴딩팬츠,Fashion
6,상품명 키밍 여성 쉬폰 화이트 블라우스 베이직 브로치 셔츠,Fashion
7,상품명 여자 오버핏 자켓 와이드 슬랙스 세트              ,Fashion
8,상품명 셔츠 남방 기본 봄 솔리드 무지 베이직 긴팔 블라우,Fashion
9,상품명        화이트  미니원피스 브이넥 슬림 가을 겨울 하객 프릴 원피스 하객원피스 가을원피스 겨울원피스 미,Fashion
10,태그 상품명 크레오라 웜기모 세미 조거 팬츠  종 택  홈쇼핑 빅사이즈,Fashion
11,상품명 하프클럽버커루버커루 쇼킹초     기모셋업  종 여성,Fashion
12,셰프라인 비비드 상품명       여성 노카라 원버튼 겨울 정장 자켓,Fashion
13,리스트 상품명  현대       리스트 레더 벨티드 더블 원피스            ,Fashion
14,써스데이아일랜드 상품명  현대                       반 하이넥 잔 꽃 패턴 원피스              ,Fashion
15,상품명 로맨틱 소개팅 회사원 롱셔츠 면 블랙 편안한   대 여름 봄 가을 여자 블라우스 와이셔츠 남방,Fashion
16,상품명 니트 투피스 겨울 세트 스커트 셋업 롱     여성 라운드넥 하프 수트 빅 사이즈 카디건 트렌디 용수철 가을,Fashion
17,홈쇼핑 상품 상품명 런칭가      원 크레송             배색 니트 원피스  종,Fashion
18,백화점 상품 쥬시쥬디 상품명  현대백화점  쥬시쥬디  레이어드져지원피스          ,Fashion
19,상품명 여자자켓 가을겨울 커리어우먼 모직 숏 정장아우터,Fashion
20,상품명 여자 섹시 긴팔 크롭 니트 가디건 미니 짧은 치마 스커트 투피스 세트 클럽 룩 복장,Fashion
21,상품명 겨울 여성 기모 본딩바지   사이즈부터        ,Fashion
22,홈쇼핑 상품 상품명 초특가      팔주머니 기모 플리츠 셋업,Fashion
23,상품명 여성 퍼프 여름 소매 꽃무늬 플라워 블라우스 셔츠 봄 브라우스 루즈핏 예쁜 벌룬 긴팔,Fashion
24,상품명 새로본 지 봄여름   여성정장세트투피스면접 유니폼,Fashion
25,상품명 여자 체크 마이 간절기 가을 자켓 재킷,Fashion
26,상품명 남자   대   대 캐주얼 정장 바지 패션 대학생 코디,Fashion
27,상품명 여성 여름 정장 자켓 오버핏 얇은 긴팔 아우터 화이,Fashion
28,상품명 여성 여름 정장 자켓 오버핏 얇은 긴팔 아우터 그린,Fashion
29,상품명 키밍 여성 슬림핏 정장 자켓 오피스  부소매 코트,Fashion
30,상품명 여성블라우스 브이넥블라우스    세미정장 셔츠,Fashion
31,상품명 깔끔 심플 블라우스 세미정장 오피스룩 하객룩,Fashion
32,상품명 봄 가을 데님 자켓 여성 여자 청자켓 코트 정장 가,Fashion
33,상품명 여성 데이트룩 원피스  라인 실루엣 연그린 정장 치,Fashion
34,상품명 여자 캐주얼 자켓 깔끔한 롤업 재킷 기본 정장자켓,Fashion
35,상품명 가을하객 여자 블라우스 직장인 정장코디 데이트룩,Fashion
36,상품명 미니원피스 슬림핏 정장 가을 하객 셔링   라인,Fashion
37,상품명 체크패턴 루즈핏 오버핏 클래식 자켓 세미정장 캐주,Fashion
38,상품명 여성 봄 오피스룩 자켓형 블랙 화이트 정장 원피스,Fashion
39,상품명 여자 린넨  부 셔츠 블라우스 여성블라우스 여자블라우스 여성의류 여성남방 여성셔츠,Fashion
40,상품명 베이직 심플 깔끔한 라운드 롱원피스 니트 상하의세트,Fashion
41,상품명 롱셔츠 후드 긴팔 바람막이 긴남방 여자 캐주얼 코디,Fashion
42,상품명 캡내장 초슬림 슬리브리스 여성 나시티 이너탑 클럽룩,Fashion
43,상품명 여성 캐주얼 출근룩 베이직 자수 나뭇잎 셔츠 남방,Fashion
44,상품명 체크 패턴 짧은 소매 예쁜 여자 편한 블라우스 셔츠,Fashion
45,상품명 셔츠 블라우스 여자 기본 베이직 남방 캐주얼 나뭇잎,Fashion
46,상품명 여성 부드럽고 시원한 기본스타일 데일리 셔츠 남방,Fashion
47,상품명       셋트가격 앞단추  나시와 루즈핏면블라우스셋트,Fashion
48,상품명       예뻐 언발  부 면마블라우스 브라우스   ,Fashion
49,상품명 스트라이프 셔츠 여자 오버핏 넉넉한 품 블루 컬러,Fashion
50,상품명        레이스 시원한 마블라우스 마셔츠 면블라우스,Fashion
51,상품명        봄신상 너플장식 도트무늬 공주풍  넥블라우스,Fashion
52,상품명          여성 기본 긴팔 블라우스,Fashion
53,미센스 상품명  현대       미센스 랩스타일 프릴 패턴 원피스            ,Fashion
54,해외직구 상품 상품명 여성 여름 얇고 심플한 드레이프 자켓 빅사이즈 정장 자켓,Fashion
55,백화점 상품 상품명        신세계타임스퀘어점패션관 숲 투웨이 더블 원피스          ,Fashion
56,아울렛 상품 리스트 상품명  리스트  솔리드 스트레이트 팬츠              ,Fashion
57,상품명 여성 티셔츠 브이넥 이쁜 카라 반팔 이너 데이트룩 크롭티 니트,Fashion
58,시크라인 상품명 빅사이즈추가 정장원피스 결혼식원피스 오피스룩 하객룩 빅사이즈원피스,Fashion
59,백화점 상품 상품명  현대백화점  앤아틀리에 나인 현대충청         브이넥 케이블 니트 원피스,Fashion
60,써스데이아일랜드 상품명                 체크 롱 원피스             ,Fashion
61,쥬시쥬디 상품명  현대       쥬시쥬디  홀리데이빅카라니트베스트원피스         ,Fashion
62,상품명 빅사이즈 여성정장 롤업반오픈카라셔츠원피스      ,Fashion
63,상품명 차분한 세라복 코스프레 오렌지 블라썸 의상 세트 긴팔 일본 교복,Fashion
64,상품명 스카프 벨티드 일자 와이드핏 슬랙스 정장 팬츠 바지,Fashion
65,상품명                오버핏 라이더 자켓 패딩 겨울패딩 양털 양털자켓 겨울자켓,Fashion
66,상품명 미니원피스 브이넥 슬림 가을 겨울 하객 프릴 원피스 하객원피스 가을원피스 겨울원피스 미니원피스 여성정,Fashion
67,상품명          여자  부자켓  부밴딩팬츠 세트 여자의류 여성의류 자켓 밴딩팬츠 자켓세트 정장 정장세트 세미정,Fashion
68,상품명 여성겨울조거팬츠 융털골덴조거팬츠 화이트  여성하의 여자바지 여성바지 바지 조거팬츠,Fashion
69,백화점 상품 올리브데올리브 상품명  신세계센텀점  라인 트위드 원피스         ,Fashion
70,상품명          여자소매시스루긴팔블라우스 반팔블라우스 여름블라우스 여자블라우스 여성블라우스 블라우스 셔,Fashion
71,상품명          여자셔링반팔블라우스 반팔블라우스 여름블라우스 여자블라우스 여성블라우스 블라우스 셔츠 셔츠,Fashion
72,상품명          여자카라포인트반팔블라우스 반팔블라우스 여름블라우스 여자블라우스 여성블라우스 블라우스 셔,Fashion
73,상품명          여자 레이스 금장 버튼 반팔 블라우스 여자의류 여성의류 블라우스 반팔블라우스 버튼블라우스 단,Fashion
74,상품명          여자  부자켓  부밴딩팬츠 세트 여자의류 여성의류 자켓 밴딩팬츠 자켓세트 정장 정장세트 세미정,Fashion
75,상품명          여자 플라워 시스루   긴팔 블라우스 여자의류 여성의류 블라우스 시스루 시스루블라우스 여자블,Fashion
76,상품명          여자 파스텔 단추 반팔 블라우스 탑이너포함 여자의류 여성의류 블라우스 반팔블라우스 단추블라,Fashion
77,상품명 쉐바 마스터스판레저룩,Fashion
78,상품명 여성 셔츠 블라우스 여자 정장 와이셔츠        여자셔츠 여자흰셔츠 여자옥스포드셔츠 여성흰색셔츠 여자,Fashion
79,상품명          여자  부자켓  부밴딩팬츠 세트 여자의류 여성의류 자켓 밴딩팬츠 자켓세트 정장 정장세트 세미정,Fashion
80,상품명 카라 화이트 랩원피스,Fashion
81,상품명 플로레센스청베스트상하세트,Fashion
82,홈쇼핑 상품 상품명 런칭 가격       원         구스다운 퀼팅팬츠  종  골프 ,Fashion
83,상품명 여성 데일리 룩 캐쥬얼 데님 남방 베이직 청 티 셔츠 여자 봄 청난방 코디,Fashion
84,백화점 상품 상품명        신세계타임스퀘어점패션관 라인      사이드 훌 미디원피스           ,Fashion
85,상품명 스타일핏  클립 멜빵 라인  서스펜더 남자멜빵 고급멜빵 신사용멜빵 캐주얼멜빵 정장멜빵,Fashion
86,상품명 슬리브리스 보들보들 상의  컬러 셔츠 루즈핏 차르르,Fashion
87,상품명 여성블라우스  컬러    데일리 줄무늬 루즈 정장 셔,Fashion
88,상품명 여성 여름 스퀘어넥 쉬폰소매 셔츠 블라우스 니트 데일리 여친룩 브라우스,Fashion
89,상품명 단품그레이 여자 교복 자켓,Fashion
90,상품명 교복몰 당일출고 화이트셔츠 만원대 여자둥근카라   ,Fashion
91,상품명 세트정장 투피스 여성 오 슈트세트 면접 정장 치마,Fashion
92,상품명 내남편과결혼해줘 박민영 강지원 니트 원피스 패션,Fashion
93,상품명 여자정장세트 오피스룩 인싸 자켓 조끼 바지 쓰리피스,Fashion
94,상품명 여성 투피스 정장 세트 모직 카라 더블 긴팔 반 코트 와이드 팬츠 결혼식 하객 오피스룩,Fashion
95,홈쇼핑 상품 라라쎄 상품명 라라쎄 레이어드 원피스캉캉팬츠  종세트,Fashion
96,시크폭스 상품명     크리스피 히든버튼반팔셔츠,Fashion
97,상품명 알트베니 인견자수풀오버 린넨팬츠,Fashion
98,백화점 상품 레코브 상품명  대구신세계   라인 배색원피스              ,Fashion
99,상품명 수술용     멸균 가운 부직포 수술가운 수술복           매입  ,Fashion
100,상품명      융기모 레깅스 방한 겨울쫄바지 블랙,Fashion
101,상품명 교복몰 당일출고 화이트셔츠 만원대 여자둥근카라  ,Fashion
102,상품명 교복몰 당일출고 화이트셔츠 만원대 여자각카라  ,Fashion
103,상품명 교복몰 당일출고 화이트셔츠 만원대 여자각카라  ,Fashion
104,상품명 교복몰 당일출고 화이트셔츠 만원대 여자둥근카라   ,Fashion
105,상품명 여성 여름 쿨 썸머 반팔 상하 예쁜 투피스 세트 블랙,Fashion
106,상품명 교복몰 당일출고 화이트셔츠 만원대 여자둥근카라   ,Fashion
107,상품명 교복몰 당일출고 화이트셔츠 만원대 여자각카라   ,Fashion
108,상품명 교복몰 당일출고 화이트셔츠 만원대 여자각카라   ,Fashion
109,상품명 교복몰 당일출고 화이트셔츠 만원대 여자각카라   ,Fashion
110,상품명 교복몰 당일출고 화이트셔츠 만원대 여자둥근카라  ,Fashion
111,상품명 교복몰 당일출고 화이트셔츠 만원대 여자각카라  ,Fashion
112,상품명 교복몰 당일출고 화이트셔츠 만원대 여자둥근카라   ,Fashion
113,상품명 교복몰 당일출고 화이트셔츠 만원대 여자둥근카라  ,Fashion
114,상품명 교복몰 당일출고 화이트셔츠 만원대 여자둥근카라   ,Fashion
115,상품명 교복몰 당일출고 화이트셔츠 만원대 여자각카라  ,Fashion
116,상품명 나시티 랩스커트 세트 나시원피스 비치웨어      ,Fashion
117,상품명 수술용     멸균 가운 부직포 수술가운 수술복           매입  ,Fashion
118,상품명 수술용     멸균 가운 부직포 수술가운 수술복            매입  ,Fashion
119,상품명 여성 여름 쿨 썸머 반팔 상하 예쁜 투피스 세트 핑크,Fashion
120,상품명 세트네이비 반팔 세라복   ,Fashion
121,상품명      슬림한 기모 레깅스 방한 겨울쫄바지,Fashion
122,상품명 여성자켓 상하한벌세트 캐쥬얼정장 허리밴딩바지 자켓,Fashion
123,상품명      에밀리 쉬폰 브이넥 블라우스  긴팔블라우스,Fashion
124,상품명 일회용 멸균 수술가운 병원 부직포 가운 수술복   ,Fashion
125,상품명 여성 여름 쿨 썸머 반팔 상하 예쁜 투피스 세트 그린,Fashion
126,상품명 여성 셔츠 민소매 하운드 플레어 원피스 투피스 세트,Fashion
127,상품명 수술용     멸균 가운 부직포 수술가운 수술복           매입  ,Fashion
128,상품명 여자스커트자켓세트블랙 오버핏자켓스커트세트,Fashion
129,백화점 상품 온앤온 상품명  대구신세계 온앤온 터틀넥 울 니트 미니 원피스          ,Fashion
130,해외직구 상품 상품명 여자 트로트 정장 자켓 공연 행사 반짝이 비즈 재킷    ,Fashion
131,상품명 벨리 라틴댄스 숙 테마 패션         ,Fashion
132,상품명 벨트 시즌 패션 새로운         여름,Fashion
133,상품명 클럽 시즌 줌바 테마 패션 카         ,Fashion
134,상품명 교복몰 당일출고 화이트셔츠 만원대 여자둥근카라   ,Fashion
135,상품명 반팔 세트그레이 세라복   ,Fashion
136,상품명 교복몰 당일출고 화이트셔츠 만원대 여자둥근카라   ,Fashion
137,상품명 롱티숙 살사 패션 시즌 밸리         ,Fashion
138,상품명 데님 투피스 세트,Fashion
139,상품명 라운드 니트 고무줄 팬츠 상의 밑단 언발 트임 세트,Fashion
140,상품명 여자정장세트 기분이 여상천조 스커트 겨울 투피스 코트 체크   ,Fashion
141,상품명 여성블라우스  컬러    무지 포켓 레이어드 정장 셔,Fashion
142,상품명 여성 출근룩 세미정장 베이직 코듀로이셔츠 블라우,Fashion
143,상품명 여성 오피스룩 세미정장  넥 단추 포인트 블라우스,Fashion
144,상품명 여성 체크자켓 클래식 자켓 캐주얼 마이 봄자켓,Fashion
145,상품명 여성 브이넥 블라우스,Fashion
146,상품명 남자 캐주얼 스판 슬렉스 고급 정장 바지 일자핏,Fashion
147,상품명 여자 투버튼 린넨 자켓    여름 정장 여성 재킷,Fashion
148,상품명 자켓 가을 겨울 마이재킷 여성 가벼운 정장 아우터,Fashion
149,상품명 편안한 블라우스 구김없는 정장블라우스 정장셔츠,Fashion
150,상품명          진주벨트포함 라인배색 슬림니트 정장원피,Fashion
151,상품명 깔끔 심플 블라우스 세미정장 오피스룩 하객룩,Fashion
152,상품명 여성  컬러 단정한 베이직 블라우스 카라 정장 패션,Fashion
153,상품명 여성 브이넥 단정한 오픈 블라우스 노카라 정장 패,Fashion
154,상품명 여성 봄 간절기 프릴  부 소매 벨티드 정장 원피스,Fashion
155,상품명 여성 정장 원피스 이너 카라 셔츠 쉬폰 블라우스옷,Fashion
156,상품명 오피스 출근룩 코디 이너 쉬폰 블라우스 정장룩 셔,Fashion
157,상품명 정장 깔끔 스타일 여자 쉬폰 베이직 블라우스 코디,Fashion
158,상품명 정장 캐주얼룩 브이넥 이너 티셔츠 여성복 블라우스,Fashion
159,상품명 스트라이프 여성 티셔츠 스퀘어넥 크롭티 신축성 긴팔 얇은 여성옷 여성반팔티 여성나시티,Fashion
160,해외직구 상품 상품명 트로트무대의상 여자 세트 정장 공연 트로트 화려한 프릴  종 여성 티셔츠 돋보이는 특별한 드레스 홀복,Fashion
161,상품명 여성투피스 빅사이즈 가을 하객룩   대 슬랙스 에로틱 베이비 돌 및         섹시 레이스 나이트 드레스,Fashion
162,상품명  현대       나이스클랍 니트 배색 트위드 원피스           ,Fashion
163,백화점 상품      상품명  현대백화점  매긴 플리츠 티어드 원피스            ,Fashion
164,상품명 플로레센스린넨나염투피스,Fashion
165,백화점 상품 상품명    지고트  광주신세계 자수 레이스 울 퍼프 원피스          ,Fashion
166,상품명 셔츠         루즈핏 블라우스 롱 여성,Fashion
167,상품명 스타일로그 설레임 노카라 여성정장자켓 여성자켓 단품,Fashion
168,백화점 상품 상품명        대구신세계 레터링 아웃포켓 핀턱 롱원피스          ,Fashion
169,상품명 오버핏         노기모 체크 남방 롱 여성,Fashion
170,상품명 셔츠 골지 블라우스 골덴 남방 캐주얼 블라우스 셔츠 여자 여성,Fashion
171,상품명 미니원피스 브이넥 슬림 가을 겨울 하객 프릴 여성정,Fashion
172,해외직구 상품 상품명 봄 여름 여성 정장세트  부 자켓  부바지 빅사이즈,Fashion
173,상품명 여자여름정장세트 롤업 자켓 밴딩팬츠 세미정장   ,Fashion
174,상품명                여성단추포인트블라우스 여자상의 여성상의 여자블라우스 여성블라우스 블라우스,Fashion
175,상품명                여자브이카라블라우스 여자상의 여성상의 여자블라우스 여성블라우스 블라우스,Fashion
176,상품명       이중지퍼 가죽 라이더자켓         가죽점퍼 가죽자켓 라이더자켓 가죽라이더 래더자켓,Fashion
177,상품명       키섬 라운드 원피스 니트세트         브이넥니트 롱니트 롱스커트 니트원피스 상하세트,Fashion
178,상품명    빅포켓 빅사이즈 캐주얼 봄 가을 간절기 국내생산 미시 염색 빈티지 면 트윌 기본 절개 바지 보헤미안,Fashion
179,상품명    늘씬한 편한 국산 면 스판 고무줄 기본 심플 간절기 미시 바지 이플 보헤미안스타일 엄마옷   대여성,Fashion
180,상품명    내츄럴 오가닉 화사 봄 여름 시원한 워싱 린넨 중년 미시 빅사이즈 밴딩 세미 와이드 바지 보헤미안스,Fashion
181,상품명    유니크한 귀여운 캐주얼 빅사이즈 미시 가을 봄 간절기 염색 면 여성 멜빵바지 보헤미안스타일 중년의,Fashion
182,상품명    기모 코듀로이 벨벳 와이드 밴딩팬츠        기모골덴바지 골덴벨벳팬츠 기모밴딩바지 밍크융기모 와,Fashion
183,상품명    슬로슬랙스 여자 정장바지 스판 일자팬츠 춘추하계 정장바지 스판바지 스판팬츠 일자바지 여자바지,Fashion
184,상품명 여성용 오프숄더 핑크 섹시 파티 투피스 세트 프랑스 빈티지 스커트 정장 곰 프린트 귀여운 가을,Fashion
185,상품명 영문 기모 후드 집업 자켓                ,Fashion
186,상품명 여성 체크정장 자켓 마이 겨울 체크패턴 오피스룩,Fashion
187,상품명 등산 남여공용 바람막이 운동복 오버핏,Fashion
188,상품명 후드집업 헬스복 운동복 후드티 운동복장,Fashion
189,상품명 여성 루즈핏 쟈켓형 원피스 투웨이룩 셔츠원피스  컬러 차르르 원피스 겸 쟈켓,Fashion
190,상품명 골지 긴소매 티셔츠 가슴 단추 쉬운코디 슬림핏 여성,Fashion
191,상품명 여름 투피스 코디 외출복 반팔세트 데일리룩,Fashion
192,상품명 여성 루즈핏 여름 정장 자켓 오버핏 얇은 긴팔 아우,Fashion
193,상품명 빅카라 셔츠 블라우스       ,Fashion
194,상품명 어깨주름 손목셔링 블라우스       ,Fashion
195,상품명 브이넥 소매단추 포인트 니트 티셔츠       ,Fashion
196,상품명 여대생 개강룩 코디법 귀여운 체크 셔츠 데일리 패,Fashion
197,상품명 여성 블라우스  컬러    베이직 큐빅 단추 기본 셔,Fashion
198,상품명 여성 블라우스 셔츠 히든버튼 정장블라우스 봄 가을,Fashion
199,상품명 체크블라우스 벌룬소매 봄옷 라운드넥 밴딩소매,Fashion
200,상품명 여성 가을 체크남방코디 빈티지 레이온 여자 셔츠,Fashion
201,상품명 체크남방 가을셔츠 블라우스 여성캐주얼셔츠,Fashion
202,상품명 캐주얼 여성 가을 결혼식 하객룩 패션 블라우스 셔,Fashion
203,상품명 민소매블라우스 슬리브리스 정장나시 여름 브이넥,Fashion
204,상품명 캐주얼 프린팅 블라우스 멀티 코디 데일리룩 스타일,Fashion
205,상품명 여성 블라우스 화이트 브이넥 여자 캐주얼 셔츠,Fashion
206,상품명 여자 끈나시 원피스 셔츠 세트 민소매 치마 남방,Fashion
207,상품명 오버핏스타일 여성 마이 정장상의 간절기 아우터 자,Fashion
208,상품명 여성 블라우스 남방 팔시스루 여자 블라우스 셔츠,Fashion
209,상품명 여성 블라우스 반팔 남방 여자 블라우스 셔츠 베이,Fashion
210,상품명 여성 블라우스 남방 주머니 카라 여자 블라우스 셔,Fashion
211,상품명 여성 데일리 셔츠 린넨 여름 남방 블라우스 루즈핏,Fashion
212,상품명 여성 블라우스 셔츠 여자 블라우스 긴팔티 플라워,Fashion
213,상품명 여성 블라우스 남방 기본 카라 여자 블라우스 셔츠,Fashion
214,상품명 여성 블라우스 남방 엣지 여자 카라 블라우스 셔츠,Fashion
215,상품명 여성 블라우스 남방 반팔 여자 카라 블라우스 셔츠,Fashion
216,상품명 여성 블라우스 반팔 남방 셔링 여자 블라우스 셔츠,Fashion
217,상품명 샤르르한 루즈핏 체크 셔츠 블라우스 오버핏 루즈핏,Fashion
218,상품명 여성 블라우스 반팔 남방 여자 블라우스 셔츠 화이,Fashion
219,상품명 여성 블라우스 셔츠 남방 여자 와이셔츠 무지 롱  ,Fashion
220,상품명 여성 롱셔츠 가디건 여자 롱남방 오버핏 셔츠  색,Fashion
221,상품명 여성 코듀로이 셔츠 여자 긴팔 와이셔츠 남방  색,Fashion
222,상품명 여성 긴팔티 플리츠 라운드티 루즈핏 티셔츠 무지티,Fashion
223,상품명 여성 체크 셔츠 남방 긴팔티 여자 체크 남방  색상,Fashion
224,상품명 여성 블라우스 셔츠 여자 오피스 셔츠 무지 프리  ,Fashion
225,상품명 여성 블라우스 셔츠 여자 오피스 셔츠 무지 프리  ,Fashion
226,상품명 여성 여름 정장 자켓 오버핏 얇은 긴팔 아우터 화이,Fashion
227,상품명 여성 여름 정장 자켓 오버핏 얇은 긴팔 아우터 그린,Fashion
228,상품명 여성 쓰리피스 반바지 정장 세트 여름 출근룩 데일,Fashion
229,상품명 여성 세미정장   까지 투버튼 싱글 린넨 카라자켓,Fashion
230,상품명 여성 여름 쉬폰 케이프 블라우스 정장 바지 상하세,Fashion
231,상품명 여자 자켓긴바지세트 린넨 여성패션의류 정장세트,Fashion
232,상품명 여성 가을 정장 니트 티셔츠 허리 벨트 스커트 세트,Fashion
233,상품명 여자 투버튼 린넨 자켓    여름 정장 여성 재킷,Fashion
234,상품명 여성 자켓 정장 세트 팬츠 투피스 셋업 수트 슬랙스,Fashion
235,상품명 여성 투피스 자켓 팬츠 세트 정장 슬랙스 셋업 수트,Fashion
236,상품명 여성 투피스 자켓 셋업 팬츠 정장 세트 슬랙스 바지,Fashion
237,상품명      세트 여성 롤업  부 자켓 반바지 나시 정장 셋업,Fashion
238,상품명 여자상하의 가을 더블 버튼 정장 자켓 스커트 투피스 세트,Fashion
239,상품명 키밍 여성 면접정장 오피스 코트 바지 스커트 티셔츠,Fashion
240,상품명 여성 여름 쉬폰 케이프 블라우스 정장 바지 상하세트,Fashion
241,상품명 여자투피스 그린 가을 블랙 비즈니스 정장세트,Fashion
242,상품명 여자투피스 더블 오피스룩 가을겨울 자켓 바지 정장세트,Fashion
243,상품명 여자투피스 꾸안꾸룩 체형커버 오피스 가을겨울 정장세트,Fashion
244,상품명 새로이 여성 겨울 트위드 자켓 미니 스커트 정장 세트 투피스 ,Fashion
245,상품명  컬러 루즈핏 슬리브리스 차르르 보들보들 여성 셔츠 여성상의 블라우스 플라워블라우스 민소매셔츠 슬리브,Fashion
246,상품명 여자정장세트 베이지 꾸안꾸 반바지 오피스룩,Fashion
247,상품명 여성 여름 브이넥 네모버클 포인트 반팔 블라우스,Fashion
248,상품명 여성 여름 간절기 린넨  부 소매 정장 숏 자켓,Fashion
249,상품명 여성  부 폴리셔츠 봄 여름 블라우스 면접용 하객룩,Fashion
250,상품명            리본벨트 면원피스  색상,Fashion
251,상품명            슬리핑아이 데님 벨트 원피스,Fashion
252,상품명           린넨 사파리 반팔원피스,Fashion
253,하이나미 상품명 오버핏 반팔 반바지 투피스 세트,Fashion
254,상품명 실크 부드러운 빅카라 여성 심플 블라우스 셔츠 롱 짝꿍닷컴 남방,Fashion
255,백화점 상품 온앤온 상품명  신세계강남점 장식 테이프 포켓 미니 트위드 원피스          ,Fashion
256,상품명           자가드 장미 랩원피스  색상,Fashion
