,titles,category
0, 강릉 숙소  세인트존스 호텔 강원도 호캉스 강문해변 숙박,Trip
1,강원   하이원 팰리스 호텔   스탠다드 트윈    ,Trip
2,경기   호텔 푸르미르   디럭스 트윈  인 조식     ,Trip
3, 월 출발 오사카 자유여행  박 일 신오사카 에사카 도큐     호텔 피치항공 오전인천출발,Trip
4,서울   로사나 호텔   슈페리어 더블,Trip
5, 월 출발 오사카 자유여행  박 일 신오사카 에사카 도큐     호텔 피치항공 오전인천출발,Trip
6,제주   호텔 토스카나   키즈 패밀리침대  인 조식 ,Trip
7,가심비 해외수학여행 영국문화탐방  박 일 힐링 학생,Trip
8,다낭 자유여행  박 일 포포인츠 바이 쉐라톤 다낭 제주항공 저녁인천출발,Trip
9,서울   롯데시티호텔 구로   슈페리어 더블 모션 릴랙스 시몬스 모션베드    인치 스마트    ,Trip
10,부산   신라스테이 해운대    룸온리  프리미어 디럭스 패밀리 트윈 시티뷰   미니바 무료,Trip
11,서울   롯데시티호텔 마포   스탠다드 더블  연박 패키지 욕조  무료주차 ,Trip
12,부산   파라다이스 호텔 부산    초강력특가  본관시티트윈,Trip
13,강원   휘닉스 리조트 평창    조식  인  그린동 리뉴얼 스카이 스탠다드 패밀리,Trip
14,서울   이비스 스타일 앰배서더 강남   슈페리어 트윈 단독특가 ,Trip
15,강원   오크밸리리조트   골프빌리지   평 트윈베드 노블 버틀러커피 브런치  인 패키지 ,Trip
16,인천   송도 센트럴파크 호텔   디럭스 패밀리트윈 조식 인포함  ,Trip
17,서울   롯데호텔 월드                                롯데월드 자유이용권  매  브레드 이발소 패밀리 트윈룸 ,Trip
18,경북   라한호텔 포항   코리안 디럭스 더블 조식  인 특가 ,Trip
19,강원   강릉 세인트존스호텔   슈페리어 더블 노오션뷰 초강력특가  성수기 ,Trip
20,강원   홀리데이 인 스위트 알펜시아 평창   스탠다드 더블 오션           워터파크  인 ,Trip
21,인천   오크우드 프리미어 인천                      패키지 스튜디오 디럭스 룸,Trip
22,경북   라한셀렉트 경주   디럭스 트윈 산 전망 초강력특가 ,Trip
23,제주   해비치 호텔 리조트   이그제큐티브 트윈 오션           호텔 ,Trip
24,강원   강릉 세인트존스호텔   골져스 오션 트윈 성수기       인 혜택 ,Trip
25,경기   신라스테이 동탄    초강력특가 스탠다드 더블   시 스테이,Trip
26,강원   강릉 세인트존스호텔   로얄스위트 트윈 오션 오션뷰       인 혜택 ,Trip
27,서울   신라스테이 광화문    조식  인             스탠다드 트윈,Trip
28,부산   웨스틴 조선 부산   디럭스 해변전망 랜덤배정 까밀리아 조식 특가 ,Trip
29,서울   신라스테이 구로    석식  인특가  스탠다드 트윈,Trip
30,서울   롯데호텔 월드                           롯데월드 자유이용권  매 ,Trip
31,강원   휘닉스 리조트 평창    조식  인  그린동 리뉴얼 스카이 스위트 패밀리,Trip
32,강원   홀리데이 인 스위트 알펜시아 평창   디럭스 더블                 눈썰매  회권  인 ,Trip
33,강원   홀리데이 인 스위트 알펜시아 평창   디럭스 온돌 단독 하늘목장      ,Trip
34,마카오 홍콩 코타이젯 페리 탑승권,Trip
35,광주   라마다 플라자 광주 호텔   디럭스 더블,Trip
36,광주   라마다 플라자 광주 호텔   디럭스 트윈,Trip
37,베트남 다낭 패키지 골프 자유 여행 부산출발 동남아 반자유여행,Trip
38,괌 자유여행  박 일 크라운 플라자 진에어 조식포함 저녁부산출발,Trip
39,대만   시 출발 예스폭진지 야경 버스투어 시먼역 메인역 탑승가능,Trip
40,   바로입장  일본 도쿄 팀랩 플래닛 전시 입장권   월부터 예약 가능 ,Trip
41,전남   여수 베네치아 호텔 앤리조트    조식     패키지  슈페리어 더블,Trip
42,전남   여수 베네치아 호텔 앤리조트    조식     패키지  디럭스 패밀리 트윈,Trip
43,말레이시아이심 쿠알라룸푸르 코타키나발루 여행용  심 데이터전용     ,Trip
44,부산   호텔 농심   하이 디럭스 더블  인 조식 특가  허심청 온천권  매 제공 ,Trip
45,일본 오사카 유니버셜 스튜디오 재팬 익스프레스 패스      ,Trip
46,일본 디즈니랜드 해외여행 가족과함께 도쿄 패키지,Trip
47,경기   여주 썬밸리 호텔   디럭스 패밀리 트윈   룸온리  ,Trip
48,대구   대구 엘디스 리젠트 호텔   신관 디럭스 트윈   룸온리  ,Trip
49,경기   노보텔 앰배서더 수원   슈페리어 트윈   룸온리  ,Trip
50,경기   노보텔 앰배서더 수원   슈페리어 킹 우리끼리 룸콕     ,Trip
51,경기   노보텔 앰배서더 수원    로맨틱나잇  슈페리어 킹             ,Trip
52,경기   노보텔 앰배서더 수원   슈페리어 킹   룸온리  ,Trip
53,경기   노보텔 앰배서더 수원   슈페리어 트윈 우리끼리 룸콕     ,Trip
54,경기   이비스 앰배서더 수원   슈페리어 더블   슈페리어더블룸            ,Trip
55,경기   여주 썬밸리 호텔   디럭스 더블 트윈   룸온리  ,Trip
56,오키나와  박 일 여행  월여행 일본 패키지 여행상품,Trip
57,제주   캠퍼트리 호텔 리조트 제주   호텔 트윈 룸온리 ,Trip
58,보홀 자유여행  박 일 라 카사 디 베아트리체 에어부산 예약 특전 저녁인천출발,Trip
59,인천   파라다이스호텔 리조트 파라다이스시티    스위트조식 디럭스 스위트 더블,Trip
60, 설날엔티몬해  고양 매직플로우 원더래빗 입장권   지금껏 본 적 없던 새로운 세계,Trip
61,모두투어 베트남 다낭 골프여행  인출발가능  박 일,Trip
62,강원   정선 인투라온 호텔   디럭스트윈,Trip
63,아이파크콘도     평  스탠다드    강원도 고성 리조트 숙박 숙소,Trip
64,스페인 바르셀로나 몬세라트 시체스 검은성모상 근교 버스투어,Trip
65,아이파크콘도     평  패밀리    강원도 고성 리조트 숙박 숙소,Trip
66,아이파크콘도     평  디럭스    강원도 고성 리조트 숙박 숙소,Trip
67,경북   소노벨 경주   패밀리 취사 레이크뷰 온돌    확정예약   ,Trip
68,전남   소노캄 여수   테마 아랍 오션뷰 더블   마이 홀리데이      ,Trip
69,강원   소노문 델피노   스위트 취사 울산바위뷰 침대   키즈윈터     ,Trip
70,전남   소노캄 여수   테마 타다미 오션뷰 패밀리 트윈   마이 홀리데이      ,Trip
71,다낭 자유여행  박 일 메리어트 다낭 논누억 비치빌라 이스타항공 저녁인천출발,Trip
72,경북   소노벨 경주   패밀리 취사 레이크뷰 온돌   어드벤처     ,Trip
73,전남   소노캄 여수   테마 아랍 오션뷰 더블   러브썸     ,Trip
74,강원   쏠비치 양양 호텔   패밀리 오션뷰 패밀리 트윈 호텔    키즈쿠킹     ,Trip
75,전남   소노캄 여수   디럭스 오션뷰 패밀리 트윈   마이 홀리데이      ,Trip
76,경북   소노벨 경주   패밀리 취사 스탠다드 온돌   오션     ,Trip
77,전남   소노캄 여수   타워스위트 오션뷰 더블   마이 홀리데이      ,Trip
78,전남   소노캄 여수   타워스위트 오션뷰 패밀리 트윈   마이 홀리데이      ,Trip
79,경북   소노벨 경주   스위트 취사 스탠다드 침대   오션     ,Trip
80,다낭 자유여행  박 일 메리어트 다낭 논누억 비치빌라 비엣젯항공 오전인천출발,Trip
81,경북   소노벨 경주   패밀리 취사 스탠다드 온돌                   ,Trip
82,다낭 자유여행  박 일 메리어트 다낭 논누억 비치빌라 비엣젯 항공 저녁인천출발,Trip
83,경북   소노벨 경주   스위트 클린 스탠다드 침대   오션     ,Trip
84,경북   소노벨 경주   패밀리 취사 스탠다드 온돌    확정예약   ,Trip
85,강원   쏠비치 양양 호텔   패밀리 스탠다드 더블 호텔    송이     ,Trip
86,경북   소노벨 경주   패밀리 취사 스탠다드 침대   오션     ,Trip
87,경북   소노벨 경주   스위트 취사 스탠다드 침대    확정예약   ,Trip
88,전남   소노캄 여수   슈페리어 오션뷰 더블   마이 홀리데이      ,Trip
89,전남   소노캄 여수   파밀리에 스위트 오션뷰 더블   마이 홀리데이      ,Trip
90,다낭 자유여행  박 일 메리어트 다낭 논누억 비치빌라 제주항공 저녁인천출발,Trip
91,전남   소노캄 여수   테마 한실 오션뷰 더블   마이 홀리데이      ,Trip
92,아랍에미리트 두바이        속도 유심 이심  심 로밍전화  일 매일   ,Trip
93,부산출발 노옵션 노쇼핑 노팁 일정 옵션 베트남 나트랑 패키지 여행,Trip
94,서울   호텔 선샤인 서울   디럭스 트윈   무료 주차 미식 호캉스 패키지 ,Trip
95,가족 빈펄 풀빌라 업그레이드 푸꾸옥패키지 세미팩  일 노쇼핑 동남아,Trip
96,경북         더케이 호텔 경주   트리플 황룡원뷰,Trip
97,경북         더케이 호텔 경주   온돌 로드뷰,Trip
98,경북         더케이 호텔 경주   트리플 마운틴뷰 조식 인 ,Trip
99,경북         더케이 호텔 경주   온돌 트윈 로드뷰 조식 인 ,Trip
100,웰리힐리파크리조트 성우리조트 강원도 둔내 ,Trip
101, 서울 평일   년식 쏠라티렌트 디젤  인승 종합보험포함,Trip
102,경비행기체험 공주 가볼만한 곳 체험프로그램 국내스카이다이빙 부여열기구,Trip
103,호주이심 뉴질랜드 시드니 여행용             심,Trip
104,홍천 비발디파크 스노위랜드 오션월드 워터파크 오후권 패키지 주중권 기준,Trip
105,제주   파크 선샤인 제주   슈페리어 트윈 초강력특가    시 늦은체크아웃 ,Trip
106,경상권 단체 진주 투어 거제 수학여행  박 일 관광 전쟁의상흔딛고우뚝선 도시체험,Trip
107,호텔 포마   이탈리아 밀라노 가성비 인기 호텔,Trip
108,괌 서커스     슈퍼 아메리칸 신규 공연 호텔픽업드랍,Trip
109,강원   엘리시안 강촌   패밀리형 닭갈비    ,Trip
110,강원   엘리시안 강촌   패밀리형 주말 스키    ,Trip
111,충남   롯데리조트 부여   스위트 빼빼로 클린형 ,Trip
112,서울   포시즌스 호텔 서울   디럭스 킹 조식     ,Trip
113,서울   그랜드 하얏트 서울   프리미엄 한강전망 킹   룸온니   룸온리  ,Trip
114,서울   호텔 스카이파크 킹스타운 동대문점   스탠다드 트윈 감성 불멍패키지 ,Trip
115,제주   제주신라호텔   정원 전망 프리미어 테라스 더블 룸   룸온리 가족형  ,Trip
116,강원   휘닉스 리조트 평창   로얄 스위트   평,Trip
117,제주   호텔 리젠트마린   슈페리어 트윈 오션뷰  인 조식 포함 ,Trip
118,충남   롯데리조트 부여   스위트 온돌 트윈 클린형 ,Trip
119,부산   신라스테이 해운대    룸온리  체크인시 배정 오션뷰,Trip
120,경기   곤지암리조트   노블  호텔형 미취사형              ,Trip
121,제주   호텔 리젠트마린   스탠다드 패밀리 트윈   룸온리  ,Trip
122,강원   메이힐스 리조트   오크룸  체크인시 배정   룸온리  ,Trip
123,충남   롯데리조트 부여   패밀리 더블 콘도형 ,Trip
124,서울   이비스 스타일 앰배서더 서울 용산   프리미어 더블           ,Trip
125,충남   신라스테이 천안    음 치킨 패키지 디럭스 더블,Trip
126,강원   메이힐스 리조트   메이플룸 사우나  인 패키지  체크인시 배정 ,Trip
127,서울   신라스테이 역삼    배리어 프리 객실  스탠다드 더블 장애인 객실,Trip
128,제주   롯데 호텔 제주   디럭스 패밀리트윈 제한적인      ,Trip
129,제주   제주신라호텔   산 전망 디럭스 패밀리 트윈 룸   룸온리  ,Trip
130,충남   롯데리조트 부여   패밀리 트윈 콘도형 ,Trip
131,제주   호텔 리젠트마린   슈페리어 트윈 오션뷰   룸온리  ,Trip
132,제주   제주신라호텔   산 전망 코너 스위트 룸   룸온리  ,Trip
133, 마요르카 섬     델핀 아술 호텔   스페인 가성비 인기 호텔,Trip
134,괌 자유여행  박 일 하얏트 리젠시 제주항공 조식포함인천출발,Trip
135,메종글래드제주    룸온리  스탠다드 트윈   제주도 호텔 제주시 숙박 숙소,Trip
136,제주   그랜드메르 호텔 제주   주니어 스위트    마운틴뷰 ,Trip
137,제주   그랜드메르 호텔 제주   스탠다드   마운틴뷰 ,Trip
138,제주   그랜드메르 호텔 제주   패밀리   오션뷰 ,Trip
139,제주   그랜드메르 호텔 제주   스탠다드   마운틴뷰 ,Trip
140, 새해빅세일  인천 중구  중구  파라다이스호텔 리조트 파라다이스시티,Trip
141,전남   히든베이 호텔   디럭스 패밀리 트윈 오션뷰 초강력특가 ,Trip
142, 설날엔티몬해  잠실 롯데월드 전망대 서울스카이 입장권 유효기간         서울이 한눈에 도심 속 휴가 즐기기,Trip
143,전남   히든베이 호텔   디럭스 더블 오션뷰 초강력특가 ,Trip
144,전남   금호 화순 스파 리조트   휴그린패밀리   룸온리  ,Trip
145,전북   소노벨 변산 리조트   패밀리 취사 스탠다드 침대   쉼      ,Trip
146,제주   소노벨 제주   패밀리 취사 오션뷰 더블                     ,Trip
147,홈쇼핑여행 비즈니스 탑승 이탈리아 스위스 아시아나 직항 여행 패키지 여행서비스,Trip
148,제주   소노벨 제주   패밀리 취사 스탠다드 더블                     ,Trip
149,제주   소노벨 제주   패밀리 클린 스탠다드 트윈                     ,Trip
150,충북   소노문 단양   스위트 취사 스탠다드 온돌   키즈윈터     ,Trip
151, 전국 평일  포르쉐 박스터             렌트   년식 가솔린  인승 종합보험,Trip
152,오끼나와 일본 오키나와 패키지  인가족 베스트 한번뿐,Trip
153,설해원    박 일 골프패키지   월  인가능 ,Trip
154,강원   팜파스 리조트   골드클래스   시티뷰,Trip
155,괌 자유여행  박 일 크라운 플라자 진에어 조식포함 저녁부산출발,Trip
156, 경기 광주  곤지암리조트       리프트권 렌탈   ,Trip
157,서울   아만티 호텔 서울 홍대   디럭스 트윈,Trip
158,태국이심              일     통화 데이터 무제한,Trip
159,중국 청도여행 칭다오여행,Trip
160, 럭셔리투어  흰그림자투어 훗카이도 비에이 후라노 일일투어,Trip
161, 마요르카 섬  유니버설 아파트호텔 돈 카밀로   스페인 가성비 인기 호텔,Trip
162,럭셔리 패밀리 호텔 로열 팰리스   프라하 가성비 인기 호텔,Trip
163, 아이즈 와카마쓰  오오카와소   일본 가성비 인기 호텔,Trip
164, 쿠사츠 온천  쿠사츠 온천 에이다야   일본 가성비 인기 호텔,Trip
165,데저트 로즈 리조트   미국 라스베가스 가성비 인기 호텔,Trip
166,부산   이비스 앰배서더 부산 시티센터   슈페리어 더블              ,Trip
167, 제주도숙소  브라운 스위트 제주 호텔 앤 리조트 숙소 숙박,Trip
168,다낭 자유여행  박 일 포포인츠 바이 쉐라톤 다낭 비엣젯 항공 저녁인천출발,Trip
169,제주   제주 부영호텔 리조트    대기예약 리조트 프리미엄 오션뷰   룸온리  ,Trip
170, 마요르카 섬  힐튼 마요르카 갈라초   스페인 가성비 인기 호텔,Trip
171,서울 시티투어 버스 도심 고궁 남산 코스,Trip
172,부산   신라스테이 해운대         딜  룸   디럭스 체크인 시 배정 시티뷰,Trip
173,서울   노보텔 앰배서더 강남   슈페리어 더블                                ,Trip
174,경기   양평 블룸비스타   디럭스 트윈 초강력특가  강 전망 ,Trip
175,강원   홀리데이 인 스위트 알펜시아 평창   스탠다드 온돌 단독 하늘목장      ,Trip
176,서울   신라스테이 마포    조식  인             디럭스 더블,Trip
177,서울   롯데시티호텔 마포   디럭스 트윈  연박 패키지 욕조  무료주차 ,Trip
178,강원   평창 라마다호텔 스위트 바이 윈덤   스탠다드 더블 초강력특가 ,Trip
179,서울   신라스테이 구로    스위트 블루 모스카토 와인 제공   그랜드 디럭스,Trip
180,강원   인터컨티넨탈 알펜시아 평창   스탠다드 킹 단독 하늘목장       호수뷰 ,Trip
181,서울   서울신라호텔   디럭스 더블                시 이후 체크인 ,Trip
182,강원   강릉 세인트존스호텔   슈페리어 트윈 노오션뷰 초강력특가  성수기 ,Trip
183,서울   노보텔 앰배서더 강남   슈페리어 트윈 안뜨레                      ,Trip
184,서울   호텔 스카이파크 킹스타운 동대문점   스탠다드 트윈 다이브인 온유어마인드 아트스테이 서울 ,Trip
185,강원   인터컨티넨탈 알펜시아 평창   스탠다드 킹                  눈썰매  회권  인 ,Trip
186,경북   라한호텔 포항   오션뷰 코너 스위트 조식  인 특가 ,Trip
187,제주   호텔 휘슬락 바이 베스트웨스턴 시그니처 컬렉션   프리미어 패밀리 스위트 바다전망,Trip
188,서울   롯데시티호텔 구로   스탠다드 트윈     플래터  인 와인    맥주   씨카페 사전 유선 예약 필수 ,Trip
189,부산   코오롱 씨클라우드호텔   디럭스 더블 오션뷰  인 조식 무료    년 리뉴얼  ,Trip
190,울산   롯데 시티호텔 울산   스탠다드 더블          웰컴드링크  잔     ,Trip
191,강원   강릉 세인트존스호텔   골져스 파셜오션 트윈 초강력특가  성수기 ,Trip
192,경기   롤링힐스 호텔   디럭스 킹 초강력특가  정원뷰 ,Trip
193,제주   해비치 호텔 리조트   이그제큐티브 더블 오션  인 조식 포함 호텔 ,Trip
194,울산   신라스테이 울산    일요일전용 조식 인     디럭스 더블,Trip
195,서울   롯데시티호텔 명동   슈페리어 트윈  연박 패키지  ,Trip
196,강원   스카이베이 호텔 경포   디럭스 더블 초강력특가  레이크뷰 ,Trip
197,부산   신라스테이 해운대     인 추가무료  프리미어 패밀리 트윈 시티뷰   엑스트라베드 ,Trip
198,서울   롯데호텔 월드                      조식  인 롯데월드 자유이용권  매 ,Trip
199,강원   인터컨티넨탈 알펜시아 평창   스탠다드 킹 단독 발왕산케이블카  인     ,Trip
