,titles,category
257,상품명 긴팔 스웨터 니트 티셔츠 롱 스커트 긴 장 치마 머메이드 투피스 세트 가을 겨울 데일리,Fashion
258,상품명 긴팔 크롭 니트 스웨터 티셔츠 긴 장 치마 롱 스커트 투피스 세트 가을 겨울 여자,Fashion
259,홈쇼핑 상품 상품명     남성 소프트 기모 모크넥 티셔츠  종,Fashion
260,피턴진 상품명          여자 부자켓 끈나시 뒷밴딩 부반바지  세트,Fashion
261,피턴진 상품명          여자 부자켓  부밴딩팬츠세트,Fashion
262,피턴진 상품명          반바지      자켓    린넨여자자켓반바지세트,Fashion
263,피턴진 상품명               여자오버핏자켓와이드슬랙스세트,Fashion
264,피턴진 상품명               여자오버핏자켓스커트세트,Fashion
265,백화점 상품 르샵 상품명 기모 후드 플레어 롱 원피스            ,Fashion
266,해외직구 상품 상품명 여자정장세트 하객룩 투피스 세미 롱기장 투피스 의상    ,Fashion
267,상품명 여자 힙합 카고 포켓 밑단 와이드 스트링 팬츠        힙합바지 카고바지 통바지 일자,Fashion
268,상품명 초특가 핵쿨 쿨팬츠 여성 남성 아동용 쿨링바지 빅사 빅사이즈 쿨팬츠 냉동고 쿨링팬츠 아이,Fashion
269,상품명           옆트임 반나팔 정장슬랙스 봄여름용 정장바지 정장팬츠 슬랙스 정장슬랙,Fashion
270,상품명 시어스 기모 밴딩 스판 바지           기모바지 밴딩바지 겨울바지 스판바지 여자기,Fashion
271,상품명 여성 코듀로이 슈트 팬츠           여성바지 코듀로이팬츠 기모바지 겨울 골덴바지,Fashion
272,상품명 코깅 여자 스웨이드 카고 조거 팬츠            남녀공용 안감스웨이드 겨울바지 조,Fashion
273,상품명 렐리아 스판 울트라 기모 밴딩 바지           기모바지 밴딩바지 겨울바지 스판바지,Fashion
274,상품명 스웨이드 기모 코듀로이 밴딩 팬츠             기모 밴딩 코듀로이 골덴 여성바지,Fashion
275,상품명 여성캐주얼 조커팬츠           여자조거팬츠 겨울 양털 밴딩바지 트레이닝,Fashion
276,상품명 워빗 여자 스웨이드 카고 와이드 팬츠            남녀공용 안감스웨이드 겨울바지,Fashion
277,상품명 따스한 니트 하이 웨이스트 조거 팬츠             니트바지 조거팬츠 니트팬츠 롤,Fashion
278,상품명 디고크 여자 스웨이드 와이드 팬츠            남녀공용 안감스웨이드 겨울바지 와이,Fashion
279,홈쇼핑 상품 상품명 론칭가      원 라씨엔토           하이넥 울 블렌디드 원피스,Fashion
280,상품명  현대       쉬즈미스 라운드넥 벨티드 원피스            ,Fashion
281,백화점 상품 쥬시쥬디 상품명  현대백화점  쥬시쥬디  뷔스티에퀼팅원피스         ,Fashion
282,해외직구 상품 상품명 봄가을 여성 정장세트 자켓 바지 루즈핏 캐주얼,Fashion
283,상품명 캐주얼 편안한                  여성용 투피스 세트 유행 에디션 분위기 있는 벨트 탑 스플릿 슬림 팬츠,Fashion
284,상품명 여자자켓 블루 봄가을 오피스룩 캐주얼 정장아우터,Fashion
285,홈쇼핑 상품 상품명 런칭 가격     원 태그미 크레오라 기모 슬림핏 밴딩팬츠  종,Fashion
286,백화점 상품 코데즈컴바인 상품명  대구신세계 코데즈컴바인 스트링 반집업 원피스 쭈리버전               ,Fashion
287,해외직구 상품 상품명 핑크 보라색 여자 바지 정장 세트 무대 행사 의상 언발란스 강사 노래교실,Fashion
288,홈쇼핑 상품 상품명 마담엘레강스 플로렌스 쉬폰 앙상블  총 종 ,Fashion
289,상품명 단가라후드 원피스 스트라이프 나시 앞트임 원프시 브이넥,Fashion
290,상품명 면 레그워머 사계절 무릎보온 여성 숏 사계절 무릅 면 무릎 따뜻한 봄 겨울 여성 다리토시,Fashion
291,상품명      커플정장세트 긴팔 커리어 슈트 스타일 슬림 스판 봄가을 정장,Fashion
292,홈쇼핑 상품 윤앤팩토리 상품명 히트상품          여성 이지 트레이닝  종,Fashion
293,상품명 남성 면 링클프리 춘추 원턱팬츠      ,Fashion
294,상품명 여자바지정장 곤색기본세트 슬림핏 라쏠베이스 프라다원단,Fashion
295,공구우먼 상품명 공구우먼 제작 세르반 뒷밴딩 턱 와이드 슬랙스       빅사이즈 여성의류,Fashion
296,상품명 여자정장 여자슈트 여성정장 빅사이즈 여성 기모 트레이닝 겨울 운동복  종,Fashion
297,상품명 골지 니트 민소매 나시 티셔츠 이너 데일리 홈웨어,Fashion
298,상품명 원피스형 블라우스 롱남방 롱셔츠 허리끈 가디건 원피스 블라우스 셔츠 남방형가디건,Fashion
299,상품명 기본 루즈핏 청남방 데님셔츠 남녀공용 캐주얼 커플룩 무지반팔티 여성티셔츠 남성반팔런닝 남자,Fashion
300,상품명 여성 여름 초경량바람막이 블라우스 자켓 초경량바람막이 경량바람막이 홑겹바람막이 여자경량바,Fashion
301,상품명 여성 데일리 스트랩 장식 플랫 샌들 여성셔츠 롱셔츠 남방 블라우스 루즈핏,Fashion
302,상품명 여성 가을 체크남방코디 빈티지 레이온 여자 셔츠 여자체크셔츠 여자남방코디 여자셔츠 여자무지,Fashion
303,상품명 뽀얌 여자 데일리 루즈핏 일자 밴딩 상하세트,Fashion
304,상품명 여자셋업수트 직장인샵,Fashion
305,상품명 반 목폴라 티셔츠 스판 슬림핏 캐주얼 코디 데일리룩,Fashion
306,상품명 여성 가을 간절기 트위드 자켓 접시 스커트 상하세트,Fashion
307,상품명 민소매 슬리브 티셔츠 이너 홈웨어 무지 심플 데일리,Fashion
308,상품명 심플 라운드넥 티셔츠 반바지 세트 허리밴딩 홈웨어,Fashion
309,상품명 여성 오버핏 니트 라운드넥조거팬츠세트 여자니트셋업,Fashion
310,상품명 주방 병원 라운드반팔 면혼방 위생복 작업복 유니폼,Fashion
311,상품명 데님셋업 반집업반팔 아노락 셋업 세트,Fashion
312,상품명 스팽글 힙스카프     여성 밸리 테마 반짝          ,Fashion
313,상품명 하트 자수 반팔 티셔츠 라운드넥 여학생 심플 데일리,Fashion
314,상품명 여자 베스트 와이드팬츠세트 스트링팬츠 여성패션의류,Fashion
315,상품명 여성 반팔 무지 기본 티셔츠 홈웨어 편한옷 라운드넥,Fashion
316,상품명 루즈핏 여성 반팔 셔츠 반바지 투피스 세트,Fashion
317,상품명 출퇴근룩 오버핏자켓 와이드슬랙스 베이직 코디세트,Fashion
318,상품명 지앤제이 하복 빅사이즈 허리조절 교복바지 블랙,Fashion
319,상품명 교복몰 백합주름치마 전체 주름 교복치마 교복 네이비,Fashion
320,상품명 교복몰 교복치마 교복 허리조절하복 학생복 베이지,Fashion
321,상품명 교복몰 교복조끼여자 보풀방지 교복 학생복 브라운,Fashion
322,상품명 교복몰 편한 각카라 셔츠 교복 빅사이즈너무나,Fashion
323,상품명 교복몰 교복조끼여자 보풀방지 교복 학생복 블랙,Fashion
324,상품명 여자슬림핏 골지니트롱원피스 볼레로세트 여성상의,Fashion
325,상품명 교복몰 진그레이 교복치마 교복 학생복 하복스판,Fashion
326,상품명 교복몰 화이트라인 생활복 하의 교복 학생복  네이비,Fashion
327,상품명 여자브이골지가디건 니트바지세트 여성상의 여성세트,Fashion
328,상품명 허리조절기모 교복몰 교복치마 교복 학생복 그레이,Fashion
329,상품명 여자에어슬림반팔부츠컷레깅스셋업 애슬레저 요가,Fashion
330,상품명 교복몰 스판끈나시 여자 끈나시 교복 이너웨어             매입  ,Fashion
331,상품명 교복몰 블랙그레이체크 스커트 교복 학생복 교복치마,Fashion
332,상품명 교복몰 보풀방지 화이트라인 교복조끼 교복 네이비,Fashion
333,상품명 교복몰 보풀방지 블랙라인 교복조끼 교복 아이보리,Fashion
334,상품명 바지여자 교복몰 차콜 교복 빅사이즈허리조절,Fashion
335,상품명 교복몰 보풀방지 교복 가디건여자 학생 네이비,Fashion
336,상품명 교복몰 기모 스판 교복바지 허리조절 교복 그레이,Fashion
337,상품명 교복몰 보풀방지 롱 교복 교복가디건여자 네이비,Fashion
338,상품명 허리조절 하복스판 교복몰 교복바지 교복 청색,Fashion
339,상품명 교복몰 허리조절진그레이 교복 반바지여자,Fashion
340,상품명 교복몰 교복 빅사이즈스판 교복바지여자 밤색,Fashion
341,상품명 교복몰 반바지여자 스판 교복 학생복 연그레이,Fashion
342,상품명         와이드 멜빵청바지 통청 데님바지 점프슈트         와이드 멜빵청바지 통청 데님바지 점프슈트,Fashion
343,상품명        포켓 와이드 멜빵청바지 데님바지 점프슈트        포켓 와이드 멜빵청바지 데님바지 점프슈트,Fashion
344,상품명 엘케이트 여성 셋업 크롭 자켓 와이드 슬랙스 투피스 세트        ,Fashion
345,상품명 교복바지여자 교복몰 코코아 교복 빅사이즈하복,Fashion
346,상품명 교복몰 여자 패키지 둥근카라 셔츠 교복  장 화이트,Fashion
347,상품명 교복몰 편한 둥근카라 여성 빅사이즈너무나 셔츠,Fashion
348,상품명 베이직 식당 주방 빵집 요리 쉐프 작업 반팔 화이트,Fashion
349,상품명 타입 투피스셋트 여름 하객룩 여성 스커트  가지,Fashion
350,상품명 교복몰 교복 빅사이즈허리조절 하복먹색 바지,Fashion
351,상품명 교복몰 여자 패키지 각카라 셔츠 교복  장 화이트,Fashion
352,상품명 교복바지여자 교복몰 연베이지 하복스판 교복,Fashion
353,상품명 교복몰 차콜 교복치마 하복스판 교복 학생복,Fashion
354,상품명 교복몰 반바지여자 스판 교복 학생복 블랙,Fashion
355,상품명 교복몰 스판나시 여자 끈나시 교복 이너웨어       ,Fashion
