,titles,category
0,캔들블랑     대용량 천연소이캔들        향초 고급무료선물포장,Interior
1,인조잔디 매트 인공 베란다 옥상 테라스 마당 시공              ,Interior
2,카파 국내생산 클래식 원목 무소음 벽시계 사무실 거실 판촉물 벽걸이시계          ,Interior
3,홑겹 누빔 매트리스커버 침대커버 매트커버 시트 싱글 슈퍼 퀸,Interior
4,사이잘룩 먼지없는 사계절 거실 러그 카페트 식탁 대형 침실 단모 워셔블 러그 물세탁가능,Interior
5,그레이북 캐시미어 소프트 주방 장매트 현관러그 싱크대 부엌 키친매트 욕실 발판,Interior
6,석고디퓨저 석고방향제베어 빅베어브릭,Interior
7,제닉스 카카오프렌즈 프리미엄 컴퓨터 의자 라이언,Interior
8,베스트슬립    골든 메달리스트 매트리스   ,Interior
9,마켓비      데스크 서랍 칸         ,Interior
10,리바트 토르텔  인 대리석 식탁     토핑체어 ,Interior
11,올리디퓨저      올리 디퓨저 리필,Interior
12,까사미아 캄포 클래식    인 소파,Interior
13,천가게 골덴원단 중골덴 코듀로이원단 천 겨울 무지 심플리 한마,Interior
14,오셀픽 스트라이프 특대형 극세사 담요 캠핑 쇼파 사무실 침대 이불 밍크 블랭킷,Interior
15,하임앤하임 솜브래 도예 남자 생활 방수 카페 롱 미용실 애견 미용 앞치마       ,Interior
16,아이엔지홈 블랑쉬 세라믹 식탁 테이블 라운드     ,Interior
17,리바트 프레일      콘센트형 일자 책상,Interior
18,삼익가구 온드      라운드 템바보드 높은 수납장 거실장,Interior
19,마니랜드 펀치니들 코스터 키트  티 코스터     컵받침 만들기 세트 패키지 러그,Interior
20,잠앤빛 햇빛 세로토닌 보조 조명 생체시계 라이트테라피 관리 수면등 광테라피  만럭스 실내,Interior
21,알리제 야나 슈퍼라나 맥시                털실,Interior
22,모칠라 코튼 뜨개실      여름 가방 모자 면사 면실 코바늘 모칠라실 털실 손뜨개질,Interior
23,팬트리 시스템선반 다용도실선반 진열 선반장,Interior
24,머블 원목 벽선반 무지주 무타공 꼭꼬핀 미니 벽걸이 우드,Interior
