,titles,category
0, 온그리디언츠 속광로션 속건조 탄력 보습로션,Makeup
1,셀퓨전씨 레이저    썬 스크린     ,Makeup
2,팔꿈치 겨드랑이 무릎 미백 착색크림 화이트닝,Makeup
3,디올뷰티 어딕트 립 글로우     ,Makeup
4,헤라 블랙 쿠션           ,Makeup
5,세타필 모이스춰라이징 민감피부 고보습 로션        개  미니 종 무민스티커 증정 ,Makeup
6,니베아     케어 바디로션          개,Makeup
7,달바    핑크 비건 톤업 물광 혼합자차 겨울,Makeup
8,아베다 우든 패들 브러쉬,Makeup
9,헤라 센슈얼 파우더 매트 리퀴드   ,Makeup
10,올데이커스터블 버블바 거품 입욕제 배쓰밤     핑크,Makeup
11,세타필 대용량 민감피부 고보습 크림       개  미니 종 무민스티커 기획 ,Makeup
12,홀츠포맨 남자 남성 콜라겐 올인원 스킨 로션 화장품       주름개선 미백 기능성,Makeup
13,닥터지 블랙 스네일 크림     ,Makeup
14,헤라 스킨 래디언트 글로우 쿠션           ,Makeup
15,마녀공장 퓨어   딥 클렌징 폼           기획세트,Makeup
16,자담유 유산균 락토 페미닌 워시 여성 청결제,Makeup
17,동국제약 센텔리안   마데카 마이크로 스타톡 세럼         개   쇼핑백   기미완화  안티에이징  보습  탄력에 도움,Makeup
18,르네휘테르 포티샤 에네자이징 샴푸      ,Makeup
19,어뮤즈 젤 핏 틴트     ,Makeup
20,달바    비건 대용량 겨울 보습 광채 오일,Makeup
21,라보에이치 탈모샴푸            리필      ,Makeup
22,엘루자이 콜라겐 링클밤   개 비타민 쿨링밤 멀티밤,Makeup
23,록시땅 시어 버터 핸드 크림    ,Makeup
24,입생로랑 엉크르 드 뽀 쿠션           ,Makeup
