,titles,category
246,상품명 책꽂이겸용결재함         도이 ,Interior
247,상품명 우드밀리 원목 발받침대        받침 우드받침 발받침 책상발받침 발받침대 우드발받침대 우드발선반 원목,Interior
248,모닝글로리 상품명 모닝글로리 다이나믹 접이식 책꽂이  대   브라운   오피스용품 책꽂이 사무실용품 기본책꽂이 책상책꽂이,Interior
249,모닝글로리 상품명 모닝글로리 다이나믹 접이식 책꽂이  대   핑크   책상책꽂이 책상정리 오피스용품 기본책꽂이 테이블정리,Interior
250,모닝글로리 상품명 모닝글로리 다이나믹 접이식 책꽂이  소   블루   오피스용품 테이블정리 사무용품 책상정리 책정리,Interior
251,상품명                  엘디엘 슬라이딩 키보드 트레이  키보드거치대 슬라이드트레이 책상키보드받침,Interior
252,상품명                  엘디엘 슬라이딩 키보드 트레이  책상키보드트레이 책상키보드받침 키보드받침대,Interior
253,상품명 리템    루맥스 책꽂이  단         ,Interior
254,상품명 모던 접이식 책꽂이 길이조절 자바라책꽂이,Interior
255,상품명 서랍 책꽂이   민트         ,Interior
256,상품명 리템    루맥스 책꽂이  단         ,Interior
257,상품명       살림살림 데스크선반  단 화이트 우드 책상선반 책꽂이 장롱 서랍 책선반,Interior
258,상품명 카파 책꽂이  단       회색  책꽂이 꽂이 다용도꽂이 문구용꽂이 책정리 책장 책보관 책정리함 서류꽂이 ,Interior
259,상품명  형 원목책꽂이 책상책꽂이 사무용책꽂이 책장 정리,Interior
260,상품명  시스맥스 데스크 멀티박스       그린    ,Interior
261,상품명  시스맥스 데스크 멀티박스       그레이    ,Interior
262,상품명 어반 원형프레임 접이식 책꽂이 자바라책꽂이,Interior
263,상품명       탁상용 철재 액자 잡지 미니 거치대 이젤  금색 빅  안내거치대 홍보거치대 실외거치대 광고거치대,Interior
264,상품명 시스맥스 서랍 책꽂이 민트          책상정리대 서류정리대 파일꽂이 책상정리 책꽂이 서랍책꽂이 서랍책,Interior
265,상품명 시스맥스 마이룸  꽂이 책꽂이 서류꽂이 책홀더 책정리 책수납 책상서류꽂이 투명책꽂이 책상악세사리 책상,Interior
266,상품명 리템    루맥스 책꽂이  단          화일꽂이 파일꽂이 화일보관꽂이 파일보관꽂이 다용도꽂이 문구용꽂이,Interior
267,상품명 디스플레이    거치대 꽂이  단 책거치대 메뉴판거치대 종이거치대 거치대   거치대 카다로그거치대   스탠,Interior
268,상품명 디스플레이    거치대 꽂이  단 책거치대 메뉴판거치대 종이거치대 거치대   거치대 카다로그거치대   스탠,Interior
269,상품명 스토리 하트 프레임 책꽂이 로즈골드 책상정리대 서류정리대 파일꽂이 책꽂이 북앤드 서류꽂이 프레임책꽂,Interior
270,상품명 오피스 책상 팔걸이 팔걸이 책상팔걸이 책상팔거치대 팔거치대 책상팔거치 팔지지대 책상팔지지대 데스크팔,Interior
271,상품명    책상      사무실 오피스 업무용 컴퓨터 책상,Interior
272,상품명 스탠다드 접이식 좌식책상     핑크  침대테이블 보조테이블 보조책상 침대책상 공부책상 업무책상 미니책,Interior
273,상품명 모던 접이식 책꽂이 라이트  접이식책꽂이 접이식책선반 접이형책꽂이 디자인책꽂이 책정리선반 책꽂이 책,Interior
274,상품명 모던 접이식 책꽂이 내추럴  접이식책꽂이 접이식책선반 접이형책꽂이 디자인책꽂이 책정리선반 책꽂이 책,Interior
275,상품명 스토리 삼각 프레임 책꽂이 골드  간이책꽂이 책꽂이 기본책꽂이 책상책꽂이 테이블정리 책상정리 사무용품,Interior
276,상품명 스쿨 선인장 북엔드   세트 로즈골드  책꽂이 책상책꽂이 데스크책꽂이 탁자책꽂이 책정리 북앤드 사무용책,Interior
277,상품명 엔조이 보태니컬 접이식 책꽂이 간이책꽂이 책꽂이 기본책꽂이 책상책꽂이 테이블정리 책상정리 사무용품 ,Interior
278,상품명 감각 철제 매거진 랙 화이트  잡지수납장 매거진랙 철제매거진랙 잡지정리랙 잡지꽂이 잡지수납대 잡지수납,Interior
279,상품명 카파맥스  단책꽂이 청색 책꽂이 꽂이 다용도꽂이 문구용꽂이 책정리 책장 책보관 책정리함 서류꽂이 책꽂,Interior
280,상품명  형 원목책꽂이 책상책꽂이 사무용책꽂이 책장 정리 원목책꽂이 책상책꽂이 사무용책꽂이 사무실책꽂이 책,Interior
281,상품명  단 책꽂이 회색 책상정리 책상책꽂이 사무실책꽂이 서류꽂이 플라스틱책꽂이 북앤드 북엔드 미니책꽂이 오,Interior
282,상품명    각도조절 사무실 발 받침대       발받침 발받침대 강철발받침대 높이조절발받침대 각도조절발받침대 엠,Interior
283,상품명    각도조절 사무실 발 받침대       발받침대 강철발받침대 높이조절발받침대 각도조절발받침대 엠보싱발,Interior
284,상품명 데코  단 책꽂이 연두 카파맥스  책꽂이 꽂이 다용도꽂이 문구용꽂이 책정리 책장 책보관 책정리함 서류꽂,Interior
285,상품명 책꽂이  단 카파맥스  책꽂이 꽂이 다용도꽂이 문구용꽂이 책정리 책장 책보관 책정리함 서류꽂이 책꽂이 ,Interior
286,상품명 멀티책꽂이  단       시스맥스  책꽂이 꽂이 다용도꽂이 문구용꽂이 책정리 책장 책보관 책정리함 서류꽂,Interior
287,상품명 책꽂이    단 카파맥스 양쪽손잡이  책꽂이 꽂이 다용도꽂이 문구용꽂이 책정리 책장 책보관 책정리함 서류,Interior
288,상품명 데코  단 책꽂이 하늘 카파맥스  책꽂이 꽂이 다용도꽂이 문구용꽂이 책정리 책장 책보관 책정리함 서류꽂,Interior
289,상품명 서랍형책꽂이  단        도이  책꽂이 꽂이 다용도꽂이 문구용꽂이 책정리 책장 책보관 책정리함 서류꽂이,Interior
290,상품명 데코  단 책꽂이 주황 카파맥스  책꽂이 꽂이 다용도꽂이 문구용꽂이 책정리 책장 책보관 책정리함 서류꽂,Interior
291,상품명 책꽂이겸용결재함         도이  책꽂이 꽂이 다용도꽂이 문구용꽂이 책정리 책장 책보관 책정리함 서류꽂,Interior
292,상품명 카파 책꽂이  단       하늘  책꽂이 꽂이 다용도꽂이 문구용꽂이 책정리 책장 책보관 책정리함 서류꽂이 ,Interior
293,상품명 카파 책꽂이  단       회색  책꽂이 꽂이 다용도꽂이 문구용꽂이 책정리 책장 책보관 책정리함 서류꽂이 ,Interior
294,상품명 카파 책꽂이  단       회색  책꽂이 꽂이 다용도꽂이 문구용꽂이 책정리 책장 책보관 책정리함 서류꽂이 ,Interior
295,상품명 카파 피코 책꽂이  단 회색        책꽂이 꽂이 다용도꽂이 문구용꽂이 책정리 책장 책보관 책정리함 서류,Interior
296,상품명 에이데이타 이동식 컴퓨터책상          책상 이동식책상 컴퓨터책상   책상 이동식컴퓨터책상 이동식  책,Interior
297,상품명 에이데이타 이동식 노트북 책상         책상 이동식책상 컴퓨터책상   책상 이동식컴퓨터책상 이동식  책,Interior
298,상품명 스텐드 미니 책꽂이 책꽂이 꽂이 다용도꽂이 문구용꽂이 책정리 책장 책보관 책정리함 서류꽂이 책꽂이 정,Interior
299,상품명 시스맥스 마이룸 책꽂이  단 그레이       바인더꽂이 서류꽂이 문서꽂이 사무실책꽂이 책꽂이  단책꽂이 ,Interior
300,상품명 아카데미 다이나믹 책꽂이 북앤드        책지지대 책꽂이 북앤드 북엔드 문구용책꽂이 사무용책꽂이 문구,Interior
301,상품명 아카데미 북앤드        중 책지지대 책꽂이 북앤드 북엔드 문구용책꽂이 사무용책꽂이 문구용북앤드 사무,Interior
302,상품명 오피스원 가죽  단 서류 받침대 블랙 서류받침대 가죽 단서류함 가죽 단서류받침대 서류정리함 서류트레이 ,Interior
303,상품명 스토리 하트 프레임 책꽂이 로즈골드 책상정리대 서류정리대 파일꽂이 책꽂이 북앤드 서류꽂이 프레임책꽂,Interior
304,상품명 어반 원형프레임 접이식 책꽂이 화이트  책꽂이 접이책꽂이 접히는책꽂이 책상책꽂이 테이블책꽂이 탁자책,Interior
305,상품명 모던 접이식 책꽂이 다크  접이식책꽂이 접이식책선반 접이형책꽂이 디자인책꽂이 책정리선반 책꽂이 책선,Interior
306,상품명 시스맥스 올리오책꽂이  단 베이지  책꽂이 책상책꽂이 데스크책꽂이  단책꽂이 서류꽂이 문서꽂이 책상꽂,Interior
307,상품명 스탠다드 접이식 좌식책상     블루  침대테이블 보조테이블 보조책상 침대책상 공부책상 업무책상 미니책,Interior
308,상품명 틈새활용  단 이동식 북트롤리  민트  책장수납장 책장책꽂이 틈새수납장 책장정리함 책장수납함 책상서랍 ,Interior
309,상품명 틈새활용  단 이동식 북트롤리 핑크  책장수납장 책장책꽂이 틈새수납장 책장정리함 책장수납함 책상서랍 ,Interior
310,상품명 틈새활용  단 이동식 북트롤리 옐로우  책장수납장 책장책꽂이 틈새수납장 책장정리함 책장수납함 책상서랍,Interior
311,상품명 틈새활용  단 이동식 북트롤리 화이트  책장수납장 책장책꽂이 틈새수납장 책장정리함 책장수납함 책상서랍,Interior
312,상품명 감각 철제 매거진 랙 화이트  잡지수납장 매거진랙 철제매거진랙 잡지정리랙 잡지꽂이 잡지수납대 잡지수납,Interior
313,상품명 모던 접이식 책꽂이 라이트  접이식책꽂이 접이식책선반 접이형책꽂이 디자인책꽂이 책정리선반 책꽂이 책,Interior
314,상품명 모던 접이식 책꽂이 내추럴  접이식책꽂이 접이식책선반 접이형책꽂이 디자인책꽂이 책정리선반 책꽂이 책,Interior
315,상품명 스토리 삼각 프레임 책꽂이 골드  간이책꽂이 책꽂이 기본책꽂이 책상책꽂이 테이블정리 책상정리 사무용품,Interior
316,상품명 스쿨 선인장 북엔드   세트 로즈골드  책꽂이 책상책꽂이 데스크책꽂이 탁자책꽂이 책정리 북앤드 사무용책,Interior
317,상품명 엔조이 보태니컬 접이식 책꽂이 간이책꽂이 책꽂이 기본책꽂이 책상책꽂이 테이블정리 책상정리 사무용품 ,Interior
318,상품명 우드밀리 원목 발받침대        받침 우드받침 발받침 책상발받침 발받침대 우드발받침대 우드발선반 원목,Interior
319,상품명 스마트홈 이지 카르마 우드 기본책상     인테리어책상 철제책상 철재데스크 신학기책상 메탈책상세트 책상,Interior
320,상품명 심플 잡지꽂이 원목책꽂이 미니책꽂이 스탠드책꽂이 책꽂이 잡지꽂이 꽂이 다용도꽂이 문구용꽂이 책정리 ,Interior
321,상품명 리템    루맥스 책꽂이  단          화일꽂이 파일꽂이 화일보관꽂이 파일보관꽂이 다용도꽂이 문구용꽂이,Interior
322,상품명 심플 잡지꽂이 원목책꽂이       간이책꽂이 책꽂이 기본책꽂이 책상책꽂이 테이블정리 책상정리 사무용품 ,Interior
323,상품명 엔조이 보태니컬 접이식 책꽂이 간이책꽂이 책꽂이 기본책꽂이 책상책꽂이 테이블정리 책상정리 사무용품 ,Interior
324,상품명 시스맥스 마이룸 책꽂이  단 그레이       바인더꽂이 서류꽂이 문서꽂이 사무실책꽂이 책꽂이  단책꽂이 ,Interior
325,상품명 스탠다드 접이식 좌식책상     블루  침대테이블 보조테이블 보조책상 침대책상 공부책상 업무책상 미니책,Interior
326,상품명 고급 삼나무원목     단책장     책장선반 책장수납장 원목책장    책장 조립책장 책정리 책꽂이 인테리어,Interior
327,상품명 삼나무 원목 책상 발판 받침대 받침 발받침 발받침대 우드발받침 원목발받침대 책상발판 데스크발판 원목발,Interior
328,상품명 책상 미니 북앤드 철제 이동식 간이 책꽂이  그린  책상정리 북앤드 철제책장 간이책꽂이 책상책장  형책상,Interior
329,상품명 원목접이형좌식컴퓨터책상 삼나무 좌식책상 접이형 책상 컴퓨터책상 좌식책상 좌식컴퓨터책상 원목컴퓨터책,Interior
330,상품명 원목 잡지 신문 꽂이 진열대 매거진랙 전면 책장 원목잡지꽂이 매거진랙 전면책꽂이 신문꽂이 잡지거치대 ,Interior
331,상품명  시스맥스 데스크 멀티박스       블루     화일꽂이 파일꽂이 화일보관꽂이 파일보관꽂이 다용도꽂이 문구,Interior
332,상품명  시스맥스 데스크 멀티박스       그린     화일꽂이 파일꽂이 화일보관꽂이 파일보관꽂이 다용도꽂이 문구,Interior
333,상품명  시스맥스 데스크 멀티박스       그레이     화일꽂이 파일꽂이 화일보관꽂이 파일보관꽂이 다용도꽂이 문,Interior
334,상품명 데코  단 책꽂이 연두 카파맥스  책꽂이 꽂이 다용도꽂이 문구용꽂이 책정리 책장 책보관 책정리함 서류꽂,Interior
335,상품명 책꽂이    단 카파맥스 양쪽손잡이  책꽂이 꽂이 다용도꽂이 문구용꽂이 책정리 책장 책보관 책정리함 서류,Interior
336,상품명 데코  단 책꽂이 하늘 카파맥스  책꽂이 꽂이 다용도꽂이 문구용꽂이 책정리 책장 책보관 책정리함 서류꽂,Interior
337,상품명      좌우 분리형 발 받침대 다리거치대 발받침대 사무실발받침대 의자발받침대 의자다리받침대 다리받침대,Interior
338,상품명 사각 미끄럼 소음방지 패드       긁힘방지패드 바닥보호패드 도어패드 소음방지패드 층간소음바닥보호 바,Interior
339,상품명 리템    루맥스 책꽂이  단          화일꽂이 파일꽂이 화일보관꽂이 파일보관꽂이 다용도꽂이 문구용꽂이,Interior
340,상품명           이앤위즈 발받침대 통판형 오크우드       원목발판 발판 받침대 발받침대 의자받침대 의자발받,Interior
341,상품명      발 받침대  풋레스트             각도조절  책상  사무실  가정용 발받침대생활건강 발받침대 사무실,Interior
342,상품명 고급 삼나무슬림     단책장 책장선반 책장수납장 원목책장    책장 조립책장 책정리 책꽂이 인테리어소품 ,Interior
343,상품명 모닝글로리    북앤드  대형   블루  책상정리대 서류정리대 파일꽂이 책상정리 책꽂이 북앤드 서류꽂이 책,Interior
344,상품명 국산 잡지 리플렛 카달로그거치대         열 단 백색 포스터스탠드 전시스탠드 잡지꽂이 잡지거치대 매거,Interior
345,상품명 국산 잡지 리플렛 카달로그거치대         열 단 흑색 포스터스탠드 전시스탠드 잡지꽂이 잡지거치대 매거,Interior
346,상품명  단 책꽂이 책상정리대 서류정리대 파일꽂이 책상정리 책꽂이 책보관 서류꽂이 책정리 책꽂이선반 북엔드 ,Interior
347,상품명 모닝글로리 다이나믹 접이식 책꽂이  소   블루  간이책꽂이 책꽂이 기본책꽂이 책상책꽂이 테이블정리 책,Interior
348,상품명 발해먹 책상 발받침 책상발판 책상소품 발받침대 발다리거치대 사무실발판 의자발판 다리받침 사무실발받침,Interior
349,상품명 플렉스박스    핑크       다용도정리함 박스 수납박스 문구박스 문구정리박스 멀티박스 문구정리박스 소품,Interior
350,상품명 원목팬더잡지꽂이 잡지꽂이 잡지수납 카달록꽂이 신문꽂이 우드잡지꽂이 원목잡지꽂이 잡지대 우드잡지대 ,Interior
351,상품명 심플리 원목 북앤드       책칸막이 책갈피 책장 책선반 책꽂이 우드책꽂이 원목책꽂이 인테리어책꽂이 인,Interior
352,상품명 심플리 원목 북앤드책꽂이       원목 책칸막이 책선반 책꽂이 우드책꽂이 원목책꽂이 인테리어책꽂이 인테,Interior
353,상품명 어린이 독서대 키즈 독서대    베드트레이 좌식트레이 독서대 베드독서대 미니책상 미니좌식테이블 좌식테,Interior
354,상품명 홈 오피스 공부방 문제집 서류정리 책꽂이  단 트롤리 트롤리 트롤리선반 책꽂이선반 무빙카트 서랍수납 수,Interior
355,상품명 페이퍼팝 종이책장  형 단     책장 책꽂이 조립책장 조립책꽂이 수납책장 수납책꽂이 종이가구 종이책장 ,Interior
356,상품명 틈새활용  단 이동식 북트롤리  민트  책장수납장 책장책꽂이 틈새수납장 책장정리함 책장수납함 책상서랍 ,Interior
357,상품명 틈새활용  단 이동식 북트롤리 옐로우  책장수납장 책장책꽂이 틈새수납장 책장정리함 책장수납함 책상서랍,Interior
358,상품명 틈새활용  단 이동식 북트롤리 화이트  책장수납장 책장책꽂이 틈새수납장 책장정리함 책장수납함 책상서랍,Interior
359,상품명 모던 접이식 책꽂이 라이트  접이식책꽂이 접이식책선반 접이형책꽂이 디자인책꽂이 책정리선반 책꽂이 책,Interior
360,상품명 모던 접이식 책꽂이 내추럴  접이식책꽂이 접이식책선반 접이형책꽂이 디자인책꽂이 책정리선반 책꽂이 책,Interior
361,상품명 모던 접이식 책꽂이 다크  접이식책꽂이 접이식책선반 접이형책꽂이 디자인책꽂이 책정리선반 책꽂이 책선,Interior
362,상품명 감각 철제 매거진 랙 화이트  잡지수납장 매거진랙 철제매거진랙 잡지정리랙 잡지꽂이 잡지수납대 잡지수납,Interior
363,상품명 캠핑 차박 초경량 접이식 우든 테이블 캠핑테이블 캠핑용품 차박용품 글램핑용품 폴딩테이블 미니테이블 접,Interior
364,상품명 스토리 하트 프레임 책꽂이 로즈골드 책상정리대 서류정리대 파일꽂이 책꽂이 북앤드 서류꽂이 프레임책꽂,Interior
365,상품명 스토리 삼각 프레임 책꽂이 골드  간이책꽂이 책꽂이 기본책꽂이 책상책꽂이 테이블정리 책상정리 사무용품,Interior
366,상품명 데코  단 책꽂이 연두 카파맥스  책꽂이 꽂이 다용도꽂이 문구용꽂이 책정리 책장 책보관 책정리함 서류꽂,Interior
367,상품명 데코  단 책꽂이 하늘 카파맥스  책꽂이 꽂이 다용도꽂이 문구용꽂이 책정리 책장 책보관 책정리함 서류꽂,Interior
368,상품명  시스맥스 책꽂이  단          화일꽂이 파일꽂이 화일보관꽂이 파일보관꽂이 다용도꽂이 문구용꽂이 책정,Interior
369,상품명  시스맥스 책꽂이  단          화일꽂이 파일꽂이 화일보관꽂이 파일보관꽂이 다용도꽂이 문구용꽂이 책정,Interior
370,카파맥스 상품명 카파 책꽂이  단       하늘 ,Interior
371,카파맥스 상품명 카파 책꽂이  단       회색 ,Interior
372,상품명 심플리 원목 북앤드책꽂이       원목 책칸막이,Interior
373,카파맥스 상품명 카파 피코 책꽂이  단 회색       ,Interior
374,카파맥스 상품명 카파 책꽂이  단       회색 ,Interior
375,상품명 나무선생 삼나무 원목 발받침대,Interior
376,상품명  오렌지           발해먹 발해먹 사무실발받침대 다리받침대 풋레스트 발받침대 책상발받침대 책상발판 발,Interior
377,상품명  네이비           발해먹 발해먹 사무실발받침대 다리받침대 풋레스트 발받침대 책상발받침대 책상발판 발,Interior
378,상품명  화이트  시스맥스       서랍 책꽂이 책꽂이 미니책꽂이 책상책꽂이 디자인책꽂이 책꽃이정리함 사무책꽂,Interior
379,상품명  민트  시스맥스       서랍 책꽂이 책꽂이 미니책꽂이 책상책꽂이 디자인책꽂이 책꽃이정리함 사무책꽂이 ,Interior
380,상품명  그레이  시스맥스       서랍 책꽂이 책꽂이 미니책꽂이 책상책꽂이 디자인책꽂이 책꽃이정리함 사무책꽂,Interior
381,상품명                   국산 의자발커버 층간소음방지 프리사이즈  개입 층간소음 소음방지패드 소음방지 바닥,Interior
382,상품명                   국산 의자발커버 층간소음방지 프리사이즈  개입 층간소음 소음방지패드 소음방지 바닥,Interior
383,상품명                   국산 의자발커버 층간소음방지 프리사이즈  개입 층간소음 소음방지패드 소음방지 바닥,Interior
384,상품명                    국산 의자발커버 층간소음방지 프리사이즈  개입 층간소음 소음방지패드 소음방지 바닥,Interior
385,상품명  민트  슈프림 커버 가죽 데스크 매트 와이드 논슬립 깔판 데스크매트 데스크패드 고무판 책상매트 가죽데,Interior
386,상품명  네이비  슈프림 커버 가죽 데스크 매트 와이드 논슬립 깔판 데스크매트 데스크패드 고무판 책상매트 가죽,Interior
387,상품명  그레이  슈프림 커버 가죽 데스크 매트 와이드 논슬립 깔판 데스크매트 데스크패드 고무판 책상매트 가죽,Interior
388,상품명  핑크  아날로그 슈프림 커버 가죽 데스크매트 베이직 논슬립 데스크매트 데스크패드 고무판 책상매트 가죽,Interior
389,상품명  민트  아날로그 슈프림 커버 가죽 데스크매트 베이직 논슬립 데스크매트 데스크패드 고무판 책상매트 가죽,Interior
390,상품명  네이비  아날로그 슈프림 커버 가죽 데스크매트 베이직 논슬립 데스크매트 데스크패드 고무판 책상매트 가,Interior
391,상품명  그레이  아날로그 슈프림 커버 가죽 데스크매트 베이직 논슬립 데스크매트 데스크패드 고무판 책상매트 가,Interior
392,상품명  티케 좌식 테이블  소소   휴대용 좌식 밥상 베드 트레이 테이블 소소 소  인용밥상 접이식밥상 접이식책,Interior
393,상품명  티케 좌식 테이블  소   휴대용 좌식 밥상 베드 트레이 테이블 소소 소  인용밥상 접이식밥상 접이식책상 ,Interior
394,상품명  보급형   블랙  노트북테이블 거치대 접이식 받침대 휴대용 좌식 책상 좌식책상 휴대용좌식책상 노트북테,Interior
395,상품명  보급형   레드  노트북테이블 거치대 접이식 받침대 휴대용 좌식 책상 좌식책상 휴대용좌식책상 노트북테,Interior
396,상품명  고급형   블랙  노트북테이블 거치대 접이식 받침대 휴대용 좌식 책상 좌식책상 휴대용좌식책상 노트북테,Interior
397,상품명  고급형   레드  노트북테이블 거치대 접이식 받침대 휴대용 좌식 책상 좌식책상 휴대용좌식책상 노트북테,Interior
398,상품명  보급형   블랙  노트북테이블 거치대 접이식 받침대 휴대용 좌식 책상 좌식책상 휴대용좌식책상 노트북테,Interior
399,상품명  보급형   레드  노트북테이블 거치대 접이식 받침대 휴대용 좌식 책상 좌식책상 휴대용좌식책상 노트북테,Interior
400,상품명  고급형   블랙  노트북테이블 거치대 접이식 받침대 휴대용 좌식 책상 좌식책상 휴대용좌식책상 노트북테,Interior
401,상품명  고급형   레드  노트북테이블 거치대 접이식 받침대 휴대용 좌식 책상 좌식책상 휴대용좌식책상 노트북테,Interior
402,상품명  단일상품  좌식 접이식 테이블 노트북 책상 밥상 교자상 공부상 좌식테이블 접이식테이블 접이식책상 노트,Interior
403,상품명  핑크  다용도 접이식 테이블 미니책상 밥상           테이블 좌식책상 책상 미니책상 밥상 다용도테이블 ,Interior
404,상품명  블루  일상한조각 발해먹 책상발받침대 다리거치대 발그네 해먹 책상발받침대 사무실발받침대 발해먹 다리,Interior
405,상품명  블랙  일상한조각 발해먹 책상발받침대 다리거치대 발그네 해먹 책상발받침대 사무실발받침대 발해먹 다리,Interior
406,상품명               블랙        아카시아  철제  단      칸막이책장          책장 책꽂이 서재용책장 책정리 ,Interior
407,상품명               화이트        아카시아  철제  단      칸막이책장          책장 책꽂이 서재용책장 책정,Interior
408,상품명  블랙  이지         선반형 책상 책상 데스크 컴퓨터책상 메탈책상 메탈데스크 학생책상 원룸책상 심플책,Interior
409,상품명  화이트  이지         선반형 책상 책상 데스크 컴퓨터책상 메탈책상 메탈데스크 학생책상 원룸책상 심플,Interior
410,상품명  블랙  이지 컴퓨터책상     책상 데스크 컴퓨터책상 메탈책상 메탈데스크 학생책상 원룸책상 심플책상 조,Interior
411,상품명  화이트  이지 컴퓨터책상     책상 데스크 컴퓨터책상 메탈책상 메탈데스크 학생책상 원룸책상 심플책상 ,Interior
