,titles,category
0,예산사과와인 추사         사과 증류주,Food
1,    에스비 골든 카레     고형카레 중간매운맛 일본카레 대용량 업소용 루카레 카레루,Food
2,못난이백명란       팩 총       ,Food
3,오타후쿠 수입돈까스 소스      ,Food
4,    년 경산 햇 대추 국산 건대추 상초 특초 별초    ,Food
5,일리 미디엄 로스트 원두커피     ,Food
6,삼양 임꺽정떡갈비     ,Food
7,머슬팜 컴뱃      웨이   서빙          프로틴 초콜릿밀크,Food
8,흥국 자몽농축액      자몽에이드 시럽 베이스,Food
9,프로메드 더블랙 맥주효모환          포,Food
10,팔팔양조장 팔팔막걸리  도      ,Food
11,서산 햇 생강 국산생강     특상품,Food
12,몬델리즈 호올스    멘토립터스 멘톨향 캔디    ,Food
13,청주 은영이떡볶이 떡볶이  인분 매운맛 캠핑 밀키트,Food
14,활복오징어 원양산 냉동손질오징어 선동 탈피활복     도매,Food
15,코코밥 초코 대용량        ,Food
16,  제일제당 비비고 진국육수 소고기양지     ,Food
17,바다원 진미채    ,Food
18,인아웃 사과좋아 말랑 스파클링 제로 탄산음료         칼로리 무설탕 과일탄산 사과 ,Food
19,범일콩된장      맛있는 고깃집 된장찌개용 필수 비결 대용량 맛집 업소용 식자재,Food
20,일화 초정탄산수 플레인              개,Food
21,안동 학가산 일반  포기김치    ,Food
22,페이스트리 사각시트       개 외  종 타르트생지 페스츄리 파이 붕어빵시트 냉동생지 빵,Food
23,국산 햇 콩나물콩     년산 유태,Food
24,강화 속노랑고구마         강화도 주빈농장 정직하게 직접재배 강화도 호박고구마,Food
