,titles,category
0,편한 메밀베개 빨아쓰는 거북목베개 일자목 경추 목베개 낮은 낮잠 코골이,Interior
1,호텔침구   수 순면 라지킹 침구세트 이불,Interior
2,사진액자                                  포토 탁상 액자,Interior
3,스마트커브 허리편안 쿠션 허리전만 디스크탈출 척추협착증 자동차 요추전만 비행기 의자,Interior
4,라꾸라꾸 뉴  탄 접이식 침대  ,Interior
5,한샘 밀로 패브릭소파  인용,Interior
6,템퍼 밀레니엄 베개   ,Interior
7,플레이스낭낭 프리미엄 도톰      나비주름 쉬폰 커튼      ,Interior
8,     평생   와이파이 디지털 벽시계 전자     무소음 벽걸이 개업선물,Interior
9,왕자행거 네오스페이스 미니  단 행거,Interior
10,스파이더락 흡착식 도어스토퍼,Interior
11, 이지클린  차르르 쉬폰커튼 화이트 도톰 나비주름 먼지없는커튼 거실 안방 아이방 맞춤제작,Interior
12,조은자리 듀라론 냉감 죽부인 렌징 텐셀 모달 안고자는 롱쿠션 긴 베개 바디필로우 커버 솜,Interior
13,심플룸 틸팅 전면 낮은 책장 원목 거실     조립 틈새  단  단 미니,Interior
14,대용량 수면사 뜨개실 수면실 수면양말실 목도리실 부드러운 털실 소프트 베베 붐붐 극세사,Interior
15,빌트인 주방수납장 다용도 냉장고 틈새장 오브제 비스포크수납장 김치 냉장고장 키큰 홈카페장,Interior
16,서빙카 국산 업소용 가정용 주방 식당카트 서빙카트  단  단 무소음 브레이크바퀴 스텐레스,Interior
17,철제 책상 이케아 책상 조립 컴퓨터 책상 겸 테이블  인 학생 간이 원룸 일자형         ,Interior
18,아미앙스 원피스 린넨 앞치마 롱 카페 예쁜 바리스타 어린이집 에이프런,Interior
19,라삐소 시스템행거 철제  단 선반 드레스룸 스탠드 행거,Interior
20,라꾸라꾸   웰빙 온열  인용 접이식침대,Interior
21,     인치 다운라이트    조명 움푹 매입등    인치  인치  인치 플리커프리,Interior
22,삼성 식물    식물등 식물조명 렌즈형 바 생장 성장     년 신제품,Interior
23,아쿠월 접이식파티션 카페 철제 이동식 파티션 가벽 칸막이,Interior
24,아이엔지홈 플레인  단 보조서랍 책상서랍장,Interior
