,titles,category
0,에스트라 테라크네    클리어 딥 클렌징 폼      ,Makeup
1,독일          손톱깎이 발톱 정리 세트 미스터그린 레인보우 티타늄        ,Makeup
2,버츠비 틴티드 립밤      ,Makeup
3,메종마르지엘라 레플리카 재즈클럽 오 드 뚜왈렛,Makeup
4,헤라 옴므 에센스 인 스킨      ,Makeup
5,인셀덤 더마톨로지 이엑스  종 세트,Makeup
6,결점커버 쿠션,Makeup
7,이니스프리 그린티 씨드 히알루론산 크림     ,Makeup
8,앰플엔 세라마이드샷 앰플      ,Makeup
9,에스트라 아토베리어    하이드로 수딩 크림     ,Makeup
10,수운수 손톱 영양제     ,Makeup
11,헤라 글로우 래스팅 파운데이션            ,Makeup
12,  도미나스 기미 크림        ,Makeup
13,헤어플러스 단백질 본드 샴푸        신형 ,Makeup
14,블랑네이처 클렌징 폼      ,Makeup
15,페리페라 잉크 무드 매트 틴트   ,Makeup
16,유리아쥬 제모스 스틱 레브르   ,Makeup
17,홀리카홀리카 마이 페이브 피스 아이섀도     ,Makeup
18,참존 더블 모이스처 오일 인 세럼     ,Makeup
19, 최신제조  인셀덤 엑티브 클린업 파우더 폼     클렌징 가루 효소 워시 세안제,Makeup
20,에스알비 쌀뜨물 효소 세안제    ,Makeup
21,라운드랩      독도 클렌저      ,Makeup
22,온더바디 코튼풋 발을씻자 풋샴푸 레몬                  개 리필 ,Makeup
23,딥티크 롬브로단로 오 드 퍼퓸,Makeup
24,해피바스 정말 순한 바디워시      신형 ,Makeup
25,엘로엘 선쿠션 팡팡 빅 썬쿠션 에스  시즌          리필,Makeup
26,세라마이드     피부과 레이저 점뺀후 점빼고 재생 관리 후     세라렌 크림,Makeup
27,디오디너리 히알루로닉 애시드    플러스 비      ,Makeup
28,클리오 킬 브로우 듀얼 타투 펜     ,Makeup
29,카밀 핸드크림 미니  종 세트,Makeup
30,키보 도톰 립플러스 플럼퍼     ,Makeup
31,듀이트리 픽 앤 퀵 뽑아쓰는 화장발 마스크,Makeup
32, 다니엘 트루스 오일 퍼퓸 밤쉘     ,Makeup
33,시세이도매직약 앞머리 셀프 볼륨 머리 매직 스트레이트 크림 미용실 남자 다운펌약   ,Makeup
34,     내추럴 커버 파운데이션            ,Makeup
35,메디힐 마스크팩 티트리 베스트   매 세트 수분 미백 여드름,Makeup
36,베리홉 에잇 데이즈 퓨어 비타민 씨 마스크    ,Makeup
37,히스토랩 워터맥스 폼 클렌저      ,Makeup
38,피지오겔    리페어 크림      ,Makeup
39,헤라 멜라솔브 프로그램 딥 클렌징 폼      ,Makeup
40,스틸라 매그니피센트 메탈 글리터 글로우 리퀴드 아이섀도우      ,Makeup
41,일리윤 세라마이드 아토 집중 크림      ,Makeup
42,에스쁘아 노웨어 립스틱 샤인     ,Makeup
43,에스쁘아 프로테일러 비내추럴 쿠션           ,Makeup
44,딥티크 롬브르 단 로 오 드 뚜왈렛,Makeup
45,니베아 체리 샤인     ,Makeup
46,세븐에이트 무향료 칼라 크림     ,Makeup
47,로더베르 시그니처 퍼퓸 샴푸 베이비파우더       ,Makeup
48,지미추 우먼 오 드 뚜왈렛,Makeup
49,리엔 흑모비책 골드 염색약    ,Makeup
50,인셀덤 비에톤 오일 미스트     ,Makeup
51,시즌   철벽녀쿠션 초유콜라겐 커버쿠션     자석밀착커버 보습개선 리필,Makeup
52,탬버린즈 퍼퓸 핸드         ,Makeup
53,에이프릴스킨 히어로 쿠션            ,Makeup
54,마리꼬 수딩 클렌징 밀크      ,Makeup
55,레노덤 데이 롱 비비 쿠션    ,Makeup
56,새한 체리 미라클 피니쉬 수퍼하드 스프레이      ,Makeup
57,빅토리아 뉴 스웨덴 에그팩    ,Makeup
58,클리오 수퍼프루프 브러쉬 라이너      ,Makeup
59,네일자석 초강력 마그네틱 고강도 빅마그넷 롱 몽둥이 스틱바 원기둥 하트자석네일 철사포함,Makeup
60,메디테라피 비타 리얼 샷 클리어 패치,Makeup
61,버츠비 립밤      ,Makeup
62,순녹 센시티브 클렌징 밀크      ,Makeup
63, 압도적인 구매후기     퀸즈헤나 정품 천연 염색약 레드       염색도구 제공 ,Makeup
64,어반디케이 아이섀도우 프라이머 포션 롱 래스팅 아이섀도우 베이스     ,Makeup
65,크리넥스물비누 리필 핸드솝 손세정제 핸드워시 대용량 물비누 액체비누    플로랄향,Makeup
66,바닐라코 프라임 프라이머 피니쉬 파우더    ,Makeup
67,자담유 락토 여성청결제      ,Makeup
68,블라세아 약알칼리성 클렌징폼        개 저자극 약산성 천연 진정 세안제 좁쌀 건성 민감성 클렌저,Makeup
69,제나벨 레이저 수딩 선스크린             ,Makeup
70,비오템 옴므 아쿠아틱 로션 애프터 쉐이브      ,Makeup
71,바세린 드라이스킨 리페어 로션      ,Makeup
72,클린앤클리어 에센셜 페이셜 포밍클렌저      ,Makeup
73,샤넬 블루 드 맨 오 드 퍼퓸,Makeup
74,디올뷰티 루즈 디올     ,Makeup
75,라네즈 워터뱅크 블루 히알루로닉 크림      중건성 ,Makeup
76,새치염색약 흰머리 뿌리 셀프머리염색 순한 저자극 새치커버 오징어먹물 나눠쓰는 염모제,Makeup
77,프리메라 내추럴 리치 클렌징 폼      ,Makeup
78,        내추럴 퍼펙션 더블쉴드 선스틱  워터프루프 골프 쿨링 스틱썬크림          개,Makeup
79,아론 트리트먼트 크림 염색약      실크 리페어 컬러 미용실 새치커버 셀프 저자극 순한 멋내기 뿌리 흰머리 밝은색 갈색 브라운 세치 바르는 다크 애쉬 블랙 부분 그레이 탈색 ,Makeup
80, 본사정품  인셀덤 비비 크림     아쿠아 데일리,Makeup
81,아미니 플라워 테라피 바디워시 체리 블라썸       ,Makeup
82,반코르 닥터 아크네 바하 폼클렌저,Makeup
83,셀라피 에이리페어 크림     ,Makeup
84,버버리 터치 포맨 오드뚜왈렛          ,Makeup
85,해피바스 정말 촉촉한 바디밀크 애플 바나나향     ,Makeup
86,달바 아랑 비건 글로우 쿠션       최대       수분 에센스     밀착 픽싱 커버   촉촉한 타입,Makeup
87,뉴트로지나 딥클린 클렌징 크림      ,Makeup
88,에스티로더 어드밴스드 나이트 리페어 싱크로나이즈드 멀티 리커버리 콤플렉스     ,Makeup
89,니베아 인텐시브 바디 로션      ,Makeup
90,       퍼펙트 립앤아이 메이크업 리무버      ,Makeup
91,르네휘테르 포티샤 두피 세럼      ,Makeup
92,크리노산 그린브이      ,Makeup
93, 에뛰드   리플레이  룩 앳 마이 아이즈          ,Makeup
94,파티온 노스카나인 트러블 세럼     ,Makeup
95,블레파졸 아이리무버       순면부직포   매 눈청결제 눈꺼풀세정제,Makeup
96,버디팜 당근 비누 세안 세수 천연 클렌징 코코넛     ,Makeup
97,디올뷰티 포에버 컴팩트 내추럴 벨벳    ,Makeup
98,유피토스 아미노세라마이드 헤어팩 살롱 트리트먼트      ,Makeup
99,맥 스쿼트 플럼핑 글로스 스틱     ,Makeup
100,샤넬 알뤼르 옴므 스포츠 오 드 뚜왈렛,Makeup
101,헤라 유브이 프로텍터   톤업  크림      마스크팩,Makeup
102,롬앤 듀이풀 워터 틴트   ,Makeup
103,모우모우 프로 페어링 틴트  종 ,Makeup
104,아누아 어성초     진정 토너      ,Makeup
105,나스 네츄럴 래디언트 롱웨어 쿠션 파운데이션           ,Makeup
106,오휘 에이지 리커버리  종 세트,Makeup
107,헤븐젤 러브 수용성 마사지 젤 제리,Makeup
108,포벰브 러브 수용성 유산균 바디 마사지 젤 오일      ,Makeup
109,셀퓨전씨 포스트알파 카밍 다운 크림     ,Makeup
110,바이오더마 시카비오 포마드      ,Makeup
111,자빈드서울 윙크 파운데이션 팩트            ,Makeup
112,롬앤 누 제로 쿠션     지성        ,Makeup
113,설화수 자음  종 세트 기초 에센셜 스킨로션 샘플구성 여성여자 엄마 화장품 설 명절 선물,Makeup
114,센텔리안   마데카 링클 캡처 스틱     ,Makeup
115,케라스타즈 덴시피크 새싹 세럼      ,Makeup
116,마몽드 모이스처 에멀전      ,Makeup
117,맥 스튜디오 픽스 플루이드 파운데이션            ,Makeup
118,조성아뷰티 메가 핏 스틱 파운데이션            ,Makeup
119,네이밍 레이어드 핏 쿠션            ,Makeup
120,어바웃톤 블러 파우더 팩트   ,Makeup
121,세븐피엠 셀프 스트레이트 남자 다운펌 볼륨 여성 매직펌 약 잔머리펌 헤어팩    ,Makeup
122,마렌 마스카라형 블랙 속눈썹영양제,Makeup
123, 가성비대용량 온더바디 코튼풋 발을씻자 풋샴푸       레몬  개,Makeup
124,넘버즈인  번 결광가득 에센스 토너      ,Makeup
125, 홈쇼핑 최신상      아이크림 시즌   프리미어 앰플인               샘플 ,Makeup
126,  네일 국내산 나미 큐티클오일펜     라벤더 손톱영양제 큐티클영양 강화제 고객증정품,Makeup
127,나스 에어 매트 립 컬러      ,Makeup
128,엑토인 비톱 에이지 더마크림    울트라     ,Makeup
129,메디큐브 제로 모공 원데이 세럼     ,Makeup
130,청미정 카카두플럼 기미잡티크림     ,Makeup
131,제로이드 핌프로브 포밍 클렌저      ,Makeup
132,제로이드 더마뉴얼 클렌징 젤      ,Makeup
133,썸바이미 아하 바하 파하    데이즈 미라클 토너      ,Makeup
134,슈라멕 블레미쉬 밤 슈라멕 비비크림클래식      재생크림            ,Makeup
135,라네즈 네오 에센셜 블러링 피니시 파우더   ,Makeup
136, 본사최신제품 인셀덤 비비 크림     아쿠아 데일리,Makeup
137,더페이스샵 보들보들 때 필링      ,Makeup
138,네이처리퍼블릭 데일리 베이직 팔레트     ,Makeup
139,달바 세럼 글로우 픽싱 커버 쿠션            ,Makeup
140,뉴트로지나 세서미 바디 오일      ,Makeup
141,유카자생크림 유황 시카     세라마이드 피부과 레이저 재생관리후 진정 유카 자생 아줄렌,Makeup
142,브링그린 티트리 시카 수딩 크림 플러스      ,Makeup
143,멘소래담 립아이스 매직 컬러   ,Makeup
144,베르사체 에로스 맨 오 드 뚜왈렛,Makeup
145,랩시리즈 올인원 멀티 액션 훼이스 워시      ,Makeup
146,온더바디 발을 씻자 프레쉬 레몬 민트 코튼 풋샴푸      ,Makeup
147,디마르  시그니처 에스투드 프로텍터           대용량 앰플 모공 수분 에센스  자모공,Makeup
148,바닐라코 클린 잇 제로 클렌징밤 포어 클래리파잉      ,Makeup
149,바이오더마 아토덤 크림      ,Makeup
150,이솝 휠 오 드 퍼퓸,Makeup
151,제로이드 핌프로브 모이스처 라이저      ,Makeup
152,부케가르니 퍼퓸 바디로션 화이트 머스크      ,Makeup
153,모레모 케라틴 이지 새치커버 마스카라     부분새치 헤어틴트 스틱,Makeup
154,바세린 립 에센스     ,Makeup
155,닥터자르트 더마스트 워터젯 바이탈 하이드라 솔루션 마스크     ,Makeup
156,겔랑 빠뤼르 골드 스킨 파운데이션     ,Makeup
157,메디필 레드 락토 콜라겐 클리어      ,Makeup
158,비오투름 클렌징 밀크      ,Makeup
159,애경바세린 리프팅 리페어 로션      ,Makeup
160,맥 글로우 플레이 립밤     ,Makeup
161,샤넬 바움 에쌍씨엘 글로우 스틱   ,Makeup
162,닥터지 레드 블레미쉬 포 맨 올인원 플루이드      ,Makeup
163, 클리오  트위드 에디션 클리오 뉴 마그넷 팩트 본품  리필 ,Makeup
164,아이오페 슈퍼바이탈 에멀젼      ,Makeup
165,쁘리디망 고체 향수        승무원 바르는 스틱 지속력 좋은 살냄새 명품 니치 고급,Makeup
166,인셀덤 기초  종 세트,Makeup
167,사이오스 올레오 골드라벨 새치커버 염색약     ,Makeup
168,제이그루 에스그루 프로즌 포그 스프레이      ,Makeup
169,     역대급최신상  최신상     코어리프팅 아이크림 런칭패키지,Makeup
170,뉴트로지나 데일리 바디 로션      ,Makeup
171,비건어스 탈모 완화 뉴트리션 샴푸       바이오틴 약산성 손상모 두피 비건 저자극,Makeup
172,바이오더마 아토덤    밤      ,Makeup
173,애터미 비비크림           ,Makeup
174,라피타 타투 헤어틴트     ,Makeup
175,제로이드 수딩 크림     ,Makeup
176,약국입점 유기농 글리세린 없는 러브 마사지 젤 바디 수용성 오일 제리      ,Makeup
177,자연이랑 컬러 트리트먼트     ,Makeup
178,맥 파우더 키스 벨벳 블러 슬림 스틱   ,Makeup
179,에어쿠션퍼프 메이크업 스펀지 파운데이션 화장퍼프,Makeup
180,이니스프리 그린티 아미노 수분 클렌징 폼       신형 ,Makeup
181,아라한 한방 필링 젤 수     ,Makeup
182,    골드 콜라겐 퍼밍 아이 패치,Makeup
183,아모스 리페어 포스 테라피 에센셜 오일      ,Makeup
184,헤라 파워부스팅 스페셜  종 세트,Makeup
185, 국내백화점  딥디크 플레르드뽀 오드퍼퓸        쇼핑백,Makeup
186,메트리콜 벨벳마스크,Makeup
187,헤라 옴므 에센스 인 에멀젼      ,Makeup
188,헤라 에어리 파우더 프라이머     ,Makeup
189,라카 프루티 글램 틴트     ,Makeup
190,코스알엑스 더 레티놀     크림     ,Makeup
191,쏘미미 물미역 복구 헤어 팩      ,Makeup
192,록시땅 버베나 샤워 젤      ,Makeup
193,       콜츠푸트 안티 댄드러프 샴푸      ,Makeup
194,동국제약 센텔리안   마데카크림 액티브 스킨 포뮬러         개           개   기미완화  안티에이징  보습  탄력에 도움 시즌 ,Makeup
195,엘지 캐릭터 리파이닝 스킨      ,Makeup
196,폴메디슨 시그니처 비누      카렌듈라   팥   검은콩   완두콩   머드   어성초 비누,Makeup
197,멜릭서 비건 립 버터     ,Makeup
198,커리쉴 뉴트리션 서포트 데일리 트리트먼트      ,Makeup
199,디오디너리 매트릭실     플러스 에이치에이     ,Makeup
