,titles,category
0,상품명 라벨라  아멜리에 미니 옷장    ,Interior
1,상품명 아일       화이트  단서랍수납철제선반행거시스템장,Interior
2,상품명       연그레이  단서랍오픈수납철제선반행거시스템장,Interior
3,상품명 하사 비키니옷장 모란봉옷장 장농 수납 부직포 커버,Interior
4,상품명 멀바우 서랍옷장  단,Interior
5,상품명 상하 행거 조립 앵글 슈랙  단             단 블랙,Interior
6,상품명 드레스       연그레이  단철제선반행거시스템수납장,Interior
7,상품명 서랍 옷장         ,Interior
8,상품명 드레스룸       그레이  단철제선반행거시스템수납장,Interior
9,상품명 심플리 선반 옷장     옷수납장 화이트          ,Interior
10,상품명 드레       화이트  단서랍수납철제선반행거시스템장,Interior
11,상품명 투 서랍 옷장 모던 인테리어         ,Interior
12,상품명 드       연그레이  단서랍수납철제선반행거시스템장,Interior
13,상품명 상하 행거 조립 앵글 슈랙  단             단 블랙,Interior
14,상품명       그레이  단서랍오픈수납철제선반행거시스템장,Interior
15,상품명 드레       그레이  단서랍수납철제선반행거시스템장,Interior
16,상품명 드레       그레이  단서랍수납철제선반행거시스템장,Interior
17,상품명 드레       그레이  단서랍수납철제선반행거시스템장,Interior
18,상품명 드레스룸       그레이  단철제선반행거시스템수납장,Interior
19,상품명 드레       화이트  단서랍수납철제선반행거시스템장,Interior
20,상품명 드레스룸       그레이  단철제선반행거시스템수납장,Interior
21,상품명 상하 행거 조립 앵글 슈랙  단              단 화이트,Interior
22,상품명 상하 행거 조립 앵글 슈랙  단             단 화이트,Interior
23,상품명     하우스룸 디자인 선반 옷장         ,Interior
24,상품명 드레스룸       브라운  단철제선반행거시스템수납장,Interior
25,상품명 심플리 선반 옷장 화이트          ,Interior
26,상품명 빌한슨 키큰옷장 조립식장농 원룸 간이 옷장  인     ,Interior
27,상품명     하우스룸 디자인 선반 옷장          ,Interior
28,상품명 드레스룸       화이트  단철제선반행거시스템수납장,Interior
29,상품명 비키니 옷장 베이직 커버형행거옷장,Interior
30,상품명       화이트  단서랍오픈수납철제선반행거시스템장,Interior
31,상품명 심플리 선반 옷장 의류 옷수납장 화이트          ,Interior
32,상품명 드레       브라운  단서랍수납철제선반행거시스템장,Interior
33,상품명       화이트  단서랍오픈수납철제선반행거시스템장,Interior
34,상품명       화이트  단서랍오픈수납철제선반행거시스템장,Interior
35,상품명 드레       브라운  단서랍수납철제선반행거시스템장,Interior
36,상품명     라인 선반 화이트 옷장         ,Interior
37,상품명 멀바우 옷장 모던 인테리어    ,Interior
38,상품명 멀바우 옷장,Interior
39,상품명 상하 행거 조립 앵글 슈랙  단             단 블랙,Interior
40,상품명 상하 행거 조립 앵글 슈랙  단             단 블랙,Interior
41,상품명 앤틱 우드 장롱,Interior
42,상품명     복합 선반 수납장 조립식옷장  칸          ,Interior
43,상품명 드레       브라운  단서랍수납철제선반행거시스템장,Interior
44,상품명 드레       화이트  단서랍수납철제선반행거시스템장,Interior
45,상품명 상하 행거 조립 앵글 슈랙  단              단 블랙,Interior
46,상품명 드레       화이트  단서랍수납철제선반행거시스템장,Interior
47,상품명 드레       브라운  단서랍수납철제선반행거시스템장,Interior
48,상품명 드레스룸       화이트  단철제선반행거시스템수납장,Interior
49,상품명 드레스       연그레이  단철제선반행거시스템수납장,Interior
50,상품명     라인 선반 옷장 가벼운 플라스틱옷장 화이트,Interior
51,상품명 드레       그레이  단서랍수납철제선반행거시스템장,Interior
52,상품명       브라운  단서랍오픈수납철제선반행거시스템장,Interior
53,상품명 심플리 선반 옷장 의류 옷수납장 화이트          ,Interior
54,상품명     핑크하우스 선반옷장    옷장  열 칸,Interior
55,상품명     심플리 선반 옷장 조립식 간이옷장,Interior
56,상품명 드레       화이트  단서랍수납철제선반행거시스템장,Interior
57,상품명     라인 선반 옷장 화이트             ,Interior
58,상품명 드레스       연그레이  단철제선반행거시스템수납장,Interior
59,상품명       연그레이  단서랍오픈수납철제선반행거시스템장,Interior
60,상품명 드레스룸       그레이  단철제선반행거시스템수납장,Interior
61,상품명 드레       그레이  단서랍수납철제선반행거시스템장,Interior
62,상품명 드레       그레이  단서랍수납철제선반행거시스템장,Interior
63,상품명 상하 행거 조립 앵글 슈랙  단             단 화이트,Interior
64,상품명 드레스룸       화이트  단철제선반행거시스템수납장,Interior
65,상품명 아일       그레이  단서랍수납철제선반행거시스템장,Interior
66,상품명 드       연그레이  단서랍수납철제선반행거시스템장,Interior
67,상품명 심플리 선반 옷장 조립식옷장 화이트  열  칸,Interior
68,상품명 심플리 선반 조립식옷장 화이트 옷장 열  칸,Interior
69,상품명     라인 선반 옷장 화이트             ,Interior
70,상품명 드레스룸       브라운  단철제선반행거시스템수납장,Interior
71,상품명 흑경 옷장         ,Interior
72,상품명 복합     원룸옷장 수납장 모리아 선반  칸          ,Interior
73,상품명     복합 선반 수납장 조립옷장          ,Interior
74,상품명 드레스룸       브라운  단철제선반행거시스템수납장,Interior
75,상품명     뮬라옷장  화이트,Interior
76,상품명 심플리 선반 옷장 조립식 의류 옷수납함 화이트,Interior
77,상품명     뮬라옷장  블랙,Interior
78,상품명 빌한슨 낮은옷장 조릭식장농 싱글장 옷장  인    ,Interior
79,상품명 상하 행거 조립 앵글 슈랙  단              단 블랙,Interior
80,상품명 철재 캐비넷 중형,Interior
81,상품명 플라스틱옷장 선반 옷장 화이트           열 칸,Interior
82,상품명 사무용 서류보관 수납장 철제 캐비넷,Interior
83,상품명 사야 투서랍옷장,Interior
84,상품명 옷장 선반   칸           화이트,Interior
85,상품명 선반 옷장           화이트   칸,Interior
86,상품명 상하 행거 조립 앵글 슈랙  단             단 블랙,Interior
87,상품명 선반 옷장           화이트,Interior
88,상품명 드레       그레이  단서랍수납철제선반행거시스템장,Interior
89,상품명 선반 옷장 플라스틱옷장           열 칸 화이트,Interior
90,상품명 상하 행거 조립 앵글 슈랙  단             단 화이트,Interior
91,상품명 미니 도어 철제 캐비넷 원 블랙     ,Interior
92,상품명 심플리 선반 조립식옷장 화이트 옷장 열  칸,Interior
93,상품명 캐비넷  미니 그레이 화이트 철제     ,Interior
94,상품명 서랍 캐비넷 미니 철제  단      블랙,Interior
95,상품명 오크 화이트 철제 미니 캐비넷      ,Interior
96,상품명 철제 수납 캐비넷 옐로우        칸,Interior
97,상품명 철제 스카이 캐비넷 수납  칸      ,Interior
98,상품명 상하 행거 조립 앵글 슈랙  단              단 블랙,Interior
99,상품명 철제 캐비넷  미니 화이트     ,Interior
100,상품명 철제 오크 화이트 캐비넷  미니     ,Interior
101,상품명 철제 미니 캐비넷  화이트     ,Interior
102,상품명 철제 캐비넷  미니 블랙     ,Interior
103,상품명 심플리 옷장 선반 화이트          ,Interior
104,상품명 미니 캐비넷 서랍 철제      블랙  단,Interior
105,상품명 선반옷장 심플리 화이트          ,Interior
106,상품명 캐비넷 그레이 화이트 원도어 철제 미니     ,Interior
107,상품명 선반 옷걸이 옷장     화이트 중,Interior
108,상품명 미니 철제 캐비넷 서랍 화이트  단     ,Interior
109,상품명 원 철제 오크 화이트 도어 캐비넷 미니     ,Interior
110,상품명 캐비넷 스카이 수납 철제   칸      ,Interior
111,상품명 그레이  철제 미니 캐비넷 서랍 화이트       단,Interior
112,상품명 수납 철제 캐비넷  칸    진   핑크,Interior
113,상품명 심플리 옷장 선반 화이트           ,Interior
114,상품명 옷걸이     선반 옷장 대 화이트,Interior
115,상품명 미니 캐비넷  철제      블랙,Interior
116,상품명 빌한슨 조립식장농 키큰옷장 싱글장 옷장  인     ,Interior
117,상품명 빌한슨 낮은옷장 조릭식장농 싱글 원룸 옷장  인    ,Interior
118,상품명 철제 캐비넷 혼합 수납 칼러  칸      ,Interior
119,상품명 빌한슨 낮은옷장 조릭식장농 원룸 싱글 옷장  인    ,Interior
120,상품명 빌한슨 키큰옷장 조립식장농 싱글 원룸 옷장  인     ,Interior
121,상품명 미니장농 소형옷장 키낮은장롱 이불서랍장,Interior
122,상품명 빌한슨 낮은옷장 조릭식장농 원룸 간이 옷장  인    ,Interior
123,상품명 미니 캐비넷 철제 원 도어 블랙     ,Interior
124,상품명 철제 캐비넷 수납 옐로우        칸,Interior
125,상품명 상하 행거 조립 앵글 슈랙  단             단 화이트,Interior
126,상품명 상하 행거 조립 앵글 슈랙  단              단 블랙,Interior
127,상품명 미니장농 키낮은옷장 슬림옷장  인용옷장,Interior
128,상품명  인용옷장 거울옷장 작은 싱글    옷장 원룸장롱,Interior
129,상품명 북유럽감성 종결자 리버퍼니쳐 토르니아 옷장,Interior
130,상품명 북유럽감성 종결자 리버퍼니쳐 토르니아  단서랍옷,Interior
131,상품명     호  단 행거 옷걸이 대형 옷장 파이프 거치대,Interior
132,상품명 스틸 단조립행거 행거 드레스룸 조립식 맞춤형,Interior
133,상품명  단      드레스장 옷걸이 드레스룸 옷장 장롱,Interior
134,공식 상품 상일리베가구 상품명  최종결제가       원  상일리베가구 빅 풀 슬라이딩 옷장 행거서랍,Interior
135,공식 상품 상일리베가구 상품명 심포니    장 행거형 옷장,Interior
136,공식 상품 한샘 상품명 샘베딩 세이지 옷장세트       높이       행거형  종,Interior
137,공식 상품 동서가구 상품명      아델 전신 거울     틈새 옷장         ,Interior
138,공식 상품 삼익가구 상품명 블랑     옷장,Interior
139,공식 상품 동서가구 상품명      북유럽 모던      도어 서랍 옷장 세트         ,Interior
140,공식 상품 동서가구 상품명       추천상품  모던      서랍 옷장 북유럽 옷장 시리즈         ,Interior
141,동서가구 상품명 동서가구 프렌드  서랍옷장         ,Interior
142,동서가구 상품명 동서가구 비트  단서랍형     이불장         ,Interior
143,동서가구 상품명 동서가구 엘뉴 거울  슬라이딩      옷장         ,Interior
144,공식 상품 한샘 상품명 피카 옷장세트        높이       화이트 선반형,Interior
145,지베스 상품명 바흐      단옷장 드레스룸 블라인드세트,Interior
146,장인가구 상품명 세이 원목 드레스룸      단서랍 행거형,Interior
147,동서가구 상품명 동서가구 켄델 행거형     싱글옷장  타입         ,Interior
148,동서가구 상품명 동서가구 켄델 전신거울     싱글옷장  타입         ,Interior
149,공식 상품 한샘 상품명 샘베딩 클로즈 옷장세트       높이       서랍형,Interior
150,상품명 밀란   하이그로시     전신거울 서랍 옷장 미니옷장,Interior
151,공식 상품 한샘 상품명 한샘 바이엘 채널 옷장 화이트      높이       선반형  타입,Interior
152,장인가구 상품명 로더 베이직         장롱세트       서랍옷장    행거형옷장 ,Interior
153,상품명  플레인홈 달튼 장롱세트 도어형     ,Interior
154,공식 상품 상일리베가구 상품명 빅 풀     선반 옷장  추가구성 단독구매불가 ,Interior
155,공식 상품 포더홈 상품명 스페이서     도어 옷장  추가구성 단독구매불가 ,Interior
156,공식 상품 상일리베가구 상품명 심포니     거울형 옷장,Interior
157,공식 상품 상일리베가구 상품명 심포니     서랍형 옷장,Interior
158,공식 상품 상일리베가구 상품명 심포니     옷장,Interior
159,공식 상품 한샘 상품명 바이엘 채널 작은방 거울 붙박이장 데일리서랍형           ,Interior
160,공식 상품 한샘 상품명 바이엘 채널 작은방 거울 붙박이장 데일리서랍형           ,Interior
161,디자인벤처스 상품명 로맨틱 팅커벨옷장,Interior
162,상품명 틈새 긴옷장 사무실 겉옷 보관함 장농 싱글 회사 겨울,Interior
163,에넥스 상품명 오믈렛 시즌  싱글장 기본형 ,Interior
164,유캐슬 상품명 아벨리아 엔틱 옷장 장롱 입본장,Interior
165,동화속나무 상품명 낮은 사무실 겉옷 수납 옷장 높이      기숙사 간이 겉옷보관 코너 회사 슬림,Interior
166,공식 상품 리바트 상품명 엘리아      키큰옷장,Interior
167,공식 상품 동서가구 상품명 큐브      뎀퍼  도어 옷장 행거형  큐브    상부장             ,Interior
168,마켓비 상품명 마켓비     캐비넷 옷장         옐로우,Interior
169,상품명 로홈 리오 슬라이딩옷장     사이즈 붙박이장 작은방 아이방 틈새장 슬라이드옷장 드레스룸 장농 다양한컬러,Interior
170,공식 상품 한샘 상품명 한샘 바이엘 채널 옷장세트 화이트       높이       선반형,Interior
171,공식 상품 베스트리빙 상품명 이사벨라 엔틱 의류장 옷장 화이트,Interior
172,공식 상품 잉글랜더 상품명 패런트 멀바우 서랍장 옷장 이불장 전신거울옷장,Interior
173,상품명 조립옷장 좁은방옷장 조립식장농 자취방옷장      ,Interior
174,상품명 조립옷장 좁은방옷장 조립식장농 자취방옷장        ,Interior
175,상품명 조립옷장 좁은방옷장 조립식장농 자취방옷장        ,Interior
176,상품명 조립옷장 좁은방옷장 조립식장농 자취방옷장        ,Interior
177,상품명 조립옷장 좁은방옷장 조립식장농 자취방옷장        ,Interior
178,상품명 사각매입손잡이 블랙    붙박이장 미닫이문,Interior
179,상품명 사각매입손잡이 새틴브론즈    붙박이장 미닫이문,Interior
180,상품명 사각매입손잡이 새틴실버    붙박이장 미닫이문,Interior
181,상품명 사각매입손잡이 화이트    붙박이장 미닫이문,Interior
182,상품명 조립옷장 좁은방옷장 조립식장농 자취방옷장  ,Interior
183,상품명 조립옷장 좁은방옷장 조립식장농 자취방옷장   ,Interior
184,상품명 조립옷장 좁은방옷장 조립식장농 자취방옷장        ,Interior
185,상품명 조립옷장 좁은방옷장 조립식장농 자취방옷장        ,Interior
186,더리드 상품명 선데인 슬라이딩 장롱   ,Interior
187,더리드 상품명 선데인 슬라이딩 장롱   ,Interior
188,더리드 상품명 선데인 슬라이딩 장롱   ,Interior
189,더리드 상품명 선데인 슬라이딩 장롱   ,Interior
190,더리드 상품명 선데인 슬라이딩 장롱   ,Interior
191,더리드 상품명 선데인 슬라이딩 장롱    ,Interior
192,더리드 상품명 선데인 슬라이딩 장롱   ,Interior
193,더리드 상품명 선데인 슬라이딩 장롱    ,Interior
194,더리드 상품명 선데인 슬라이딩 장롱      ,Interior
195,더리드 상품명 선데인 슬라이딩 장롱    ,Interior
196,더리드 상품명 갤러리 슬라이딩 장롱   ,Interior
197,더리드 상품명 갤러리 슬라이딩 장롱   ,Interior
198,더리드 상품명 갤러리 슬라이딩 장롱   ,Interior
199,더리드 상품명 갤러리 슬라이딩 장롱   ,Interior
200,더리드 상품명 갤러리 슬라이딩 장롱   ,Interior
201,더리드 상품명 갤러리 슬라이딩 장롱   ,Interior
202,더리드 상품명 갤러리 슬라이딩 장롱    ,Interior
203,더리드 상품명 갤러리 슬라이딩 장롱      ,Interior
204,더리드 상품명 갤러리 슬라이딩 장롱    ,Interior
205,더리드 상품명 갤러리 슬라이딩 장롱    ,Interior
206,더리드 상품명 메이든 하이그로시 슬라이딩 장롱   ,Interior
207,더리드 상품명 메이든 하이그로시 슬라이딩 장롱   ,Interior
208,더리드 상품명 트리아 슬라이딩 장롱   ,Interior
209,더리드 상품명 트리아 슬라이딩 장롱   ,Interior
210,더리드 상품명 트리아 슬라이딩 장롱   ,Interior
211,더리드 상품명 트리아 슬라이딩 장롱   ,Interior
212,더리드 상품명 트리아 슬라이딩 장롱   ,Interior
213,더리드 상품명 트리아 슬라이딩 장롱   ,Interior
214,더리드 상품명 트리아 슬라이딩 장롱    ,Interior
215,더리드 상품명 트리아 슬라이딩 장롱    ,Interior
216,더리드 상품명 트리아 슬라이딩 장롱      ,Interior
217,더리드 상품명 트리아 슬라이딩 장롱    ,Interior
218,상품명 어린이집 유치원 원목 고무나무 옷걸이 행거,Interior
219,상품명 다용도 고정  형 후크걸이 싱글    소품홀더 소품걸이,Interior
220,상품명 옷장 수납정리 슬라이드      행거 옷걸이행거 옷행거,Interior
221,상품명 옷장 수납정리 슬라이드      행거 옷걸이행거 옷행거,Interior
222,상품명 옷장 수납정리 슬라이드      행거 스탠드옷걸이,Interior
223,상품명 옷장 수납정리 슬라이드      행거 옷걸이행거 옷행거,Interior
224,상품명 옷장 수납정리 슬라이드      행거 옷행거 옷걸이행거,Interior
225,상품명 옷장 수납정리 슬라이드      행거 행거용품 옷행거,Interior
226,상품명 멀바우  단 서랍옷장,Interior
227,상품명  단     철제 드레스장,Interior
228,상품명         화이트 라인 선반 옷장 가벼운 플라스틱옷,Interior
229,상품명  단서랍     드레스장 장롱 철제옷장 행거 드레스룸,Interior
230,상품명  단서랍     드레스장 인테리어 옷장 행거 옷걸이,Interior
231,공식 상품 한샘 상품명 한샘 샘베딩 클로즈 옷장      높이        단행거형  종,Interior
232,공식 상품 동서가구 상품명 해피 드레스룸      단 행거,Interior
233,장인가구 상품명 장인가구 피콜로 이동식 전신거울 옷장 행거,Interior
234,공식 상품 프리메이드 상품명 프라임 수납 행거 옷걸이행거 드레스룸 선반행거 옷장,Interior
235,동서가구 상품명 동서가구 쏘노 조립식 오픈형     철제 드레스룸  단 행거 옷장         ,Interior
236,공식 상품 리바트 상품명 엘리아      키큰옷장,Interior
237,공식 상품 프리메이드 상품명 프라임  단 와이드 행거 옷장 드레스룸 시스템행거,Interior
238,리빙위즈 상품명 르네 행거 와이드 일반형 이동식 수납 선반 옷걸이 드레스룸 미니 시스템 옷장,Interior
239,장인가구 상품명 로더 베이직         장롱세트     행거형옷장    거울옷장      서랍옷장 ,Interior
240,공식 상품 한샘 상품명 스테이 드레스룸      단독형  단서랍형,Interior
241,공식 상품 한샘 상품명 한샘 샘베딩 드레스룸 세트        높이       행거형,Interior
242,아씨방 상품명 아씨방가구 갤러리      서랍도어형 옷장,Interior
243,공식 상품 한샘 상품명 바이엘 소프트 옷장 크림화이트       높이       수납형,Interior
244,홈쇼핑 상품 에넥스 상품명 에넥스 페블스톤 슬라이딩 붙박이장      규격추가 ,Interior
245,상품명 우메오 메이플     아일랜드시스템서랍장 드레스룸악,Interior
246,상품명 우메오 그레이     아일랜드시스템서랍장 드레스룸악,Interior
247,상품명 우메오 내츄럴     아일랜드시스템서랍장 드레스룸악,Interior
248,상품명 우메오 브라운     아일랜드시스템서랍장 드레스룸악,Interior
249,상품명 우메오 화이트     아일랜드시스템서랍장 드레스룸악,Interior
250,상품명 우메오 메이플     아일랜드시스템서랍장 드레스룸악,Interior
251,상품명 미카엘     폭 전신거울 수납 서랍 옷장        ,Interior
252,상품명          선반행거  가구 드레스룸 행거형드레스룸 드레스룸행거 고정형드레스룸행거 심플드레스룸행거 의,Interior
253,상품명 슬라이딩 시스템 옷장 조립식 서랍 조립식 드레스룸,Interior
254,상품명 옷장 수납장 자석 빠지링,Interior
255,상품명 조립식 시스템 행거 옷방 드레스룸 비키니 옷장 싱글,Interior
256,상품명 커버형 시스템 옷장 조립식 서랍 드레스룸 더블,Interior
257,상품명 착불타키        세트 장롱 장농 이불장 안방 작은방 원룸 서랍  자,Interior
258,상품명 수납 간이옷장 오픈형 옷정리함  단,Interior
259,상품명 수납 간이옷장 오픈형 옷정리함  단,Interior
260,상품명 수납 간이옷장 오픈형 옷정리함  단,Interior
261,상품명 수납 간이옷장 오픈형 옷정리함  단,Interior
262,상품명 모던 간이옷장 오픈형 옷정리함,Interior
263,상품명 간편 조립옷장 가구 플라스틱장 서랍형 행거형옷장 방 도어 조립식 신혼부부 세트 수납장 중학생 작은,Interior
264,상품명 수납장 조립옷장 서랍 선반형옷장 간이  단서랍옷장 드레스룸 옷방 원룸 조립형 간편 장농 자취 장롱,Interior
265,상품명 간이 조립옷장 선반 서랍장롱 조립식 옷장서랍장세트 드레스룸 키큰장 싱글 가구 작은방 방 간편 신혼,Interior
266,상품명 수납 조립 옷장 공간활용 선반형옷장 행거 서랍형옷장 장롱 장농 좁은 자취 드레스룸 키큰장 중학생 원,Interior
267,상품명 가구 조립옷장 화이트 옷장서랍장세트 행거 간편옷장 중학생 서랍형 신혼부부 장농 수납장 간이 싱글,Interior
268,상품명 조립식 옷장행거 옷방 드레스룸     수납장 옷정리함 시스템행거 틈새수납장 스탠드옷걸이,Interior
269,상품명 동서가구 켄델 전신거울     싱글옷장  타입         ,Interior
270,상품명 동서가구 이즈 클래스 롱바     서랍옷장       ,Interior
271,상품명 모나코가구 리퍼 소피아 투서랍     옷장 원목 호텔 장롱 착불 ,Interior
272,상품명 보스코가구 화이트     거울장 옷장 거울옷장,Interior
273,공식 상품 한샘 상품명 한샘 바이엘 채널 옷장세트             높이       화이트   종,Interior
274,공식 상품 웨스트프롬 상품명 더블린 하프갤러리 커스터마이징 슬라이딩 드레스룸 키큰 옷장           내부 선택,Interior
275,웰튼 상품명 보브         옷이불수납 서랍형 장롱 공장직판매완제품배송,Interior
276,대도갤러리 상품명 키높이 클래시 하이그로시 슬라이딩옷장   자세트,Interior
277,공식 상품 동서가구 상품명      모던 아카시아 콤비     긴 옷장 화이트 옷장 모음           ,Interior
278,공식 상품 한샘 상품명 한샘 샘베딩 스테디 옷장      높이        단행거형   종,Interior
279,바보사랑 상품명 아이린 전신거울 수납형  단 스틸 드레스룸행거    아름이와다움이무료배송,Interior
280,동서가구 상품명 동서가구 비드가 거울 화장대  단서랍장 드레스룸         ,Interior
281,동서가구 상품명 동서가구 엘뉴 오픈      드레스룸 옷장         ,Interior
282,공식 상품 동서가구 상품명 해피 드레스룸 코너 행거,Interior
283,공식 상품 동서가구 상품명 해피 드레스룸 멀티 행거,Interior
284,아씨방 상품명 아씨방가구 갤러리      옷장 장롱,Interior
285,공식 상품 한샘 상품명 한샘 더블유 드레스룸       높이       선반형  타입,Interior
286,동서가구 상품명 동서가구 라스     투서랍옷장         ,Interior
287,잉글랜더 상품명 알레아 드레스룸     긴옷장,Interior
288,상품명  보루네오하우스 라보떼 로리아     도어 옷장세트 형    옷장    옷장      ,Interior
289,공식 상품 리바트 상품명 모뜨     옷장 짧은옷장 ,Interior
290,동서가구 상품명 동서가구 켄델 전신거울     틈새옷장         ,Interior
291,공식 상품 한샘 상품명 샘베딩 클로즈 옷장세트        높이       행거형,Interior
292,공식 상품 한샘 상품명 스테이 드레스룸 세트       서랍형,Interior
293,공식 상품 한샘 상품명 스테이 드레스룸세트           서랍 거울형,Interior
294,지베스 상품명 엘린     키큰 투서랍옷장,Interior
295,상품명 보네드  단서랍 옷장 아카시아 삼나무 원목     장롱,Interior
