,titles,category
0,    아모스 녹차실감 샴푸      지성 산뜻한 타입  두피 각질 비듬 제거,Makeup
1,비욘드 딥 모이스처 크리미 바디워시       ,Makeup
2,미쟝센 살롱 플러스 클리닉    극손상모발용 에센스 팩      ,Makeup
3,유후젤 러브 수용성 마사지 젤 비건인증 성분 바디 제리    ,Makeup
4,르네휘테르 아스테라 프레시 수딩 샴푸      ,Makeup
5,닥터방기원 나노버블 클렌징폼      ,Makeup
6,퓨레드  흑채 헤어쿠션 미니    ,Makeup
7,애프터스윔 수영장 샴푸 바디워시         수영샴푸 염소,Makeup
8,록시땅 체리 블라썸 소프트 핸드 크림     ,Makeup
9,지베르니 밀착 커버 쿠션             신형 ,Makeup
10,플라워바이 겐조 우먼 오 드 뚜왈렛,Makeup
11,어노브 딥 데미지 트리트먼트 이엑스 텐더블룸      ,Makeup
12,설화수 탄력크림 기획세트      수분 영양 크림 피부 탄력 주름개선 화장품 선물,Makeup
13,크리넥스 소프트 폼 솝       핸드워시 스윗파우더향 대용량 손세정제 리필 거품비누,Makeup
14,루나 롱래스팅 팁 컨실러            ,Makeup
15,힌스 무드인핸서 워터 리퀴드 글로우    ,Makeup
16,    세이프온 시카 카밍 선 쿠션            ,Makeup
17,코스알엑스 원스텝 오리지널 클리어 패드   매,Makeup
18,일리윤 세라마이드 아토     탑투토 워시       ,Makeup
19,베리홉 에잇 데이즈 퓨어 비타민  앰플 플러스     ,Makeup
20,    무칸 남자 올인원로션      ,Makeup
21,동국제약 기미 앰플 맥스 마데카 멜라캡쳐 앰플 시즌  멜라캡처  박스          ,Makeup
22,니베아     고보습 바디로션       저자극 바디로션,Makeup
23,라끌리닉드파리 딥 클렌징밤      ,Makeup
24,구달 맑은 어성초 진정 수분 선크림             ,Makeup
25,데미 우에보 디자인 큐브 드라이 왁스    ,Makeup
26,루나 블러 커버 쿠션           ,Makeup
27,프롬랩스 퓨리파잉 비듬 개선 지성용 샴푸      ,Makeup
28,닥터자르트 시카페어 크림     ,Makeup
29,라운드랩 자작나무 수분 패드   매,Makeup
30,    온리 포 맨 올인원 에센스      ,Makeup
31,이니스프리 애플 씨드 클렌징 오일      ,Makeup
32,누아레모 염색샴푸 새치 블랙 커버 흰머리,Makeup
33,콜라겐 나이트 랩핑 마스크 대용량,Makeup
34,에스트라 아토 베리어 로션 엠디      ,Makeup
35,한스킨 수퍼 라이트 터치 비비크림           ,Makeup
36,닥터지 레드 블레미쉬 필링젤      ,Makeup
37,오드로이 레티놀 피어니 붉은기 완화 앰플 필리디     ,Makeup
38,      국산 포르테에뷔프 퍼퓸 큐티클 오일펜 체리블라썸,Makeup
39,설화수 탄력 에센셜  종 세트,Makeup
40,설화수 퍼펙팅쿠션 세트     신형 팩트 본품 리필,Makeup
41,디오메르 비피다 부스팅 앰플     ,Makeup
42,논픽션 바디케어 세트   종 중 택  ,Makeup
43,논픽션 상탈크림 바디로션      ,Makeup
44,케론 시스테인 웨이브 로션      ,Makeup
45,포딥     아로마 수용성 마사지젤 바디 오일 에로스젤,Makeup
46,입큰 퍼퓸 파우더 팩트         ,Makeup
47,에스네이처 아쿠아 오아시스 수분 젤크림     ,Makeup
48,한스킨 클렌징 오일 앤 블랙헤드 파하      ,Makeup
49,웰빙헬스 고운발크림     ,Makeup
50,설화수 설화수 탄력에센셜  종 기획세트,Makeup
51,코스알엑스 더 비타민씨    세럼    ,Makeup
52,닥터포헤어 폴리젠 헤어토닉      ,Makeup
53, 설화수  설화수 자음  종 기획세트  에센셜  종 세트  정품,Makeup
54,라르꼬발레노 티타늄 바늘          롤러        혼합색상  개,Makeup
55,미쯔요시    프로페셔널 메이크업 아이라이너 펜슬   ,Makeup
56,입생로랑 리브르 핸드 크림 리미티드 에디션     ,Makeup
57,나스 파워매트 하이 인텐시티 립 펜슬     ,Makeup
58,제니퍼로페즈 글로우 바이 제이로 오 드 뚜왈렛,Makeup
59,설화수 윤조 에센스  세대     ,Makeup
60,탬버린즈 퍼퓸드 핸드 앤 바디 워시          ,Makeup
61,미쟝센 샤이닝 에센스 새치 염색약    흑갈색     ,Makeup
62,가히 링클 바운스 수분 가득 퍼펙팅 마스크    ,Makeup
63,메디플라워 보니타 가든 핸드 크림  종 세트,Makeup
64,네일아트 리필팁 네일팁 숏오발  타입클리어 호   개입,Makeup
65,호유 프로스텝 염색약    ,Makeup
66,니베아 프로텍트 앤 라이트 필 퍼펙트 선 세럼             ,Makeup
67,스킨푸드 블랙 슈가 퍼펙트 에센셜 스크럽        ,Makeup
68,아이디얼포맨 올인원 기획  종  퍼펙트 시카 프레시 선디펜스 ,Makeup
69,리엔 흑모비책 한방 크림 염색     ,Makeup
70,안나플러스 헤어 트리트먼트 에센스      ,Makeup
71,광동제약 내가그린빠른허브 염색약,Makeup
72,밀크바오밥 세라 바디로션 화이트머스크      ,Makeup
73,일리윤 세라마이드 아토 로션        네이버 전용 ,Makeup
74,음모숱가위   왁싱가위 브라질리언 비키니라인 숱치는 제모 왁싱용 미용,Makeup
75,아비브 부활초 크림 뉴트리션     ,Makeup
76,퀸즈헤나 천연 염색약     ,Makeup
77,헤라 벨벳 나이트 퍼퓸드 바디 로션      ,Makeup
78,페리페라 잉크 더 에어리 벨벳,Makeup
79,한율 자연을 닮은 립밤   ,Makeup
80,라네즈 네오 파운데이션 글로우            ,Makeup
81,     신년        에센스 커버 팩트 다이아 용띠에디션,Makeup
82,유리아쥬 여성청결제 진피  존케어 데일리 이너퍼퓸                 코스트코,Makeup
83,알롱 셀프왁싱 브라질리언 제모 하드 왁스 왁싱 키트 비키니 겨드랑이 종아리 수염 다리 팔,Makeup
84,네이처리퍼블릭 진생 로얄 실크 워터리 크림     ,Makeup
85,에스쁘아 리얼 아이 핸디 팔레트   ,Makeup
86,닥터지 레드 블레미쉬 클리어 수딩 크림              수분 시카 성분 포함,Makeup
87,아이오페 슈퍼바이탈 아이크림     ,Makeup
88,바이오더마 센시비오 크레알린      클렌징워터      ,Makeup
89,      더 퍼스트 젤 아이라이너     ,Makeup
90,디뷰스 인텐시브 에너제닉 쿠션 컴플리트             ,Makeup
91,톰포드 화이트 스웨이드 오 드 퍼퓸,Makeup
92,미쯔요시 그리스 페인트 컨실러   ,Makeup
93,온더바디 발을씻자 풋샴푸 민트향             비누향      ,Makeup
94,     섹스 밤     ,Makeup
95,달바 화이트 트러플 로얄 인텐시브 세럼     ,Makeup
96,센텔리안   마데카 파워 앰플     ,Makeup
97,바이오힐보 프로바이오덤 리프팅 괄사 마사저,Makeup
98,프랑스와즈 히알루론산 고분자      ,Makeup
99,엘루자이 콜라겐 링클밤   개 비타민 쿨링밤 멀티밤,Makeup
100,천연비누 선물 돌 답례품    수제비누 비누각인 가능,Makeup
101,모로칸오일 스무딩 로션      ,Makeup
102,닥터빠르마       항문전용워셔 세정제 클렌저 청결제 남녀노소 사용가능     ,Makeup
103,설화수 순행 클렌징 오일      ,Makeup
104,아이깨끗해 핸드워시 순                  개 리필 ,Makeup
105,뉴트로지나 인텐스 리페어 핸드크림    ,Makeup
106,아윤채 리프레싱 샴푸     ,Makeup
107,베네피트 프리사이슬리 마이 브로우 펜슬 미니     ,Makeup
108,탬버린즈 핸드 크림         ,Makeup
109,애터미 선크림 베이지             ,Makeup
110,손톱영양제 큐티클 오일 펜    ,Makeup
111,쓰리세븐    손톱깎이세트        ,Makeup
112,그라운드랩 소나무 진정 시카 앰플     ,Makeup
113,비앙카 핸드워시 손세정제 대용량 리필 물비누   ,Makeup
114,더페이스샵 파워 퍼펙션 비비           ,Makeup
115,온더바디 발을씻자 코튼 풋 샴푸 쿨링      ,Makeup
116,뉴트로지나 딥클린 포밍 클렌저       개,Makeup
117,닥터지 블랙 스네일 토너      ,Makeup
118,비바스 바이옴 맥주효모 내추럴 탈모완화 샴푸      ,Makeup
119,데쌍브르 스피룰리나 고무팩      ,Makeup
120,에르띠    인텐시브 셀룰러 이알 크림     ,Makeup
121,젤로젤로 필오프베이스 원킬리무버 젤네일 세트 오팔스톤  알,Makeup
122,카디뷰 아사이 오일      ,Makeup
123,실키허그 단백질 헤어 트리트먼트       임산부 극손상 탈색 대용량 미용실 헤어팩     약산성,Makeup
124,발레아 아이 립 케어 집중 앰플  개입,Makeup
125,루시도엘 헤어스프레이 슈퍼하드      ,Makeup
126,헤드앤숄더 퍼퓸 프레쉬 샴푸      ,Makeup
127,밀본 스캘프 서포트 오일     ,Makeup
128,클로란 퀴닌 에델바이스 두피 세럼      ,Makeup
129,나푸키아       상한 머리 복구 셀프 헤어클리닉 손상모 관리 크리닉 모발 미용실 단백질 케라틴     트리트먼트,Makeup
130,동구밭 올바른 중건성용 샴푸바     ,Makeup
131,르네휘테르 까리떼 뉴트리 시어버터 헤어 에센스      ,Makeup
132,아모스 칼라제닉 잇츠 글로우     ,Makeup
133,디오넬  존 케어 여성 질 냄새 제거 세정제 청결제 용품 이너 젤 오일 퍼퓸 향수    ,Makeup
134,폴로랄프로렌 그린 오 드 뚜왈렛,Makeup
135,달바 화이트 트러플 로얄 인텐시브 세럼      ,Makeup
136,롬앤 글래스팅 컬러 글로스  호 피오니 발레,Makeup
137,탱글엔젤 프로 헤어 브러쉬,Makeup
138,딥티크 오르페옹 오 드 퍼퓸,Makeup
139,클리오 킬래쉬 수퍼프루프 마스카라   당일발송 속눈썹,Makeup
140,바이오니들 나노샷 카트리지    홈케어 마이크로 셀프 피부과 시술,Makeup
141,제이숲 딥그린제이 어성초 샴푸       ,Makeup
142,무드매처 컬러 체인지 립스틱     ,Makeup
143,파코라반 원밀리언 골드콜렉터 맨 오 드 뚜왈렛,Makeup
144,네이처리퍼블릭 포레스트 가든 캐모마일 클렌징 오일      ,Makeup
145,미프 비타맥스 남자 올인원 로션 스킨 남성 옴므 화장품 본품       리필      ,Makeup
146,바이오가 밀크판테놀 지성용 헤어 앤 바디워시 오일프리       ,Makeup
147,홀리카홀리카 알로에 워터프루프 선크림             ,Makeup
148,이솝 레버런스 아로마틱 핸드 밤     ,Makeup
149,리엔 물들임 새치커버 샴푸      ,Makeup
150,클리오 킬 커버 광채 쿠션            ,Makeup
151,다슈 데일리 볼륨 업 컬크림      ,Makeup
152,달바 워터풀 슬리핑 팩    ,Makeup
153,딥티크 필로시코스 오 드 퍼퓸,Makeup
154,세타필 모이스쳐라이징 크림     ,Makeup
155,치노시오야 나티베르 포어 텍트 클렌징오일      ,Makeup
156,유리아크림 반질크림 굳은살연고 발 바닥 뒤꿈치 무좀 갈라짐 연화제 풋크림,Makeup
157,입생로랑 와이 맨 오 드 뚜왈렛,Makeup
158,웨이크메이크 리얼 애쉬 브러쉬 아이라이너   ,Makeup
159,웨이크메이크 워터 벨벳 커버 쿠션            ,Makeup
160,려 우아채 멋내기 새치크림 염색약,Makeup
161,맥 글로우 플레이 블러쉬     ,Makeup
162,삐아 레디 투 웨어 다우니 치크     ,Makeup
163,가히    아쿠아밤           ,Makeup
164,씨퓨리 샤비크 빙하 크림         ,Makeup
165,끌로에 오드 퍼퓸  개     ,Makeup
166,세타필 모이스춰라이징 대용량 저자극 고보습 로션        미니 종 무민스티커 증정 ,Makeup
167,필로소피 어메이징 그레이스 발레 로즈 프레그런스 오 드 뚜왈렛,Makeup
168,달리프 클로렐라 베러 루트 헤어토닉      ,Makeup
169,키엘 울트라 훼이셜 크림     ,Makeup
170,설화수 윤조 마스크,Makeup
171,헤라 파워 부스팅 페이스 트리트먼트      ,Makeup
172,코스알엑스 더 레티놀     크림     ,Makeup
173,닥터지 브라이트닝 필링 젤      얼굴각질제거스크럽,Makeup
174,순수더살롱 사이언스 염색약      최신상 색상선택,Makeup
175,더마팩토리 트라넥삼산    크림     ,Makeup
176,스킨푸드 베리 수분 선크림             ,Makeup
177,닥터트럽 스킨 리터닝 클렌징 밀크      ,Makeup
178,    마스크팩 비타 미백 콜라겐 탄력 뽑아쓰는 수분 진정 보습 얼굴팩     매,Makeup
179,넘버즈인  번 도자기결 파데스킵 톤업베이지             ,Makeup
180,센텔리안   엑스퍼트 마데카 쏙 앰플     ,Makeup
181,세잔느 메이크업 킵 베이스            ,Makeup
182,블랑네이처 시카 클리어 커버 쿠션            ,Makeup
183,클리오 프리즘 하이라이터 피부밀착 투명하고 맑은 색감 은은한 미세 펄감,Makeup
184,조르지오아르마니 아쿠아 디 지오 맨 오 드 뚜왈렛,Makeup
185,닥터지 블랙 스네일 프레스티지  종세트,Makeup
186,해피바스 정말 순한 바디밀크 베이비파우더향      ,Makeup
187,피지오겔 레드 수딩    크림     ,Makeup
188,실크테라피 본드 앤 리페어 에센스      ,Makeup
189,보닌 트리플 액션 원샷 플루이드      ,Makeup
190,비욘드 피토가닉 페이셜 폼      ,Makeup
191,비욘드 프로페셔널 디펜스 샴푸       리필 ,Makeup
192,청담남자 프리미엄 티타늄 헤어 스프레이      ,Makeup
193,존바바토스 향수 아티산 오드뚜왈렛          ,Makeup
194,바이오옵틱스 아이크린 리드 클리너   매,Makeup
195,크리니크 린스 오프 포밍클렌저      ,Makeup
196,동광 깔깔이 미용장갑 염색장갑 블랙 아이보리 주방 공장 작업용 장갑,Makeup
197,아모스 락킹 피니셔      ,Makeup
198,닥터지 블랙 스네일 에멀젼       건성 ,Makeup
199,닥터 리프팅 밴드,Makeup
