,titles,category
269,상품명 라운드넥 숄더프릴 자수 시스루 루즈핏 봄 블라우스      ,Fashion
270,상품명 셔링 퍼프 어깨 레이스 소매 긴팔 블라우스 상세설명참조,Fashion
271,상품명        원피스셔츠 코디하는 화이트롱셔츠 셔츠원피스 빅사이즈 빅사이즈셔츠 오버핏셔츠 박스핏셔츠 롱셔,Fashion
272,상품명 여성 루즈핏 긴팔 청 데님 셔츠 남방 연청 여성셔츠 데님셔츠 청남방 스트라이프셔츠 가을블라우스,Fashion
273,상품명        루즈핏 기본스타일 원피스셔츠 롱 화이트셔츠 기본셔츠 무지화이트셔츠 무지셔츠 빅사이즈 빅사이즈,Fashion
274,상품명 트렌디 패턴 카라 셔츠 오피스룩 하객룩 블라우스 여성셔츠 퍼프블라우스 여성블라우스 여성남방,Fashion
275,상품명 오버핏 기모 셔츠 베이직 아우터 여성 울 체크 남방 봄셔츠 여성봄셔츠 브이넥셔츠 여자오버핏셔츠 겨울셔,Fashion
276,상품명        원피스셔츠 코디하는 화이트롱셔츠 셔츠원피스 빅사이즈 빅사이즈셔츠 오버핏셔츠 박스핏셔츠 롱셔,Fashion
277,상품명 린넨 오버핏 여성  부 셔츠 예쁜 꽃무늬 블라우스 여자블라우스 여성브라우스 면접블라우스 하늘하늘블라우,Fashion
278,상품명 여자 여성 코듀로이 셔츠 긴팔 와이셔츠  색 남방     ,Fashion
279,상품명          블루 스트라이프 롱 셔츠 블라우스 여성셔츠 여성블라우스 여자블라우스,Fashion
280,상품명 여자 청셔츠 데이트 패션 코디 긴팔 데님 청남방 여자청남방 청난방청남방 여성데님셔츠 여성청남방 남방,Fashion
281,상품명       예쁨주의 허리셔링 펀칭레이스  넥 블라우스    레이스블라우스  넥블라우스 봄신상블라우스 가을신,Fashion
282,상품명        원피스셔츠 코디하는 화이트롱셔츠 셔츠원피스 빅사이즈 빅사이즈셔츠 오버핏셔츠 박스핏셔츠 롱셔,Fashion
283,상품명 린넨 오버핏 여성  부 셔츠 예쁜 꽃무늬 블라우스 여자블라우스 여성브라우스 면접블라우스 하늘하늘블라우,Fashion
284,상품명       알사탕 콩단추 라운드 화이트 쉬폰 블라우스 예쁜여자블라우스 레이스블라우스 쉬폰블라우스 루즈핏,Fashion
285,상품명        등레터패치 빈티지 청자켓 청아우터 야상 데님 빅사이즈청자켓 빅사이즈데님자켓 여자블루진 여자청,Fashion
286,상품명        플라워 화사한 리본 블라우스 넥리본 플라워블라우스 쉬폰블라우스 봄신상블라우스 예쁜신상블라우,Fashion
287,상품명 여성 여리 핏 데일리 셔츠 여름 슬림 블라우스 핑크 단정한블라우스 여자블라우스 면접블라우스 예쁜브라우,Fashion
288,상품명          블루 스트라이프 롱 셔츠 블라우스 여성셔츠 여성블라우스 여자블라우스,Fashion
289,상품명        예쁨주의 허리셔링 펀칭레이스  넥 블라우스 예쁜여자블라우스 레이스블라우스 쉬폰블라우스 루즈핏,Fashion
290,상품명        아우터 활용굿 연청남방 데님셔츠 데님남방 청남방 청셔츠 청아우터,Fashion
291,상품명       여름셔츠 루즈핏 나시 얇은면 원피스셔츠 세트 면원피스 롱원피스 휴가원피스 휴양지원피스 면반팔원,Fashion
292,상품명        루즈핏 기본스타일 원피스셔츠 롱 화이트셔츠 기본셔츠 무지화이트셔츠 무지셔츠 빅사이즈 빅사이즈,Fashion
293,상품명 어깨 레이스 셔링 퍼프 소매 긴팔 블라우스 여성셔츠 퍼프블라우스 여성블라우스 여성남방,Fashion
294,상품명 줄무늬 롱셔츠 스트라이프 남방티 오버핏,Fashion
295,상품명        원피스셔츠 코디하는 화이트롱셔츠 셔츠원피스 빅사이즈 빅사이즈셔츠 오버핏셔츠 박스핏셔츠 롱셔,Fashion
296,상품명 여리여리 하프 레이스 블라우스 여성봄블라우스 쉬폰블라우스 여성브라우스 빅사이즈블라우스 여성셔츠,Fashion
297,상품명 카라큰 아이보리 블라우스 진주단추 자수패턴 예쁜옷 가을데이트룩 가을여성옷 여신룩 가을소개팅룩 첫데이,Fashion
298,상품명        아우터 활용굿 연청남방 데님셔츠 데님남방 청남방 청셔츠 청아터,Fashion
299,상품명 오버 핏 셔츠 형 티 여성 데일리 블라우스 블루 여자셔츠 여성스러운블라우스   블라우스 고급블라우스 여,Fashion
300,상품명 플라워 패턴 봄 블라우스 오피스 룩 티 셔츠 옐로우 여자셔츠 여성스러운블라우스 빅사이즈블라우스 고급블,Fashion
301,상품명        예쁨주의 허리셔링 펀칭레이스  넥 블라우스 예쁜여자블라우스 레이스블라우스 쉬폰블라우스 루즈핏,Fashion
302,상품명        원피스셔츠 코디하는 화이트롱셔츠 셔츠원피스 빅사이즈 빅사이즈셔츠 오버핏셔츠 박스핏셔츠 롱셔,Fashion
303,상품명 스트링 레이스업 메쉬 탑 시스루 망사 블라우스망사블라우스 망사티셔츠 메쉬티셔츠 메쉬블라우스 메쉬탑,Fashion
304,상품명 꽃무늬 여름 소매 퍼프 블라우스 플라워 여성    ,Fashion
305,상품명 패턴 반팔 여성 라운드넥 루즈핏 블루 여름 블라우스    ,Fashion
306,상품명 여성 베이직 체크 셔츠 깔끔한 회사원 데일리 이쁜,Fashion
307,상품명 자수 화이트 그레이스 블라우스 브이넥   대 골드    ,Fashion
308,상품명 레드 여름 라운드넥 여성 블라우스 패턴 반팔 루즈핏    ,Fashion
309,상품명 여성 오피스룩 롱셔츠 하늘색 스트라이프 긴팔 패션 여자셔츠 여성셔츠 오피스룩코디 오버핏셔츠 긴팔남방,Fashion
310,상품명        플라워 화사한 리본 블라우스 넥리본 플라워블라우스 쉬폰블라우스 봄신상블라우스 예쁜신상블라우,Fashion
311,상품명        예쁨주의 허리셔링 펀칭레이스  넥 블라우스 예쁜여자블라우스 레이스블라우스 쉬폰블라우스 루즈핏,Fashion
312,상품명        등레터패치 빈티지 청자켓 청아우터 야상 데님 빅사이즈청자켓 빅사이즈데님자켓 여자블루진 여자청,Fashion
313,상품명        아우터 활용굿 연청남방 데님셔츠 데님남방 청남방 청셔츠 청아우터,Fashion
314,상품명 린넨 오버핏 여성  부 셔츠 예쁜 꽃무늬 블라우스 여자블라우스 여성브라우스 면접블라우스 하늘하늘블라우,Fashion
315,상품명 웨이브 폴라넥 기모 긴팔티 빅사이즈 여성의류         ,Fashion
316,상품명 골덴남방            ,Fashion
317,상품명 배색 체크 수술 블라우스 빅사이즈 여성         ,Fashion
318,상품명 가을 체크 코튼 남방 셔츠 빅사이즈 여성         ,Fashion
319,상품명 고급 큐빅 브로치 블라우스 여성 브이넥 체크 티 셔츠 여성스러운블라우스 부드러운블라우스 여자셔츠 여성,Fashion
320,상품명 도트 블라우스 카라넥 퍼프소매 플레어핏 체형커버 여성셔츠 퍼프블라우스 여성블라우스 여성남방,Fashion
321,상품명       알사탕 콩단추 라운드 화이트 쉬폰 블라우스 예쁜여자블라우스 레이스블라우스 쉬폰블라우스 루즈핏,Fashion
322,상품명 오버 핏 셔츠 형 티 여성 데일리 블라우스 퍼플 여자셔츠 여성스러운블라우스   블라우스 고급블라우스 여,Fashion
323,상품명        아우터 호피배색 청남방 데님셔츠 데님남방 청셔츠 청아터,Fashion
324,상품명       예쁨주의 허리셔링 펀칭레이스  넥 블라우스    레이스블라우스  넥블라우스 봄신상블라우스 가을신,Fashion
325,상품명         루즈핏 잡지 오픈 숄더 반팔 블라우스 티셔츠 오픈숄더 오픈숄더블라 영문잡지 잡지프린팅 루즈핏,Fashion
326,상품명        원피스셔츠 코디하는 화이트롱셔츠 셔츠원피스 빅사이즈 빅사이즈셔츠 오버핏셔츠 박스핏셔츠 롱셔,Fashion
327,상품명       여름셔츠 루즈핏 나시 얇은면 원피스셔츠 세트 면원피스 롱원피스 휴가원피스 휴양지원피스 면반팔원,Fashion
328,상품명 여성 폴리 블루 세로 스트라이프 롱셔츠 블라우스 남방 여자남방 여성남방 셔츠 박스남방,Fashion
329,상품명        루즈핏 기본스타일 원피스셔츠 롱 화이트셔츠 기본셔츠 무지화이트셔츠 무지셔츠 빅사이즈 빅사이즈,Fashion
330,상품명   대 셔링 여름 화이트 블라우스 스모크 밴딩 슬림룩 하객룩 상견례코디 학생코디 예쁜블라우스 데일리룩,Fashion
331,상품명 카라큰 아이보리 블라우스 진주단추 자수패턴 예쁜옷 가을데이트룩 가을여성옷 여신룩 가을소개팅룩 첫데이,Fashion
332,상품명        원피스셔츠 코디하는 화이트롱셔츠 셔츠원피스 빅사이즈 빅사이즈셔츠 오버핏셔츠 박스핏셔츠 롱셔,Fashion
333,상품명 여성 여리 핏 데일리 셔츠 여름 슬림 블라우스 핑크 단정한블라우스 여자블라우스 면접블라우스 예쁜브라우,Fashion
334,상품명 꽃무늬 루즈핏 셔츠 로맨틱 예쁜 여성 블라우스 블랙 여자블라우스 면접블라우스 예쁜브라우스 단정한블라,Fashion
335,상품명        루즈핏 기본스타일 원피스셔츠 롱 화이트셔츠 기본셔츠 무지화이트셔츠 무지셔츠 빅사이즈 빅사이즈,Fashion
336,상품명 여성 루즈핏 여름 라운드넥 반팔 패턴 블라우스 블루 여름블라우스 반팔블라우스 여성블라우스 여성여름블,Fashion
337,상품명 여성 루즈핏 긴팔 청 데님 셔츠 남방 연청 여성셔츠 데님셔츠 청남방 스트라이프셔츠 가을블라우스 여성 루,Fashion
338,상품명        원피스셔츠 코디하는 화이트롱셔츠 셔츠원피스 빅사이즈 빅사이즈셔츠 오버핏셔츠 박스핏셔츠 롱셔,Fashion
339,상품명 트렌디 패턴 카라 셔츠 오피스룩 하객룩 블라우스 여성셔츠 퍼프블라우스 여성블라우스 여성남방 트렌디 패,Fashion
340,상품명 무지 소프트 심플 셔츠 빅사이즈 여성         ,Fashion
341,상품명 포켓 체크 박시 롱 남방 빅사이즈 여성         ,Fashion
342,상품명        원피스셔츠 코디하는 화이트롱셔츠 셔츠원피스 빅사이즈 빅사이즈셔츠 오버핏셔츠 박스핏셔츠 롱셔,Fashion
343,상품명 골드포인트 타이 화이트 노카라 블라우스 직장인 면접   대블라우스 면접블라우스 회사원블라우스 직장인블,Fashion
344,상품명  급         루즈핏 멀티 색 봄 가을 체크 셔츠 남방  급         루즈핏 멀티 색 봄 가을 체크 셔츠 남방,Fashion
345,상품명         초봄 모직 체크 셔츠 아우터 코트 남방 점퍼         초봄 모직 체크 셔츠 아우터 코트 남방 점퍼,Fashion
346,상품명 플리츠 레이스 하이넥 페이크 카라 이너카라 레이어드 차이나카라,Fashion
347,상품명 도톰 컬러 체크 카라 남방 빅사이즈 여성         ,Fashion
348,상품명 캐주얼 가을 체크 셔츠 빅사이즈 여성의류         ,Fashion
349,상품명 면 빅 페이크 카라 이너셔츠 넥케이프 레이어드 목만있는 넥카라 빅카라,Fashion
350,상품명     면체크남방 여성체크남방 체크남방 여성롱남방,Fashion
351,상품명 체크 수술 카라 블라우스 빅사이즈 여성         ,Fashion
352,상품명 루즈핏 박시핏 데님 셔츠 원피스 청남방        ,Fashion
353,상품명 베이직 데님 카라 이너셔츠 이너카라 레이어드 목만있는 차이나카라  컬러,Fashion
354,상품명 줄무늬 롱셔츠 스트라이프 남방티 오버핏,Fashion
355,상품명 러플 리본 하이넥 페이크 이너셔츠 레이어드 목만있는 넥카라 차이나카라,Fashion
356,상품명 기하학 나염 헨리넥 셔츠 빅사이즈 여성의류         ,Fashion
357,상품명 브이넥 스트라입      셔츠       색상,Fashion
358,상품명      플라워 프린트 새틴블라우스     ,Fashion
359,상품명 캐주얼 여름 봄 남성 여성 편안한 패션 의류 실크 셔츠 빈티지 블라우스 쉬어 탑 긴 드레스 루즈한 오버셔,Fashion
360,상품명   넥 아세테이트 새틴 셔츠 캐주얼 오피스 레이디 상인공 실크 블라우스 반팔 화이트 여름,Fashion
361,홈쇼핑 상품 상품명 마담 엘레강스 크루즈 인견 상하의 세트,Fashion
362,상품명 대박난박양 시스루 박시 셔츠       ,Fashion
363,홈쇼핑 상품 상품명 리더잭 여성 데님 셔츠  종     ,Fashion
364,닥스레이디스 상품명 닥스골프용셔츠체크남방여  중고명품최상,Fashion
365,상품명 투웨이 롱 셔츠,Fashion
366,상품명 기본 루즈핏 청남방 데님셔츠 남녀공용 캐주얼 커플룩 무지반팔티 여성티셔츠 남성반팔런닝 남자반팔티 여,Fashion
367,상품명     라이트남방 매일샵 블라우스 니트 원피스 스커트 가디건 바지,Fashion
368,상품명  컬러 데일리 시크 링클프리 셔츠 블라우스 여성 여자 봄 데일리 베이직 카라넥,Fashion
369,갠소 상품명 트윌코튼솔리드박시셔츠 여성 베이직 봄 무지,Fashion
370,상품명 겨울 여성 터틀넥 니트 원피스 꽈배기 골지 봄가을 스웨터,Fashion
371,상품명     리엔셔츠,Fashion
372,허밍퍼플 상품명 허밍퍼플 여성용      래던 차이나 도트    여름 시원한 아이스 쿨 셔츠 남방 빅사이즈 여성의류,Fashion
373,공구우먼 상품명 제작 리얼핏레이즌 루즈핏 오픈카라 시어서커 남방       빅사이즈 여성의류,Fashion
374,상품명     시간 특가   고품질 여성 줄무늬 셔츠      ,Fashion
375,홈쇼핑 상품 상품명 여성 여름 꽃무늬 플라워 반팔 블라우스 핑크,Fashion
376,알트베니 상품명 모리에 블라우스  종,Fashion
377,상품명           밴딩벨트 루즈핏셔츠  색상,Fashion
378,상품명 체리 프린팅 오버 반팔티 빅사이즈 여성의류         ,Fashion
379,상품명 단추 트임 와이드 롤업 남방 빅사이즈 여성의류         ,Fashion
380,상품명 가오리 체크 시스루 셔츠 빅사이즈 여성         ,Fashion
381,상품명 시스루 카라넥 셔츠블라우스 댄디 섹시 레이어드 오피스룩  컬러,Fashion
382,상품명 패치 스트라이프 포켓 남방 빅사이즈 여성         ,Fashion
383,상품명 여자 긴 셔츠 오버핏 롱 후드       ,Fashion
384,상품명 세로물결      블라우스        종,Fashion
385,상품명 베이직 롤업 반팔 남방 빅사이즈 여성         ,Fashion
386,상품명 진주 포인트 넥 케이프 이너셔츠 이너카라 목만있는 넥카라 차이나카라,Fashion
387,상품명 여성 편한 루즈핏셔츠 스웨셔츠 레이어드 데님셔츠,Fashion
388,상품명 시크릿송 브이넥 펀칭블라우스          ,Fashion
389,상품명 여성 무지 셔츠 긴팔 가을 남방 솔리드 코디       ,Fashion
390,상품명 린넨 절개 버튼 셔츠 빅사이즈 여성         ,Fashion
391,상품명 가오리 루즈 시스루 체크셔츠 빅사이즈 여성         ,Fashion
392,상품명 겉기모 체크 롱남방 빅사이즈 여성         ,Fashion
393,상품명 루즈핏 슬리브리스 셔츠 오피스룩 추천 차르르 모던심플 블라우스  컬러,Fashion
394,상품명 스트라이프 코튼 패치 남방 빅사이즈 여성         ,Fashion
395,상품명 로미홀리 여성남방 여자셔츠 솔리드셔츠 빅사이즈 롱셔츠,Fashion
396,상품명      체크 남방 셔츠 남자남방,Fashion
397,상품명 토르 오버 체크 남방 빅사이즈 여성의류         ,Fashion
398,상품명 사선버튼      잔체크 셔츠       색상,Fashion
399,상품명 펀칭 페이크 카라 이너셔츠 넥케이프 이너카라 목만있는 레이어드카라,Fashion
400,상품명 자수 펀칭 페이크 넥케이프 카라 이너셔츠 이너카라 레이어드 목만있는,Fashion
401,상품명 자수 펀칭 레이스 페이크 카라 레이어드 블라우스 넥 케이프 셔츠 이너셔츠,Fashion
402,상품명 로미홀리 소매 퍼프 체크 셔츠    ,Fashion
403,상품명 줄지 세라 퍼프 셔츠 빅사이즈 여성의류         ,Fashion
404,상품명 로제 스트라이프 셔츠 빅사이즈 여성         ,Fashion
405,상품명 진주 장식 자수 페이크 카라 넥케이프 이너카라 목만있는 차이나카라,Fashion
406,상품명 벨트 체크남방 택            색상중,Fashion
407,상품명 오버핏체크카라셔츠 빅사이즈 여성의류        ,Fashion
408,상품명 진주링 벨로아      블라우스     ,Fashion
409,상품명 자수 스트라이프 셔츠 빅사이즈 여성의류         ,Fashion
410,상품명 파스텔포켓체크셔츠 빅사이즈 여성의류        ,Fashion
411,상품명 로미홀리 여성셔츠 시스루 레이스 이너 블라우스 메탈 벌룬소매    ,Fashion
412,상품명 레트로 빌딩 박시 반팔티 빅사이즈 여성         ,Fashion
413,상품명 줄지 패치 포켓 오버 셔츠 빅사이즈 여성         ,Fashion
414,상품명 블리딩      블라우스 한색상     ,Fashion
415,상품명 진주큐빅 페이크 이너셔츠 이너카라 레이어드 목만있는 차이나카라,Fashion
416,상품명 배색 자수 시그니 셔츠 빅사이즈 여성         ,Fashion
417,상품명 오픈 카라 체크 남방 빅사이즈 여성의류         ,Fashion
418,상품명 벌룬 모던 포켓 셔츠 빅사이즈 여성         ,Fashion
419,상품명 비기닝 체크 카라 셔츠 빅사이즈 여성의류         ,Fashion
420,상품명 아사면 주름 롱 남방 빅사이즈 여성의류         ,Fashion
421,상품명 파스텔체크카라남방 빅사이즈 여성의류        ,Fashion
422,상품명 치즈체크크롭후드셔츠 빅사이즈 여성의류        ,Fashion
423,상품명 스판 페이크 포켓 셔츠 빅사이즈 여성         ,Fashion
424,상품명 여성 남방블라우스 오피스룩 코듀로이셔츠 데님셔츠,Fashion
425,상품명 플라워      블라우스       색상,Fashion
426,상품명 체크 카라 포켓 블라우스 빅사이즈 여성         ,Fashion
427,상품명 로미홀리 엔젤 자수레이스 블라우스,Fashion
428,상품명 여성용 루즈핏 체크 남방,Fashion
429,상품명 기본 넥케이프 페이크 이너셔츠 이너카라 레이어드 차이나카라  컬러,Fashion
430,상품명 로미홀리     메이 진주 장식 프릴 청 데님 남방 셔츠          ,Fashion
431,상품명 뚜껑포켓      체크셔츠       색상,Fashion
432,상품명 오버 롱 스트라이프 셔츠 빅사이즈 여성         ,Fashion
433,상품명 여성 여자 카라 러블리 긴팔 봄 가을 정장룩 출근룩 하객룩 결혼식룩,Fashion
434,상품명 프릴 페이크 카라 넥케이프 이너카라 레이어드 넥카라 차이나카라,Fashion
435,상품명 카라 쉬폰 가오리 셔츠 빅사이즈 여성의류         ,Fashion
436,상품명 빅 체크 롱남방 여성 후드 블라우스 셔츠 롱기장,Fashion
437,상품명 로미홀리 여성 빅사이즈 앞뒤 반전 블라우스    ,Fashion
438,상품명 레이어드 셔츠     망사레이스,Fashion
439,상품명 하절기 여성의류 체크 셔츠블라우스              ,Fashion
440,상품명 패션쟁이 나는 빅포켓루즈핏 롱청남방,Fashion
441,상품명 주얼 체크 롱 남방 빅사이즈 여성의류         ,Fashion
442,상품명 스트라입 얇은 롱셔츠      택       부  색상중,Fashion
443,상품명 오픈 카라 롤업 남방 빅사이즈 여성         ,Fashion
444,상품명 로미홀리 후크 셔츠 긴팔 여자 여성 긴소매 반집업 슬림핏 카라 티셔츠     ,Fashion
