,titles,category
0,엔프라니 상품명 엔프라니 데일리 선블록            ,Makeup
1,터치미 상품명 썬크림 선크림 선스틱 썬스틱  개  중기능성       ,Makeup
2,시세이도 상품명 시세이도 퍼펙트    프로텍터 파란자차  신형      ,Makeup
3,백옥생 명경지수 상품명 썬크림 선크림 자외선차단제 썬블럭 선로션       개             ,Makeup
4,피지오겔 레드수딩   상품명 피지오겔 레드수딩 선스크린      개    마스크팩 개,Makeup
5,피지오겔     상품명 피지오겔 포켓몬        썬쿠션 피카츄   마스크팩  매,Makeup
6,바세린 상품명 바세린 썬크림 자외선차단제       개              ,Makeup
7,바세린 상품명 바세린 썬크림 썬젤 자외선차단제       개              ,Makeup
8,터치미 상품명 대용량 썬크림 자외선차단제        개       ,Makeup
9,니베아 상품명 니베아 썬크림 울트라 센서티브 선크림 선로션        개,Makeup
10,공식 상품 아이오페 상품명 아이오페   쉴드 선 스틱       증정,Makeup
11,벨먼 상품명 벨먼 포켓몬 선스틱 피카츄     ,Makeup
12,    상품명  택     선스틱     개     썬스틱     개 선크림 썬크림   년  월까지,Makeup
13,푸드어홀릭 상품명 푸드어홀릭 멀티 선크림        참존 로제 꽃을든남자외 선크림 베스트,Makeup
14,벨먼 상품명 온더바디 벨먼 포켓몬    선크림      개 피카츄,Makeup
15,벨먼 상품명 벨먼 포켓몬    선쿠션 피카츄    ,Makeup
16,이자녹스 상품명    선프로     익스트림 선플루이드,Makeup
17,홈쇼핑 상품 상품명 엘라비에 최유라쇼 선물구성 기미 집중관리 선물 패키지 기미선세럼       기미패치,Makeup
18,공식 상품     상품명     세이프온 에센스 선크림     ,Makeup
19,피지오겔 상품명 피지오겔     선스크린       개,Makeup
20,케어존 상품명 케어존 닥터솔루션 마일드 핑크 톤업 선 기획세트,Makeup
21,디오프러스 상품명 디오프러스 히알루로닉 쿨링 선 젤 스페셜 에디션                     ,Makeup
22,라보니따 상품명 라보니따 토탈    가드 선크림 저자극임상완료 대용량     ,Makeup
23,디오프러스 상품명 디오프러스 비건 유브이 디펜스 올 데이 선 쿠션                  ,Makeup
24,디에이치아이 상품명     선스틱         스틱 썬크림 스틱형 선크림      ,Makeup
25,상품명 에바끌레르 선크림 자외선 차단 대용량           ,Makeup
26,엔프라니 상품명 엔프라니 데일리 선블록            ,Makeup
27,백화점 상품 랑콤 상품명 랑콤           엑스퍼트      세트           용량 추가 증정 ,Makeup
28,셀라보 상품명 쟈스 액토인 맨얼굴 크림       캐어세럼 데일리 크림      ,Makeup
29,니베아 상품명 니베아 선크림     선로션 롤온 어린이선크림,Makeup
30,홈쇼핑 상품 상품명 안달로우 단품     천송이 젠틀 클렌징폼      ,Makeup
31,공식 상품     상품명 세이프온 시카 카밍 선쿠션      개,Makeup
32,퍼스트픽 상품명  만족도       끈적임 입소문 썬크림              ,Makeup
33,더샘 상품명 더샘 화장품  무배 더샘 에코 어스 핑크 선크림         총     ,Makeup
34,홈쇼핑 상품     상품명     역대최다구성 기본 마스터즈 크림 투 선 샤벳트 본품 개 수딩밤 개 ,Makeup
35,벨먼 상품명 온더바디 벨먼 포켓몬    선크림     피카츄,Makeup
36,벨먼 상품명 벨먼 포켓몬 선스틱 꼬부기     ,Makeup
37,공식 상품     상품명     마스터즈 에어리치 선스틱    ,Makeup
38,에이지투웨니스 상품명          스킨핏수분선크림,Makeup
39,공식 상품     상품명 세이프온 시카 카밍 선쿠션 리필      개,Makeup
40,    상품명  택     썬스틱     개     선스틱     개  선크림 썬크림   년  월까지,Makeup
41,벨먼 상품명 온더바디 벨먼 포켓몬    선크림     메타몽,Makeup
42,달바 상품명 달바 선크림 썬크림 마일드   에센스   톤업     ,Makeup
43,상품명 김보화  초 노터치 선스틱   세트  자외선차단 미백 주름 썬크림 클렌징폼,Makeup
44,비더스킨 상품명 세범 제로 알로에라이스 비건 선크림       바하플러스 일회용 파우치  종 증정,Makeup
45,    상품명  택     선스틱          파랑 초록    썬스틱 선크림 선크림   년  월까지,Makeup
46,피지오겔     상품명 피지오겔 포켓몬 이상해씨         썬팩트     마스크팩  매,Makeup
47,    상품명  택     선스틱    파랑     썬스틱    초록  선크림 선크림  년  월까지,Makeup
48,아트델리 상품명 아트델리 콜라겐밤 멀티 쿠션 커버쿠션,Makeup
49,벨먼 상품명 온더바디 벨먼 포켓몬    선크림      개 메타몽,Makeup
50,에이지투웨니스 상품명         스킨핏수분선크림기획 골프존 ,Makeup
51,이니스프리 상품명 이니스프리 인텐시브 롱래스팅 선스크린            개,Makeup
52,비욘드 상품명 비욘드 엔젤 아쿠아 톤업 선크림              개 ,Makeup
53,상품명 클라랑스 선크림    로지글로우     ,Makeup
54,상품명 선크림          백탁 눈시림 끈적임없이 촉촉한선크림,Makeup
55,공식 상품 셀퓨전씨 상품명 레이저 썬스크린 더블 기획세트 쿠폰가      원 ,Makeup
56,공식 상품 닥터지 상품명 브라이트닝 업 선 플러스       개         개 증정,Makeup
57,헤라 상품명 헤라    프로텍터 톤업       ,Makeup
58,닥터지 상품명 닥터지        브라이트닝 업 선 플러스        추가증정 ,Makeup
59,공식 상품 헤라 상품명    프로텍터 톤업  증정,Makeup
60,백화점 상품 상품명  클라랑스  신세계강남점       썬크림 듀오  정품용량하트거울 ,Makeup
61,상품명 더페이스샵 파워 롱래스팅 선크림        개,Makeup
62,백화점 상품 헤라 상품명 갤러리아 헤라 단독  프로텍터 톤업 듀오 세트 화장품파우치 톤업     개,Makeup
63,헤라 상품명 헤라 유브이 프로텍터 톤업              ,Makeup
64,백화점 상품 헤라 상품명  롯데 단독     프로텍터 톤업 듀오 세트   트래블 파우치   톤업       개 증정,Makeup
65,공식 상품 이니스프리 상품명 인텐시브 롱래스팅 선스크린          개,Makeup
66,헤라 상품명 헤라 선 메이트 데일리                  선크림,Makeup
67,닥터지 상품명 그린 마일드 업 선 플러스         ,Makeup
68,닥터지 상품명 닥터지       그린 마일드 업 선 플러스      추가증정 ,Makeup
69,백화점 상품 헤라 상품명  신세계강남점 기획   프로텍터 톤업      톤업         메이크업 픽서     ,Makeup
70,닥터지 상품명  현대       닥터지 브라이트닝 업 선 플러스      듀오         개 ,Makeup
71,애터미 상품명 애터미 선크림 베이지   개,Makeup
72,공식 상품 헤라 상품명   프로텍터 멀티 디펜스           ,Makeup
73,   차앤박 상품명     차앤박 톤 업 프로텍션 선       개,Makeup
74,공식 상품 닥터지 상품명 그린 마일드 업 선 스틱    ,Makeup
75,공식 상품 셀퓨전씨 상품명  중복    토닝 썬스크린 단독 더블 기획세트,Makeup
76,백화점 상품 정샘물 상품명  롯데백화점     마스터클래스 앰플 선            ,Makeup
77,헤라 상품명 헤라 선 메이트 레포츠 프로 워터프루프                ,Makeup
78,공식 상품 설화수 상품명 상백크림 선크림       택    증정,Makeup
79,헤라 상품명 선 메이트 프로텍터                ,Makeup
80,공식 상품 닥터지 상품명 그린 마일드 업 선 플러스      브라이트닝 업 선 플러스        한정수량  만원 체험특가,Makeup
81,닥터지 상품명 닥터지 그린 마일드 업 선 플러스               ,Makeup
82,한율 상품명 한율 흰감국 광채 선크림    ,Makeup
83,백화점 상품 헤라 상품명  신세계강남점 기획선 메이트 레포츠 프로 워터프루프               ,Makeup
84,달바 상품명 달바 워터풀 톤업 선크림     ,Makeup
85,닥터지 상품명 닥터지 브라이트닝 업 선 플러스         ,Makeup
86,헤라 상품명 헤라 유브이 프로텍터 멀티디펜스      데일리 선크림,Makeup
87,헤라 상품명 헤라 선메이트 데일리크림      썬크림 선크림,Makeup
88,헤라 상품명 헤라 유브이 프로텍터 톤업             ,Makeup
89,공식 상품 참존 상품명  참존 멀티스틱밤  개  모음전 선멀티  콜라겐탄력  아쿠아수분진정  비타미백  택 ,Makeup
90,공식 상품 미바 상품명 더마코스메틱 미바          대란 메이크업 스킨케어,Makeup
91,공식 상품 헤라 상품명   프로텍터 멀티디펜스 프레쉬        특별증정,Makeup
92,더페이스샵 상품명    더페이스샵 내추럴선 에코파워 롱래스팅선크림    ,Makeup
93,백화점 상품 시세이도 상품명  신세계강남점 특별 파란자차 스틱     세트,Makeup
94,공식 상품 에스쁘아 상품명 워터 스플래쉬 선크림 세라마이드              ,Makeup
95,헤라 상품명 헤라 유브이 프로텍터 톤업       ,Makeup
96,백화점 상품 시세이도 상품명  신세계강남점 특별 파란자차     세트,Makeup
97,예브랑 예브랑쎈서티브 상품명 예브랑 예브랑쎈서티브 센스티브 선크림            ,Makeup
98,에스트라 상품명 더마      레드진정 톤업 선크림       개,Makeup
99,헤라 상품명 헤라 유브이 프로텍터 톤업        ,Makeup
100,오휘 상품명 데이쉴드 퍼펙트 선 레드        선물포장 쇼핑백 가능 최근입고,Makeup
101,공식 상품 이니스프리 상품명 톤업 노세범 선스크린        ,Makeup
102,헤라 상품명 헤라 선메이트 크림 데일리 레포츠         개 코스트코,Makeup
103,더후 공진향설 상품명 더 후 공진향 설 미백 톤업 선       단품   ,Makeup
104,헤라 상품명 헤라 유브이 프로텍터 톤업                     ,Makeup
105,이지듀 상품명 이지듀   포스트레이저 퍼펙트 쉴드 선크림     ,Makeup
106,헤라 상품명 헤라 선 메이트 레포츠 프로 워터프루프     ,Makeup
107,백화점 상품 헤라 상품명  신세계강남점 기획   프로텍터 톤업 듀오 세트 트래블 파우치 증정,Makeup
108,라운드랩 상품명 라운드랩 자작나무 수분 선크림              ,Makeup
109,씨케이디 상품명 종근당건강 씨케이디 그린프로폴리스 올커버리 선  개,Makeup
110,르네셀 상품명 르네셀 컴플리트 레이어 썬블럭     ,Makeup
111,빌리프 상품명 빌리프    프로텍터 톤업 선스크린     ,Makeup
112,   차앤박 상품명 톤 업 프로텍션 선        선크림 자외선 차단 데일리 썬크림 최근입고   선물포장 가능,Makeup
113,공식 상품 리코셀 상품명 저자극 마일드 패밀리 선크림       개             ,Makeup
114,백화점 상품 클라란스 상품명  롯데백화점  단독       로지글로우      듀오 세트,Makeup
115,셀퓨전씨 상품명 셀퓨전씨 레이저 썬 스크린         ,Makeup
116,닥터지 상품명 닥터지 메디    울트라 선              ,Makeup
117,헤라 상품명 헤라 유브이 프로텍터 멀티디펜스              ,Makeup
118,공식 상품 닥터지 상품명 그린 마일드 업 스킨 선 로션     ,Makeup
119,공식 상품 닥터지 상품명 브라이트닝 업 모이스처 선     ,Makeup
120,아넷사 상품명 아넷사 퍼펙트    선스크린 마일드 밀크          증정 브라이트닝      개,Makeup
121,    상품명     대용량 썬스틱 선스틱 선크림                  ,Makeup
122,헤라 상품명 헤라 선메이트 레포츠         개        코스트코,Makeup
123,아이오페 상품명 아이오페 선크림    쉴드 에센셜 선 프로텍터         개         개,Makeup
124,이자녹스 상품명 유브이 선 프로     데일리       워터프루프 선크림,Makeup
125,아넷사 상품명 퍼펙트    선스크린 스킨케어 젤         브라이트닝 젤      ,Makeup
126,홈쇼핑 상품 하퍼스바자 상품명        하퍼스바자 루미너스 선쿠션   단독 베이직패키지,Makeup
127,빌리프 상품명 빌리프 유브이 프로텍터 톤업 선스크린       ,Makeup
128,공식 상품 이니스프리 상품명 톤업 노세범 선스크린 이엑스     ,Makeup
129,홈쇼핑 상품 엘로엘 상품명 엘로엘 팡팡 빅 선쿠션    본품   리필    미니선쿠션,Makeup
130,김정문알로에 상품명 김정문알로에 큐어 에어라이트 선스틱      개,Makeup
131,홈쇼핑 상품 동인비 상품명 동인비 멀티 퍼펙션 선크림                   ,Makeup
132,아이오페 상품명 아이오페 유브이 쉴드 에센셜 선 프로텍터 세트 트레이더스 기획 썬크림,Makeup
133,닥터지 상품명 닥터지 그린 마일드 업 선 플러스     ,Makeup
134,더페이스샵 상품명 파워 롱래스팅 선 크림     ,Makeup
135,라운드랩 상품명 라운드랩 자작나무 수분 톤업 선크림 대용량            ,Makeup
136,백화점 상품 헤라 상품명 헤라  롯데 단독     프로텍터 톤업 듀오 세트   트래블 파우치   톤업      ,Makeup
137,공식 상품 마녀공장 상품명 갈락토미 모이스처 선 세럼       리뉴얼 ,Makeup
138,설화수 상품명 설화수 상백크림      선크림 기획세트  호 밀키 톤업,Makeup
139,공식 상품 프리메라 상품명 프리메라 리페어링 세라캡슐    프로텍터   추가 증정,Makeup
140,헤라 상품명 헤라 선메이트 크림          레포츠,Makeup
141,백화점 상품 키엘 상품명  신세계강남점    키엘 자외선 차단제      세트,Makeup
142,백화점 상품 헤라 상품명  신세계강남점 기획선 메이트 레포츠 프로 워터프루프                듀오세트,Makeup
143,헤라 상품명 헤라 유브이 프로텍터 멀티 디펜스             ,Makeup
144,백화점 상품 키엘 상품명  신세계강남점 울트라 라이트 데일리 유브이 디펜스 아쿠아 젤     ,Makeup
145,헤라 상품명 헤라 유브이 프로텍터 멀티디펜스        ,Makeup
146,공식 상품 스킨푸드 상품명 베리 생기 선크림     ,Makeup
147,수려한 상품명 수려한 비책 자단 선크림         개,Makeup
148,아넷사 상품명 아넷사 퍼펙트    선스크린 스킨케어 밀크          브라이트닝 젤      ,Makeup
149,셀퓨전씨 상품명 셀퓨전씨 레이저 썬스크린             사은품 종 ,Makeup
150,    상품명         박세리 선스틱 선크림 마스터즈 에어리치 프,Makeup
151,헤라 상품명 헤라 유브이 프로텍터 톤업            ,Makeup
152,헤라 상품명 헤라 유브이 프로텍터 톤업                   ,Makeup
153,셀퓨전씨 상품명 롯데단독 빠른배송 토닝 썬스크린                      체험팩,Makeup
154,이니스프리 상품명 이니스프리 인텐시브 트리플 쉴드 선스크린     ,Makeup
155,헤라 상품명 헤라 선 메이트 데일리                  선크림,Makeup
156,구달 상품명 구달     맑은어성초진정수분선크림     ,Makeup
157,닥터지 상품명 닥터지 그린 마일드 업 스킨 선 로션        스킨 선 로션       개 증정,Makeup
158,백화점 상품 랑콤 상품명  신세계강남점       엑스퍼트      세트,Makeup
159,메이크프렘 상품명 유브이 디펜스 미 카밍 톤업 선크림        폼    매 ,Makeup
160,공식 상품 셀퓨전씨 상품명 어드밴스드 클리어 썬스크린            썬클렌징폼     증정,Makeup
161,오띠 상품명 워터 배리어 선스크린                    ,Makeup
162,헤라 상품명  헤라     프로텍터 톤업 선크림       개   멜라솔브 딥 클렌징 폼      증정 ,Makeup
163,공식 상품 설화수 상품명 상백크림 선크림       택    증정,Makeup
164,셀퓨전씨 상품명 롯데단독 빠른배송 레이저 썬스크린                      체험팩,Makeup
165,공식 상품 이자녹스 상품명   선프로     익스트림 선플루이드 기획,Makeup
166,애터미 상품명 애터미 선크림 비비크림 이브닝케어 폼 필링젤 마스크,Makeup
167,공식 상품 맥퀸뉴욕 상품명          데일리 선크림 데일리 매트 선크림    할인  만개 입고 완료  시주문건 당일출고,Makeup
168,공식 상품 로쎄앙 상품명 최신제조상품     로쎄앙 르나르도 선스틱 스틱형 고체 선크림 선밤 자연유래추출물 함유              ,Makeup
169,백화점 상품 오휘 상품명  신세계강남점     데이쉴드 퍼펙트선 블랙     ,Makeup
170,아이오페 상품명   쉴드 에센셜 톤업 선     ,Makeup
171,르나르도 상품명 최신제조상품     로쎄앙 르나르도 선스틱 스틱형 고체 선크림 선밤 자연유래성분 함유              ,Makeup
172,상품명 닥터지 그린 마일드 업 선 플러스         ,Makeup
173,엘로엘 상품명      엘로엘 팡팡 빅 선쿠션    시즌  본품      리필   ,Makeup
174,종근당건강 상품명 종근당건강 씨케이디 그린프로폴리스 올커버리선     ,Makeup
175,벨라오로라 상품명 벨라오로라 바이오텐 솔라 선크림         개,Makeup
176,홈쇼핑 상품 엘로엘 상품명   년 최신상 엘로엘 팡팡 빅 선쿠션    본품   리필    미니선쿠션  ,Makeup
177,초공진 상품명 설본 진 톤업 선크림     ,Makeup
178,백화점 상품 데코르테 상품명  신세계강남점 선 쉘터 멀티 프로텍션 톤 업 씨씨         ,Makeup
179,설화수 상품명 설화수 상백크림      기획세트           ,Makeup
180,인셀덤 상품명 인셀덤 아쿠아 프로텍션 선 젤     ,Makeup
181,수려한 상품명 수려한 비책 자단 선     ,Makeup
182,아넷사 상품명 아넷사 퍼펙트    선스크린 스킨케어 밀크         개   증정 브라이트닝      개,Makeup
183,일리윤 상품명 일리윤 저자극 이지워시 선크림      ,Makeup
184,    상품명        박세리 마스터즈 선스틱      개 선크림       개,Makeup
185,   차앤박 상품명     차앤박 톤 업 프로텍션 선       개,Makeup
186,공식 상품 리코셀 상품명 워터프루프 레포츠 선크림       개 썬 블록 크림 무기자차 톤업 대용량,Makeup
187,상품명 헤라 선 크림 데일리               개,Makeup
188,셀퓨전씨 상품명 셀퓨전씨 롯데단독 빠른배송 레이저 썬스크린                      체,Makeup
189,공식 상품 아이오페 상품명   쉴드 에센셜 선 프로텍터      개   증정,Makeup
190,에스쁘아 상품명 에스쁘아 워터 스플래쉬 선크림 세라마이드         개,Makeup
191,엘로엘 상품명      엘로엘 팡팡 빅 선쿠션    시즌  본품      개 리필     개,Makeup
192,공식 상품 피지오겔     상품명 피지오겔     마일드 릴리프 선크림       개 포켓몬 여행용세트,Makeup
193,에끌라두 상품명    톤업 커버 선크림                  ,Makeup
194,공식 상품 프리메라 상품명 프리메라 리페어링 세라캡슐    프로텍터     ,Makeup
195,홈쇼핑 상품 상품명 달바 화장품  화이트트러플 프라임 세럼  통   선미스트,Makeup
196,백화점 상품 토니모리 상품명  신세계의정부점  정품 개 기미야 미백 톤업 선크림 사은품 골드    스네일 마스크 시트  매 중복 증정,Makeup
197,아이오페 상품명   쉴드 에센셜 톤업 선          옵션 ,Makeup
198,달바 상품명 달바 워터풀 에센스 선크림     ,Makeup
199,엘로엘 상품명 엘로엘  초보정 파데프리 플러스 빅 본  기본 본  립오일,Makeup
200,달바 상품명 워터풀 톤업 선크림             ,Makeup
201,스킨앤랩 상품명 스킨앤랩 베리어덤 마일드 선쿠션 세트 본품       리필     ,Makeup
202,리에노 상품명 리에노 수분 듬뿍 빅 선쿠션        개 장윤정 온가족 썬쿠션 선팩트  무료배송   ,Makeup
203,랑콤   엑스퍼트 상품명 랑콤    엑스퍼트 선크림                     ,Makeup
204,상품명 남자 레포츠 눈 안따가운 순한 선 썬크림 이엔코스,Makeup
205,헤라 상품명 헤라 선메이드 데일리 크림         개  선블록,Makeup
206,오휘 상품명 오휘 데이쉴드 퍼펙트 선 블랙 레드 기획세트,Makeup
207,공식 상품 리르 상품명 트리플케어 썬스틱     총 개    세트 구입시 본품  개 저 증정,Makeup
208,공식 상품 에스트라 상품명 더마      레드진정 톤업 선크림     ,Makeup
209,더페이스샵 상품명 파워 롱래스팅 선 크림     ,Makeup
210,종근당건강 상품명 종근당건강 씨케이디 그린프로폴리스 올마일드 선  개,Makeup
211,    상품명     내추럴 퍼펙션 더블 쉴드 선 스틱     파란,Makeup
212,김정문알로에 상품명 김정문알로에 그린 진정 톤업 선크림 톤업크림 큐어 리알로에 워터 스플래쉬 카밍,Makeup
213,공식 상품 네이처리퍼블릭 상품명 캘리포니아 알로에 데일리 선블럭                    ,Makeup
214,백화점 상품 오휘 상품명  신세계강남점 쓱 데이쉴드 아쿠아 선스틱 투 고    ,Makeup
215,공식 상품 닥터지 상품명 레드 블레미쉬 수딩 업 선       개   브라이트닝 업 선 플러스      증정,Makeup
216,백화점 상품 랑콤   엑스퍼트 상품명           엑스퍼트      세트           용량 추가 증정 ,Makeup
217,파라코스메틱 상품명 썬크림  설화수 자음생크림클래식       개       ,Makeup
218,해외직구 상품 키엘 상품명     키엘 울트라 라이트 데일리    디펜스 선스크린       키엘 선크림,Makeup
219,애터미 상품명 애터미 선크림 화이트                    ,Makeup
220,조선미녀 상품명 조선미녀 맑은쌀 선크림          더블 기획세트,Makeup
221,아이오페 상품명   쉴드 선 스틱                  ,Makeup
222,엔프라니 상품명     엔프라니 실키핏 톤업 선블록     ,Makeup
223,공식 상품 미샤 상품명 세이프 블록   커버 톤업 선         ,Makeup
224,프랑스와즈 상품명 뽀송선스틱  미백 주름개선 모공커버                ,Makeup
225,애터미 상품명 애터미 앱솔루트 에센스 선,Makeup
226,공식 상품 리코셀 상품명 저자극 데일리 썬 크림       개 마일드 대용량 선 블록 패밀리 촉촉 빠른흡수,Makeup
227,설화수 상품명 설화수 상백크림       호   ,Makeup
228,홈쇼핑 상품 일리윤 상품명 일리윤 이지워시 선크림        입,Makeup
229,한율 상품명 한율 흰감국 광채 선크림             ,Makeup
230,라운드랩 상품명 라운드랩 자작나무 수분 선스틱    ,Makeup
231,상품명 뷰그린 썬프로 아웃도어 패치  매입 귀걸이형 골프 낚시 등산 자외선차단 썬패치 낚시썬패치 골프썬패치 등,Makeup
232,더후 공진향 상품명 후 공진향 진해윤 선크림 기획세트,Makeup
233,백화점 상품 시세이도 상품명  신세계강남점 하이드로    콤팩트 포 스포츠              리필 케이스 ,Makeup
234,공식 상품 모레모 상품명        선스틱                       ,Makeup
235,크레마카발로 상품명 크레마카발로 오리지날 선 세럼       개,Makeup
236,공식 상품 비욘드 상품명 피토 아쿠아 트루 워터 선베이스     ,Makeup
237,유세린 상품명 울트라 프로텍션    세럼                   ,Makeup
238,테라로직 상품명 테라로직 히알시카 토탈 모이스처     선크림     ,Makeup
239,홈쇼핑 상품 지엘리 상품명 본품 개 지엘리 트루프 올투게더 선쿠션 패키지,Makeup
240,    상품명     내추럴 퍼펙션 더블 쉴드 선스틱   개,Makeup
241,한율 상품명 한율 흰감국 광채 선크림                  ,Makeup
242,공식 상품 정샘물 상품명 정샘물 마스터클래스 앰플 선,Makeup
243,헤라 상품명 헤라 선메이트 레포츠 크림       개              ,Makeup
244,빌리프 상품명 빌리프 유브이 프로텍터 멀티 선스크린 플러스     ,Makeup
245,라운드랩 상품명 라운드랩 자작나무 수분 선크림       개,Makeup
246,공식 상품 닥터지 상품명 브라이트닝 톤 업 선 스틱    ,Makeup
247,해외직구 상품 비오레 상품명 비오레    대용량 선크림         개 아쿠아리치 워터리 에센스        익일 발송 최신 제조상품 ,Makeup
248,애터미 상품명 애터미 선크림베이지  개,Makeup
249,상품명 어성초 그린 톤업 크림 톤업 선크림,Makeup
250,피지오겔 레드수딩   상품명 피지오겔 레드 수딩    선크림                ,Makeup
251,그린핑거 상품명 그린핑거 포레스트 청정 멀티 디펜스 선쿠션 본품,Makeup
252,닥터지 상품명 닥터지 그린 마일드 업 선 플러스         ,Makeup
253,홈쇼핑 상품 엘로엘 상품명     최신상 엘로엘 업그레이드 빅 선쿠션   본품  리필 ,Makeup
254,헤라 상품명 헤라 선메이트 크림          레포츠        선 썬 햇빛 피부 선물,Makeup
255,마녀공장 상품명 마녀공장 파데프리 선크림        개      퓨어 클렌징오일 딥클린     추가 증정,Makeup
256,수려한 효비담 상품명 수려한 효비담 발효 선크림 커버 선크림 미백 선크림,Makeup
257,오스트리안골드 상품명 올리브영      태닝오일 스프레이        ,Makeup
