,titles,category
0,풍원 상품명  단 참숯 더블 접이식 매트리스 소파베드 원룸 침대,Interior
1,풍원 상품명  단 참숯 싱글 접이식 매트리스 쇼파  인용 소파베드,Interior
2,풍원 상품명 키즈  단 참숯 소파베드 접이식매트리스 쇼파 침대,Interior
3,풍원 상품명 키즈  단 메모리폼 소파베드 참숯 접이식쇼파매트리스,Interior
4,풍원 상품명  단 참숯 접이식 매트리스 싱글 토퍼 침대겸쇼파,Interior
5,풍원 상품명  단 참숯 접이식 매트리스 더블  인용 쇼파베드 침대,Interior
6,풍원 상품명  단 참숯 접이식 매트리스 싱글 토퍼 침대겸쇼파,Interior
7,풍원 상품명  단 참숯 접이식 매트리스  인용 침대 쇼파베드 나염,Interior
8,풍원 상품명  단 참숯 접이식 매트리스 더블  인 좌식 쇼파베드,Interior
9,풍원 상품명  단 참숯 접이식 매트리스 싱글  인용 쇼파베드 패브릭,Interior
10,상품명      휴대용 에어 소파 베드 침대 에어배드 캠핑 매,Interior
11,상품명  단계 각도조절 낮은의자  인용 좌식소파  그레이 ,Interior
12,상품명 원룸 거실 낮은소파 각도조절  인용 좌식소파 핑크 ,Interior
13,상품명 원룸 거실 의자 각도조절  인용 좌식소파 다크그레이 ,Interior
14,상품명       월 데코 패브릭 스테이윗유 포스터 특대          패브릭포스터 인테리어포스터 패브릭가림막 가림막,Interior
15,상품명       이레 스포츠    컬러 빈백  세트    개입                놀이체육 체육교구 유치원 어린이이집 유아,Interior
16,상품명       원목무빙벤치 이동식벤치의자 수납형벤치의자 원목무빙벤치 수납형벤치의자 공간박스 수납형소파 보,Interior
17,상품명       빌한슨 빔백 빙백 일인 쇼파 벌룬 에어 빈백 의자 일인쇼파 거실의자 소파의자 쇼파의자 에어소파,Interior
18,인텍스 상품명 인텍스 수리패치   다용도 인텍스 전상품 사용가능  ,Interior
19,상품명            휴대용 에어 소파 베드 침대 에어배드 캠핑 매 소파베드 캠핑침대 야외침대 휴대용침대 에어침,Interior
20,상품명     인용 에어소파 네이비 원룸 기숙사 에어 쿠션 의자 에어소파 에어쇼파 에어의자 마약빈백 원룸소파,Interior
21,상품명     인용 에어소파 스툴세트 원룸 소파 발받침세트 브라운 에어소파 에어쇼파 에어의자 마약빈백 원룸소,Interior
22,상품명     인용 에어소파 스툴세트 원룸 소파 발받침세트 레드 에어소파 에어쇼파 에어의자 마약빈백 원룸소파,Interior
23,상품명     인용 에어소파 스툴 원룸 소파 발받침세트 네이비 에어소파 에어쇼파 에어의자 마약빈백 원룸소파,Interior
24,상품명    인텍스 에어소파 스툴 세트  인용 카우치소파 그레이 에어매트 인텍스소파 에어소파 소파 쇼파,Interior
25,상품명    인텍스 싱글매트 소파베드 접이식 에어소파 침대 에어매트 인텍스소파 인텍스매트 에어소파 소파,Interior
26,더리드 상품명 크리미 조야원단 코너형  인소파,Interior
27,더리드 상품명 크리미 조야원단 코너형  인소파,Interior
28,더리드 상품명 네스트 조야원단  인 스윙소파,Interior
29,더리드 상품명 네스트 조야원단  인 스윙소파,Interior
30,더리드 상품명 베로나 조야원단  인소파,Interior
31,더리드 상품명 네스트 조야원단 코너형  인 스윙소파,Interior
32,더리드 상품명 네스트 조야원단 코너형  인 스윙소파,Interior
33,더리드 상품명 베로나 조야원단  인소파 스툴세트,Interior
34,더리드 상품명 베로나 조야원단  인소파,Interior
35,더리드 상품명 베로나 조야원단 코너형  인소파,Interior
36,더리드 상품명 베로나 조야원단 코너형  인소파,Interior
37,더리드 상품명 크레아 조야원단  인소파,Interior
38,더리드 상품명 크레아 조야원단 코너형  인소파,Interior
39,더리드 상품명 크레아 조야원단  인소파 스툴세트,Interior
40,더리드 상품명 비비드 조야원단  인소파,Interior
41,더리드 상품명 크레아 조야원단 코너형  인소파,Interior
42,더리드 상품명 비비드 조야원단 코너형  인소파,Interior
43,더리드 상품명 비비드 조야원단  인소파,Interior
44,더리드 상품명 비비드 조야원단 코너형  인소파,Interior
45,더리드 상품명 루이스 조야원단  인소파,Interior
46,더리드 상품명 루이스 조야원단  인소파 스툴세트,Interior
47,더리드 상품명 루이스 조야원단  인소파,Interior
48,더리드 상품명 루이스 조야원단 코너형  인소파,Interior
49,더리드 상품명 크리미 조야원단  인소파,Interior
50,더리드 상품명 루이스 조야원단 코너형  인소파,Interior
51,더리드 상품명 크리미 조야원단  인소파 스툴세트,Interior
52,상품명 디무드  인 리클라이너 좌식 소파  인리클라이너쇼파  인리클라이너소파  인소파  인쇼파 인테리어소파 의,Interior
53,상품명 자취방 소파  인용 에어소파 스툴세트 브라운 쇼파의자 쇼파쿠션 안락한소파 에어소파 에어쇼파,Interior
54,상품명         다목적 평철 일자 브라켓 철물 고정 보강,Interior
55,상품명  폴딩와플체어 베이지  편안한  인용 좌식소파 패브릭소파 각도조절 의자 원 접이식 좌식 캠핑 게이밍 쇼파,Interior
56,상품명        형 거실 야외 캠핑 에어소파 빈백소파 대형빈백 빈백 야외소파 캠핑의자,Interior
57,상품명       거실 빈백 에어소파 캠핑의자 야외소파 빈백소파 에어소파 야외소파 휴대용소파 공기주입소파,Interior
58,상품명       이시아르 각도조절 좌식 소파 그레이 리클라이너 릴랙서 안락의자 라운지체어 퍼블릭체어,Interior
59,상품명 마벨러스홈데코 모찌 극세사  인 빈백 소파 원룸 거실 극세사빈백 극세사빈벡 빈백 침대빈백 원룸소파 원룸,Interior
60,가구쟁이 상품명 가구쟁이 깔끔이수납형 벤치쇼파  인용  인용수납쇼파,Interior
61,오스본가구 상품명 오스본가구      인기    인용 가죽소파   종 모음전,Interior
62,서광퍼니처 상품명 서광퍼니처 베스트   라텍스  인,Interior
63,공식 상품 베스트리빙 상품명 켄트  인용  인용 초생피 가죽 쇼파  인  인 사무실 매장 거실 소파,Interior
64,공식 상품 베스트리빙 상품명 켄트  인용  인용 패브릭 아쿠아텍스 쇼파  인  인 사무실 매장 거실 소파 할인,Interior
65,상품명 세계로가구 아론  인 신소재 인조가죽 소파  인용 쇼파  스툴 선택 ,Interior
66,공식 상품 이노센트 상품명 순수 조야원단 패브릭  인용소파 스툴        ,Interior
67,홈쇼핑 상품 에넥스 상품명 에넥스에스코지 마망 원목 아쿠아텍스 데이베드 소파베드 매트 원형쿠션 등쿠션 개 착불배송,Interior
68,상품명  인용 패브릭 소파베드        브라운  접이식침대,Interior
69,공식 상품 베스트리빙 상품명 뉴켄트 패브릭 아쿠아텍스 생활방수  인용 쇼파  인 사무실 매장 거실 소파,Interior
70,바로크가구 상품명 바로크가구 토니 라탄  인용 원목 식탁의자 기본형,Interior
71,상품명 에어소파,Interior
72,상품명  인용 에어소파 네이비 원룸 기숙사 에어 쿠션 의자,Interior
73,상품명  인용 에어소파 스툴세트 원룸 소파 발받침세트 레드,Interior
74,상품명  인용 에어소파 스툴 원룸 소파 발받침세트 네이비,Interior
75,상품명  인용 에어소파 스툴세트 원룸 소파 발받침세트 브라운,Interior
76,상품명 인텍스 에어소파 스툴 세트  인용 카우치소파 그레이,Interior
77,상품명 인텍스 싱글매트 소파베드 접이식 에어소파 침대,Interior
78,상품명 다용도  자            평철 고정 브라켓 공방 목공,Interior
79,상품명 다용도  자 평철         고정브라켓    선반 의자,Interior
80,상품명          다목적 일자형 평철 브라켓 철물 고정 보강,Interior
81,상품명 다용도 잠금장치 걸쇠    금속 푸시 풀 클램프 도구,Interior
82,상품명          다목적 일자형 평철 브라켓 철물 고정 보강,Interior
83,상품명 다용도  자            평철 고정 브라켓 공방 목공,Interior
84,상품명    스테인레스 중형 다기능 가구 코너 커넥터  면,Interior
85,상품명         다목적 평철 일자 브라켓 철물 고정 보강,Interior
86,상품명 다용도  자 평철         고정브라켓    선반 의자,Interior
87,상품명 다용도 경첩     브라켓    선반 목공 공방 중형,Interior
88,상품명 다용도 경첩     브라켓    선반 목공 공방 대형,Interior
89,더리드 상품명 그래미 조야원단  인 우퍼컵홀더 리클라이너소파,Interior
90,더리드 상품명 플레인 수납형 소파베드 싱글,Interior
91,더리드 상품명 플레인 수납형 소파베드 슈퍼싱글,Interior
92,해외직구 상품 상품명 스플릿 폴라 플리스 리클라이너 소파 커버 탄성 레이지 보이 의자 커버 라운저 소파 슬립 커버 편안한 안락,Interior
93,상품명 인텍스 에어소파 스툴 세트 그레이 인용 카우치소파 에어매트 인텍스소파 에어소파 소파,Interior
94,상품명 룸메이트  인용 에어소파 레드 원룸쇼파 일인소파 에어소파 에어쇼파 에어의자 마약빈백,Interior
95,상품명  인용 에어소파 스툴 세트 레드 원룸소파 에어소파 에어쇼파 에어의자 마약빈백,Interior
96,상품명 룸메이트  인용 에어소파 네이비 원룸쇼파 일인소파 에어소파 에어쇼파 에어의자 마약빈백,Interior
97,상품명  인용 에어소파 스툴 세트 네이비 원룸소파 에어소파 에어쇼파 에어의자 마약빈백,Interior
98,상품명 원라인 수납형 벤치소파      브라운  소파벤치 수납벤치 소파 의자,Interior
99,상품명 원라인 수납형 벤치소파      그린  소파벤치 수납벤치 소파 의자,Interior
100,상품명 원라인 수납형 벤치소파      그린  소파벤치 수납벤치 소파 의자,Interior
101,상품명 원라인 수납형 벤치소파       그린  소파벤치 수납벤치 소파 의자,Interior
102,상품명 원라인 수납형 벤치소파      그레이  소파벤치 수납벤치 소파 의자,Interior
103,상품명 원라인 수납형 벤치소파      그레이  소파벤치 수납벤치 소파 의자,Interior
104,상품명 원라인 수납형 벤치소파       그레이  소파벤치 수납벤치 소파 의자,Interior
105,상품명 원라인 수납형 벤치소파      딥 그레이  소파벤치 수납벤치 소파 의자,Interior
106,상품명 원라인 수납형 벤치소파      딥 그레이  소파벤치 수납벤치 소파 의자,Interior
107,상품명 원라인 수납형 벤치소파       딥 그레이  소파벤치 수납벤치 소파 의자,Interior
108,상품명 원라인 수납형 벤치소파      오렌지  소파벤치 수납벤치 소파 의자,Interior
109,상품명 원라인 수납형 벤치소파      오렌지  소파벤치 수납벤치 소파 의자,Interior
110,상품명 원라인 수납형 벤치소파       오렌지  소파벤치 수납벤치 소파 의자,Interior
111,상품명 원라인 수납형 벤치소파      네이비  소파벤치 수납벤치 소파 의자,Interior
112,상품명 원라인 수납형 벤치소파      네이비  소파벤치 수납벤치 소파 의자,Interior
113,상품명 원라인 수납형 벤치소파       네이비  소파벤치 수납벤치 소파 의자,Interior
114,상품명 인텍스 풀아웃 더블매트 소파베드 접이식 에어쇼파 에어매트 에어소파 소파침대 소파베드,Interior
115,상품명 빈백      라이트베이지,Interior
116,비투비월드 상품명 리벨리  인용 좌식소파 발받침세트 빈백 쇼파,Interior
117,풍원 상품명  단 참숯 퀸 레자 패브릭 접이식 소파베드 매트 침대,Interior
118,풍원 상품명  단 참숯 더블 접이식 소파베드 매트리스 원룸침대,Interior
119,큐피드 상품명 빈백 트라이앵글 레자  인쿠션소파 좌식의자 안락쇼파,Interior
120,큐피드 상품명       에르고  인용 쇼파 수유 의자 안락 소파 스툴,Interior
121,풍원 상품명  단 참숯 접이식 매트리스 더블  인 침대겸쇼파 패브릭,Interior
122,풍원 상품명  단 참숯 메모리폼 접이식 매트리스 싱글 토퍼 패브릭,Interior
123,큐피드 상품명 빈백 립스 싱글  인용쇼파 카우치 거실 소파 안락의자,Interior
124,큐피드 상품명 빈백 립스 더블 카우치  인용쇼파 커플 좌식의자 소파,Interior
125,큐피드 상품명 퓨전 쇼파베드 싱글 패브릭  인용 좌식소파 매트리스,Interior
126,상품명 백화상점 무지 빈백 소파 대형  인용 마약빈백 원룸 거실 쿠션 쇼파,Interior
127,상품명 좌식 소파베드  인용 침대 쇼파 쿠션 접이식 매트리스,Interior
128,자코모 상품명 헤드레스트 개 무료 모드    인 깊은형 천연면피 소가죽소파,Interior
129,자코모 상품명 헤드레스트 개 무료 모드    인 기본형 천연면피 소가죽소파,Interior
130,공식 상품 베스트리빙 상품명 와퍼 쿠션 더블 소파베드 쇼파베드 쇼파침대  인 소파  인용 쇼파  단각도조절,Interior
131,공식 상품 보니타빈백 상품명       보니타 풋스툴      스웨이드 대형 발쿠션    컬러중 택   센스 있는 연말 선물,Interior
132,서광퍼니처 상품명 비타민 라텍스  인용  인용 소파,Interior
133,상품명 퍼시스        패브릭 소파 하부바퀴 이동가능,Interior
134,공식 상품 베스트리빙 상품명 피렌체 인테리어 거실  인용 쇼파 인조가죽  인 매장 소파,Interior
135,까사미아 상품명 까사미아 비엘라 세미 카우치소파 좌형 라이트그레이,Interior
136,공식 상품 레이디가구 상품명  최종결제가         끌레망 천연소가죽 면피쇼파  인용 스툴,Interior
137,상품명 세계로가구 에파타 신소재 인조가죽  인 소파 비건레더  인용 쇼파,Interior
138,상품명 세계로가구 지브  인 신소재 인조가죽 소파  인용 쇼파,Interior
139,상품명 세계로가구 오르바  인용 아쿠아텍스 패브릭 소파 이지클린    인 쇼파,Interior
140,퍼시스 상품명 퍼시스 패브릭 소파  인용 거실 카페 사무용               ,Interior
141,공식 상품 에보니아 상품명 디오  인쇼파 신규칼라  종 단독특가,Interior
142,상품명  에피하임 에피하임 임스체어 라운지체어  인용 안락의자,Interior
143,상품명 아티슈슈 크루즈 야외빈백 실내빈백 생활방수 발받침미포함  방수빈백 테라스빈백 카페빈백,Interior
144,공식 상품 베스트리빙 상품명 베로나 패브릭  인 소파베드  인용 쇼파베드 쇼파침대 소파 쇼파 침대         ,Interior
145,상품명 면마 소파베드  인용  그레이  접이식쇼파,Interior
146,상품명 면마 소파베드  인용  민트  접이식쇼파,Interior
147,공식 상품 보니타빈백 상품명 보니타 빈백 방수커버 아웃도어용 실외커버  대형 파우치             전용  완벽방수   실내외 전용 커버,Interior
148,상품명 에어소파 빈백 원룸 쇼파 캠핑용  인용쇼파펌프세트,Interior
149,상품명 붙박이쇼파 벽의자 레스토랑 가게 라운지  인용 가죽 코너형 호텔 사무실 대기의자,Interior
150,공식 상품 모던하우스 상품명 준 기능성패브릭 오픈카우치 스툴세트 베이지 좌암,Interior
151,상품명  인용 의자 네일샵 패브릭 쇼파 안락 카페 벨벳 체어,Interior
152,폴리몰리 상품명 빈백      차콜,Interior
153,큐피드 상품명 빈백 공의자 스툴  인용소파 거실 보조 쿠션 쇼파,Interior
154,큐피드 상품명 빈백 댄디  인용쇼파 좌식의자 푹신한 거실 안락 소파,Interior
155,공식 상품 베스트리빙 상품명 켄트  인용쇼파 초생피 가죽 쇼파 사무실 매장 거실 소파,Interior
156,풍원 상품명  단 참숯 접이식 매트리스 퀸  인 좌식 쇼파베드,Interior
157,상품명 중력없는 리클라이너 무중력 의자 목베개 패드 거치대,Interior
158,상품명  아카시아원목  바오  인벤치 원목 실내벤치 의자 원목의자 철제벤치의자 인테리어벤치 실내벤치 휴게실의,Interior
159,상품명  멀바우원목  바오  인벤치 원목 실내벤치 의자 원목의자 철제벤치의자 인테리어벤치 실내벤치 휴게실의자 ,Interior
160,상품명     멀바우  바오  인벤치 원목 실내벤치 의자 원목의자 철제벤치의자 인테리어벤치 실내벤치 휴게실의자  ,Interior
161,상품명 월 데코 패브릭 별빛밤야경 포스터소       ,Interior
162,상품명 각도 리클라이너 의자 조절,Interior
163,상품명 이이 보리 옐로우 소파 거실  인용      ,Interior
164,상품명 소파베드 그레이  인용,Interior
165,상품명 원라인 수납형 벤치소파      그레이,Interior
166,상품명 패브릭 소파베드 블루  인용      ,Interior
167,상품명 각도 조절 좌식 그레이  인용 소파베드     ,Interior
168,상품명 세상편한 헤링본 워싱면 소파 패드     브라운  인용,Interior
169,상품명 접이식 소파 블루  인용,Interior
170,상품명 세상편한 각도 소파 베드 좌식 조절  인용   베이지,Interior
171,상품명 레드 패브릭 각도 조절 소파  인용,Interior
172,상품명 베이지 크라운 각도조절 좌식소파  인용,Interior
173,상품명 스판덱스 접이식 소파베드  인용      ,Interior
174,상품명 홈챈스 소파커버 사시사철 매일 패브릭 소파스킨  인용,Interior
175,상품명 세상편한 패브릭 소파 스툴 세트  인용 그레이,Interior
176,상품명 원라인 수납형 벤치소파 그레이     딥,Interior
177,상품명 옐로우 유럽풍 패브릭 소파의자  인,Interior
178,상품명 원라인 수납형 벤치소파      네이비,Interior
179,상품명 소파다크 베이지 가리비  인용 그레이,Interior
180,상품명 각도 조절 소파 그레이 스툴 세트  인용,Interior
181,상품명 푹신 그레이 빈백  인용,Interior
182,상품명 이이보리 핑크 거실 패브릭 소파  인용      ,Interior
183,상품명 세상편한 룸메이트 세트 소파 스툴 에어  인용 레드,Interior
184,상품명 세상편한 소파 가구 패드 커버 투명 시트지 보호필름           매입  ,Interior
185,상품명 세상편한 원라인 수납 벤치 형 소파 네이비,Interior
186,상품명 그린 다크 패브릭 소파베드  인용      ,Interior
187,상품명 세상편한 인텍스 풀아웃 매트 소파 베드 더블,Interior
188,상품명 거실 패브릭 아리보리 옐로우 소파  인용      ,Interior
189,상품명 스판덱스 접이식 소파베드  인용      ,Interior
190,상품명 거실 패브릭 소파 핑크  인용      ,Interior
191,상품명 세상편한 베드 소파 퍼플  인용   ,Interior
192,상품명 세상편한 소파 유럽식 인조 가죽 의자 카키  인용,Interior
193,상품명 세상편한 스판 덱스 접이식 베드 소파  인용    ,Interior
194,상품명 패브릭 소파베드 그레이 다크  인용      ,Interior
195,상품명 세상편한 가벼운 쇼파 빈백 소파 겸  인용 베이지,Interior
196,상품명 세상편한 헤링본 워싱면 소파 패드 걸이 팔 블루  ,Interior
197,상품명 푹신 빈백 퍼플  인용,Interior
198,상품명 좌식소파그레이  인용,Interior
199,상품명 스퀘어 각도조절 좌식소파 그레이  인용,Interior
200,상품명 유럽풍 사무용 오렌지 등받이 의자,Interior
201,상품명 세상편한 각도 베드 좌식 조절 소파  인용     그레이,Interior
202,상품명 세상편한 빈백 에어 의자 거실 휴대용 공기 캠핑 소파 야외 쇼파 주입,Interior
203,상품명 가리비 블루 소파베이지  인용,Interior
204,상품명 세상편한 패브릭 베드 소파  인용    그레이,Interior
205,상품명 세상편한 소가죽 리클라이너 소파  인용  ,Interior
206,상품명 트랜디한 컬러   빈백 핑크 소파,Interior
207,상품명 세상편한 패브릭 베드 소파 올리브  인용   ,Interior
208,상품명 세상편한 홈챈스 쿠션 나뭇잎 소파 커버 세트  인용,Interior
209,공식 상품 보니타빈백 상품명 야외빈백 기능성 소재 프리미엄 방수빈백 시리즈   블랙에디션 실내외 겸용 수영장빈백   초경량 빈백,Interior
210,공식 상품 베스트리빙 상품명 리암 카우치형  인용  인용 가죽 쇼파  인  인 사무실 매장 거실 소파 할인,Interior
211,아누리 상품명 아누리 에그빈백 마약빈백  인쇼파 원형쿠션,Interior
212,상품명 심플디자인의 웨이트소파 스툴 장의자               ,Interior
213,공식 상품 보니타빈백 상품명 보니타 정품 빈백 리필용 충전재     대용량       개분량  센스 있는 연말 선물,Interior
214,공식 상품 동서가구 상품명      테라 천연 가죽  인용 소파         ,Interior
215,동서가구 상품명 동서가구 홀릭 구스포켓 라텍스탑  인 천연가죽 소파         ,Interior
216,공식 상품 베스트리빙 상품명 리옹 카우치  인용  인용 초생피 가죽 쇼파  인  인 사무실 매장 거실 소파 할인,Interior
217,동서가구 상품명 동서가구 루엘  인용 이태리 천연가죽 라텍스탑 소파         ,Interior
218,동서가구 상품명 동서가구 루엘  인용 이태리 천연가죽 라텍스탑 소파 스툴         ,Interior
219,상품명  텐바이텐 슬리피펭귄 유아쇼파 유아동 빈백,Interior
220,상품명     도브 미용 비누     수분포함      매입  ,Interior
221,상품명 이동식 수납형 벤치 소파 스툴 보관함 나무 의자 스툴벤치 벤치의자 수납벤치 이동식의자 나무벤,Interior
222,엠비언트라운지 상품명 아트박스 엠비언트라운지 엠비언트라운지 빈백 충전재     ,Interior
223,홈쇼핑 상품 상품명 바이탈버브 엘리스 아쿠아원단  인 리클라이너소파,Interior
224,상품명 레이디가구 모우 패브릭 소파베드    인,Interior
225,상품명 패브릭 북유럽 그린유칼립투스 가림막  호 대         ,Interior
226,상품명 월 데코 패브릭 그레이시티 포스터 대        ,Interior
227,상품명 패브릭 월 데코 빼꼼고양이 가림막 소       ,Interior
228,상품명 접이식 회전 패브릭 쇼파  인용    도  번,Interior
229,상품명 룸메이트 에어소파 원룸쇼파 일인소파  인용 레드,Interior
230,상품명 라이프홈 각도조절 좌식 소파 등받이 쿠션 의자,Interior
231,상품명 에어소파 스툴세트 원룸 소파 발받침세트  인용 레드,Interior
232,상품명 에어소파 스툴 쇼파 디자인소파 간이침대 빈백 그레이,Interior
233,상품명 에어소파 원룸 기숙사 에어 쿠션 의자  인용 네이비,Interior
234,상품명 에어소파레드 원룸쇼파 룸메이트 일인소파  인용,Interior
235,상품명 월 데코 패브릭 스테이윗유 포스터대        ,Interior
236,상품명 벨벳코팅 에어소파 에어쇼파 원룸쇼파  인용 네이비,Interior
237,상품명 굿라이프 각도조절 좌식 소파 등받이 쿠션 의자,Interior
238,상품명 인텍스 싱글매트 소파베드 접이식 에어소파 침대,Interior
239,상품명 에어소파 원룸쇼파 일인소파 룸 인용 네이비,Interior
240,상품명 에어소파 스툴 원룸 소파 발받침세트  인용 네이비,Interior
241,상품명 원목무빙벤치 이동식벤치의자 수납형벤치의자,Interior
242,상품명 커버 등받이 패드 겸 팔걸이 워싱면 소파 소파패드 쇼파패드 소파깔개,Interior
243,상품명 도브 시어버터뷰티바 개입,Interior
244,상품명 에어소파 스툴 세트 원룸소파  인용 네이비,Interior
245,상품명 인텍스 풀아웃 더블매트 소파베드 접이식 에어쇼파,Interior
246,상품명      휴대용 에어 소파 베드 침대 에어배드 캠핑 매,Interior
247,상품명 신소재 돌쇼파매트   매쉬매트,Interior
248,상품명 라이프홈 각도조절 좌식 소파 리클라이너 좌식스툴,Interior
249,상품명 월 데코 패브릭 별밑잠자리 포스터특대        ,Interior
250,상품명 월 데코 패브릭 그레이시티 포스터 소       ,Interior
251,상품명 야외빈백 쇼파 소파 에어 의자 야외용빈백 빈백,Interior
252,상품명 라이프인 각도조절 좌식 소파 리클라이너좌식 의자,Interior
253,상품명 체스터 천연가죽 수동 리클라이너 소파 하버     인 그레이,Interior
254,상품명 에어소파네이비 룸메이트 원룸쇼파 일인소파  인용,Interior
255,상품명 이시아르 각도조절 좌식 소파 그레이,Interior
256,상품명 빌한슨 빔백 빙백 벌룬 빈백 의자 에어 러브 소파,Interior
257,상품명 빌한슨 빔백 빙백 일인 쇼파 벌룬 에어 빈백 의자,Interior
258,상품명 체스터 천연가죽 수동 리클라이너 소파 퍼마넌트     인 옐로우,Interior
