,titles,category
222,상품명 리얼트리 레드파인 퀸원목침대 매트포함 ,Interior
223,상품명 고운님  단 홑겹 누빔 접이식매트리스 고탄성   접이식매트 토퍼매트,Interior
224,파미가구 상품명 철제 층침대 인조가죽매트 일층침대 기숙사침대 원룸침대 싱글침대 철제침대 간이침대,Interior
225,상품명 우드퍼니쳐 침대 프레임 매트리스토퍼겸용 깔판 저상형 패밀리 받침대 토퍼겸용 미니싱글      깔판,Interior
226,상품명 리얼트리 레드파인    더블수납침대 매트포함 ,Interior
227,웰하우스 상품명 보스코 구수납침대 삼나무침대 원목침대 평상침대 슈퍼싱글 퀸침대,Interior
228,상품명  단접이식메모리폼매트리스       무료배송 국내제작,Interior
229,상품명 편백나무 아모르 벙커 이층침대 주문제작 싱글 슈퍼싱글침대 매트리스포함,Interior
230,상품명 리퍼 피아제 우빈이  형 슈퍼싱글 침대프레임 침대,Interior
231,해외직구 상품 상품명     접이식침대 간이침대 소파베드 쇼파침대      너비,Interior
232,상품명 도아르      폼 접는 얇은 바닥 매트리스 손님용 원룸 토퍼 싱글 수면매트 쟈가드   ,Interior
233,상품명 도아르      폼 푹신한 얇은 바닥 매트리스 손님용 원룸 토퍼 싱글 수면매트 쟈가드   ,Interior
234,네이처월드 상품명  단 접이식 매트리스 침대 바닥 토퍼 원룸 손님용 수면매트,Interior
235,상품명 전동베드 미용베드 마사지 피부과 한의원 병원침대,Interior
236,상품명 흙마루 돌침대 리퍼브 황토볼 흙침대  인 카우치        ,Interior
237,오데뜨 상품명 좋은아침 깊은잠    슬립마루 투나잇 토퍼 매트리스 메모리폼 접이식 순면 누빔패드 방수 속커버 증정,Interior
238,해외직구 상품 상품명 접이식 이동식 마사지침대 마사지베드,Interior
239,홈쇼핑 상품 현대의료기 상품명   만세일 현대의료기 포그니처 모던     수납침대    사은품 종 냄비 협탁 ,Interior
240,상품명 베리 일반형 서랍형침대 더블침대 매트리스포함 퀸침대,Interior
241,상품명 트리탑퍼니처 편백나무 로이 서랍형통판 싱글침대 본넬양면 매트리스포함 더블침대 킹침대,Interior
242,상품명 편백나무 벙커 책상형 이층 침대프레임 매트리스별도 싱글침대 슈퍼싱글침대주문제작,Interior
243,상품명 트리탑퍼니처 루리 싱글침대 슈퍼싱글침대 매트리스포함 서랍침대 고시원 원룸 기숙사침대,Interior
244,상품명 트리탑퍼니처 편백나무 루이 서랍형 통판 침대프레임             매트리스별도,Interior
245,상품명 트리탑퍼니처 편백나무 원목 통판 침대프레임             매트리스별도,Interior
246,상품명 트리탑퍼니처 편백나무 원목 통판 침대 매트리스포함 싱글 슈퍼싱글 더블 퀸 킹침대             ,Interior
247,상품명 앙상블 쇼파베드 폼단면매트포함 싱글침대 슈퍼싱글침대 주문제작,Interior
248,상품명 초특가 한정판매     슈퍼싱글침대 매트리스포함 고시원 원룸 기숙사침대,Interior
249,상품명 루리 일반 서랍형 침대 퀸침대 매트리스포함 더블침대     ,Interior
250,상품명 트리탑퍼니처 편백나무 원목 저상형통판 싱글침대 슈퍼싱글 더블 퀸 킹침대 매트리스포함,Interior
251,상품명 트리탑퍼니처 편백나무 저상통판프레임 싱글 슈퍼싱글 더블 퀸 킹 매트리스별도             ,Interior
252,상품명 트리탑퍼니처 편백     평상형              통판침대프레임 싱글 슈퍼싱글 더블 퀸 킹침대,Interior
253,상품명 트리탑퍼니처 편백 무헤드 평상형 통판침대 싱글 슈퍼싱글 더블 퀸 킹 본넬매트리스포함,Interior
254,상품명 전동 미용 병원 한의원 마사지 피부과 베드,Interior
255,상품명 트리탑퍼니처 편백 원목 포레스트 저상형프레임 받침대 매트리스별도           ,Interior
256,상품명 허리편한 매트리스  단 접이식 바닥 수면 매트 원룸 토퍼 메모리폼 라텍스 매트릭스 싱글 퀸         ,Interior
257,상품명 헤드수납 저상침대         침대 받침대별도 본넬양면 매트리스포함,Interior
258,상품명 앙상블 쇼파베드 싱글침대 슈퍼싱글침대 주문제작,Interior
259,공식 상품 하포스 상품명 멀티수납 서랍형침대    조명 콘센트 침대프레임 매트리스 세트 공장직송 특가,Interior
260,상품명  소비자만족  년연속  위 수상 최저가  탄탄하게 받쳐주는 알로하 매트리스 필로우탑매트리스       ,Interior
261,공식 상품 파로마가구 상품명 포마드     통서랍형 수납침대 슈퍼싱글 퀸 수납침대 더블침대 원룸침대 수납프레임 킹침대,Interior
262,공식 상품 파로마가구 상품명      캐럴       단 수납침대       매트리스포함 수납침대 조명침대 빅서랍침대 공간활용침대 원룸침대,Interior
263,공식 상품 한샘 상품명 한샘 노뜨컴포트 포켓스프링 매트리스 슈퍼싱글 퀸,Interior
264,상품명 숨쉬는 침대 매트리스 깔판 높낮이 선택 슈퍼싱글 퀸,Interior
265,삼익가구 상품명 롯데 단독 최저가 마레      단 수납 원목 침대    양모 라텍스  존 독립스프링,Interior
266,상품명 소프트 볼륨매트 메모리폼    더블,Interior
267,상품명 수니홈  단 접이식 매트리스 멀티싱글       사이즈 체크 필수,Interior
268,지누스 상품명 얼티마 에어 하이브리드 스프링 매트리스       퀸 ,Interior
269,상품명 싱글 단면매트리스 원룸 고시원침대 주문제작,Interior
270,르메르침대 상품명 호텔매트리스 퀸사이즈   ,Interior
271,홈쇼핑 상품 상품명 패밀리  개세트프리미엄 삶아쓰는 경추베개,Interior
272,베드리움 상품명    베드리움     노블아워 유로탑 매트리스 슈퍼싱글 ,Interior
273,공식 상품 알파침대 상품명  쿠폰가    만 루나컴포트    롤팩 독립스프링 매트리스                ,Interior
274,베드리움 상품명 베드리움 독립스프링 매트리스 슈퍼싱글 ,Interior
275,공식 상품 더릭스홈 상품명 베이직 단단한 침대 매트리스     원룸 바닥 수면매트 자취 침대 라텍스 매트릭스 토퍼,Interior
276,공식 상품 더릭스홈 상품명  존 기절 매트리스 침대 바닥 토퍼         퀸 ,Interior
277,슬릭스 상품명 메모리폼  단 접이식 매트리스   센치 싱글 누비커버,Interior
278,공식 상품 하비라텍스 상품명 말레이시아 천연라텍스 매트리스 푹신한     싱글,Interior
279,파로마가구 상품명 퍼스트 노아  존 유로탑 독립쿠션 오가닉양모   라텍스매트리스  ,Interior
280,삼익가구 상품명 삼익가구 빌리지 원목 침대매트제외 퀸,Interior
281,리바트 상품명 꼼므 주니어 싱글 항균 고탄성폼 지퍼커버 매트리스,Interior
282,상품명 침대받침대   침대깔판   플라스틱침대받침대,Interior
283,리바트 상품명 로넌 슈퍼싱글 침대 프레임   색 ,Interior
284,키즈아이랜드 상품명 침대프레임매트리스깔판 패밀리받침대   침대 받침대,Interior
285,자미스 상품명 접이식매트리스  단 토퍼   고탄성 면 디자인 대사이즈,Interior
286,지누스 상품명 텐셀 매트리스 커버 그레이  슈퍼싱글 ,Interior
287,지누스 상품명 텐셀 매트리스 커버 화이트  슈퍼싱글 ,Interior
288,지누스 상품명 컨투어 필로우,Interior
289,공식 상품 동서가구 상품명      프리미엄 가죽 슈퍼싱글 흙침대 황토 볼보료            ,Interior
290,백화점 상품 알레르망 상품명 카이 퀼팅패드     싱글 ,Interior
291,리바트 상품명 꼼므 길이조절 침대     매트리스,Interior
292,지누스 상품명 얼티마 럭스   스프링 매트리스       퀸 ,Interior
293,공식 상품 에이스침대 상품명 원매트리스                  슈퍼싱글사이즈 ,Interior
294,상품명 명품의료기 전국무료배송 명품의료기        쇼파 황토숯볼 흙쇼파 흙카우치,Interior
295,공식 상품 한샘 상품명 노뜨 라텍스탑 매트리스 포켓스프링    슈퍼싱글,Interior
296,지누스 상품명 텐셀 매트리스 커버 화이트  싱글 ,Interior
297,씰리침대 상품명 씰리 비올라 플러스 유로탑 매트리스 퀸 설치비포함,Interior
298,상품명             황토볼 싱글 흙침대,Interior
299,미즌하임 상품명 미즌하임 모노폴리 원목 철재침대  ,Interior
300,상품명 엔젤홈스  단 접이식매트리스 중형  바닥토퍼 면 혼방 원단 무료배송 국내생산 엠보원단  단 샤카그레이 중 ,Interior
301,휴도 상품명 넉넉한 선유 빅 수납     무헤드 침대 프레임      ,Interior
302,삼익가구 상품명 삼익가구      마레      단 수납 원목 침대 매트제외 퀸  착불배송,Interior
303,공식 상품 한샘 상품명 한샘 아임빅 수납침대    일반헤드형  매트별도 ,Interior
304,홈쇼핑 상품 센스맘 상품명    매트리스 베이직    ,Interior
305,삼익가구 상품명     라이프  존 매트리스 토퍼 풀세트 슈퍼싱글 ,Interior
306,휴도 상품명 푹신한 제주      슬림 포켓스프링 바닥 매트리스 토퍼 침대매트          ,Interior
307,공식 상품 동서가구 상품명      인기     서랍형 슈퍼싱글 수납침대 프레임         ,Interior
308,휴센 상품명 휴센 러블리  단 폭조절 이동식 행거,Interior
309,지누스 상품명 매든 침대 프레임 라이트그레이  퀸 ,Interior
310,지누스 상품명 클라우드 에어 하이브리드 스프링 매트리스       슈퍼싱글 ,Interior
311,상품명 그린티 럭스   하이브리드 매트리스       슈퍼싱글 ,Interior
312,현대의료기 상품명 포그니처 온열소파   카우치 스웨이드황토숯볼 흙소파,Interior
313,라꾸라꾸 상품명 라꾸라꾸  탄 온열내장 싱글 침대          접이식,Interior
314,동서가구 상품명 동서가구   매트 견면  단 접이식 슈퍼싱글    토퍼 매트리스         ,Interior
315,상품명 올인원 본넬스프링 일체형침대 매트리스 싱글  ,Interior
316,백화점 상품 레노마홈 상품명 미엘모달 양면패드    컬러,Interior
317,공식 상품 웨스트프롬 상품명  한정 특가  마드리드 헤드 쿠션형     수납침대     프레임    매트리스 선택,Interior
318,상품명 제주 원목 접이식 침대 매트리스 깔판 프레임   ,Interior
319,상품명 태국 천연라텍스 싱글 매트리스                싱글매트리스 슈퍼싱글매트리스 싱글토퍼 매트리스 메트리,Interior
320,공식 상품 더릭스홈 상품명  단 접이식 매트리스     원룸 바닥 단단한 수면매트 접는 라텍스 토퍼,Interior
321,라폼 상품명 필맷 허리가 편한 토퍼매트리스    통기성 매트리스,Interior
322,삼익가구 상품명 삼익가구 태리      단 수납 원목 침대 매트제외 퀸 ,Interior
323,왕자행거 상품명 왕자  단조절행거       옷걸이행거 고정식행거 조립식행거,Interior
324,벨로코 상품명 벨로코 순면 스테이 누빔매트리스커버 퀸 ,Interior
325,홈쇼핑 상품 롤앤롤 상품명 롤앤롤 행거     세트,Interior
326,상품명 보루네오하우스 프라임 올슨     서랍    침대  존독립       ,Interior
327,공식 상품 포더홈 상품명 퍼지 호텔형 패브릭 스프링 침대 프레임         ,Interior
328,상품명 씰리 비올라 플러스 유로탑 매트리스 슈퍼싱글   메트 토퍼 매트 수면 호텔 씰리비올라매트리스슈퍼싱글    ,Interior
329,동서가구 상품명 동서가구   매트     벨로아 라텍폼스 토퍼 슈퍼싱글    매트리스         ,Interior
330,베드리움 상품명 금성침대 베드리움 레오스 가죽      단 수납침대   매트제외,Interior
331,동서가구 상품명 알폰스 오가닉  존 투매트리스 퀸침대         ,Interior
332,상품명 지누스 그린티 플러스 메모리폼 매트리스       퀸 ,Interior
333,웰하우스 상품명 리에또 원목 서랍수납침대 프레임    슈퍼싱글침대,Interior
334,르메르침대 상품명 호텔매트리스 슈퍼싱글    ,Interior
335,동서가구 상품명 착불 이즈카이    조명 수납침대   프레임         ,Interior
336,동서가구 상품명 동서가구 무료배송 포미   폼  단 접이식토퍼    싱글         ,Interior
337,베드리움 상품명 베드리움데코       평상형 침대     독립형,Interior
338,상품명 수니홈  단 접이식 매트리스 퀸      사이즈 체크 필수,Interior
339,삼익가구 상품명 롯데단독최저가 엔느     평상형 침대 파워 본넬스프링 매트리스 슈퍼싱글  착불배송,Interior
340,홈쇼핑 상품 센스맘 상품명 센스맘 투사이드 에어매트리스         양면형 ,Interior
341,몽스홈 상품명  단 접이식 마약매트리스 토퍼 바닥형      슈퍼싱글,Interior
342,숙면연구소 상품명  단 접이식 마약매트리스 토퍼 바닥용      멀티싱글 원룸 바닥 단단한 수면매트 자취 침대 매트릭스,Interior
343,상품명 접이식침대 전용 쿠션 매트리스,Interior
344,공식 상품 신우팜라텍스 상품명 클라우드 말레이시아 천연라텍스 토퍼 매트리스 일반               ,Interior
345,공식 상품 레이디가구 상품명  최종혜택가       원  코쿤 저상형침대 데이베드 슬림형   프레임 매트제외 ,Interior
346,공식 상품 삼익가구 상품명 포텐      단 수납 원목 침대 양모 라텍스  존     최대혜택가     만원 ,Interior
347,동서가구 상품명 동서가구 사커 슈퍼싱글    독립 매트리스         ,Interior
348,홈쇼핑 상품 롤앤롤 상품명 롤앤롤 행거   ,Interior
349,서광퍼니처 상품명  지마켓단독최저가  이너프   존 토퍼 매트리스        멀티싱글,Interior
350,상품명 웰빙건강침대 느루 소파 황토볼 흙소파   ,Interior
351,라꾸라꾸 상품명 라꾸라꾸 온열 접이식침대  탄 싱글  인용         ,Interior
352,라꾸라꾸 상품명 온열 라꾸라꾸접이식침대  탄 열선내장형  인용 더블,Interior
353,필우드 상품명 필우드가구 로제 원목 슈퍼싱글 침대 프레임   ,Interior
354,상품명 인베스코 숨쉬는 침대깔판     퀸      다리,Interior
