,titles,category
0,            사가 폭스 트리밍 양모 자켓           ,Fasion
1,나이스클랍            벨티드 하프구스다운           ,Fasion
2,레코브 넥카라 맨투맨 티셔츠             ,Fasion
3,웜테크 여성  부  넥             ,Fasion
4,      지컷      후디 볼륨 코트           ,Fasion
5,쉬즈미스 투턱 포멀 팬츠            ,Fasion
6,  혜택가 오모떼 수피마 매직서포트 란쥬쉐이퍼  종           ,Fasion
7,탑텐 더 웜 코듀로이 스커트           ,Fasion
8,        더엣지      울혼방 더블 하프 코트,Fasion
9,탑텐밸런스 여성         하이넥 집업           ,Fasion
10,더엣지       소프트기모 와이드 팬츠  종,Fasion
11,곰블리 리얼 소가죽 푹신한 양털 키높이 퍼 털슬리퍼  ,Fasion
12,겨울 원피스 맨투맨 베리 부드러운 롱 기모 원피스,Fasion
13,게스 여성 기모  톤 슬림 붓컷         ,Fasion
14,          부클 싱글 롱 코트           ,Fasion
15,클로그내피 탈부착 털슬리퍼 퍼 실내화 겨울 신발 방한 안감,Fasion
16,비너스 헤리티지 더 뮤즈 팬티         ,Fasion
17,로라 모직스커트  라인 겨울롱치마,Fasion
18,나인  시그니처      데일리 케이블 패턴 니트               ,Fasion
19,촉감좋은 브이넥 단추 니트조끼 레이어드,Fasion
20,순면 여성트렁크팬티 네모 엄마할머니팬티 위생 여자사각팬티 요실금질염 빅사이즈편한펜티,Fasion
21,케멜 여성 브이넥 울 골지 레이어드 이너 니트가디건,Fasion
22,마리끌레르 마리 로고 케이블 스탠카라 풀오버           ,Fasion
23,헤지스레이디스 울 캐시미어 혼방 더블 롱코트            ,Fasion
24,부루앤쥬디      후드버튼가디건          ,Fasion
25,    무료배송  슬라브 기본 여성 티셔츠 여자 봄여름가을 면 베이직 무지 이너 긴팔티,Fasion
26,비비안 웨스트우드 여성 베아 울 실크 가디건         ,Fasion
27,지오다노          경량 카라 플리스 어니언 퀼팅 자켓       ,Fasion
28,캘빈클라인 언더웨어 여성 팬티 여자 속옷,Fasion
29,쉬즈미스 주름 플레어 스커트            ,Fasion
30,탑텐 여성 슈퍼 에어 롱다운 점퍼                          ,Fasion
31,지컷 구스다운 백 니트 패딩 점퍼           ,Fasion
32,지오다노 지오다노 여 스트레이트 슬렉스       ,Fasion
33,씨씨콜렉트   콜렉트 하이넥 핸드메이드 하프코트                        ,Fasion
34,어그 펀케트 플랫폼        ,Fasion
35,텐바이미 휘뚜루마뚜루 포인트 컬러 실버백 패딩 보부상 여행가방,Fasion
36,제너럴아이디어       로고 스트라이프 하프 니트                 ,Fasion
37,쉬즈미스 히든버튼 핸드메이드 롱베스트            ,Fasion
38,시슬리 백 플랩 자수벨트 롱 코트          ,Fasion
39,게스 게스진 여성 페더라이트 글램 숏 구스다운 점퍼         ,Fasion
40,헌터 우먼스 코만도 첼시 레인부츠 숏 캐스트                ,Fasion
41,위생복 식품회사       계절별 모음 여름위생복 겨울위생복 빅사이즈 위생모자 해썹,Fasion
42,바버 여성 인터네셔널 폴라퀼트 자켓            ,Fasion
43,지오다노          여 에코 숏 푸파       ,Fasion
44,  컬러 목폴라 부드러운 캐시미어니트 여성 폴라니트 반폴라 반목 니트 티,Fasion
45,쉬즈미스 울 블렌드 싱글 트렌치코트            ,Fasion
46,쉬즈미스 퍼라이닝 패딩 점퍼            ,Fasion
47,                       캘빈클라인 언더웨어 여성 인비저블    푸쉬업 플런지 브라            ,Fasion
48,탑텐        여성 에코 쉘파 하이넥 가디건                 ,Fasion
49,     오아로 푸퍼 패딩 점퍼,Fasion
50,헤지스레이디스 헤지스 레이디스 스트랩 반팔   원피스            ,Fasion
51,지오다노 여 브러시드 후드 풀오버       ,Fasion
52,르포엠 코튼    세일러 브이넥 케이블 니트  종세트,Fasion
53, 아이메르 당일 울캐시 터틀니트조끼 겨울 레이어드 파인울 캐시미어 목폴라 니트베스트,Fasion
54,크크섬 라텍스 흉곽 코르셋 다이어트 허리 흉통줄이기,Fasion
55,의사가운 실습 실험가운 약사 실험복 대학생 이름자수   수   수   수,Fasion
56,홈쇼핑     블루핏     코듀로이 팬츠  종,Fasion
57,              토글 후드 롱 다운점퍼           ,Fasion
58,                       캘빈클라인 언더웨어 여성 모던코튼 트라이앵글 브라          ,Fasion
59,더엣지      까나쥬 퀼팅 자켓,Fasion
60,폴햄 폴햄 여성 오로라 숏 푸퍼           ,Fasion
61,베네통 카멜리아 라일락 체크 코트          ,Fasion
62,여성 기모청바지 허리밴딩 하이웨스트 여자 부츠컷 와이드 일자 스판 블랙진 빅사이즈,Fasion
63,브라썸 브라팬티세트     컵 왕뽕 여성속옷,Fasion
64,폴햄 여성 코숏 플리스 와펜 기모 맨투맨티셔츠           ,Fasion
65,지오다노 여     케이블 풀집 가디건       ,Fasion
66,리스트           부클 칼라 하프 덕다운 점퍼            ,Fasion
67,오조크      오조크      레터링 푸퍼 다운,Fasion
68,셀린느 트리오페 스몰 버킷백 호환 이너백,Fasion
69,캘빈클라인 모티브 푸쉬업 브라팬티세트        ,Fasion
70,제너럴아이디어        데이데이 맨투맨           ,Fasion
71,클램                            ,Fasion
72, 커플세트  르무통 발 편한 메리노울 운동화   족 이상 교차선택가능 ,Fasion
73,인디코드      여성 올타임 경량패딩 점퍼,Fasion
74,베어파우 베어파우                양털 뮬       ,Fasion
75, 여주아울렛 당일발송 백화점     구찌 마이크로시마 미니 크로스백       ,Fasion
76,온앤온 자수 포인트 컬러 셔츠                ,Fasion
77,비너스 여성팬티 기획전 순면 모달 면     냄새 가려움 민감피부 아토피 부인용 학생용,Fasion
78,에고이스트 사가퍼벨티드시티구스롱다운         ,Fasion
79,폴햄 하프집업 래글런 맨투맨   ,Fasion
80, 이너백무료 롱샴 르 플리아쥬 미니백 호환 리폼 가방끈 파우치 스트랩 소가죽 크로스백,Fasion
81,후아유 스티브  넥 크롭 케이블 풀오버                  ,Fasion
82,커플잠옷 세트 여성 홈웨어 원피스 겨울 수면잠옷 빅사이즈 파자마,Fasion
83, 컬러 멀티 셔닐사      보들이 곰자수 반목넥 풀오버 니트,Fasion
84,나이키 리버서블 인조 퍼 봄버 재킷       ,Fasion
85, 당일발송  반팔 긴팔 애견미용가운 원피스 지퍼 바람막이 애견미용사복           ,Fasion
86,일회용 비닐가운   가운   가운 병원방역복,Fasion
87,이상봉에디션      퀼팅 패딩 후드 롱점퍼,Fasion
88,리스트 프리미엄 코듀로이 백 슬릿 스커트            ,Fasion
89,크로커다일레이디 별 프린팅 하프넥 루즈 티셔츠          ,Fasion
90,쉬즈미스 베이직 폴리 셔츠               ,Fasion
91, 엣프터  라라트렁크  여자 트렁크팬티 여성 사각팬티 홈웨어 반바지 ,Fasion
92,에고이스트 포켓변형      부츠컷 팬츠         ,Fasion
93,쉬즈미스 덕다운 야상 점퍼            ,Fasion
94,지오다노 여성     초경량 어니언 퀼팅 자켓전지현착용                       ,Fasion
95,리스트 미니멀 싱글 원버튼 재킷            ,Fasion
96,리빙투유     기모레깅스,Fasion
97,르오트 콜라보 데님 벨벳 퀼팅점퍼,Fasion
98,프로젝트엠 여성 롱 캐시미어블렌드 싱글코트           ,Fasion
99,어그            앤슬리                  ,Fasion
100,나인                                             ,Fasion
101, 매그파이  그랩       펌프스,Fasion
102,젝시믹스  업    플러스 레깅스            ,Fasion
103,한번쯤이혼할결심  회 이혜정 핑크브이넥앙고라 러블리캐주얼,Fasion
104, 당일발송      코스 퀼티드 미니백 초미니 마이크로 식빵백 구름백 메신저 오버사이즈,Fasion
105,  만원인하 진도 엘페 휘메일 풀스킨 롱 후드 밍크 코트   실버블루 카키브라운     ,Fasion
106,시에로 파격기획가 여성 퀼팅 셋업  종 자켓 스커트,Fasion
107,우아한 요루면 거즈면 여성샤워가운 골프가운 라운딩 로브 파자마 헤일리,Fasion
108,폴햄 여성 코듀로이 와이드 팬츠 바지           ,Fasion
109,비비안 소프트볼륨 노와이어 여성속옷세트   종,Fasion
110,     패딩 점퍼        ,Fasion
111,    여성 목 폴라티 기모 이너 슬림,Fasion
112,빈폴레이디스       케이블 후드 집업 카디건 베이지           ,Fasion
113,       클라비스 슬림구스 샤이니 후드 숏다운           ,Fasion
114,플라스틱아일랜드 양털카라 숏 패딩 점퍼         ,Fasion
115,써스데이아일랜드                 체크 오버핏 반코트            ,Fasion
116,    티비제이 여성 경량다운 브이넥                      ,Fasion
117,쉬즈미스 캐시미어 베이직 벨티드 코트            ,Fasion
118,화산귀환 도복 잠옷  상 하의     ,Fasion
119,지오다노 초경량 셔츠카라 크랍 자켓       ,Fasion
120,잇미샤 캐시미어 싱글버튼 핸드메이드 코트           ,Fasion
121,스튜디오톰보이 리오더 히든 맥코트           ,Fasion
122,제니룸 잠옷   종 상하세트 여성 파자마 파티 빅사이즈 원피스 투피스,Fasion
123,     핸드메이드 코트        ,Fasion
124,지오다노 여 브러쉬드 터틀넥 긴팔티       ,Fasion
125,지오다노 여성     브러시드 스트레이트 데님       ,Fasion
126,원더브라 노와이어 컴포트리프트 스킨   종,Fasion
127,    피에이티 피에이티수입소재 머스크렛 토끼털 안감 구스다운            ,Fasion
128,     롱 코트        ,Fasion
129,린 모리스 울 자켓           ,Fasion
130,크로커다일레이디 미디기장 점퍼          ,Fasion
131,플라스틱아일랜드 야상형 퍼카라 다운 점퍼         ,Fasion
132,나인              시그니처 울 슬림 반넥 니트       ,Fasion
133,게스 진 바지 청바지 데님 스키니진 팬츠 하이웨스트 여 기모 슬림 붓컷,Fasion
134,빈폴레이디스 울 캐시미어 루즈핏 미디엄 피코트           ,Fasion
135,로보      스페인 라도마 리버시블 더블 카라 무스탕,Fasion
136,크로커다일레이디 크로커다일레이디 후드 트임 다운 패딩          ,Fasion
137,더조이 매일브라 압박 처진가슴 작아보이는 뽕없는 큰컵 등살커버 얇은 브라탑,Fasion
138, 바쿠백        장바구니 구데타마 헬로키티 한정판,Fasion
139,어그 코케트         ,Fasion
140,저스트원 겨울여행 기모 일자 부츠컷 블랙팬츠 숏 롱      ,Fasion
141,    보브 퍼 구스다운 롱 패딩 점퍼           ,Fasion
142,조르쥬레쉬 조르쥬 레쉬      울 블렌디드 케이블 니트  종,Fasion
143,심리스 브라렛 편한 노와이어 수면 브라탑 여자 빅사이즈 여성 속옷 스포츠 브래지어 세트,Fasion
144,나인 헨리 셋업 니트 스커트        ,Fasion
145,     모직 맥코트        ,Fasion
146,가       원 리버티 구스다운 여성         ,Fasion
147,시슬리 후드 탈착 구스 패딩 점퍼             ,Fasion
148,폴로랄프로렌 피마면 여성 가디건                              ,Fasion
149,리바이스 로우 루즈 진           ,Fasion
150,컴포트랩 큰가슴 브라렛,Fasion
151,선진모피 기획      사가폭스 래빗 덕다운코트,Fasion
152,      꾸즈 후드 볼륨패딩,Fasion
153,나이키 우먼스 줌 보메로   포톤 더스트 앤 메탈릭 실버           ,Fasion
154,리스트 니트 칼라 덕다운 점퍼            ,Fasion
155,잇미샤 폭스퍼 후드 미들 덕다운           ,Fasion
156,전 자체제작 울터치 한겨울까지 도톰한 니트 가을 겨울 롱 스커트,Fasion
157,프리미엄 털실내화 겨울 실내화 실내슬리퍼 거실 사무실 방한,Fasion
158,갤러리샵 여자니트후드 가을 겨울 봄 레이어드 심플 티,Fasion
159,롱샴 르 플리아쥬 그린 백팩         ,Fasion
160,     숲 핸드메이드 등판 구스 벨티드 코트        ,Fasion
161,스파오 웜테크 에브리웨어 여성 긴팔 크루넥             ,Fasion
162,탑텐 여성 밸런스 와이어리스 브라           ,Fasion
163,    트라이 여성 순면 런닝  매 세트 여자 민소매 반팔 메리야스 캐미솔 캡나시 브라탑,Fasion
164,    커프스 포인트 트위드 자켓           ,Fasion
165,블루페페 세이브존   폭스후드박스롱코트           ,Fasion
166,노스페이스 여성 로프티 다운 자켓 버전               ,Fasion
167,살안타템 여름 휴양지 비치가디건 아이보리 여성 시스루 볼레로 크롭 니트 가디건  컬러,Fasion
168,프로젝트엠          여성 기모 핀턱 와이드 슬랙스           ,Fasion
169,모덴      알파카블렌디드 프린지 풀오버,Fasion
170,오늘출발 기장 몽글 융기모 벨벳 코듀로이 스트링 밴딩 롱 와이드 팬츠,Fasion
171,     쥬크 폭스 구스 점퍼           ,Fasion
172,헤지스레이디스 헤지스레이디스 코듀로이 카라 퀼팅 긴팔 캐주얼 점퍼           ,Fasion
173,호주어그부츠     클래식 미니부츠 스웨이드 코케트 양털 겨울 실내화 털슬리퍼,Fasion
174,     숲 핸드메이드 루즈핏 모직 롱코트        ,Fasion
175, 뉴발란스  국내배송      씨솔트 문빔 스니커즈 택일,Fasion
176,리스트 리스트 루즈핏핸드메이드코트  칼라            ,Fasion
177,     캐시미어 블렌드 와이드 카라 벨티드 코트           ,Fasion
178,미니멈 미니멈블라우스 레이어드 플레어원피스           ,Fasion
179,비너스 자스민 노와이어 몰드브라       ,Fasion
180,엘르 앨르 여성 모달팬티  매 소프트 여성 데일리 코튼 스포츠 팬티 코스트코,Fasion
181,지오다노 여성     하이넥 경량 자켓 숏패딩       ,Fasion
182,빅토리아슈즈 오다 메리제인 플랫슈즈,Fasion
183,            헤리티지 퀼팅 자켓 여성,Fasion
184,나인 베인 웜터치 플리츠 스커트                ,Fasion
185,쉬즈미스 퍼 카라 레더 재킷                       ,Fasion
186,에고이스트      숄더슬릿 메탈릭 스웨트 티셔츠         ,Fasion
187,후아유 스티브  넥 케이블 풀오버           ,Fasion
188,마쟈 컬러 체크패턴 비죠장식 볼륨소매 하프코트            ,Fasion
189,올리비아로렌 비비올리비아 퀄팅 구스 다운 사파리 점퍼            ,Fasion
190,기모 옵션추가 물빠짐 없는 생지 데님 부츠컷 팬츠 스티치 나팔 청바지,Fasion
191,온앤온 정채연 탈부착 카라 핸드메이드 숏 점퍼          ,Fasion
192,잇미샤 하이웨이스트 와이드 데님 팬츠           ,Fasion
193,오트리 메달리스트 고트스킨 스니커즈          ,Fasion
194,부클카라 숏 다운점퍼           ,Fasion
195,라코스테 여성 코듀로이카라 퀼팅점퍼               ,Fasion
196,에고이스트 니트카라파카링숏패딩점퍼         ,Fasion
197,울   빈티지 잔체크 가을 겨울 여성 자켓 빅사이즈                  ,Fasion
198,제너럴아이디어        빈티지 하트 엔젤 풀오버                ,Fasion
199,르오트 마리나 아트웍 기모 맨투맨 티셔츠,Fasion
