,titles,category
0,    키트 가죽 공예 가방 만들기,Interior
1,꼬꼬미 양면 가죽 식탁보 유리대용 방수테이블보  인  인용 투명 매트 다이소 테이블커버 사각,Interior
2,  지인 한화     등 호환가능한 클락 샷시손잡이 오토락핸들 셀프교체 인테리어 샷시핸들,Interior
3,차렵 이불세트 사계절 겨울 호텔식 침구세트 호텔 기숙사 침대 이불 신혼 혼수 침구류 퀸,Interior
4, 슬림 원목 회전책장  유아 책장  단  단 책꽂이 키즈 자작 편백나무 아이방 거실 책장,Interior
5,가구 경첩 문주 삼성      씽크대 싱크대 경첩 장롱 장농 힌지 흰지 욕실장 댐퍼 문,Interior
6,플라베니아    청색 플로베니아 바닥보양재 플라스틱골판지 단프라   장씩 묶음판매,Interior
7,와이온      인용 리클라이너 소파,Interior
8, 단 캐비넷 옷장 목재 락카장 사무용 수납장 개인 사물함 사우나 목욕탕 잠금 전자키 제작,Interior
9,롤앤롤 행거   ,Interior
10,한일카페트 거실러그 카페트 대형 단모 워셔블 먼지없는 주문제작가능,Interior
11,코튼렛 순면   수 베개커버        ,Interior
12,펠트복주머니 만들기,Interior
13,드레스룸 시스템옷장 시스템장 맞춤제작가구 아파트행거 수납장  단서랍장,Interior
14,규아르 고정밴드 침대패드 이불패드 라지킹 이스턴킹 슈퍼킹 매트리스,Interior
15,레일조명 레일등     등기구 원통,Interior
16,홈소잉 스프링도트 단추   세트 기구포함 똑딱이단추,Interior
17,탑플레이어 게이밍 의자                ,Interior
18,업소용 아파트 베란다 현관 바닥 코일 눈 매트 신발장 고무 발 카페트 롤 레드카펫,Interior
19,보석 십자수 해바라기 대형 비즈 큐빅 구슬 캔버스형,Interior
20,씨가드 릴랙스 워셔블 메모리폼 베개,Interior
21,스텐레스 방문손잡이 문고리 도어 문손잡이 현관문 목문 화장실 욕실 스텐 방문도어락 교체,Interior
22,아이템톡 맘마존 분유존 젖병소독기 정리정돈 다용도 선반 국내생산,Interior
23,하이에이프런 방수앞치마 업소용 식당 앞치마 단체 유니폼 앞치마 주문제작 로고 편한  형,Interior
24,호텔침구세트 차렵이불세트 호텔식 신혼 혼수 겨울 기숙사    퀸   라지킹   ,Interior
