,titles,category
0,빌리프 뉴메로    에센스     ,Makeup
1,에이지    팩트 오로라    에센스 골드 에디션 커버 최신상 리필,Makeup
2,블루크로스 큐티클리무버 공병 세트 젤 네일 연화제    ,Makeup
3,아베다 보태니컬 리페어 스트렝쓰닝 샴푸       ,Makeup
4,해피바스 등드름 향좋은 대용량 약산성 바디워시 자몽향      기프트,Makeup
5,뷰티레시피 리틀머메이드 디스 이즈 프린세스 클렌징 워터      ,Makeup
6,닥터지 그린 마일드 업 선 에센스             ,Makeup
7,클레어스 일루미네이팅 서플 블레미쉬 크림             ,Makeup
8,글루타셀 업 스프레이      ,Makeup
9,미쟝센 스킨 케어 퍼퓸 샴푸 페어 앤 프리지아      ,Makeup
10,센텔리안   엑스퍼트 마데카 멜라 캡처 앰플 맥스     ,Makeup
11,부케가르니 히말라야 허브 나드 샴푸       ,Makeup
12,바른생각 젤 스탠다드      ,Makeup
13,보떼 뉴트럴브라운         밀본 염색약       새치 뿌리 흰머리염색 셀프   산화제 미포함,Makeup
14,더젤 젤네일   개 스톤 랜덤  알 시럽젤네일매니큐어폴리쉬 누드베일    호,Makeup
15,뮤겐스 게츠 컨디셔닝 로션     ,Makeup
16,비레디 트루 톤 로션             ,Makeup
17,       코튼 블러셔   ,Makeup
18,이니스프리 그린티 히알루론산  종 세트,Makeup
19,맥 스튜디오 퍼펙트 파운데이션           ,Makeup
20,입큰 퍼스널 무드 워터 핏 쉬어 틴트     ,Makeup
21,이즈앤트리 어니언 뉴페어 겔 크림     ,Makeup
22,크리드 실버 마운틴 워터 맨 오 드 퍼퓸,Makeup
23, 체험딜  디스커버리  종 키트  여성용 남성용 ,Makeup
24,라스고 속눈썹연장패치 아이패치 하이드로겔 재료,Makeup
