,titles,category
0, 카페노리  냉동생지   붕크로와상 시트 붕어빵 페스츄리,Food
1,못난이백명란       팩 총       ,Food
2,    년 경산 햇 대추 국산 건대추 상초 특초 별초    ,Food
3,종근당건강 락토핏 생유산균 골드        포,Food
4,우리가스토리 디저트 종합캔디     대용량 사탕 업소용사탕 캔디,Food
5,일리 미디엄 로스트 원두커피     ,Food
6,삼양 임꺽정떡갈비     ,Food
7,머슬팜 컴뱃      웨이   서빙          프로틴 초콜릿밀크,Food
8,흥국 자몽농축액      자몽에이드 시럽 베이스,Food
9,용   한정판 용에디션   도      ,Food
10,몬델리즈 호올스    멘토립터스 멘톨향 캔디    ,Food
11,청주 은영이떡볶이 떡볶이  인분 매운맛 캠핑 밀키트,Food
12,닥터머콜라 퀘르세틴 앤 프테로스틸벤 어드밴스드    캡슐,Food
13,활복오징어 원양산 냉동손질오징어 선동 탈피활복     도매,Food
14,튀김용 탈피 대왕오징어몸채    총알배송 튀김용 짬뽕용,Food
15,바다원 진미채    ,Food
16,범일콩된장      맛있는 고깃집 된장찌개용 필수 비결 대용량 맛집 업소용 식자재,Food
17,중앙맛김 보령 대천김 재래 파래 돌김   봉 도시락김 곱창캔김,Food
18,정직한농부 흑보리현미칩   봉,Food
19,인아웃 사과좋아 말랑 스파클링 제로 탄산음료         칼로리 무설탕 과일탄산 사과 ,Food
20,페이스트리 사각시트       개 외  종 타르트생지 페스츄리 파이 붕어빵시트 냉동생지 빵,Food
21,국산 햇 콩나물콩     년산 유태,Food
22, 대저농협인증  부산 산지직송 대저 짭짤이 토마토      ,Food
23,생새우살     벌크 냉동 깐 생 새우살,Food
24,최상급 아보카도 초신선 직수입   과,Food
