,titles,category
0,리스트 벌룬캐시미어후드코트            ,Fasion
1,      원         코듀로이 팬츠  종,Fasion
2,    퓨어캐시미어    반하이넥 니트,Fasion
3,      후드 덕다운 패딩점퍼          ,Fasion
4,   종  별바라기 미니니트백 니트 토드백 손가방 조동모임 선물,Fasion
5, 국내백화점   가능  바오바오 루센트 박시 미니 무광 신상 토트백       ,Fasion
6, 마스마룰즈  손목 생리대 핸드폰 화장품 미니 이너백 스트랩 파우치,Fasion
7,지오다노 여 기본 옥스포드 셔츠       ,Fasion
8,리스트      핀턱 포인트 데님 팬츠,Fasion
9,      에블린 브라       컬러 울트라푸쉬     심리스 해운대점           ,Fasion
10,가이거 프리알피나 첼시 부츠,Fasion
11,지컷       벨티드 와이드 후드 코트 다크           ,Fasion
12,베어파우 위니 리얼 양모 부띠,Fasion
13,올리브그린 울트라텐션 밍크벨벳기모본딩팬츠 종,Fasion
14,와이어리스 심리스 브라렛 무봉제 편한 수면 브라탑 큰가슴 빅사이즈 스포츠브라 노와이어,Fasion
15,써스데이아일랜드 덤블 카라 구스다운 점퍼            ,Fasion
16,클라이드앤 여성 크롭 소매 탈부착 다운점퍼          ,Fasion
17,까사렐 울 모달 블렌디드 풀오버  종,Fasion
18,지오다노 여 초경량 코듀로이 카라 자켓       ,Fasion
19,쉬즈미스 캐시미어 더블 버튼 롱 코트            ,Fasion
20,산리오잠옷 겨울 포차코 폼폼푸린 쿠로미 수면잠옷 짱구 시나모롤,Fasion
21,듀엘 에코퍼 숏 무스탕 자켓           ,Fasion
22,이태리 램스킨 포켓     밍크 후드자켓,Fasion
23,에르노           여성 패딩                   ,Fasion
24,게스 여성                   후드 롱 구스         ,Fasion
25,온앤온 라운드넥 에코무스탕점퍼 신구로점          ,Fasion
26,스튜디오럭스 런칭     원 스튜디오럭스 셋업  종 니트 종 기모팬츠 종,Fasion
27,나인              울 헤어리 피셔맨 니트        ,Fasion
28,씨씨콜렉트 아웃포켓 중기장 하프코트           ,Fasion
29,지오다노 여 브러시드 스트레이트 슬렉스  컬러       ,Fasion
30,반달크로스백 여행용크로스백 나일론 보부상 크로와상백 범백 해외여행 가벼운,Fasion
31,폴로랄프로렌 여성 클래식핏 옥스포드 버튼다운 긴팔셔츠,Fasion
32,써스데이아일랜드 브레이드 라운드 자켓            ,Fasion
33,스트라스베리             모자이크 나노 가방  케이트 미들턴 가방  바닐라,Fasion
34,비비안 하이스토어 심리스브라 스포츠 노와이어브라 패드일체형,Fasion
35,루즈핏 골지 카라 니트 집업 가디건 봄 가을 겨울 임산부,Fasion
36,    보아퍼 데일리 패딩         ,Fasion
37,에잇세컨즈           벨티드 투턱 와이드 슬랙스   애쉬                ,Fasion
38,르무통 버디 메리노울 운동화,Fasion
39,에고이스트 프리미엄사가퍼인퀼팅벨티드롱구스다운         ,Fasion
40, 국내매장판  나이키     런 테크 서밋화이트 메탈릭실버,Fasion
41,으네샵     기모 와이드팬츠 코듀로이 바지 아이보리  블랙 ,Fasion
42,             오리지날 플레이 톨 레인부츠                ,Fasion
43,모덴      올메텍스 샤인 구스다운,Fasion
44,스파오 패딩 푸퍼 여성 숏패딩 글로시 자켓 점퍼 커플 겨울,Fasion
45,                                                  ,Fasion
46,가바 컬렉션 더블 기모 여성데님  종,Fasion
47,비비안  세트 무  비비안 스킨핏     커버플러스,Fasion
48,보디가드 티나지 않는여성 노라인 헴팬티  종,Fasion
49,폴리스      여성 웜 시어링 패딩 자켓       ,Fasion
50,울     반코트 여성 핸드메이드 하프 코트 숏 여자 겨울 가을,Fasion
51,가        셀렙샵 에디션      체크 헝가리구스 푸퍼다운,Fasion
52,마담엘레강스 브이로그 구스다운 점퍼         ,Fasion
53,핏플랍 루루 글리터 여성 슬라이드            ,Fasion
54,루즈핏 여성 캐시미어 목폴라 터틀넥 니트 그린  천장 돌파,Fasion
55,     트라이  여성 런닝  매 세트 모달 브라탑 캡나시 브라런닝 순면 민소매 캐미솔,Fasion
56,스후 플라워 단추 포켓 크롭 가디건  ,Fasion
57,오조이 타임 이틀만 자체제작 울    플리츠 모직 롱 밴딩 스커트   만장 돌파,Fasion
58,온앤온 카라넥 구스다운 숏패딩점퍼          ,Fasion
59,지컷 퍼 후드 슬림 롱 구스다운 코트           ,Fasion
60,베어파우      양털 슬리퍼            ,Fasion
61,보브     구스다운 후드 니트           ,Fasion
62,센존블루라벨      라쿤 울 블랜디드 니트 코트,Fasion
63,      엔니튜드 캐시미어 블렌드 후드 니트  종,Fasion
64,    여자 내복 세트 순면,Fasion
65,여성 심리스팬티 모달팬티   수 무봉제 하이웨스트 햄팬티   ,Fasion
66,리스트 캐시미어 오픈 핸드메이드 코트            ,Fasion
67,리스트 미니멀 부츠컷 팬츠            ,Fasion
68,     어텀 스퀘어넥 니트  종,Fasion
69,피치기모잠옷 원피스잠옷 홈웨어원피스 빅사이즈 임산부 수유 겨울 여성실내복,Fasion
70,     여 하프 하이넥 다운 점퍼           ,Fasion
71,제너럴아이디어            케이블 하프 니트                 ,Fasion
72,토리버치 가방 사첼 엘리너 스파졸라토                         ,Fasion
73,시나모롤 하트 방한슬리퍼,Fasion
74,크로커다일레이디 폭스 퍼 탈부착 벨트장식 구스다운 패딩 점퍼          ,Fasion
75,     숲 핸드메이드 모직 맥코트        ,Fasion
76,보내요 바스키아      슈프림 구스 다운 여성,Fasion
77,스튜디오럭스       스튜디오럭스 캐시미어 울 블렌드 모크넥 니트  종,Fasion
78,     숲 등판구스 핸드메이드 코트        ,Fasion
79,온앤온 하이넥 크롭 맨투맨티셔츠          ,Fasion
80, 르포엠 쁘띠 아가일 가디건 베스트 풀오버  종세트,Fasion
81,도씨 수면잠옷 극세사 커플 홈웨어 파자마 솔리드밍크 카라,Fasion
82,  지고트 베이직 골드버튼 트위드 자켓          ,Fasion
83,가        에디바우어      여성 기모 코듀로이 팬츠  종,Fasion
84, 비비안 홈쇼핑 프리미엄라인 여자속옷 노와이어브라세트 모음,Fasion
85,지오다노          크루넥 가디건       ,Fasion
86,비너스 심리스 브라 노라인 무봉제 노와이어 편한브라 스포츠 탑 퓨징 들뜸없는 런닝형,Fasion
87,     폭스퍼 덕다운 숏패딩           ,Fasion
88,조르쥬레쉬         시그니처 스트레치 기모 팬츠  종,Fasion
89,몽돌         오버핏 울 발마칸 벨티드 롱코트 오트밀               ,Fasion
90,스케쳐스          여성 고 워크 스태빌리티 부츠            ,Fasion
91,더아이잗 벨트 슬리브 울 코트          ,Fasion
92,  지고트 펄 장식 보트넥 원피스          ,Fasion
93,정상가        타미힐피거 여성 에코퍼후드 덕다운 패딩,Fasion
94,케네스레이디 더블버튼 핸드메이드 울 하프 자켓           ,Fasion
95,지컷       디태처블 퍼 구스다운 숏 패딩 자켓           ,Fasion
96,      호카 여성 클리프톤   와이드            ,Fasion
97,카라배색 에코레더 크롭 블루종           ,Fasion
98,컴포트랩 다시 없을 초특가 브라렛  장  장  색상 교차 구매가능    빅사이즈   노와이어,Fasion
99,비너스 비너스 말리지 않고 겉옷에 표시안나는 여성 롱 사각팬티         ,Fasion
100,            하비전용 크게나온 오프숄더 니트세트       ,Fasion
101,게스 케이블 스웨터 가디건         ,Fasion
102,빈폴레이디스 폴리 칼라 경량 다운 쇼트 재킷           ,Fasion
103,올리브데올리브 자수 포인트 가디건형 핸드메이드 코트          ,Fasion
104,올리브데올리브 리본배색니트가디건         ,Fasion
105, 수면잠옷  크리스마스 커플 스누피잠옷 파자마 극세사 선물 연말 우정 파티,Fasion
106,론론                                       ,Fasion
107,면접블라우스 정장블라우스 여성블라우스 셔링 라운드 여자 쉬폰,Fasion
108,            럭키브랜드      뷔스티에 레이어드 니트,Fasion
109,순면 생리 위생 팬티 월경 노라인 방수팬티 빅사이즈 여성 요실금 생리대 초경 선물 주니어,Fasion
110,스튜디오톰보이 폭스퍼 후디다운           ,Fasion
111,지오다노 여성 목넥 거위털 구스다운 숏 푸파 패딩 점퍼       ,Fasion
112,리스트 유니크 플리츠 미디 스커트            ,Fasion
113,센존블루라벨      캐시미어    뷔스티에,Fasion
114,싸이클린 질염팬티 노라이너 면팬티  종 택  오가닉 뱀부 여성속옷 삼각 사각 하이웨이스트,Fasion
115,비비안 보정 비비안       스킨핏 사각 롱 거들 팬티패키지,Fasion
116,여성 기모 트레이닝세트 빅사이즈 츄리닝 후드 아노락 운동복 긴팔 조거 여자 트레이닝복세트,Fasion
117,컴포트랩 재구매율 브라렛  장  장 교차 구매가능 브라탑 노와이어,Fasion
118,헤지스레이디스 탈착후드 긴팔캐주얼점퍼             ,Fasion
119,봄청바지 세미와이드데님 앞포켓청바지,Fasion
120,마리끌레르      보카시 버튼 포켓 니트 가디건           ,Fasion
121,잇미샤        니트 카라 구스다운 숏패딩           ,Fasion
122,코오롱스포츠 여성 윈터 부츠 다우니              ,Fasion
123,     담곰이 집이 제일 좋담곰 수면잠옷                ,Fasion
124,베어파우 에밀리 양털 모카신,Fasion
125,     어그 부츠                    ,Fasion
126,듀엘 폭스퍼 퀼팅 벨티드 구스다운 크림              ,Fasion
127,여성 기본 모달 라운드넥 긴팔 티셔츠,Fasion
128,지컷 리브드 카라 부클 자켓           ,Fasion
129,학생속옷 노와이어브라세트 모달 중학생 고등학생 청소년 속옷,Fasion
130,폴햄 폴햄여성 컴포트 스트레이트핏 데님           ,Fasion
131,스케쳐스 스케쳐스          여성 경량 쿠션 워킹화 고워크 아웃도어               ,Fasion
132,나이키 스포츠웨어 여성 하이웨이스트 와이드 레그 플리스 팬츠           ,Fasion
133,시크루즈      겨울시즌오프 기모 밍크 롱원피스 상하세트 점프슈트 가디건 스커트 팬츠 니트,Fasion
134,라이프롬 프롬팬티  부 심리스 여성 드로즈,Fasion
135,써스데이아일랜드                 퍼 후드 다운 점퍼            ,Fasion
136,여성 기모 골덴 바지 코듀로이 와이드 일자 팬츠,Fasion
137, 국내매장판  나이키 코르테즈 그린 블랙 흰검 레드 네이비 라일락 검흰 우먼스,Fasion
138,시스티나 부클 포켓 라운드넥 재킷            ,Fasion
139,                   언더웨어    여성 브라렛 팬티 세트              ,Fasion
140,쉬즈미스 세이브존   핸드메이드                     ,Fasion
141,융기모 코듀로이팬츠 골덴 와이드 조거팬츠 키작녀 겨울 핑크 크림색바지,Fasion
142,실리콘 누드브라 수영복 웨딩 브라 붙이는 뽕브라 드레스 속옷,Fasion
143,마인드브릿지 숏 다운 패딩 겨울 점퍼         ,Fasion
144,    허벅지 지방흡입 압박복 체형보정속옷 에덴메디칼,Fasion
145,엠프리스 발편한 여성구두 승무원 면접 호탤리어 구두 기본 둥근코 여자 유니화,Fasion
146,톰보이 후드배색롱다운                  ,Fasion
147,에잇세컨즈 피그먼트 코듀로이 부츠컷 팬츠           ,Fasion
148,베어파우        여성 양털부츠 푸시아  센치            ,Fasion
149,엄마 꽃무늬 김장조끼 할머니 누빔 조끼 뽀글이 꽃무늬 양털 조끼 엄마 촌캉스 옷,Fasion
150,리스트 부클퍼 하이넥 숏 덕다운 점퍼            ,Fasion
151,라코스테 여성 물결 퀼팅 점퍼               ,Fasion
152, 나이키           여성            ,Fasion
153,지컷       브이넥 싱글 트위드 자켓           ,Fasion
154, 비너스 외 강력 보정 속옷 올인원 치마 사각 삼각 거들 니퍼 노라인 거들 바디쉐이퍼,Fasion
155,폴햄        여성 캐시 하프넥 스웨터           ,Fasion
156,온앤온 알파카 바시티 점퍼          ,Fasion
157,게스진 여성 기모 슬림 부츠컷 데님팬츠        ,Fasion
158,지오다노 지오다노 여 언브러시드 테리 조거 팬츠       ,Fasion
159,타미힐피거 여성 덕다운 롱 패딩 후드 코트,Fasion
160,    더엣지      세미플레어 기모 데님  종,Fasion
161,써스데이아일랜드 보더 패턴 롱 원피스                   ,Fasion
162,                   여성 벨트 롱 푸퍼        ,Fasion
163,저스트원 쫀쫀탄력 기모 와이드밴딩 일자팬츠        ,Fasion
164,클라이드앤 클라이드 여성 숏 다운 후드점퍼          ,Fasion
165,탈착카라 울 숏코트     스튜디오 톰보이           ,Fasion
166,씨씨콜렉트   콜렉트     캐시미어더블롱코트           ,Fasion
167,지컷       지컷      구스다운 하이넥 패딩 점퍼           ,Fasion
168,게스 여성 원워시 슬림 붓컷         ,Fasion
169,지오다노 지오다노 여 브러시드 미니테리 홈웨어 조거팬츠       ,Fasion
170,헌터 여성 패딩 부츠 방한화 인 아웃 부티 크림               ,Fasion
171,지퍼형 간호복 세트 수술복 병원유니폼 간호사복,Fasion
172,여성 셔츠 블라우스 면접 정장 와이셔츠 기본 남방 빅사이즈         ,Fasion
173,굿유 브이랩 남녀공용 상하세트 수술복 스크럽복 간호복 병원유니폼,Fasion
174,        여성 클래식핏 폴로 티셔츠              ,Fasion
175,타미힐피거 여성 미니 플래그 로고 라운드넥 베이직 버튼업 가디건,Fasion
176,미쏘 니트 스웨터 티셔츠 반집업 풀오버              ,Fasion
177,     숲 헤링본 싱글 투버튼 자켓        ,Fasion
178,데일리앤 스텔라 플레어 롱 샤스커트,Fasion
179,제너럴아이디어            울 스트라이프 풀오버           ,Fasion
180,온앤온 퀼팅 덕 다운 점퍼          ,Fasion
181,더블 벨티드 코트               ,Fasion
182,리스트 하이넥 덕다운            ,Fasion
183,부드러운 니트 미디 원피스        ,Fasion
184,벨벳트레이닝 벨로아트레이닝 기모트레이닝세트,Fasion
185,국산 여성 내복 상 하 융기모 텐셀 편한 내의 엄마 할머니 겨울내복,Fasion
186, 당일배송  겨울 도톰한 벨로아 밴딩 롱 골지 스판 밍크 융 기모 와이드 조거 팬츠,Fasion
187,세루티 핸드메이드 하프 코트                     ,Fasion
188,    여성 순면 맥시 삼각 팬티  매        ,Fasion
189,    라삐아프     모크넥  종       ,Fasion
190,    페이크 버튼 스트링 트임 니트           ,Fasion
191,숏클립할인 톰브 겨울 방한 포근 안감 밍크 기모 밴딩  라인 골지 롱 스커트,Fasion
192,온앤온 사가 폭스퍼 구스 패딩 점퍼          ,Fasion
193,온앤온 빅카라케시미어 벨티드코트 신구로점          ,Fasion
194,제너럴아이디어      클래식 셔츠                ,Fasion
195,시슬리 버디 아웃 포켓 숏 코트          ,Fasion
196,캘빈클라인    언더웨어 여성 푸쉬업 패드내장 브라렛 스포츠 브라탑            ,Fasion
197,가       원 셀렙샵 에디션      기모 슬림 크레이프 팬츠,Fasion
198,오프숄더 심리스 끈없는 브라 웨딩 누드 튜브탑 흘러내림방지,Fasion
199,일회용 실내 슬리퍼 부직포 호텔 실내화  ,Fasion
