,titles,category
0,황금똥빵   우리밀    통밀빵 직접 제분 숙성 발효한 수제빵 무첨가제빵 주문제작빵,Food
1,  팩 베지밀 국산 검은콩 함유 두유 고칼슘      ,Food
2,대봉식품 둘이함께먹는 매일 하루 견과         개입,Food
3,한끼통살 닭가슴살   종 택  골라담기 냉동 스팀 양념닭가슴살,Food
4,힘가네 콘드로이친 우슬즙 우슬 진액  박스           개입 ,Food
5,트와이닝 허브티 카모마일      티백 퓨어,Food
6,하루를 위한 나만의 효소 습관  효소            포         포 ,Food
7,웰파인 피토틱스 시트루 아르기닌         포,Food
8,파이토웨이 써큐시안 블러드케어           캡슐,Food
9,녹동양조장 고흥유자주 선물세트  도          개입,Food
10,        일본 야마사 다시마간장 콘부쯔유 다시마쯔유     ,Food
11,해남 꿀 고구마 베니하루카 세척             ,Food
12,네슬레 네스프레소 이스피라치오네 피렌체 아르페지오          개입,Food
13,비피러스블로썸 비피러스 블로썸 어덜트        포,Food
14,락피도 프로바이오틱스 키즈 플러스        포,Food
15,종근당건강 프리미엄                 정,Food
16,정식품 베지밀 담백한 베지밀  병       ,Food
17,    광천김 설선물세트 추석 설날 명절 김 선물,Food
18,오리온 무뚝뚝 감자칩     ,Food
19,캘리포니아골드뉴트리션          프로바이오틱스     억       캡슐,Food
20,설날선물 과자선물세트 종합 간식박스 과자꾸러미 알잘딱깔센 심플,Food
21,호주산 소고기 청정 소 차돌양지 갈비살 차돌박이 우삼겹 삼겹양지 척아이롤 부채살 방목 목초우,Food
22,관주원 흑도라지청      대용량 도라지청,Food
23,    건조한 눈엔 루테인 오메가   박스 총  개월분 ,Food
24,좋은날좋은떡 파주본점   앙금인절미 원조떡집 다수 매스컴에서 소개된 정담길인절미 인생맛집 찹쌀 특제콩가루  박스  개      내외  영의정인절미 ,Food
