,titles,category
0,메밀베개 바이오칩 편백나무 옆으로자는 딱딱한 경추 목베개 일자목 정국 배게 목침베개,Interior
1,라텍스방석 수험생방석 사무실 의자방석 키높이 두꺼운 쿠션,Interior
2,해바라기 그림 황금     액자 금전운 인테리어 개업 집들이선물 돈들어오는그림,Interior
3, 딥블러쉬  대용량디퓨저 실내방향제 인테리어 호텔디퓨저 도손 교보문고 디퓨져      ,Interior
4,위드휴 매트리스 침대 방수패드,Interior
5,감성 캠핑 러그 담요 소파 블랭킷 에스닉 여름 차박 거실 이불 거즈 대형 블랑캣,Interior
6,중형 행운을 부르는 황금인테리어 골드프레임 위너컬렉션 액자 디자인,Interior
7,    셀프 원통 나팔           레일조명 레일등기구 인테리어조명,Interior
8,카페로고 자수 가죽 방수 작업용 식당 주방 네일샵 미용실 미술 공방 서진이네앞치마,Interior
9,패브릭 가림막커튼 중문 현관문 문 가리개 커튼 세탁실 주방 공간분리 가림천,Interior
10,순면 항균 홑겹 누빔 침대 매트리스 커버        토퍼 침대보 시트 기숙사,Interior
11,메모리폼 극세사 발매트 주방 욕실 화장실 매트 대형,Interior
12,상일리베가구  인용 원룸 미니 매트리스 좁은방 일체형 싱글침대 슈퍼싱글       ,Interior
13,맞춤형 무지 티비커버   가리개   인치까지,Interior
14,   애비뉴 제로데스크에보 컴퓨터 게이밍책상                         ,Interior
15,바디럽 딥슬립 베개 에어볼 에어폼  타입 오가닉 커버  매     더스트백 포장 메모리폼베개       ,Interior
16,알레르망 에티카 사계절 구스 차렵이불  ,Interior
17,올즈 퓨어   년 메쉬 사무용의자 책상 공부 컴퓨터 사무실의자,Interior
18,오노홈 러버원형테이블 라운드 카페테이블 원형식탁  인용  인용식탁의자,Interior
19,먼지없는 단모 원형 극세사 러그 스마일 워셔블 침실 포인트 카페트 미니러그,Interior
20,리바트 프렌즈 소호      단 와이드 책장,Interior
21, 집중의자  조이알레       팔걸이없는 고정형 학생 공부 책상 독서실 서울대의자,Interior
22, 앵콜스  삼베실 제로웨이스트 천연 수세미실 여름가방실,Interior
23,의류 패딩 셀프 수선 구멍 땜빵 스티커 패치      ,Interior
24,가죽 의자커버 식탁의자커버 시트 리폼 천갈이 방수 덮개,Interior
