,titles,category
0,    캔버스 보석십자수 주문제작 비즈 큐빅 대형 액자형,Interior
1,분리형 쇼파커버 소파 패드 카우치 커버링 등받이 제작 리클라이너 천커버 스툴 방석 천갈이,Interior
2,에보니아 뉴토리노 철제 벙커침대 싱글 슈퍼싱글 책상 수납선반  층벙커 학생 성인 기숙사,Interior
3,바나나빌딩 생활백서 못없이 안뚫어고리        세트  개입 못없는 커튼봉,Interior
4,전자렌지 수납장 밥통 밥솥거치대 선반 다이 렌지대 전자레인지장 에어프라이어    ,Interior
5,오르브 실내 디퓨저       화장실 실내방향제 생화향 꽃집향 교보문고 집들이 디퓨저,Interior
6,폭좁은 반원 테이블 이케아  인용 식탁 겸 책상 소형 미니식탁 화이트 반원형 반타원형,Interior
7,윈홈스 항균 블라인드 친환경 암막 창문 거실 아이방,Interior
8,브리즈필 기내용 목베개 여행용 비행기 목배게,Interior
9,꼬리뼈 치질 자세교정 엉덩이 체중분산 방석 쿠션,Interior
10,반디즈 행거트리 원목 스탠드 옷걸이 행거 논슬립,Interior
11,룸앤디 모노  단      등급     다용도 슬림 선반 수납장,Interior
12,이안퍼니 레시     콘솔 서랍형 폭조절 확장형 화장대 세트 거울 포함           ,Interior
13,전체잠금  단 이동서랍 다용도 사무실 이동식 책상 사무용서랍장,Interior
14,소프티 뜨개실      인형실 부드러운 털실 가방 니트 소프티실,Interior
15,한샘 샘 어린이책장  단       시공,Interior
16,슬림       싱크대 책상등    바 화장대 간접조명 거실 무드등 주광 주백 전구,Interior
17,  퍼니처 게이밍 컴퓨터 사무용 사무실 책상 의자 메쉬체어           ,Interior
18,임파스토실 뜨개실 두꺼운실 겨울 굵은 가방 네트백실 그라데이션 마크라메      얀스케치,Interior
19,조립없는 루게스테디     반고정 서울대 학생 회의 바퀴없는 사무책상 공부의자,Interior
20,웨빙끈 웨이빙끈 에코백끈 가방 스트랩,Interior
21,             컬러 고양이눈 캣아이   색상 모루인형 동물눈 나사형눈,Interior
22,미미월드 바느질로 산리오캐릭터즈 미니백 만들기,Interior
23,왕자행거 왕자 트윈타공선반   시스템행거    ,Interior
24,사무실 사무용 멜론 직원 직원용 책상 사무용가구,Interior
