,titles,category
0,상품명       침대 좌식 접이식 폴딩 테이블 베드테이블 침대독서대  인용책상 배드트레이 베드트레이 차박테이블,Interior
1,상품명                          단 다용도 슬라이딩 선반 블랙  모니터    컴퓨터 노트북 선반,Interior
2,상품명 골드 삼각 책꽂이 잡지꽂이 매거진랙 잡지대 잡지함 책꽂이인테리어 철제꽂이 철제잡지꽂이 철제책꽂이 잡,Interior
3,상품명  인용 컴퓨터 노트북 스탠딩 책상 스탠딩테이블,Interior
4,상품명 수납 심플 인테리어 철제  단 홀리책장     선반 블,Interior
5,상품명 인테리어 철제  단 프로도책장      선반 블랙,Interior
6,상품명 심플 인테리어 철제  단 홀리책장     선반 화이트,Interior
7,공식 상품 마켓비 상품명      책상 서랍 칸           가지 색상,Interior
8,상품명 로제 매거진랙,Interior
9,상품명 코어데스크 듀얼 일렉  전동    서서 일하는 자동 높이 조절 스탠딩 책상 모션 데스크,Interior
10,상품명            접이식 책꽂이 중        접이식책꽂이 책꽂이      칼       ,Interior
11,상품명       카파맥스 데코 단책꽃이               연두  서류꽂이 파일 트레이 책상 정리,Interior
12,상품명       블랙투명  자형 북엔드 책꽂이 책정리   세트         형 도서관용 튼튼한철재북앤드 책꽂이 책고정,Interior
13,상품명       아크릴    종이꽂이 카다로그 꽂이  단 종이 종이꽂이 카탈로그 카타록 꽂이판 잡지꽂이,Interior
14,상품명  인용 컴퓨터 책상      다용도  인 책상    책상 데스크,Interior
15,상품명 멀티  단 책꽂이,Interior
16,상품명 다이나믹접이식책꽂이 대          책꽃이 책 책꽂,Interior
17,시스맥스 상품명 문구사무 점보책꽂이  단       시스맥스 ,Interior
18,상품명 발받침대 통판형 오크우드       원목발판,Interior
19,상품명 미끄럼방지 데스크 발해먹 발받침대 발그네 책상발,Interior
20,상품명 코어데스크 듀얼 일렉 전동 높이 각도 조절 책상,Interior
21,공식 상품 삼익가구 상품명 모이      단 책장      누적판매      조,Interior
22,공식 상품 제닉스 상품명                   컴퓨터 게이밍책상,Interior
23,상품명 잡지 거치대 꽂이 팜플렛 진열대 전단지 카다로그,Interior
24,상품명        책장                미들브라운          ,Interior
25,상품명 더블데스크 학원 책상 바른자세 공부편한 학교 공부방 책상 대량주문,Interior
26,상품명 인테리어 심플  단 철제 잡지 책꽂이 매거진랙,Interior
27,상품명 튼튼한 북앤드 도서칸막이 책거치대  개입         ,Interior
28,상품명       아크릴 양면 받침대  중  아크릴양면받침대중형 아크릴받침대 아크릴진열대 소품상품진열대 핸드폰받,Interior
29,상품명  이든    책꽂이  형  이든    책꽂이 선반 책상선반 데스크선반 책꽂이선반 간이책꽂이    책꽂이선반  형,Interior
30,상품명  일반형 화이트  접이식 좌식 간이 책상 테이블           좌식테이블 접이식테이블 접이식책상 베드트레이,Interior
31,다하미가구 상품명 하프탑 고무나무 원목 책상 편수책상 세트,Interior
32,상품명 뉴퍼스트 코너책상  단 상부책꽂이,Interior
33,공식 상품 동서가구 상품명      피츠 엘      정면 책상 책장         ,Interior
34,상품명 해피클래스 다용도 자 단책장 공장에서 직접생산,Interior
35,가구느낌 상품명 베스트책상          접이식 간이 테이블,Interior
36,필웰 상품명        테미스 라운드 틸팅 전면책장        ,Interior
37,공식 상품 동서가구 상품명 몬티아 스마트 컨트롤 듀얼모터 모션데스크 커브형              ,Interior
38,상품명      조인트 북앤드 중         북스탠드 북꽂이 책꽂이 북앤드 북엔드 화일꽂이 화일정리대 파일꽂이 책꽂,Interior
39,상품명 강화스틸 책상        ,Interior
40,상품명 보조책상 책받침 각도조절 미니 바퀴 이동식 높낮이조절책상 테이블,Interior
41,상품명 고등학생책상 컴퓨터 중학생책상  형 학생데스크 가성비 공부방,Interior
42,상품명 코어데스크 듀얼 일렉  전동식    서서 일하는 높이조절 스탠딩 책상 전동 모션 데스크 모니터  대 거치,Interior
43,상품명       크라프트 서류 정리꽂이  개 세트 서류함 파일함 서류정리함 서류보관함 책상정리함,Interior
44,상품명  블랙  발받침 기내용 해먹 의자 풋레스트 그네 다리 휴식 의자발받침대 발받침대 발해먹 발받침 풋레스트 ,Interior
45,상품명 서재 학생 공부  인용 사무용 컴퓨터 테이블 책상,Interior
46,공식 상품 스틸리 상품명     독서대 침대 소파 간이 테이블 노트북거치대 좌식 책상 접이식 배드테이블 공부상 어린이책상     대형 ,Interior
47,동서가구 상품명 동서가구 시온     책상책장세트         ,Interior
48,동서가구 상품명 동서가구 프리미엄          정면책상세트         ,Interior
49,상품명 삼나무 원목 책장 장식장 수납장     일반형  단,Interior
50,상품명 코너 책상선반 다용도 책장 책꽂이 수납장     중 기본 ,Interior
51,상품명 책장  단 회전 오픈형 도서관 전시형 오픈,Interior
52,상품명 나무선생 삼나무 원목 책꽂이,Interior
53,리센트 상품명         리시스커스텀     폭 책상세트,Interior
54,상품명 엔틱 작은 책꽂이 책상용 책장 원목 파일 꽂이 책,Interior
55,상품명 사무실 멀티 서랍 책상세트 컴퓨터책상           인     ,Interior
56,상품명          테이블책상 이동식 조절    가능한 강의,Interior
57,상품명 완전 자동 높이조절 전동 스탠딩 모션데스크                            ,Interior
58,상품명  화이트  책상 책장 서류 정리 수납 마이룸 책꽂이  단 책정리 접이식책꽂이 서류정리 책상정리 책꽂이칸막,Interior
59,상품명 높이조절 철재 책장  단,Interior
60,상품명 접이식 좌식책상 미니 낮은책상 바닥 노트북 앉은뱅이책상,Interior
61,상품명 간이 책장 조립식 옷장 다용도 보관함  칸  칸   칸,Interior
62,상품명 좌식하모니컴퓨터책상 좌식컴퓨터책상 좌식책상,Interior
63,공식 상품 듀오백 상품명 듀오백 이지풋  단 발받침,Interior
64,공식 상품 스틸리 상품명 베드트레이 독서대 좌식테이블 노트북거치대 책상 사이드 거실 소파 침대 접이식 테이블 간이 탁자   ,Interior
65,공식 상품 프리메이드 상품명 로그 책상세트     컴퓨터책상 테이블 공부책상 책상,Interior
66,상품명    이동식 조절 가능한 강의 테이블책상    책상 이동책상 각도조절 각도조절책상 스탠딩형책상 컴퓨터책상,Interior
67,상품명 시스맥스 마이룸 책꽂이  단 그레이       ,Interior
68,리바트 상품명 로넌 화이트      책상세트 플랩도어형 ,Interior
69,상품명 스탠드 노트북 독서 테이블 사이드 책상,Interior
70,상품명 스탠다드 접이식 좌식책상     핑크 ,Interior
71,상품명                  엘디엘 슬라이딩 키보드 트레이 키보드받침 키보드받침대 키보드트레이 책상키보드받침 ,Interior
72,상품명 예쁜책장 오픈책장      단          ,Interior
73,상품명 실리콘 의자 발캡 발싸개 식탁의자 양말 화이트    층간소음 소음방지패드 소음방지 바닥스크래치 의자발커,Interior
74,상품명 실리콘 의자 발캡 발싸개 식탁의자 양말 화이트    층간소음 소음방지패드 소음방지 바닥스크래치 의자발커,Interior
75,상품명 실리콘 의자 발캡 발싸개 식탁의자 양말 화이트    층간소음 소음방지패드 소음방지 바닥스크래치 의자발커,Interior
76,상품명 대나무 접이식 테이블 다용도 책상 원목책상 학생책상 간이테이블     책상 접이식책상 대나무 접이식 테이,Interior
77,상품명 키밍 의자발 소음방지 매트 패드 긁힘방지 식탁발,Interior
78,상품명    강화스틸    책상      다용도 테이블 가정 사무,Interior
79,공식 상품 한샘 상품명 한샘 샘 책장  단       시공,Interior
80,공식 상품 한샘 상품명 홀리라이트 책상      ,Interior
81,상품명 위너 기본책상    테이블 일자형테이블 학생책상,Interior
82,상품명 프리미엄 소나무 원목 책꽂이 라운드형  단  칸      ,Interior
83,키모 상품명          밸런스 수납선반  단 다용도 장식장 거실 서재 책장 인테리어 책꽂이,Interior
84,공식 상품 프리메이드 상품명 로이 좌식책상 선반형 컴퓨터책상 사무용책상 책상,Interior
85,공식 상품 한샘 상품명 한샘 샘 책장 와이드  단          ,Interior
86,공식 상품 한샘 상품명 샘 책장 와이드  단          단          시공,Interior
87,상품명      열쇠 서랍형 오픈형 컴퓨터책상 사무용책상,Interior
88,시스맥스 상품명 시스맥스 올리오 책꽂이  단   서랍 간이 책상정리함,Interior
89,상품명 모닝글로리 접이식 책꽂이 대  단 늘어나는 북트레이,Interior
90,상품명 휴대용 좌식 밥상 베드 트레이 테이블 소소 소  인용밥상 접이식밥상 접이식책상 좌식공부책상 접이식테이,Interior
91,상품명 조립식책상 일자형 철제 사무용 컴퓨터책상      ,Interior
92,상품명 굿하우스     니요 좌식 컴퓨터 책상,Interior
93,상품명 원목미니책꽂이 책상정리 스텐드 미니책장,Interior
94,상품명 베드트레이 노트북 높이조절 좌식 책상 테이블,Interior
95,상품명 스탠다드 접이식 좌식책상     블루 ,Interior
96,상품명 카파 책꽂이  단       청색 ,Interior
97,상품명 철제 잡지 꽂이 블랙        ,Interior
98,상품명 스탠다드 접이식 좌식책상     블루 ,Interior
99,상품명 북플레이스 책상위 선반 월넛  책상선반 책상정리함 책상책꽂이 선반책상 책상정리 책꽂이선반 수납선반,Interior
100,상품명 자유배치 코너 책상위 선반 핑크  책상선반 책상정리함 책상책꽂이 선반책상 책상정리 책꽂이선반 수납선반,Interior
101,상품명 자유배치 코너 책상위 선반 월넛  책상선반 책상정리함 책상책꽂이 선반책상 책상정리 책꽂이선반 수납선반,Interior
102,상품명     해마 동물모형 선반 책장            블루 ,Interior
103,상품명     토끼 동물모형 선반 책장           옐로우 ,Interior
104,상품명     토끼 동물모형 선반 책장           화이트 ,Interior
105,상품명 모던 접이식 책꽂이 내추럴 형 디자인 정리선반 자바,Interior
106,상품명 모던 접이식 책꽂이 다크 형 디자인 정리선반 자바라,Interior
107,상품명 모던 접이식 책꽂이 라이트 형 디자인 정리선반 자바,Interior
108,상품명     순록 동물모형 선반 책장            그레이 ,Interior
109,상품명     토끼 동물모형 선반 책장           레드 ,Interior
110,상품명     코끼리 동물모형 선반 책장           엘로우 ,Interior
111,상품명 리빙홈 대나무 발받침대 사선 ,Interior
112,상품명 어반 원형프레임 접이식 책꽂이 화이트 ,Interior
113,상품명 공간탄생 책상위 선반         베이지 화이트  책상선반,Interior
114,상품명     코끼리 동물모형 선반 책장           화이트 ,Interior
115,상품명     펭귄 동물모형 선반 책장            월넛 ,Interior
116,상품명     코끼리 동물모형 선반 책장            옐로우 ,Interior
117,상품명     펭귄 동물모형 선반 책장           브라운 ,Interior
118,상품명     토끼 동물모형 선반 책장           레드 ,Interior
119,상품명     토끼 동물모형 선반 책장           화이트 ,Interior
120,상품명  인책상 공부책상 밥상 베드테이블 편리한 접이식 좌식책상      화이트 ,Interior
121,상품명 자유배치 코너 책상위 선반 핑크  책상선반 책상정리함 책상책꽂이 선반책상 책상정리 책꽂이선반 수납선반,Interior
122,상품명 북플레이스 책상위 선반 월넛  책상선반 책상정리함 책상책꽂이 선반책상 책상정리 책꽂이선반 수납선반,Interior
123,상품명 북플레이스 책상위 선반 화이트  책상선반 책상정리함 책상책꽂이 선반책상 책상정리 책꽂이선반 수납선반,Interior
124,상품명  인책상 공부책상 밥상 베드테이블 편리한 접이식 좌식책상  핑크 ,Interior
125,상품명  인책상 공부책상 밥상 베드테이블 편리한 접이식 좌식책상  그린 ,Interior
126,상품명  인책상 공부책상 밥상 베드테이블 편리한 접이식 좌식책상  화이트 ,Interior
127,상품명  인책상 공부책상 밥상 베드테이블 편리한 접이식 좌식책상  블랙 ,Interior
128,상품명  인책상 공부책상 밥상 베드테이블 편리한 접이식 좌식책상  라이트우드 ,Interior
129,상품명  인책상 공부책상 밥상 베드테이블 편리한 접이식 좌식책상     핑크 ,Interior
130,상품명  인책상 공부책상 밥상 베드테이블 편리한 접이식 좌식책상      그린 ,Interior
131,상품명  인책상 공부책상 밥상 베드테이블 편리한 접이식 좌식책상      블랙 ,Interior
132,상품명  인책상 공부책상 밥상 베드테이블 편리한 접이식 좌식책상      화이트 ,Interior
133,상품명  인책상 공부책상 밥상 베드테이블 편리한 접이식 좌식책상      핑크 ,Interior
134,상품명  인책상 공부책상 밥상 베드테이블 편리한 접이식 좌식책상      그린 ,Interior
135,상품명  인책상 공부책상 밥상 베드테이블 편리한 접이식 좌식책상      블랙 ,Interior
136,상품명 월간플랜 자석 스케줄보드   ,Interior
137,상품명 사랑스러운 레이스디자인 면스판 여성삼각팬티  매입,Interior
138,상품명 미니도트 노와이어 주니어 팬티  고아라         ,Interior
139,상품명 베이직한색상 테일폭스 캐릭터 아동반장  새실  아동,Interior
140,상품명 텐셀소재 무봉제 누디 삼각팬티  린다         ,Interior
141,상품명 하트패턴 주니어 삼각팬티  조은        ,Interior
142,상품명 자외선차단 손등민자 자수 숙녀용 운전 골프 레져 장,Interior
143,상품명 시크한 레오파드 패턴 사각스타일 팬티  디올라      ,Interior
144,상품명 스토리 하트 프레임 책꽂이 로즈골드 ,Interior
145,상품명 아리아라 가죽 메탈 책꽂이 북홀더 서류함 오션스블루,Interior
146,펠로우즈 상품명 오피스 수트 발 받침대        ,Interior
147,상품명 자바라 접이식 책꽂이 펜꽂이 블랙 ,Interior
148,상품명 자바라 접이식 책꽂이 펜꽂이 화이트 ,Interior
149,상품명 책꽂이  단 카파맥스 ,Interior
150,상품명 스탠다드 접이식 좌식책상     블루 ,Interior
151,상품명 스탠다드 접이식 좌식책상     블랙 ,Interior
152,상품명 스탠다드 접이식 좌식책상     그린 ,Interior
153,상품명 스탠다드 접이식 좌식책상     핑크 ,Interior
154,상품명 스탠다드 접이식 좌식책상     핑크 ,Interior
155,상품명 스탠다드 접이식 좌식책상     블루 ,Interior
156,상품명 이지데스크 각도조절 좌식 책상   ,Interior
157,상품명 우드테리어     좌식 테이블,Interior
158,상품명 필우드 접이식 좌식 테이블    내추럴 ,Interior
159,상품명 필우드 접이식 좌식 테이블    내추럴 ,Interior
160,상품명 필우드 접이식 좌식 테이블    내추럴 ,Interior
161,상품명 자유배치 책꽂이 선반 앤틱체리 ,Interior
162,상품명 감각 철제 매거진 랙 화이트 ,Interior
163,상품명 실리콘 의자 발캡 발싸개 식탁의자 양말 화이트    층간소음 소음방지패드 소음방지 바닥스크래치 의자발커,Interior
164,상품명       책꽂이  단 책정리 프라스틱책꽂이 서류함 칸막이정리대 책장,Interior
165,상품명 굿마켓 접이식 책꽂이 블랙  북트레이 책상위책꽂이 사무실책꽂이 칸막이책꽂이 간이책꽂이,Interior
166,상품명 접이식 좌식 노트북침대 테이블 책상 베드트레이 간이,Interior
167,상품명 내맘대로 이동 책상위 선반 블랙  책상선반 책상정리함 책상책꽂이 선반책상 책상정리 책꽂이선반 수납선반,Interior
168,상품명 내맘대로 이동 책상위 선반 핑크  책상선반 책상정리함 책상책꽂이 선반책상 책상정리 책꽂이선반 수납선반,Interior
169,상품명 내맘대로 이동 책상위 선반 메이플애쉬 ,Interior
170,상품명 더크린 하단선반 책상         블랙 책상 테이블 타원책상 반원책상 학생책상 데스크 사무실책상 좌식테이,Interior
171,상품명 언택트 아이방 재택근무 낮은 수납장 오픈장 책장 재택근무 온라인수업 언택트 원목책장  단책장  단책장  ,Interior
172,상품명  인책상 공부책상 밥상 베드테이블 편리한 접이식 좌식책상  블랙 ,Interior
173,상품명  인책상 공부책상 밥상 베드테이블 편리한 접이식 좌식책상  라이트우드 ,Interior
174,상품명  인책상 공부책상 밥상 베드테이블 편리한 접이식 좌식책상  화이트 ,Interior
175,상품명  인책상 공부책상 밥상 베드테이블 편리한 접이식 좌식책상  옐로우 ,Interior
176,상품명  인책상 공부책상 밥상 베드테이블 편리한 접이식 좌식책상      그린 ,Interior
177,상품명  인책상 공부책상 밥상 베드테이블 편리한 접이식 좌식책상      핑크 ,Interior
178,상품명 키밍 사무실 발받침대 발판 책상 풋레스트 다용도,Interior
179,공식 상품 한샘 상품명 한샘 샘스틸 책상          ,Interior
180,공식 상품 한샘 상품명 한샘 샘스틸 책상          ,Interior
181,상품명 높이조절책상 카멜마운트       전동식책상  제품명      로 변경 ,Interior
182,공식 상품 프리메이드 상품명 로이 책상 일반형      컴퓨터책상 사무용책상 테이블,Interior
183,공식 상품 한샘 상품명 한샘 샘와이드 책장  단       시공,Interior
184,공식 상품 프리메이드 상품명 루시 선반형 책상     컴퓨터책상  인용책상 철제책상,Interior
185,와이디가구 상품명 밀라노 북선반 인테리어 책장 책꽂이 수납장 철제 선반   단 ,Interior
186,아씨방 상품명 아씨방가구 제이슨          단 책장 책꽂이,Interior
187,공식 상품 이반가구 상품명 절탁자         접이식테이블 컴퓨터 입식책상 식탁,Interior
188,상품명 책상선반 다용도 책장 책꽂이 수납장     중형     ,Interior
189,미즌하임 상품명 미즌하임 켈트 선반책상       블랙 화이트,Interior
190,공식 상품 제닉스 상품명                        인용 컴퓨터 게이밍책상,Interior
191,공식 상품 제닉스 상품명         전동          높이조절 컴퓨터 모션데스크,Interior
192,공식 상품 동서가구 상품명 착불 라스카 삼나무 원목      단수납책장           ,Interior
193,카멜마운트 상품명 카멜마운트 이동식 높이 조절 스탠워크 무빙 데스크       ,Interior
194,청사초롱 상품명 라네모 낮은 원목 수납 서랍 도어  단 책장     ,Interior
195,공식 상품 리바트 상품명 프렙      콘센트형 독서실 책상  조명패널포함 ,Interior
196,공식 상품 포스트모던 상품명 포스트모던 소프트       단 낮은책장,Interior
197,공식 상품 루나랩 상품명 루나랩 높이조절 스탠딩 책상 높낮이조절 수동 모션데스크     ,Interior
198,상품명 나무선생 삼나무 원목 발받침대 발판 우드발판 원목발판 우드발받침대 원목발받침대 삼나무발판 학생발판 ,Interior
199,상품명 원형티 좌식 테이블 거실탁자 좌식식탁,Interior
200,상품명 원형 회전책장 회전식 회전형     책꽃이  단 내추럴,Interior
201,상품명 고급 삼나무슬림     단책장 책장선반 책장수납장 원목책장    책장 조립책장 책정리 책꽂이 인테리어소품 ,Interior
202,보루네오 상품명 보루네오 마르체 밀리       단 전면책상세트          착불 ,Interior
203,곧은나무 상품명  단 명품 각도조절 독서대     오크 원목 필기독서대 책받침대     일까지 한정특가,Interior
204,핏쳐 상품명 핏쳐 전동식 어플 원격 작동 스마트 커스터마이징 모션데스크   ,Interior
205,상품명     열  단 책전시대 엽서진열대 리플릿거치대 리플렛거치대 팜플렛 브로셔,Interior
206,리바트 상품명 로넌 화이트      책상세트,Interior
207,퍼시스 상품명 퍼시스 컴퓨터 책상                빌트인 매립 콘센트 게이밍 책상 인에이블 원룸 사무용,Interior
208,상품명 북플레이스 책상위 선반 월넛  책상정리 미니 책꽂이,Interior
209,상품명 원목 책꽂이 간이 전면 수납장 책상 정리함 미니 책상위 수납 선반  단 책장  벤티,Interior
210,해외직구 상품 상품명       기발한 성냥 골드바 만번 성냥 탁월한 내구성 메탈 바디 밀봉 방수,Interior
211,상품명 조립식 책장 거실 다용도 수납장 패브릭 보관함 옷,Interior
212,상품명 우드기본책상    작은테이블 미니 소형 간이 학생공부,Interior
213,상품명 사무용 인조가죽 책상매트 일반형 데스크패드,Interior
214,상품명 회전책장 원형 스탠드 책꽂이 전면 교구장 회전 책장     도 바닥 선반 다층 홈 학생,Interior
215,상품명 바닥 앉은책상 낮은책상 앉는 기도 좌식책상    ,Interior
216,상품명 공부집중 독서실공부집중 독서실 칸막이 책상  상단 ,Interior
217,상품명 더크린 하단선반 책상        화이트 책상 테이블 타원책상 반원책상 학생책상 데스크 사무실책상 좌식테이,Interior
218,상품명 더크린 좌식 스틸프레임 테이블          책상 테이블 타원책상 반원책상 학생책상 데스크 사무실책상 좌식,Interior
219,상품명 북앤드  형 사무용 책꽂이 대형  개 세트,Interior
220,공식 상품 리바트 상품명 프렌즈 소호      낮은책장,Interior
221,공식 상품 한샘 상품명 한샘 티오 일반책상        컬러 택  ,Interior
222,공식 상품 이반가구 상품명 절탁자         접이식테이블 컴퓨터 입식책상 식탁,Interior
223,아씨방 상품명 아씨방가구 심플           단 책장  단 정리함,Interior
224,미즌하임 상품명 미즌하임 켈트 선반책상       블랙 화이트,Interior
225,공식 상품 루나랩 상품명 높이조절 스탠딩 책상 높낮이조절 수동 모션데스크         ,Interior
226,상품명 아우스     올인원 컴퓨터책상 게이밍책상 사무용 서재책상 학생책상  인용  인용           ,Interior
227,상품명  시스맥스 책꽂이  단          화일꽂이 파일꽂이 화일보관꽂이 파일보관꽂이 다용도꽂이 문구용꽂이 책정,Interior
228,상품명 모던종이책장 형  단    책장 책꽂이 조립책장 조립책꽂이 수납책장 수납책꽂이 종이가구 종이책장 종이책,Interior
229,상품명 어린이 독서대 키즈 독서대   ,Interior
230,상품명 삼나무 원목 책상 발판 받침대 받침 발받침 발받침대 우드발받침 원목발받침대 책상발판 데스크발판 원목발,Interior
231,상품명 캠핑 차박 초경량 접이식 우든 테이블 캠핑테이블 캠핑용품 차박용품 글램핑용품 폴딩테이블 미니테이블 접,Interior
232,상품명 이크홈 원목 손잡이   트레이 접이식 침대 테이블 노트북테이블 접이식밥상 좌탁 침대책상 간이테이블 베,Interior
233,상품명 우드밀리 원목 발받침대        받침 우드받침 발받침 책상발받침 발받침대 우드발받침대 우드발선반 원목,Interior
234,상품명 시스맥스 마이룸  꽂이 책꽂이 서류꽂이 책홀더 책정리 책수납 책상서류꽂이 투명책꽂이 책상악세사리 책상,Interior
235,상품명 우드밀리 원목 발받침대       ,Interior
236,상품명   철제          책상 프레임         ,Interior
237,상품명 스탠다드 접이식 좌식책상     블루 ,Interior
238,상품명 책꽂이    단 카파맥스 양쪽손잡이 ,Interior
239,상품명 키높이 발판 컴퓨터 발판 컴퓨터 발 받침대 침대 디딤판,Interior
240,상품명 스탠다드 접이식 좌식책상     블루  침대테이블 보조테이블 보조책상 침대책상 공부책상 업무책상 미니책,Interior
241,상품명  자바라책꽂이대화이트  책꽂이정리함 북엔드 간이 책상 책선반 자바라 서류 책꽂이 북스탠드 북스탠더 책,Interior
242,상품명  칸 책상책꽂이          화이트  책꽂이 간이책꽂이 책상정리 서류꽂이 사무실책상정리 사무용책꽂이 데스,Interior
243,상품명 나무선생 삼나무 원목 발받침대,Interior
244,상품명 에이데이타 이동식 노트북책상         ,Interior
245,상품명 스터디온 원목 컴퓨터 책상     ,Interior
