,titles,category
0,     막스마라         마누엘라 여성 벨티드 울 롱 코트 카멜                  ,Fasion
1,써스데이아일랜드                 패턴 리버서블 다운 점퍼            ,Fasion
2,   제품만 가장 두꺼운 여성 융기모 성인내복 추운겨울 방한내의,Fasion
3,탑텐        여성 리얼라이트 다운 투인원 베스           ,Fasion
4,지고트 메탈 트위드 원피스          ,Fasion
5,미니멈 럭셔리 셀럽 롱 자켓           ,Fasion
6,쉬즈미스 셋업 스트레치 슬림 팬츠            ,Fasion
7,리바이스                              ,Fasion
8,폴햄 여성 알래스카 에어 듀얼 덕다운 숏 점퍼             ,Fasion
9,리바이스 여성     하이라이즈 스트레이트 웜진 라이트워시                  ,Fasion
10,에잇세컨즈           울 스티치 롱 스커트                  ,Fasion
11,클라이드앤 클라이드 반팔 롱티셔츠          ,Fasion
12,크포 여성 레이어드 이너 꽈배기 케이블 라운드 베스트 조끼,Fasion
13,             울 트위드 셋업 머메이드 스커트        ,Fasion
14,             크롭 카라에리 퍼 자켓           ,Fasion
15,제임스딘 여성 기모 스판 겨울 긴팔 내의 내복 상의         ,Fasion
16,캘빈클라인언더웨어 언더웨어    여성 브라렛 브라 티팬티 세트       ,Fasion
17,험멜      헥사 프로텍트 웜 코트 패딩점퍼  종 여성,Fasion
18,유니제이 델리나 후드 니트 티셔츠,Fasion
19,프렌즈 셀렙샵 에디션      레더 뷔스티에 원피스,Fasion
20,온앤온 레터링 포인트 후드 니트원피스          ,Fasion
21,구김없는 여성 블라우스 여자 셔츠 링클프리   컬러 히든버튼 화이트 포켓 블랙 검정,Fasion
22,클라이드앤 클라이드엔 미키 레터링 니트 스웨터          ,Fasion
23,르샵 기모 세미 부츠컷 슬랙스 팬츠         ,Fasion
24, 랄라닷  가방 체인줄 크로스 가방끈 핸드백스트랩 숄더 스트랩          주문가능,Fasion
25,     라이브무료반품 듀엘 에코퍼 다운           ,Fasion
26,제시뉴욕 알렉시스  레오파드 페이크퍼 양면 데님자켓             ,Fasion
27,바버              아난데일 퀄팅 여성 자켓        ,Fasion
28,라인      라인어디션      쥬얼버튼  라인 원피스           ,Fasion
29,오르시떼 여성      굿나잇 긴소매 상하,Fasion
30,아미      여성 하트로고 니트                    ,Fasion
31,써스데이아일랜드                 레이어드 민소매 원피스            ,Fasion
32,랩    상의     로고자수 기모 맨투맨          ,Fasion
33,리스트   년 겨울 투턱 와이드 바지            ,Fasion
34,지오다노 여 슬림 스트레이트핏 기모 스판 청바지       ,Fasion
35,온앤온 스티치 포인트 핸드메이드 자켓          ,Fasion
36,꽃무늬 여성 잠옷 바지 파자마 홈웨어 개버딘 순면        ,Fasion
37,조은 하이웨스트 맥시 허리 레이스 면스판 팬티,Fasion
38,     벨티드 덕다운 롱 패딩        ,Fasion
39,     여        코튼 보트넥 스트라이프 긴팔티 젯           ,Fasion
40,브루마스     브루마스 클래식 소가죽 앵클부츠,Fasion
41,올리비아로렌 호피 밍크    라운드넥 퍼            ,Fasion
42,보브 웨이스트 스트링 후디드 원피스           ,Fasion
43,세컨스킨 모달 플러스사이즈 브라렛          ,Fasion
44,캠퍼 이만 앵클부츠            ,Fasion
45,뉴발란스             ,Fasion
46,온앤온 아웃 포켓 포인트 테일러드 자켓          ,Fasion
47,마리끌레르      니트 카라 퀼팅 숏 패딩           ,Fasion
48,베어파우 여성 겨울 방수 양털 부츠 히코리 울                       ,Fasion
49,탑텐        여성 쿨에어 브라패드 캐미솔           ,Fasion
50,   레코브 도토리그라티셔츠             ,Fasion
51,폴햄 여성 슬릿카라 풀오버           ,Fasion
52,이자벨마랑      샤를리 여성 자켓                ,Fasion
53,고세 여성 앵클부츠           ,Fasion
54,       디엠버 모헨 피셔 케이블 니트 꽈배기 니트   ,Fasion
55,나이키 반팔티 데일리 무지 루즈핏 기본,Fasion
56,프로스펙스   휘핑기모이지웨어  종 여,Fasion
57,로엠 더플 미디 코트           ,Fasion
58,제시뉴욕 알렉시스 제시뉴욕 숏 항공점퍼             ,Fasion
59,오조크 레터링 후드 다운점퍼             ,Fasion
60,스튜디오톰보이               다이아퀼팅 롱 다운 라이트베이지           ,Fasion
61,제너럴아이디어            피케 세일러 반팔 티셔츠                ,Fasion
62,아르켓 트렌치코트                            ,Fasion
63,     라운드넥 자켓        ,Fasion
64,                         ,Fasion
65,쉐비뇽 여성 오리진스 다운 자켓,Fasion
66,쉬즈미스 피케 카라 니트 탑            ,Fasion
67,         여 코튼 카고 조거 팬츠       ,Fasion
68,겨울 잠옷 피치기모잠옷 극세사 수면 빅사이즈 가족 패밀리 파자마파티,Fasion
69,제임스딘 여성 순면 삼각 요일 팬티  매         ,Fasion
70,나이스클랍 폭스퍼조끼패딩                   ,Fasion
71,크로스 버클 핸드백 가죽 가방 스트랩 끈,Fasion
72,셀렙샵 지스튜디오      울실크 핸드메이드 케이프코트,Fasion
73,     캐시미어 혼방 더블 테일러드 롱 코트           ,Fasion
74,나인              하이넥 루즈핏 니트       ,Fasion
75,              아웃포켓 숏 다운점퍼           ,Fasion
76,자체제작 뉴 핫밍크 부츠컷 팬츠,Fasion
77,     숲 라운드넥무스탕        ,Fasion
78,겨울 여성코트 오버핏 오피스룩 대학생 블랙 오트밀 여자 울 누빔 더블 롱 코트 빅사이즈,Fasion
79,간호복 상의 앞지퍼형 세탁성 좋은 간호사복 병원 유니폼,Fasion
80,체이스컬트 여성 중힙기장 초경량 다운점퍼             ,Fasion
81,겨울 결혼식 하객룩 보정핏 블랙 체크 트위드  라인 배색 미니 원피스   사이즈 오피스,Fasion
82,보브        보브 터틀넥 레이어드 니트 세트           ,Fasion
83,당배 가죽 반달 크로와상 크로스백 슬링백,Fasion
84,린 울 앙고라 코트           ,Fasion
85,에잇세컨즈 퍼 칼라 가로 퀼티드 패딩                    ,Fasion
86,나이스클랍            라운드 크롭 자켓           ,Fasion
87,톰보이 다이아퀼팅에코레더다운점퍼           ,Fasion
88,최강스판 밴딩 부츠컷 기모슬랙스 키작녀바지 와이드슬랙스,Fasion
89,스케쳐스 스케쳐스    여성 방한화 온더고 엘리베이트                           ,Fasion
90,잠뱅이 여 전용 라이크라 컬러 면 데님 팬츠             ,Fasion
91,리스트           폭스퍼 스트링 숏 덕다운 점퍼            ,Fasion
92,       알파 라운드             ,Fasion
93,러빙리 커플 잠옷 실크 파자마 신혼부부 잠옷 세트,Fasion
94,시슬리 캐시미어 벨티드 롱 코트          ,Fasion
95,리스트 캐시미어 칼라 오버핏 코트  가지색상              ,Fasion
96,커플잠옷 여성 원피스잠옷  피스 파자마 로브가운,Fasion
97,라운지 라쿤 캐시 라운드 가디건 여자울가디건,Fasion
98,소프트 반목폴라 캐시미어   니트 울 홀가먼트 여성 루즈핏 목폴라 니트 여자 가을 겨울,Fasion
99,         프리에어 캡나시탑 여성 면 보정 끈 캐미솔 런닝 노브라 쿨      ,Fasion
100,꼼데가르송 아오야마 레더토트백 라운드 스퀘어,Fasion
101,세인트제임스                                       ,Fasion
102,비비안 풀컵 노와이어 몰드 브래지어          ,Fasion
103,크로커다일레이디 오비 배색 포인트 밴딩 와이드핏 팬츠          ,Fasion
104,에잇컨셉    스판꽈긴팔                 ,Fasion
105,듀베티카 알로로 로고     벨티드 다운 패딩 점퍼               ,Fasion
106, 신세계백화점 여성 나이키 스포츠웨어 리버서블 인조 퍼 봄버 재킷           ,Fasion
107,애니바디 여성 면기모  부 원피스 스누피          ,Fasion
108,장바구니 투명 마트 휴대용 코스트코 이케아 타포린 백 가방 쇼핑백 네이버 쇼핑 시장,Fasion
109,바쿠 산리오 베이비 헬로키티 아이콘 에코백,Fasion
110,르샵 어깨 퍼프 앙고라 반목 니트 티셔츠         ,Fasion
111,스테파니 세이브존   아가일 반폴 배색 니트          ,Fasion
112,에고이스트  라인골지믹스져지원피스         ,Fasion
113,  여름 라글란배색 티셔츠           ,Fasion
114,몽클레르 여성 로고 믹스 패딩자켓                   ,Fasion
115,지오다노 여      브이넥 립 가디건       ,Fasion
116,폴햄 여성 스트레치 슬림 슬랙스           ,Fasion
117,닥스   백화점 닥스핸드백 체크경판 가죽 백팩          ,Fasion
118,헤지스레이디스 퍼피자수 리넨 긴팔셔츠            ,Fasion
119,포커스 투버튼뒤밴딩와이드데님팬츠            ,Fasion
120,올리브데올리브 패딩 카키 벨티드 슬림핏 폭스퍼롱구스패딩                ,Fasion
121,행텐 여성 기모 스트레이트핏 셋업 팬츠                 ,Fasion
122,닥스 쇼핑백동봉        블랙 칼라일 가죽 백팩          ,Fasion
123,        보브 트리밍 트위드자켓           ,Fasion
124,솔브 컵 큰컵브라 기능성브라                ,Fasion
125,에잇세컨즈           자수 포인트 기모 반집업 스웨트셔츠  ,Fasion
126,나이스클랍            벨트레터링 슬림구스다운           ,Fasion
127, 차콜 진블루당일  홀가먼트 라쿤 새들 라운드 니트  고급져요 강추,Fasion
128, 닥스 악세서리 여성           블랙   로고 크로스백            ,Fasion
129,메타퍼 여성 겨울 후드 기모 원피스 맨투맨 루즈핏 리본 맥시 롱 원피스,Fasion
130,       톰보이 아웃포켓 숏 다운점퍼           ,Fasion
131,씨씨콜렉트   콜렉트 트렌치형 롱 구스 다운 점퍼           ,Fasion
132,탑텐 여성 에코 소프트 크루넥 긴팔 티           ,Fasion
133,포멜카멜레 서클 스트랩 니트 펌프스              ,Fasion
134,푸마 바디웨어 여성 웜셀 모크넥 조거 홈웨어  종,Fasion
135,비비안 누브라 실리콘 흡착 스키니 브라  컵       ,Fasion
136,     벨티드 플랩포켓 구스 롱 점퍼           ,Fasion
137,비너스 시스루 레이스 와이어 홑겹 풀컵 브라        ,Fasion
138,아미      스몰 하트 브이넥 가디건                  ,Fasion
139,저스트원 꿀스판 본딩기모 일자진   다크블루        ,Fasion
140,융 기 모 스키니진 팬츠 허리 스판 화이트블랙진 겨울 여자 밴딩 기모 스키니 청바지,Fasion
141,잇미샤 플리츠 카라 레이스 원피스            ,Fasion
142,레코브 엘자수 맨투맨티셔츠                    ,Fasion
143,빅사이즈여성팬티 맥시 엄마 할머니팬티 여성용면팬티 순면 텐셀 인견 아줌마 중년,Fasion
144,유아이너프 정착브라  큰가슴 잘잡아주는 노와이어 브라    컵부터    컵까지 빅사이즈 속옷,Fasion
145,비비안웨스트우드 베아 가디건 여성                    ,Fasion
146,캐시미어 울 니트 목폴라,Fasion
147,쉬즈미스 소프트 솔리드 니트            ,Fasion
148,         꿈의브라 시그니처 포근 패키지 프리컷 노와이어,Fasion
149,탑텐 여성 슬림 스트레이트 데님           ,Fasion
150,비비안 뽀송뽀송 엠보싱 면스판 요일 팬티       ,Fasion
151,오리털 후드 경량 롱 패딩 코트,Fasion
152,탑텐 여성 플리스 스트레이트 팬츠           ,Fasion
153,에잇세컨즈 기모 세미와이드핏 데님 팬츠           ,Fasion
154,버커루 여성 플레어 진청 데님팬츠           ,Fasion
155,비너스      운동용 스포츠 풀컵 몰드브라          ,Fasion
156,포커스 핀턱라운드넥맨투맨 와이드팬츠                 ,Fasion
157,써스데이아일랜드 배색 자수 덤블 자켓            ,Fasion
158,      버클카라 뽀글이 자켓          ,Fasion
159,나이스클랍 리버시블 무스탕           ,Fasion
160,     자주 여 와이드핏 데님 팬츠   ,Fasion
161,케네스레이디 버튼다운 로우웨스트 플리츠 원피스           ,Fasion
162,                       캘빈클라인 언더웨어 여성 모던코튼 비키니 팬티            ,Fasion
163,에고이스트 시스루 터틀넥 니트         ,Fasion
164,비지트인뉴욕 핸드메이드 트렌치코트        ,Fasion
165,    보브 세미 부츠컷 밴딩 팬츠           ,Fasion
166,리스트 유니크 플리츠 미디 스커트            ,Fasion
167,락포트 여성화 수사나 로퍼                     ,Fasion
168,잭필드      겨울 여성 웜히트 패딩팬츠  종,Fasion
169,      가을 여성정장 여자셋업수트 웨딩수트 바지정장 벨트셋       로렌셋트,Fasion
170,국내생산 체크 면 파자마 잠옷바지 커플 남녀공용 빅사이즈 홈웨어 캐릭터,Fasion
171,에고이스트 비조 리얼퍼 투웨이 코트         ,Fasion
172,어그 스커페트  에스프레소            ,Fasion
173,써스데이아일랜드 김태리 딥 브이넥 레이어드 데님 원피스                   ,Fasion
174,베어파우 베어파우              웨지양털슬리퍼       ,Fasion
175,겨울 원피스 하객 플리츠 골지  라인 맥시 롱 니트 원피스,Fasion
176,나인 볼륨 슬리브 코튼 오버핏 셔츠        ,Fasion
177,모스트맘 모스트맘 홈웨어 피치기모 주니어잠옷 피치원피스 커플잠옷 파자마 세트,Fasion
178,바쿠백 고 파우치 세트,Fasion
179,더아이잗 하프넥 니트 원피스 세트            ,Fasion
180,       울 캐시미어 혼방 루즈핏 롱 코트          ,Fasion
181,빈폴레이디스 코튼 혼방 기모 자전거 자수 기본 스웨트 셔츠           ,Fasion
182,           컵 풀컵몰드브라 종        ,Fasion
183,써스데이아일랜드 페이크 퍼 하이넥 다운 점퍼            ,Fasion
184,보브 롱패딩 니트 카라 숏 구스다운 점퍼                      ,Fasion
185,나이키 레볼루션   넥스트 네이처 운동화           ,Fasion
186,테이트 테이트 미디 덕다운 이중 여밈 패딩 경량 오리솜털   깃털              ,Fasion
187,베어파우 남성 방수 패딩 앵클 부츠                        ,Fasion
188,쉬즈미스 벨티드 울 롱코트,Fasion
189,슈콤마보니 워커 힐 로퍼              ,Fasion
190,크로커다일레이디 후드 폭스퍼 클래식 구스다운          ,Fasion
191,입체 리얼   심리스 홀가먼트 노와이어 브라렛 브라,Fasion
192, 자체 제작  샌델 맥시 롱 코트,Fasion
193,폴앤조      리버시블 프린트 헝가리 구스,Fasion
194,쉬즈미스 턴업 커프스 오버핏 코트            ,Fasion
195,미쏘 핸드메이드 싱글 롱 코트 잠실           ,Fasion
196,체이스컬트      본딩 부츠컷 팬츠            ,Fasion
197,베스띠벨리 퍼후드 덕다운 점퍼              ,Fasion
198,무배라지까지출시 히든밴딩 코듀로이 부츠컷팬츠     ,Fasion
199, 아리울  시즌  네이비면스판  간호사복 수술복 간호복 병원복 실습복,Fasion
