,titles,category
267,상품명 회의팔유 고정  사무실의자 사무용의자 업무용의자,Interior
268,상품명 팬텀 중 회의팔무 고정  의자 사무실 사무용 업무용,Interior
269,상품명 티코팔무 로라  의자 사무실의자 사무용의자 사무의,Interior
270,상품명 티코팔무 고정  의자 사무실의자 사무용의자 사무의,Interior
271,상품명 스마트팔유 로라  의자 사무실의자 사원용의자 사무,Interior
272,상품명 세이브 중  회의 고정  의자 사무실의자 사원용의자,Interior
273,상품명 회의용 의자 사무실의자 사원용의자 업무용의자,Interior
274,상품명 중역용        의자 중역의자 사무실의자 사무의자,Interior
275,상품명 모시 중  도금 의자 사무실의자 사무의자 관리자용,Interior
276,상품명 의자 사무실의자 업무용의자 관리자용의자 사무의자,Interior
277,상품명 책상     사무용책상 업무용책상 사무실책상 인테리,Interior
278,상품명 책상    사무용책상 업무용책상 사무실책상 인테리,Interior
279,상품명 회의실 책상 카페 식당 가정용 식탁  인세트 테이블,Interior
280,상품명 사무실 회의실 직원 학생 책상 컴퓨터 메쉬의자 로,Interior
281,상품명 회사 사무실 사장님 임원 책상 컴퓨터 중역용의자,Interior
282,상품명 회사 사무실 회의실 강의실 대기실 의자 레드 연두,Interior
283,상품명 업무용 회사 직장 강의실 사무실 회의실 대기실 의,Interior
284,상품명 업무용 회사 직장 사무실 강의실 회의실 컴퓨터 의,Interior
285,상품명 업무용 대기실 강의실 사무실 회의실 세미나실 의자,Interior
286,상품명 업무 대기실 강의실 사무실 회의실 세미나실 의자,Interior
287,상품명 업무 대기실 세미나실 사무실 강의실 회의실 의자,Interior
288,상품명 회사 직장 사원 세미나실 사무실 회의실 강의실 의,Interior
289,상품명 직장 회사 사원 세미나실 사무실 회의실 강의실 의,Interior
290,상품명 회사 직장 업무 사무실 세미나실 회의실 강의실 의,Interior
291,상품명 직장 업무 컴퓨터 사무실 회의 강의 대기실 의자 블,Interior
292,상품명 직장 업무 사무실 회의실 강의실 로비 대기실 의자,Interior
293,상품명 직장 회사 사원 사무실 강의실 회의실 대기실 의자,Interior
294,상품명 사무실 회의실 강의실 업무 로비 대기실 다용도 의,Interior
295,상품명 업무 사무실 강의실 회의실 대기실 세미나실 의자,Interior
296,상품명 업무 사무실 강의실 회의실 세미나실 대기실 의자,Interior
297,상품명 사무실 업무 강의실 회의실 세미나실 대기실 의자,Interior
298,상품명 강의실 회의실 사무실 세미나 로비 대기실 사원 의,Interior
299,상품명 직장 회사 회의실 세미나실 사무실 로비 대기실 의,Interior
300,상품명 회사 직장 업무 강의실 회의실 사무실 대기실 의자,Interior
301,상품명 회사 강의실 회의실 사무실 로비 대기실 사원 의자,Interior
302,상품명 회사 사무실 로비 대기실 의자 고정 팔유 로라 블랙,Interior
303,상품명 회사 사무실 회의 세미나 학생 가정 컴퓨터 의자 레,Interior
304,상품명 회사 회의실 사무실 사원 업무 가정 학생 학교 의자,Interior
305,상품명 회사 사무실 직장 사원 대기실 회의실 강의실 의자,Interior
306,상품명 직장 사원 회사 사무실 강의실 세미나실 회의실 의,Interior
307,상품명 회사 사무실 강의실 회의실 대기실 의자 고정 블랙 ,Interior
308,상품명 직장 회사 사원 사무실 업무용 강의실 회의실 의자,Interior
309,상품명 컴퓨터 회사 오피스 사무 회의 강의실 고정 의자 블,Interior
310,상품명 학교 직장 회사 사무실 세미나실 업무용 회의실 의,Interior
311,상품명 회의 팔무 고정 레드  사무실 병원 학원 대기실 의,Interior
312,상품명 사무실 카페 식당 대기 세미나실 회의실 책상 의자,Interior
313,상품명 사무실 카페 식당 대기 세미나실 회의실 책상 의자,Interior
314,상품명 사무실 카페 식당 대기 세미나실 회의실 책상 의자,Interior
315,상품명 사무실 카페 식당 대기 세미나실 회의실 책상 의자,Interior
316,상품명 사무실 카페 식당 대기 회의 책상 의자 원사출 핑크,Interior
317,상품명 접의자 아이보리 학교 회사 강당 회의실 접이식,Interior
318,상품명 사무실 업무용 사무용 직원용 책상 컴퓨터 회전 의,Interior
319,상품명 사무실 업무용 사무용 직원용 책상 컴퓨터 회전 의,Interior
320,상품명 사무실 업무용 사무용 직원용 책상 컴퓨터 회전 의,Interior
321,상품명 사무실 업무용 사무용 직원용 책상 컴퓨터 회전 의,Interior
322,상품명 사무실 업무용 직원용 책상 컴퓨터 회전 의자,Interior
323,상품명 사무실 업무용 사무용 직원용 책상 컴퓨터 회전 의,Interior
324,상품명 사무실 업무용 사무용 직원용 책상 컴퓨터 회전 의,Interior
325,상품명 사무실 업무용 직원용 책상 컴퓨터 회전 의자   ,Interior
326,상품명 사무실 업무용 사무용 직원용 책상 컴퓨터 회전 의,Interior
327,상품명 사무실 업무용 사무용 직원용 병원 컴퓨터 바퀴 의,Interior
328,상품명 사무실 업무용 사무용 직원용 책상 컴퓨터 회전 의,Interior
329,상품명 사무실 병원 업무용 사무용 직원용 컴퓨터 바퀴 의,Interior
330,상품명 사무실 업무용 사무용 직원용 책상 컴퓨터 바퀴 의,Interior
331,상품명 사무실 업무용 사무용 직원용 책상 컴퓨터 회전 의,Interior
332,상품명 사무실 회의실 사장님 임원 중역 컴퓨터 피시방 의,Interior
333,상품명 사무실 사무용 오피스 컴퓨터 책상 의자 블랙,Interior
334,상품명 강의실 오피스 회의실 사무실 사무용 의자 블랙,Interior
335,상품명 회의실 오피스 사무실 컴퓨터 책상 사무용 의자 흰,Interior
336,상품명 회의실 오피스 사무실 컴퓨터 책상 병원 의자 레드,Interior
337,상품명 회의실 오피스 사무실 컴퓨터 책상 병원 의자 블랙,Interior
338,상품명 회의실 오피스 사무실 컴퓨터 책상 병원 의자 그레,Interior
339,상품명 회의실 오피스 사무실 컴퓨터 바퀴 책상 의자  블랙,Interior
340,상품명 회의실 오피스 사무실 컴퓨터 바퀴 책상 의자 레드,Interior
341,상품명 회의실 오피스 사무실 컴퓨터 회전 책상 의자  블랙,Interior
342,상품명 회의실 오피스 사무실 병원 사무용 팔걸이 회전 의,Interior
343,상품명 회의실 오피스 사무실 병원 사무용 바퀴 의자 옐로,Interior
344,상품명 회의실 오피스 사무실 병원 바퀴 회전 의자 진그레,Interior
345,상품명 강의실 회의실 사무실 병원 사무용 바퀴 의자 퍼플,Interior
346,상품명 강의실 회의실 사무실 병원 사무용 바퀴 의자 블루,Interior
347,상품명 강의실 회의실 사무실 병원 사무용 바퀴 의자 블랙,Interior
348,상품명 강의실 회의실 사무실 병원 회전 바퀴 의자 바이올,Interior
349,상품명 강의실 회의실 사무실 병원 바퀴 의자 블루 진녹색,Interior
350,상품명 강의실 세미나실 회의실 사무실 병원 바퀴 회전 의,Interior
351,상품명 강의실 세미나실 회의실 사무실 바퀴 회전 의자 레,Interior
352,상품명 강의실 세미나실 회의실 사무실 바퀴 회전 의자 그,Interior
353,상품명 강의실 세미나실 회의실 사무실 바퀴 회전 의자 블,Interior
354,상품명 강의실 세미나실 회의실 사무실 사무용 의자 보라,Interior
355,상품명 강의실 세미나실 회의실 사무실 사무용 의자 블루,Interior
356,상품명 회의실 사무용 의자 강의실 도서관 학원 상담용 체,Interior
357,상품명 사무용의자    듀얼체어 블루 책상의자,Interior
358,상품명 회의의자    매쉬체어 그린 컴퓨터용의자 사무용의,Interior
359,상품명 낮은 바퀴 보조 의자 간의 패디 의자 네일 재료 가,Interior
360,상품명 사무실 사무용 오피스 컴퓨터 책상 모시 의자 분체,Interior
361,상품명 회사 사무실 회의실 강의실 세미나실 의자 로라 블,Interior
362,상품명 해피서랍장 단,Interior
363,상품명 해피서랍장 단,Interior
364,상품명    뉴 접이식 테이블          강의실 회의책상 탁,Interior
365,상품명 안깨지는 방역 투명 가림막 칸막이 회의실 식당  인,Interior
366,상품명 모던 사무실 접이식 의자 폴딩 체어 간이의자,Interior
367,상품명 지주스탠드 대형주물      강철 실험실,Interior
368,상품명 비말 차단 방역 안전 투명 칸막이 가림막 회의실  ,Interior
369,상품명 비말차단 방역 투명칸막이 안전가림막 상담실  인용,Interior
370,상품명 투명 칸막이 비말차단 안전 가림막 회의실 접수처  ,Interior
371,상품명 문구사무용품 파티션 클립 페이퍼클립 페이퍼집게,Interior
372,상품명 안전한 생활 화재안전,Interior
373,상품명     만공한국사 조선 태극기,Interior
374,상품명       신형진찰용  형 원 검사출 진료의자,Interior
375,상품명  인용 비말차단 투명 칸막이 가림막 식당 공장직영,Interior
376,상품명 샤워걸이 단,Interior
377,상품명 온누리다용도신발장  족,Interior
378,상품명 모던지그재그 단 일반 ,Interior
379,상품명 알파고정쿠션 레드 레드레쟈,Interior
380,상품명 회사 사무실 회의실 세미나실 학생 학교 강의실 의,Interior
381,상품명        명함꽂이 실버  명함집 명함정리함,Interior
382,상품명 북앤드  형 사무용 책꽂이 중형  개 세트,Interior
383,상품명           도금 블랙 중역용 중역용의자  중역용의자 사무용의자 다용도의자 관리자용의자 임원용의자,Interior
384,상품명        단투명쫄대가림판화일 대형   단 가림판 가림판 투명 가림판화일 책상 가림막 개인칸막이,Interior
385,진영가구 상품명 신멀티 회의용 회의실의자 사무용의자 회의용의자 스틸다리의자 사무실회의의자 회의용사무의자 대기실의자,Interior
386,상품명 접의식책상 강의실테이블  연수용책상 세미나 학원 교회 학교 회의용 수강용                  ,Interior
387,상품명 사무용 사무실  형 퍼즐형 넓은 책상,Interior
388,상품명 퍼시스 서울대 의자 블랙쉘 화이트쉘                     독서실 학생 사무용,Interior
389,상품명 엘리트 와이드 독서실책상           스탠드 그레이,Interior
390,상품명 시니프 에어웰         올메쉬 컴퓨터 책상 사무용의자,Interior
391,상품명 사각장의자 등무      인 로비 대기실 휴게실 병원 약국 장의자,Interior
392,나인홈 상품명 포밍테이블 접이식테이블 다용도테이블 회의         ,Interior
393,파미가구 상품명 피오르장의자  인용등무 대기용의자 로비의자 대기 약국의자 병원의자 간이의자 재고 소진시까지 할인판매,Interior
394,내마우스 상품명 사무 회의용 등받이 보조 쿠션 고정식크롬라운딩의자,Interior
395,상품명  단 락커 캐비넷 옷장 사물함,Interior
396,상품명          사무용책상 사무실 컴퓨터 책상,Interior
397,상품명 병원용 원형회전의자 진료실 연구실 작업용 약국 진찰용 형의자 바퀴 고정 선택가능 ,Interior
398,상품명 캐비넷 락카장 사무실옷장 개인사물함 사무실 개인옷장,Interior
399,퍼시스 상품명 퍼시스 시스템 하부장 모듈  단서랍장 책상 보조 사이드 수납장 사무실       ,Interior
400,듀오백 상품명 듀오백  년형  플러스        메쉬의자         ,Interior
401,상품명 퍼시스 서울대 의자          독서실 학생 컴퓨터,Interior
402,상품명 시디즈               에어 라이트 사무용 메쉬 의자,Interior
403,상품명 포밍테이블 가정용 회의용 다용도 사무실 책상         ,Interior
404,상품명 빠른 배송안내판 명함 직급 파티션이름표 아크릴 회사 양면,Interior
405,노바디 상품명 노바디체어 허리편한 사무용 컴퓨터 학생 책상 의자      스스로 바른자세 유도 장시간 허리 부담 최소화,Interior
406,상품명 아네모네 사무용 의자 흰사출,Interior
407,상품명 퍼시스          회의용의자 글라이드 회의실 사무실,Interior
408,상품명  단 선반형 좁은 책장 하부서랍 틈새 책꽂이    ,Interior
409,상품명 퍼시스 연세대의자        학생 공부 책상 서울대 의자 회의용 컴퓨터 수험생 학원 강의실 허리에 편한,Interior
410,상품명       가구느낌 위니책장  단,Interior
411,상품명 강의대 보급형 강연대 교탁 스탠딩책상 강의용책상,Interior
412,동서가구 상품명 동서가구 스테이       형 책장책상         ,Interior
413,상품명 약국용의자 병원대기용의자 휴게실용 은행 대기 사무실장의자,Interior
414,상품명 그레이 이동형 사무실 서랍장 회사 보조 책상 서재 컴퓨터,Interior
415,상품명 편한 의자 사무실 회의용 의자 회의실 의자 대기실 강의실 휴게실 강당 공부방,Interior
416,상품명 국산 의자 진찰의자 병원의자 빵의자 원형 간이의자,Interior
417,와이디가구 상품명  수량한정특가   단 이동서랍 사무용 수납장 펜서랍,Interior
418,투버스 상품명 레제르티 메쉬의자 편한 컴퓨터 책상 사무실 책상    ,Interior
419,상품명 편한 침대형의자 네즈 컴퓨터 책상 사무실 사장님 리클라이너,Interior
420,상품명 레인보우 회의용 아이보리 사무용 공부 교구용가구소품 컴퓨터 사무교구용가구 게이밍 가구인테리어,Interior
421,상품명 원목파티션 예쁜칸막이 다용도 가벽  단 파티션     ,Interior
422,상품명 패브릭의자 머리받침 사무실 서재 컴퓨터 의자 블랙 ,Interior
423,상품명 라탄 오픈형  단 접이식 파티션             베이지 ,Interior
424,상품명 라탄 구텐  단 접이식 파티션             화이트 ,Interior
425,상품명 라탄 오픈형  단 접이식 파티션             화이트 ,Interior
426,상품명 작업 등무 환의자 다용도 스툴 공장 회전의자 간이의자 작업용의자 공장의자 진찰의자 진찰용의자 병원의자,Interior
427,상품명  블랙  환의자 고정 작업의자 작업용의자 공장의자 진찰의자 진료실의자 스툴의자 높이조절의자 업소의자,Interior
428,상품명 굿단미 파티션 걸이 케이스 세트   사무실파티션꽂이 파티션아크릴 아크릴파티션꽂이 파티션걸이대 파티션,Interior
429,상품명 기도 체형교정 허리디스크에 좋은 자세 김연아 통풍 의자 등받이,Interior
430,상품명 사무실  단 사출 이동식 잠금 보조 서랍    수납장 책상밑 회사 열쇠 사이드 서류,Interior
431,상품명 회의실 사무실 연수원 등받이 의자    스틸 일체형 체어 팔걸이없는 업무용 고정형,Interior
432,상품명 이동서랍 펜목재서랍 사무실서랍,Interior
433,상품명 고정식 등받이 회의실 사무실 의자 인테리어 체어,Interior
434,상품명 카페 인테리어 의자 예쁜 책상 거실 식탁 체어,Interior
435,상품명 병원용회전의자 진료실 연구실 약국 작업장 진찰용 형오리발 링사발 바퀴 고정 선택가능 ,Interior
436,상품명 다용도 정리박스  호 수납함 정리함 플라스틱 바스,Interior
437,상품명 일루일루 리오넬 회전형 메쉬 체어       학생 공부 의자,Interior
438,상품명 스마트 포밍테이블          사무용 회의용 책상,Interior
439,공식 상품 베스트리빙 상품명 매화  단 파티션 원목파티션 칸막이 가리개,Interior
440,공식 상품 베스트리빙 상품명 애슐리 파티션 칸막이 인테리어파티션  단 파티션,Interior
441,파미가구 상품명 무료배송 챠밍팔무의자 진찰용의자 진찰의자 진료의자 작업의자 병원의자 보조의자 실험실의자 간이의자,Interior
442,상품명 원목 사무용 서랍장 틈새 미니 서랍 책상 선반 사무실 책장 보조 정리함 프린터 받침대 수납장  리치,Interior
443,라샘 상품명 토끼 베이비장 주니어 아동 옷장             착불,Interior
444,상품명 벨류템  단 높이조절 발받침대 철재 받침대,Interior
