,titles,category
0,상품명 냉동목전지 수입 돼지목살 제육볶음용      수입산 돼지고기 목전지 돼지목살 돼지제육,Food
1,상품명 국내산 돼지 김치찌개용 앞다리살 한돈 세절      찌개용 김치찌개용 앞다리살 돼지고기,Food
2,상품명 한돈 돼지 앞다리살 냉동돼지고기 불고기용      앞다리살 불고기용 제육볶음 돼지고기 한,Food
3,상품명 한돈 돼지앞다리살 수육 보쌈용 고기      앞다리살 보쌈용 수육 돼지고기 한돈,Food
4,상품명 한돈 돼지고기 앞다리살 구이용      앞다리살 구이용 수육 돼지고기 한돈,Food
5,상품명 한돈 돼지고기 목살 캠핑구이용      한돈 돼지고기 목살 캠핑고기 구이용,Food
6,상품명 한돈 돼지목살 숯불 돼지고기 바베큐용      한돈 돼지고기 목살 캠핑목살 숯불용,Food
7,상품명 한돈 보쌈고기 돼지목살 수육용      한돈 돼지고기 목살 보쌈 돼지수육,Food
8,상품명 구이용 한돈 돼지고기 삼겹살      돼지고기 삼겹살 한돈 국산 돼지삼겹,Food
9,상품명 국내산 냉동삼겹살 수육 보쌈용 두툼한삼겹살      한돈 돼지고기 삼겹살 보쌈 돼지수육,Food
10,상품명 수입산 냉동 돼지고기 수육용 삼겹살      수입산 돼지수육 캠핑고기 보쌈 삼겹살,Food
11,상품명 국내산 돼지고기 삼겹살 캠핑고기 바베큐용      돼지고기 삼겹살 한돈 국산 캠핑바베큐,Food
12,상품명 미국산 대패 삼겹살 돼지고기      수입산 돼지고기 대패삼겹 삼겹살 삼겹살구이,Food
13,상품명 수입산 냉동 삼겹살 돼지고기      수입산 돼지고기 옛날삼겹 삼겹살 삼겹살구이,Food
14,상품명  야미소      오전  시 주문건까지 명절전출고 야미소 미국산 블랙앵거스 초이스 냉장 소고기 선물세트   ,Food
15,상품명 한돈 종합선물세트 삼겹살 돼지갈비 항정살 목살  등급       축협 설 명절,Food
16,삼다몰 상품명 제주 흑돼지 선물세트  호,Food
17,상품명 돼지머리고기 절단        개 수육 돼지국밥 순대국밥,Food
18,상품명 돼지머리고기 절단      편육 수육 돼지국밥 순대국밥,Food
19,미트아울렛 상품명 신선 삼겹살 원육        독일산,Food
20,상품명 한돈 암돼지  등급 삼겹살      국내산 생고기 전문점,Food
21,상품명 한돈 암돼지  등급 오겹살      국내산 생고기 전문점,Food
22,상품명 수입 돈뼈 감자탕용       캐나다 살밥많은 돼지 목뼈 등뼈,Food
23,상품명  한원푸드     오전 시 주문건까지 명절전출고냉동웰던푸드 호주산   갈비     찜갈비    ,Food
24,상품명 통등갈비               미국산 수입돼지고기,Food
25,삼다몰 상품명 제주 흑돼지 선물세트  호,Food
26,삼다몰 상품명 제주 흑돼지 선물세트  호,Food
27,으뜸한돈 상품명 바로배송 국내산 한돈 냉장 삼겹살 목살     선물세트 구이용  선물포장,Food
28,배터짐 상품명 통 돼지머리      내외 순대 곱창 대창 막창 돼지염통,Food
29,       상품명     고소한 목삼겹 구이용        팩,Food
30,미트아울렛 상품명 신선 삼겹살 구이용      독일산,Food
31,하몽 상품명  무료배송  하몽 이베리코 데 베요타    ,Food
32,배터짐 상품명 미국 돼지갈비   대갈비 쪽갈비 등갈비 스페어립 등뼈,Food
33,상품명 국내산 돼지갈비             찜용   한돈 강원도 돼지고기 갈비찜,Food
34,상품명 국내산 돼지갈비            구이용   한돈 강원도 돼지고기 갈비,Food
35,홈쇼핑 상품 상품명 소돈가 돼지 등갈비 쪽갈비 폭립 로인립        ,Food
36,상품명 지리산산골흑돼지 흑돈 선물세트  호,Food
37,상품명 냉동미국산 소스와 볶아먹는 매콤달콤 제육볶음       ,Food
38,상품명 베스트밀 냉동 삼겹살       팩  총          씩 소분 포장하여 발송,Food
39,배터짐 상품명 구이용 돼지 오겹살     삼겹살 뒷고기 목살 돼지갈비,Food
40,배터짐 상품명 돼지족발 앞족   개 곱창 대창 막창 돼지간 돼지염통,Food
41,상품명 캐나다 돼지 목뼈     감자탕 뼈찜   수입 돼지고기 업소용 대용량 등뼈,Food
42,상품명 더느림  무항생제 삼겹살       ,Food
43,상품명   식 양념돼지갈비       팩,Food
44,배터짐 상품명 업소용 돼지목뼈      돼지등뼈 삼겹살 오겹살 항정살,Food
45,배터짐 상품명 돼지목뼈     돼지등뼈 삼겹살 오겹살 항정살 캐나다산,Food
46,배터짐 상품명 업소용 돼지목뼈      돼지등뼈 삼겹살 오겹살 캐나다,Food
47,상품명 삼겹살  냉동 수육용 통삼겹       스페인산,Food
48,상품명 삼겹살  냉동 통삼겹       스페인산,Food
49,홈쇼핑 상품 몽탄 상품명 몽탄 꽃갈비살 우대갈비  대        유자와사비 소스     ,Food
50,상품명 베스트밀 냉동 통삼겹살      팩  총     수육 보쌈 구이용     씩 소분 포장하여 발송,Food
51,상품명 고기중독 우대갈비        번 캠핑고기   생와사비  개 증정,Food
52,상품명 도래창      특수부위 돼지부속 돼지부속물 돼지부속,Food
53,배터짐 상품명 고급요리 새끼돼지  애저       통돼지 바베큐 갈비,Food
54,상품명 미트프로젝트 당일생산 냉장 소고기 부채살 스테이크         팩,Food
55,상품명 돼지갈비찜 세트  프리미엄 돼지갈비 찜용        직접만든 건강한 소갈비소스      ,Food
56,홈쇼핑 상품 상품명  등급 한돈 대패삼겹살       팩 대패목살       팩,Food
57,배터짐 상품명 삶은 돼지 오소리감투 세절 오소리 돼지위    ,Food
58,배터짐 상품명 삼겹살 옆추리 세절     제육볶음 두루치기,Food
59,홈쇼핑 상품 상품명 프리미엄 듀록 흑돼지 세트     뼈삼겹 오겹살 목살 외,Food
60,상품명 프리미엄 갈매기살            팩 ,Food
61,상품명 바라던 시그니처 기름손질 잘 된         갈비     꽃갈비 ,Food
62,농협안심한돈 상품명     오전 시 주문건까지 명절전출고 농협안심한돈 명품 한돈 돼지고기 선물세트  호      삼겹살       ,Food
63,자연맛남 상품명     오전 시 주문건까지 명절전출고 자연맛남 강원도  등급 한돈 선물세트  구  호     삼겹살         ,Food
64,홈쇼핑 상품 도드람한돈 상품명   도드람한돈 냉장 삼겹살       구이 보쌈용 ,Food
65,상품명 송월타올 한국 손행주  매       세트  ,Food
66,상품명 압축 일회용 타올 외출 여행 등산 낚시 압축타월      매입  ,Food
67,상품명 양념 불고기 불백 돼지불고기       개,Food
68,상품명 너무 맛난 제주백년초함유 돼지양념갈비    ,Food
69,상품명 돼지 불백 불맛 간장 양념불고기           매입  ,Food
70,상품명 프리런 아이스 스포츠타월오렌지헬스 등산 쿨링타월      매입  ,Food
71,상품명 목살 구이용 저지방      이지팩    인용 소포장,Food
72,상품명 후지 제육용 뒷다리살      국내산  인분 제육 주물럭,Food
73,상품명 왕목살 불고기 제육용      수입돼지고기,Food
74,상품명 명품 대패삼겹살  팩   대패 목살  팩          팩  총       이지팩 소포장,Food
75,상품명 목전지 찌개용      찌개용 절단 이지팩 진공 소포장,Food
76,상품명 한돈 암돼지  등급 등심      돈까스용 생고기,Food
77,친절정육점 상품명 한돈 뒷다리살 제육 보쌈 찌개 다짐육,Food
78,상품명 프리미엄 항정살      쫄깃한 식감의 돼지 특수부위,Food
79,상품명  인정푸드     월  오전  시까지 주문시 명절전배송바로배송냉동리얼블랙프리미엄 블랙앵거스     ,Food
80,우체국쇼핑 상품명 나주목장 함초를 먹여 키운 한돈구이선물세트      ,Food
81,상품명 템포크 듀록 흑돼지 정통목살     매혹적인 맛,Food
82,미트아울렛 상품명 이베리코 베요타 선물세트       부직포가방,Food
83,배터짐 상품명 생 돼지머리 한개      내외 발골머리 돼지국밥순대국,Food
84,상품명 돼지고기 삼겹살 대패삼겹용     총    오스트리아산 ,Food
85,공식 상품 프레시누리 상품명     고소한 목삼겹 구이용        팩,Food
86,상품명 케이쿡 폭립  종  팩 선물세트  바베큐  매콤폭립  숯불구이향폭립  ,Food
87,우체국쇼핑 상품명 남도목장 녹차먹여 키운 한돈 구선물세트      ,Food
88,상품명 삶은 돼지머리 통  한마리     돼지장육,Food
89,국제식품 상품명 국제식품 우리돼지 한돈 냉장 칼집 벌집 목살      구이용 바베큐용 ,Food
90,배터짐 상품명 업소용 돼지껍데기      삼겹살 오겹살 목살 돼지갈비,Food
91,상품명 헤이미트 국내산 돼지목살 한정수량 목살 구이용 냉동목살     ,Food
92,배터짐 상품명 돼지목뼈     돼지등뼈 돼지머리 돼지귀 돼지혀 사골,Food
93,배터짐 상품명 돼지 내장 갈매기살    뒷고기 삼겹살 항정살 오겹살,Food
94,홈쇼핑 상품 데일리이츠 상품명 데일리이츠 프리미엄 대패 삼겹살 구이용    ,Food
95,배터짐 상품명 왕덜미살     뒷고기 꼬들살 삼겹살 오겹살 돼지목살,Food
96,금천미트 상품명 덴마크 삼겹살    ,Food
97,상품명 베스트밀 냉동 항정살       팩  총          씩 소분 포장하여 발송,Food
98,배터짐 상품명 업소용 듀록 돼지고기 삼겹살 다짐육     오겹살 목살,Food
99,상품명 국내산 제주 흑돼지로 만든 양념왕구이        총      ,Food
100,공식 상품 프레시누리 상품명 누리푸드 프리미엄 목살과 앞다리살 주물럭용       팩,Food
101,홈쇼핑 상품 상품명   프레시 바베큐폭립        팩,Food
102,상품명 순수본가 진심 통오겹살  등분     ,Food
103,공식 상품 프레시누리 상품명 누리푸드 돼지 갈비찜용 큐브 삼겹갈비 스페어립        팩       ,Food
104,상품명 삼겹살 돼지고기    삼겹살꼬치      ,Food
105,배터짐 상품명 수육용 듀록 돼지 삼겹살    ,Food
106,공식 상품 이마트 상품명 미트센터 스페인산 뼈없는 대패 삼겹살      구이용 돌돌말이   팩   팩이상 무료배송,Food
107,일품나라 상품명 호주산 찜갈비      팩 일반 아이스박스 포장 ,Food
108,배터짐 상품명 돼지 오겹살 깍두기    훙쏘우러우,Food
109,공식 상품 프레시누리 상품명 누리푸드 오돌뼈 없는 통삼겹 바베큐용 보쌈용     ,Food
110,상품명 바디클 버블 목욕 거품 샤워타월 샤워볼핑크베이지      매입  ,Food
111,상품명 쿨링 스포츠 타월 에어홀 케이스세트 운동 아이스수건,Food
112,상품명 소프렌 샤워볼          매입  ,Food
113,상품명 꽈배기 스크럽 바디 샤워 스펀지 거풍망          매입  ,Food
114,상품명 뽀송데이 격자무늬 순면타월핑크 세안수건      매입  ,Food
115,상품명 쿨링 스포츠 타월 에어홀 케이스세트 등산 아이스수건,Food
116,상품명 미니 세면타올 타월   블루       매입  ,Food
117,상품명 쿨러 휴대용 스포츠타올핑크 습식타올      매입  ,Food
118,상품명 현지푸드 내장국밥재료 돼지내장 삶은돼지소창    ,Food
119,물고기삼촌 상품명 돼지고기 등갈비 쪽갈비        ,Food
120,상품명 가야촌 한돈 돼지고기 뒷다리살     ,Food
121,상품명 미트하우스 등 갈비 로인립 통절단     쪽 살 스페인 산 냉동 바베큐 찜 구이,Food
122,상품명 와프레쉬 한돈 후지 뒷다리살 대용량 원육     내외 업소용 식당용,Food
123,삼다몰 상품명 삼다몰 제주 흑돼지 오겹살 가정용       팩 ,Food
124,상품명 옛날냉동삼겹살         팩 총      한팩당  인분,Food
125,자연맛남 상품명     오전 시 주문건까지 명절전출고 자연맛남 유황먹인 한돈 돼지 선물세트  호       삼겹살 팩 목   ,Food
126,상품명 지방제거 통갈매기살         팩 손질잘된,Food
127,상품명 비교불가 돼지목뼈 소포장 푸짐한살고기    ,Food
128,상품명 국내산 냉장 돼지고기 사태     ,Food
129,미트아울렛 상품명  미트아울렛  돼지목뼈 미국산      ,Food
130,상품명 특가판매 대패삼겹살      수입돼지고기,Food
131,상품명 왕목살 보쌈용           수입돼지고기,Food
132,상품명 한돈 앞다리살      구이 보쌈 제육 찌개,Food
133,상품명 돼지갈비 찜용      국내산 돼지고기,Food
134,고기천국 상품명 고기천국 삼겹살 바베큐용       ,Food
135,상품명 현지푸드 돼지고기 특수부위 촉촉살코기 수육용    ,Food
136,상품명  으뜸한돈 국내산 냉장 삼겹살 목살 구이선물세트      한돈  돼지고기 선물세트 무료배송,Food
137,상품명 절단 등갈비     미국산 수입돼지고기,Food
138,상품명 국내산 삼겹살 보쌈용 및 수육용       강원도 한돈 돼지고기 통삼겹 오븐구이,Food
139,자연맛남 상품명 자연맛남 저온숙성 큐브 양고기 쯔란세트    쯔란세트,Food
140,상품명 돼지고기 삼겹살 판삼겹 원육       오스트리아산 ,Food
141,상품명 돼지머리고기 반마리 약          편육 수육 돼지국밥,Food
142,배터짐 상품명 배터짐 뒷덜미살   삼겹살 뒷고기 목살 항정살 오겹살,Food
143,배터짐 상품명 캠핑 돼지갈비     바베큐립 대갈비 쪽갈비 등갈비,Food
144,금천미트 상품명 동원 납작 육전 홍두깨          팩,Food
145,상품명 돼지고기 한돈  등급 돈토마호크            총  덩어리  돈마호크,Food
146,우체국쇼핑 상품명 남도목장 보성 녹차 먹여키운 한돈구이선물세트     ,Food
147,배터짐 상품명 수육통 돼지 삼겹살   오겹살 목살 앞다리살 가브리살,Food
148,배터짐 상품명 미국산통 돼지갈비     내외 등갈비 쪽갈비 등뼈 목뼈,Food
149,상품명 한돈 안심 덩어리    장조림용 돈가스용 냉장  개,Food
150,상품명 국내산 돼지목살 수육용     보쌈 한돈   강원도 돈목심 돼지고기 통목살,Food
151,상품명 한돈 국내산 돼지 목살 찌개용       강원도 돼지고기 국내산,Food
152,배터짐 상품명 국내산 삶은 돼지곱창 소창 세절     막창 대창 순대,Food
153,상품명 가야촌 한돈 돼지뒷고기 모듬     ,Food
154,홈쇼핑 상품 상품명 우돈타 우리돼지 한돈 생대패 삼겹살     ,Food
155,배터짐 상품명 특미 이베리코 수육용 삼겹살     오겹살 목살 항정살,Food
156,상품명 한돈 강원도 한입 삼겹살     구이용 냉삼 옛삼   국내산 돼지고기 집밥 삼겹,Food
157,상품명 한돈 강원도 돼지 목살 구이용 및 스테이크용       한돈 돼지고기 돈목심 숯불구이 바베큐 캠핑,Food
158,상품명 국내산 한돈 시즈닝 목살스테이크        ,Food
159,공식 상품 대한민국농수산 상품명 지리산 순수혈통 흑돼지 삼겹살      구이용    국내  명 흑돼지명인,Food
160,배터짐 상품명 돼지목뼈     돼지등뼈 등뼈찜 감자탕 뼈해장국 뼈찜,Food
161,배터짐 상품명 돼지목뼈     돼지등뼈 돼지갈비 돼지머리 캐나다산,Food
162,배터짐 상품명 돼지장족    개     내외 돼지족발 삼겹살 오겹살,Food
163,금천미트 상품명 동원 금천한돈 앞다리살 두루치기용      냉장 ,Food
164,배터짐 상품명 왕덜미살     뒷고기 꼬들살 삼겹살 오겹살 돼지목살,Food
165,배터짐 상품명 왕덜미살     뒷고기 꼬들살 삼겹살 오겹살 돼지목살,Food
166,배터짐 상품명 업소용 왕덜미살      뒷고기 꼬들살 삼겹살 오겹살,Food
167,상품명  보성녹돈  한돈 앞다리살 찌개용          팩,Food
168,상품명 국내산 돼지 수육 머리고기 머릿고기 돼지머리    ,Food
169,홈쇼핑 상품 상품명 닭 염통 삼겹 은행 모듬꼬치         개 ,Food
170,공식 상품 프레시누리 상품명 누리푸드 프리미엄 목살과 앞다리살 주물럭용       팩,Food
171,상품명 솔티봉고 솔트에이징 진심선물세트     명절선물세트 돈마호크도끼삼겹살갈매기살항정살캠핑고기,Food
172,배터짐 상품명 통 돼지 삼겹살 수육    ,Food
173,상품명  리얼블랙     월  오전  시까지 주문시 명절전배송냉동리얼블랙 블랙앵거스   갈비     선물세트   ,Food
174,홈쇼핑 상품 상품명 국내산 대용량 돼지머리 수육       인분,Food
175,상품명 템포크 수육용 삼겹살      등분  보쌈용 바베큐용,Food
176,상품명 가야촌 한돈 냉장 앞다리살     ,Food
177,상품명 엄마손 왕돼지 갈비 국내산   박스        통   대 갈비 돼지갈비 양념갈비 양념구이 갈비찜,Food
178,상품명          국내산 삼겹살 냉장     ,Food
179,상품명 도드람한돈 생 목살 구이용     ,Food
180,공식 상품 프레시누리 상품명 프리미엄 삼겹살 숯불바베큐용        팩,Food
181,미트아울렛 상품명 신선 삼겹살 보쌈용      ,Food
182,미트아울렛 상품명  미트아울렛  신선 왕목살 숯불용  미국산      목전지,Food
183,상품명 안동식 간장맛 닭갈비      개     순살닭갈비 닭고기,Food
184,상품명 수제 불고기패티        개 햄버거패티 햄버거재료,Food
185,상품명 국내산  등급 이상 돼지 뒷다리살 후지     잡채용   한돈 채썬고기 요리 집밥,Food
186,상품명 쫄깃한 갈매기살      특수부위 구이용,Food
187,상품명 항정살 템포크 정통 콜라겐 항정살       팩,Food
188,상품명 가야촌 한돈 냉동 뒷다리살      지방없음   냉동불고기용,Food
189,상품명 황금한우 한돈 돼지목뼈  냉장     ,Food
190,상품명  해담한우     오전 시 주문건까지 명절전출고냉동해담한우 한돈   갈비 선물세트    ,Food
191,       상품명     고소한 목삼겹 구이용        팩,Food
192,공식 상품 프레시누리 상품명 프리미엄 삼겹살 구이용        팩,Food
193,상품명 국내산 돈 등갈비 쪽갈비        한돈  등급이상,Food
194,상품명 국내산 돼지갈비     찜용   강원한돈 갈비찜 돼지고기,Food
195,미트아울렛 상품명 돼지갈비 찜용      칠레산,Food
196,상품명  가지소 가지소 미국산 채끝등심 스테이크용      팩,Food
197,신선애 상품명 냉동 저지방 소고기 설도 슬라이스           팩 ,Food
198,도드람한돈 상품명 도드람한돈 생 목심 구이용     ,Food
199,홈쇼핑 상품 김나운더키친 상품명 김나운더키친 떡갈비명작   팩   장,Food
200,상품명 식당 업소용 국산 한돈 돼지등갈비 찜용     냉장  개,Food
201,상품명 토랑토랑 훈제돈삼겹살슬라이스         팩   참나무 훈연 소스포함 ,Food
202,미트아울렛 상품명 신선 왕목살 목전지  숯불용     미국산,Food
203,상품명 한돈 국내산 돼지 안심 덩어리     수육   강원도 돼지고기 보쌈 편육,Food
204,상품명 지리산 흑돼지 앞다리살 구이 찌개 불고기 수육    ,Food
205,상품명 국내산 돼지 뒷다리살 수육용     보쌈   한돈 강원도 돼지고기 김장,Food
206,상품명 국내산  등급 이상 돼지 등심      돈까스용 한돈   강원도 한돈 돼지고기 맥적 산적,Food
207,바로푸드 상품명 대패삼겹살 구이용    ,Food
208,바로푸드 상품명 항정살 구이용     ,Food
209,홈쇼핑 상품 상품명 도드람한돈  칼집 삼겹살 구이용        팩,Food
210,바로푸드 상품명 오겹살 구이용    ,Food
211,홈쇼핑 상품 상품명 소돈가 돼지 등갈비 쪽갈비 폭립 로인립      ,Food
212,상품명 도축 일내 한돈 삼겹 목살 명절 추석 설 선물세트         총    냉장 무항생제 돼지 고기,Food
213,미트킹 상품명 국내산 한돈   등급 통전지 통앞다리살 원육    ,Food
214,상품명 돼지갈비 갈비찜 찜용 진공 소포장         팩,Food
215,배터짐 상품명 통 돼지 삼겹살     오겹살 목살 돼지갈비 돼지족발,Food
216,배터짐 상품명 업소용 돼지족발 앞족      돼지장족 오겹살 삼겹살,Food
217,상품명 한돈 강원도 돼지 뒷다리살 잡채용       국내산 돼지고기 돈후지 채 볶음 요리 집밥,Food
218,상품명 더느림  무항생제 목심       ,Food
219,상품명 국내산 돼지고기 삼겹살  구이용 수육용 숯불용     ,Food
220,상품명 국내산 돼지고기 목살  구이용 수육용 숯불용     ,Food
221,국제식품 상품명 국제식품 우리돼지 한돈 냉장 갈매기살      구이용 바베큐용 ,Food
222,상품명 돼지고기 수육         개 빛나는밥상,Food
223,친절정육점 상품명 수입 통삼겹살      원육 슬라이스  무료배송,Food
224,상품명 가야촌 한돈 돼지고기 냉동 삼겹살     ,Food
225,상품명 조가네축산 돼지불갈비      돼지양념불갈비,Food
226,배터짐 상품명 듀록 돼지고기 삼겹살 다짐육     오겹살 머리 항정살,Food
227,홈쇼핑 상품 상품명 맛갈 프리미엄 저온숙성 한돈 수제 양념 돼지갈비             인분 ,Food
228,공식 상품 프레시누리 상품명 바베큐용 등갈비    ,Food
229,국제식품 상품명 국제식품 한돈선물세트 모듬구이        삼겹    목살    항정    ,Food
230,상품명 베스트밀 냉동 오겹살 총              팩      씩 소분 포장하여 발송,Food
231,홈쇼핑 상품 상품명 보성녹돈 한돈 등갈비 선물세트    ,Food
232,홈쇼핑 상품 상품명 농협안심한돈 한돈구이선물세트  호     삼겹살 팩 목살 팩 팩당      ,Food
233,상품명 순수본가 꽃삼겹 대패 삼겹살     ,Food
234,상품명 한돈 정육선물세트  오겹살 삼겹살 목살       ,Food
235,배터짐 상품명 돼지 쪽갈비 돼지갈비    ,Food
236,배터짐 상품명 냉동 돼지막창 막창 돼지내장    ,Food
237,공식 상품 이마트 상품명 미트센터 온가족이 즐겨 먹는 냉동 항정살       구이용 스페인산   팩,Food
238,상품명 안심밥상 한돈 무항생인증 대패구이 뒷다리살         팩 총      ,Food
239,도드람한돈 상품명 도드람한돈 으뜸구이세트 총      ,Food
240,배터짐 상품명 삼겹살 옆추리 세절     제육볶음 두루치기,Food
241,홈쇼핑 상품 상품명 제주 흑돼지 왕 양념구이      ,Food
242,상품명 거품 샤워볼 목욕볼 샤워 타월 목욕 타올 때밀기         매입  ,Food
243,상품명  리얼블랙     월  오전  시까지 주문시 명절전배송냉동리얼블랙 블랙앵거스   갈비     선물세트   ,Food
244,모두의식탁 상품명     일 오전 시까지 주문시 명절전 출고호주산 쇠고기 육포 선물세트      편포      견과육포     ,Food
245,상품명 돼지고기 삼겹살 냉삼       팩 두께   ,Food
246,배터짐 상품명 업소용 한돈 돼지껍데기 뒷고기      원물 제육볶음,Food
247,배터짐 상품명 구이수육 삼겹살 뒷고기     돼지고기,Food
248,상품명  월  일 오후  시 결제건까지 명절전배송제주양돈농협 제주 흑돼지 종합세트  호     선물세트   오   ,Food
249,상품명  행사상품  등급이상일품포크 갈비     ,Food
250,삼다몰 상품명 삼다몰 제주 흑돼지 오겹살 수육용       팩 ,Food
251,삼다몰 상품명 삼다몰 제주 흑돼지 앞다리살 가정용       팩 ,Food
252,상품명 소돈가 한돈 국내산 대패삼겹살             ,Food
253,상품명  나성목장      오전 시 결제건까지 명절전배송 나성목장 프리미엄 미국산 앵거스 찜갈비 선물세트     ,Food
254,상품명 데일리이츠 프리미엄 통삽겹살     수육용,Food
255,상품명 프레시퍼스트 살집 두툽한 금쪽갈비 등갈비    ,Food
256,친절정육점 상품명 수입 삼겹살  항정살 가브리살 갈매기살 돼지고기 모음전,Food
257,상품명 대명축산식품 칠레산 목살     ,Food
258,삼다몰 상품명 제주 흑돼지 오겹살 구이용       팩  가정용,Food
259,공식 상품 프레시누리 상품명 프레시누리 고추장 제육불고기       팩,Food
260,고기천국 상품명 고기천국 삼겹살      ,Food
261,고기천국 상품명 한돈 뒷다리살  껍데기    제육용        제주도 돼지,Food
262,상품명 국내산 돼지고기 다짐육      개 돼지다짐육 만두속,Food
263,도드람한돈 상품명 냉장 도드람한돈 보쌈세트  총     ,Food
264,상품명 남도미향 도축장직영 일등급 암돼지 대패삼겹살      ,Food
265,고기천국 상품명  고기천국  목삼겹 구이용       ,Food
266,고기천국 상품명 한돈 등심  돈까스용       ,Food
267,상품명 도축  일내 닥터안스프레쉬 냉장 한돈 갈비 찜용      구이용    총    무항생제   명절 설 선물 세트,Food
268,프레시누리 상품명 누리푸드 프리미엄 통삼겹 바베큐용 보쌈용     ,Food
269,국제식품 상품명 국제식품 우리돼지 한돈 냉장 칼집 벌집 오겹살      구이용 바베큐용 ,Food
270,국제식품 상품명 국제식품 우리돼지 한돈 냉장 삼겹살      구이용 바베큐용 ,Food
271,공식 상품 대한민국농수산 상품명 지리산 순수혈통 흑돼지 삼겹살      수육용    국내  명 흑돼지명인,Food
