,titles,category
0,메디시스 호텔 바르셀로나   바르셀로나 가성비 인기 호텔,Trip
1, 그린델발트  호텔 크로이츠   포스트   스위스 가성비 인기 호텔,Trip
2,치선 호텔 하마마츠초   일본 도쿄 가성비 인기 호텔,Trip
3,로얄 파크 호텔   홍콩 가성비 인기 호텔,Trip
4,경기   더 숨 포레스트   듀플렉스  펜션형 ,Trip
5,부산   호텔 일루아   슈퍼 디럭스 더블 테라스 바다전망    룸온리  ,Trip
6,부산   호텔 일루아   스파 디럭스 테라스 바다전망    룸온리  ,Trip
7,경기   소노캄 고양   패밀리 웨스트 슈페리어 스탠다드 더블   와인디너     ,Trip
8,울산   울산 시티호텔   주니어 스위트   룸온리  ,Trip
9,호텔 에트와스 텐진   후쿠오카 가성비 인기 호텔,Trip
10,경북   한화리조트 경주 담톤동   담톤 로얄    확정예약   ,Trip
11,제주도 쏠라티   인승 승합차 렌트 스타리아 솔라티 대여 디젤   년식 평일 자차미포함,Trip
12,몬테벨로 빌라 호텔   세부 가성비 인기 호텔,Trip
13,제주   호텔 시리우스 제주   슈페리어 더블,Trip
14,제주   호텔 시리우스 제주   세미 스위트  인 조식     ,Trip
15,제주   호텔 시리우스 제주   디럭스 싱글트윈  인 조식     ,Trip
16,제주   호텔 시리우스 제주   슈페리어 싱글트윈,Trip
17,제주   호텔 시리우스 제주   디럭스 패밀리트윈  인 조식     ,Trip
18,제주   호텔 시리우스 제주   디럭스 싱글트윈,Trip
19,제주   호텔 시리우스 제주   시리우스 스위트  인 조식     ,Trip
20,제주   호텔 시리우스 제주   세미 스위트,Trip
21,제주   호텔 시리우스 제주   슈페리어 트리플  인 조식     ,Trip
22,제주   호텔 시리우스 제주   슈페리어 패밀리트윈  인 조식     ,Trip
23,제주   호텔 시리우스 제주   슈페리어 트리플,Trip
24,제주   호텔 시리우스 제주   슈페리어 싱글트윈  인 조식     ,Trip
25,제주   호텔 시리우스 제주   스탠다드 더블  인 조식      저층 ,Trip
26,제주   호텔 시리우스 제주   이그제큐티브 패밀리 더블  인 조식     ,Trip
27,제주   호텔 시리우스 제주   스탠다드 더블,Trip
28,제주   호텔 시리우스 제주   슈페리어 더블  인 조식     ,Trip
29,제주   호텔 시리우스 제주   슈페리어 패밀리트윈,Trip
30,제주   호텔 시리우스 제주   시리우스 스위트,Trip
31,제주   호텔 시리우스 제주   스탠다드 싱글트윈  인 조식      저층 ,Trip
32,제주   한화리조트 제주   디럭스 베드    박상품  원더스테이  ,Trip
33,오키나와 골프  월   홀 라운딩 오키나와    홀 단체 카누챠  홀,Trip
34,서울   더 클래식     펜타즈 호텔   주니어 스위트  취사 불가 ,Trip
35,부산   켄트호텔 광안리    켄싱턴   시네마 더블         조식  인     ,Trip
36,부산   켄트호텔 광안리    켄싱턴   포토제니아 더블 오션뷰 디너뷔페  인     ,Trip
37,부산   켄트호텔 광안리    켄싱턴   시네마 더블        ,Trip
38,부산   켄트호텔 광안리    켄싱턴   디럭스 더블 오션뷰 디너뷔페  인     ,Trip
39,부산   켄트호텔 광안리    켄싱턴   프리미어 더블 오션뷰,Trip
40,부산   켄트호텔 광안리    켄싱턴   프리미어 더블 오션뷰 조식  인     ,Trip
41,부산   켄트호텔 광안리    켄싱턴   디럭스 더블 오션뷰,Trip
42,부산   켄트호텔 광안리    켄싱턴   포토제니아 더블        ,Trip
43,부산   켄트호텔 광안리    켄싱턴   디럭스 더블 시티뷰 디너뷔페  인     ,Trip
44,부산   켄트호텔 광안리    켄싱턴   디럭스 트윈 시티오션뷰 디너뷔페  인     ,Trip
45,부산   켄트호텔 광안리    켄싱턴   디럭스 더블 시티오션뷰 조식  인     ,Trip
46,부산   켄트호텔 광안리    켄싱턴   디럭스 트윈 시티오션뷰,Trip
47,부산   켄트호텔 광안리    켄싱턴   포토제니아 더블 오션뷰 조식  인     ,Trip
48,부산   켄트호텔 광안리    켄싱턴   디럭스 더블 시티뷰 조식  인     ,Trip
49,부산   켄트호텔 광안리    켄싱턴   포토제니아 더블 오션뷰,Trip
50, 경주 숙소  경주신라한옥호텔 숙박 예약,Trip
51,제주 최남단체험감귤농장   제주도 서귀포 노지귤 감귤따기,Trip
52,국립중앙박물관 초등 세계사 체험 겨울방학특강 서울 어린이 역사체험학습 메소포타미아 도슨트 수업    술술풀리는히스토리,Trip
53,대구 히어로플레이파크 침산점 이용권   초대형 실내 테마파크,Trip
54,제주   스타즈호텔 제주 로베로   패밀리 스위트,Trip
55,서울   그랜드 인터컨티넨탈 서울 파르나스   클래식 킹                            인 호캉스 ,Trip
56,에그 무제한 휴대용 와이파이 연결 설치     무약정,Trip
57, 설날엔티몬해  전국 코코몽키즈랜드 키즈카페  개 지점   프리미엄 키즈 테마파크,Trip
58,강원   용평리조트    대기예약 빌라콘도   평 더블   리프트 렌탈 패키지  ,Trip
59,강원   용평리조트    대기예약 타워콘도 스탠다드 더블   리프트 렌탈 패키지  ,Trip
60,강원   용평리조트    대기예약 타워콘도 스탠다드 온돌   리프트 렌탈 패키지  ,Trip
61,강원   쏠비치 삼척 리조트   스위트 취사 스퀘어오션뷰 침대   오션        ,Trip
62,강원   용평리조트    대기예약 빌라콘도   평 온돌   리프트 렌탈 패키지  ,Trip
63,제주   제주 부영호텔 리조트    대기예약 리조트 프리미엄 스위트 오션뷰   룸온리  ,Trip
64,제주   제주 부영호텔 리조트    대기예약 리조트 프리미엄   룸온리  ,Trip
65,제주   제주 부영호텔 리조트    대기예약 호텔 스탠다드 더블   룸온리  ,Trip
66,대전   스탕달 호텔   주니어 스위트 파티룸   조식 무료 서비스  ,Trip
67, 제주도 숙소  라마다 제주시티 호텔 공항 근처 숙박 한라산 전망,Trip
68,일본유심 속도저하없는 찐 무제한 데이터 통화옵션 도코모 소프트뱅크 로컬망 일본 여행이심,Trip
69,부산   라발스 호텔 부산   스탠다드 하프오션 더블  인 조식     ,Trip
70, 마요르카 섬  호텔 칸 리에라   스페인 가성비 인기 호텔,Trip
71,로터스 빌리지 리조트 무이 네   판티엣 가성비 인기 호텔,Trip
72,    호텔 우메다 히가시   일본 오사카 가성비 인기 호텔,Trip
73,로컬망 일본 유심 도코모                 일본여행 로컬유심 일본유심칩,Trip
74,충남   온양 제일호텔    대기예약 스탠다드 트윈    ,Trip
75,모두여행사 가오슝대만  박 일 연휴여행 에어텔 여행 연휴 부산출발,Trip
76,서울   프레지던트 호텔   스탠다드 트윈 시청 남산뷰    룸온리  ,Trip
77,서울   이비스 스타일 앰배서더 서울 용산   핫딜   슈페리어 더블 핫딜  취소불가 ,Trip
78, 타이페이 타이베이  뉴 메이 플라워 호텔   대만 가성비 인기 호텔,Trip
79,제주   제주 씨에스 호텔 앤 리조트   로얄스위트 성수기            ,Trip
80,제주   제주 씨에스 호텔 앤 리조트   스위트 성수기            ,Trip
81,서울   트레블로지 명동 을지로 호텔   슈페리어 트윈 주차불가 ,Trip
82,서울   트레블로지 명동 을지로 호텔   패밀리 트윈 주차불가 ,Trip
83,덕산 스플라스리솜   스테이타워        평  클린형    인 조식   충남 예산 리조트 콘도 숙박 숙소,Trip
84,덕산 스플라스리솜   스테이타워        평  클린형  인 조식   충남 예산 리조트 콘도 숙박 숙소,Trip
85,덕산 스플라스리솜   스테이타워        평  클린형    인 조식   충남 예산 리조트 콘도 숙박 숙소,Trip
86,덕산 스플라스리솜   스테이타워        평  콘도형  인 조식   충남 예산 리조트 숙박 숙소,Trip
87,덕산 스플라스리솜   스테이타워        평  콘도형  인 조식   충남 예산 리조트 숙박 숙소,Trip
88,덕산 스플라스리솜   스테이타워        평  콘도형 스파  인   충남 예산 리조트 숙박 숙소,Trip
89,덕산 스플라스리솜   스테이타워        평  클린형    인 조식   충남 예산 리조트 콘도 숙박 숙소,Trip
90,덕산 스플라스리솜   스테이타워        평  클린형   스파  인   충남 예산 리조트 콘도 숙박 숙소,Trip
91,덕산 스플라스리솜   스테이타워        평  콘도형 스파  인   충남 예산 리조트 숙박 숙소,Trip
92,덕산 스플라스리솜   스테이타워        평  클린형   스파  인   충남 예산 리조트 콘도 숙박 숙소,Trip
93,덕산 스플라스리솜   스테이타워        평  클린형 스파  인   충남 예산 리조트 콘도 숙박 숙소,Trip
94,덕산 스플라스리솜   스테이타워        평  클린형   스파  인   충남 예산 리조트 콘도 숙박 숙소,Trip
95,덕산 스플라스리솜   스테이타워        평  클린형   스파  인   충남 예산 리조트 콘도 숙박 숙소,Trip
96,덕산 스플라스리솜   스테이타워        평  콘도형 스파  인   충남 예산 리조트 숙박 숙소,Trip
97,덕산 스플라스리솜   스테이타워        평  클린형    인 조식   충남 예산 리조트 콘도 숙박 숙소,Trip
98,덕산 스플라스리솜   스테이타워        평  콘도형  인 조식   충남 예산 리조트 숙박 숙소,Trip
99,충북   호텔 뮤제오   슈페리어 조식  인     ,Trip
100,충북   호텔 뮤제오   프리미엄 조식  인     ,Trip
101,충북   호텔 뮤제오   디럭스   시 체크인 ,Trip
102,호텔 더본 제주       월  스탠다드 더블   제주도 서귀포 숙박 숙소,Trip
103,싱가포르 말레이시아 인도네시아 코타키나발루 발리유심칩 데이터무제한구매 인천공항 수령 링심,Trip
104, 문자발송  소노벨 변산 오션플레이  종일권  대명리조트 아쿠아월드 워터파크 주중소인기준,Trip
105,서울   호텔 페이토 삼성   어반 더블   룸온리   어반 더블  ,Trip
106,태국 방콕 왕궁투어 에메랄드 사원 왓아룬 아동  ,Trip
107,경기   소노캄 고양   패밀리 슈페리어 스탠다드 더블   키즈윈터     ,Trip
108,경기   소노캄 고양   패밀리 슈페리어 스탠다드 트윈   키즈윈터     ,Trip
109,강원   쏠비치 양양 호텔   스위트 디럭스 스탠다드 더블 호텔     대기예약   ,Trip
110,인천   파라다이스호텔 리조트 파라다이스시티    스위트위드프렌즈 디럭스 스위트 더블,Trip
111,강원   용평리조트    대기예약 빌라콘도   평 더블   리프트 렌탈 패키지  ,Trip
112,강원   용평리조트    대기예약 빌라콘도   평 더블   리프트 패키지  ,Trip
113,강원   용평리조트    대기예약 타워콘도 스탠다드 온돌   동계 애니포레 패키지  ,Trip
114,강원   용평리조트    대기예약 빌라콘도   평 온돌   동계 조식 패키지  ,Trip
115,강원   용평리조트    대기예약 빌라콘도   평 온돌   동계 워터파크 패키지  ,Trip
116,인천   파라다이스호텔 리조트 파라다이스시티    룸온리 프리미어 디럭스 트윈,Trip
117,강원   용평리조트    대기예약 빌라콘도   평 온돌   리프트 패키지  ,Trip
118,강원   쏠비치 양양 호텔    대기예약 패밀리 오션뷰 패밀리 트윈 호텔     ,Trip
119,인천   파라다이스호텔 리조트 파라다이스시티    온더플레이트 조식 프리미어 디럭스 더블,Trip
120,인천   파라다이스호텔 리조트 파라다이스시티    스위트위드프렌즈 디럭스 스위트 트윈,Trip
121,강원   용평리조트    대기예약 빌라콘도   평 더블   동계 애니포레 패키지  ,Trip
122,강원   용평리조트    대기예약 그린피아콘도   평 슬로프뷰   리프트 패키지  ,Trip
123,강원   용평리조트    대기예약 그린피아콘도   평   동계 애니포레 패키지  ,Trip
124,강원   용평리조트    대기예약 빌라콘도   평 더블   리프트 렌탈 패키지  ,Trip
125,국내 포켓 와이파이        일 휴대용 와이파이도시락 에그 대여,Trip
126,부산   아난티 앳 부산 코브   디럭스 트윈 룸 마운틴뷰    인 조식      ,Trip
127,부산   아난티 앳 부산 코브   프리미엄 킹 룸 마운틴뷰    인 조식      ,Trip
128,부산   아난티 앳 부산 코브   디럭스 킹 룸 마운틴뷰    인 조식      ,Trip
129,금호제주리조트   스위트 프리미어   제주도 서귀포 콘도 숙박 숙소,Trip
130,골든싸이   바로유심 개,Trip
131,파크선샤인 제주    조식뷔페      파크 스위트   제주도 호텔 서귀포 숙박 숙소,Trip
132, 보홀오후호핑투어       미팅 씨푸드 거북이 열대어 버진섬  고프로  팀 전담가이드 ,Trip
133,부산   한화리조트 해운대   디럭스 원룸 호텔형 취사불가     대기예약   ,Trip
134,싱가포르 유심 말레이시아 유심 코타키나발루 칩 무제한 동남아  개국 동시 사용,Trip
135,부산   한화리조트 해운대   디럭스 키즈룸 원룸 호텔형    확정예약   ,Trip
136,서울   프레지던트 호텔   디럭스 트윈   룸온리  ,Trip
137,오크밸리 렌탈 샵 리프트권  장비  의류 패키지 당일 사용 가능 주간 오야 선택 주말,Trip
138,오색그린야드호텔    온캉스  호텔 디럭스 기준인원 온천  회   강원도 양양 숙박 숙소,Trip
139,오사카 가이유칸 수족관 입장권,Trip
140, 미야즈  아마노하시다테 호텔   일본 가성비 인기 료칸,Trip
141,헝산 모럴 빌라   상해 가성비 인기 호텔,Trip
142, 포르토  나이스 웨이 포르토 호스텔   포르투갈 가성비 인기 호스텔,Trip
143, 가와고에  가와고에 다이 이치 호텔   일본 가성비 인기 호텔,Trip
144,하이드 파크 인터내셔널   런던 가성비 인기 호텔,Trip
145,칼튼 팰리스 호텔   두바이 가성비 인기 호텔,Trip
146,카탈루냐 호텔   바르셀로나 가성비 인기 호텔,Trip
147, 가즈노  유제 호텔   일본 가성비 인기 료칸,Trip
148,모텔   라스베이거스   트로피카나   라스베가스 가성비 인기 호텔,Trip
149, 마드리드     하르딘 데 레콜레토스   스페인 가성비 인기 호텔,Trip
150, 끄라비  푼시리 리조트   태국 가성비 인기 호텔,Trip
151,레나스 도나우   비엔나 가성비 인기 호텔,Trip
152, 두바이  요크 인터내셔널 호텔   아랍 에미리트 가성비 인기 호텔,Trip
153, 바르샤바  호스텔 흐미엘나 룸  개   아파트먼트   폴란드 가성비 인기 호스텔,Trip
154, 파리  오텔 미모사   프랑스 가성비 인기 호텔,Trip
155, 세비야  호텔 플라사   스페인 가성비 인기 호텔,Trip
156,촐찬 리조트   파타야 가성비 인기 호텔,Trip
157,트래블로지 바이 윈덤 샌프란시스코 에어포트 노스   샌프란시스코 가성비 인기 호텔,Trip
158, 멜버른  스펜서 스트리트 아파트먼트   호주 가성비 인기 호텔,Trip
159,호텔 빌라 산 피오   이탈리아 로마 가성비 인기 호텔,Trip
160,마켓   스페인 바르셀로나 가성비 인기 호텔,Trip
161, 멜버른  스펜서 스트리트 아파트먼트   호주 가성비 인기 호텔,Trip
162,호텔 시레네타   이탈리아 로마 가성비 인기 호텔,Trip
163, 다카마쓰  타카마수 워싱턴 호텔 플라자   일본 가성비 인기 호텔,Trip
164, 마드리드  카탈로니아 플라사 마요르   스페인 가성비 인기 호텔,Trip
165, 스톡홀름                             스웨덴 가성비 인기 호스텔,Trip
166, 후지카와구치코  고난소우   일본 가성비 인기 호텔,Trip
167,호텔 메르쿠리오   이탈리아 밀라노 가성비 인기 호텔,Trip
168,시타딘 트로카데로   파리 가성비 인기 호텔,Trip
169, 마드리드     마드로뇨스   스페인 가성비 인기 호텔,Trip
170, 파리  오텔 메디아   프랑스 가성비 인기 호텔,Trip
171, 마요르카 섬  호텔 리우토트   스페인 가성비 인기 호텔,Trip
172, 아사히카와  쿠레타케 인 아사히카와   일본 가성비 인기 호텔,Trip
173, 파리  호텔 를레 베르손   프랑스 가성비 인기 호텔,Trip
174, 이스탄불  쿰부르가즈 마린 프린세스 호텔   튀르키예 터키 가성비 인기 호텔,Trip
175, 푸켓  캐피탈       시라 그란데 호텔   스파   태국 가성비 인기 호텔,Trip
176,트레판 호텔 앤 스위트 바이 파크흐루딘   두바이 가성비 인기 호텔,Trip
177,호텔 예오   바르셀로나 가성비 인기 호텔,Trip
178, 코펜하겐  압살론 호텔   덴마크 가성비 인기 호텔,Trip
179,아시안 루비 센터 포인트 호텔   베트남 호치민 가성비 인기 호텔,Trip
180,  렉스햄 가든스 호텔   영국 런던 가성비 인기 호텔,Trip
181,실롬 스페이스 호스텔   태국 방콕 가성비 인기 숙소,Trip
182, 코사무이  팜 코코 만트라   태국 가성비 인기 리조트,Trip
183, 센다이  코요 그랜드 호텔   일본 가성비 인기 호텔,Trip
184,     이그제큐티브 호텔   포르투갈 리스본 가성비 인기 호텔,Trip
185, 마드리드  호텔 브이피 자르딘 메트로폴리타노   스페인 가성비 인기 호텔,Trip
186,알라곤 웨스턴 호텔   베트남 호치민 가성비 인기 호텔,Trip
187,케브 호텔   이탈리아 밀라노 가성비 인기 숙소,Trip
188,릭스하우스   호스텔   독일 베를린 가성비 인기 숙소,Trip
189, 이즈모  트윈 리브스 호텔 이즈모   일본 가성비 인기 호텔,Trip
190,자겔로 비즈니스 호텔   헝가리 부다페스트 가성비 인기 호텔,Trip
191,도르셋 상하이   상해 가성비 인기 호텔,Trip
192, 시부카와  후쿠이치   일본 가성비 인기 료칸,Trip
193,호텔 안티크   체코 공화국 프라하 가성비 인기 호텔,Trip
194, 파리  호텔 가든 생 마르탱   프랑스 가성비 인기 호텔,Trip
195, 파리  레 자르댕 뒤 룩셈부르크   프랑스 가성비 인기 호텔,Trip
196,호텔 오타르   체코 공화국 프라하 가성비 인기 숙소,Trip
197, 가와고에  가와고에 도부 호텔   일본 가성비 인기 호텔,Trip
198,호텔 가르다   이탈리아 밀라노 가성비 인기 호텔,Trip
199, 마츠모토  호텔 이이다야   일본 가성비 인기 호텔,Trip
