,titles,category
0,카라경량점퍼           ,Fasion
1,크로커다일레이디 폭스카라구스패딩점퍼          ,Fasion
2,시슬리 토미 레아 투피스형 원피스             ,Fasion
3,라코스테 여성 헤비 다운               ,Fasion
4,톰보이 후드토글장식하프코트           ,Fasion
5,자체제작         머스트 슬랙스 복수구매 시 장당     원,Fasion
6,온앤온 허리밴딩 기모 부츠컷 팬츠                  ,Fasion
7,헤지스레이디스 헤지스 여성 캐시미어 혼방 니트,Fasion
8,어그            클래식 클리어 미니                                    ,Fasion
9,시슬리 슬림패딩          ,Fasion
10,널널 핀턱데님  단 기장선택 하이웨스트 와이드 청바지,Fasion
11,선택 번 스타일온에어 지스튜디오 뉴프렌치린넨    니트  종세트         ,Fasion
12,          차 볼륨브라렛           ,Fasion
13,       세븐플로어 벨벳 메리제인 몰드 플랫         ,Fasion
14,데일리앤 아이콘 여성 베이직 기모 긴팔 브이넥 티셔츠,Fasion
15,프로젝트엠 여성 반집업 스웨터 풀오버           ,Fasion
16,썸머 가디건 여성 여름볼레로 가디건 여름 크롭 긴팔 얇은 시스루,Fasion
17,몽돌         구스다운 캐주얼 벌룬핏 숏패딩 점퍼 라이트카키              ,Fasion
18,    쏘울 컨사이니 내몽고 캐시미어    터틀넥 여자,Fasion
19,후아유 스티브  넥 케이블 풀오버           ,Fasion
20,크리스티나앤코 프린트 하프 패딩코트,Fasion
21,탑텐 여성 아가일 가디건                  ,Fasion
22,폴햄 시흥점 폴햄 여성 덤블 보아 쉘파 후드집업           ,Fasion
23,    울블렌디드 타임리스 스퀘어넥       ,Fasion
24,          핏이 귀여운 덕다운 숏패딩           ,Fasion
25,지오다노 여성           플레인 터틀넥 스웨터       ,Fasion
26,지오다노 여 브러시드 긴팔티       ,Fasion
27,비너스 깔끔한 힙라인 심플한 노라인 팬티                        ,Fasion
28,빈폴레이디스 울 캐시미어 핸드메이드 싱글 코트           ,Fasion
29,나인              울 부클 셋업 모즈 스커트        ,Fasion
30,옛날 교복 대여 세라복 뮤즈의 옷장,Fasion
31,푸마 스킨라이크 브라팬티   종 패키지 여성,Fasion
32,조이너스     에디션 캐시미어하이넥자켓                ,Fasion
33,나이키 덩크 로우 범고래              ,Fasion
34,여성 임산부 수유 원피스잠옷 겨울 수면잠옷 극세사 파자마,Fasion
35,     퍼 카라 크롭 푸퍼           ,Fasion
36,     니트 후드 패치 퀼팅 누빔 구스다운 패딩 점퍼           ,Fasion
37,쉬즈미스 퍼탈착 롱 구스다운점퍼                         ,Fasion
38,  쥬시쥬디 와펜포인트퀼팅 셋업                  ,Fasion
39,라인 라인어디션      벨티드 폭스퍼 구스다운 코트           ,Fasion
40,가       키스해링      니트  종 여성,Fasion
41,올리브데올리브 헤링본 싱글 자켓          ,Fasion
42,    순면 여성 보온 내의 내복 상하 세트        ,Fasion
43,나이스클랍            벨티드 하프구스다운           ,Fasion
44,라코스테 여성 베이직 브이넥 방모 가디건               ,Fasion
45,타미진스 타미진스 여성 덕다운 푸퍼               ,Fasion
46,나이키 에어맥스              ,Fasion
47,폴햄 여성 코듀로이 셔츠형 원피스           ,Fasion
48,편한 무지 모달 잠옷 빅사이즈 잠옷 여름 커플잠옷,Fasion
49,노스페이스 여성 글로시 다운 자켓         ,Fasion
50,론론                      ,Fasion
51,나이키 스포츠웨어 여성 하이웨이스트 와이드 레그 플리스 팬츠           ,Fasion
52,나인 카이브 페이크퍼 하프 자켓         ,Fasion
53,꿀핏보장 밴딩 배기바지 배기통바지 편한 일자 면 배기팬츠 빅사이즈 흰색 기모,Fasion
54,톰보이 리버시블체크코트           ,Fasion
55,마이데몬 도도희 원피스 가을 겨울 자켓 스커트 투피스세트 모임 연예인 원피스,Fasion
56, 가을 겨울잇템  겨 울  라인 니트 스커트 롱스커트,Fasion
57,층간소음 실내화 쿠션슬리퍼 면 거실화 족저근막염 어린이집 덧신,Fasion
58,에잇세컨즈           세골 코듀로이 밴딩 팬츠  ,Fasion
59,제너럴아이디어 기모 포켓 코튼 데님           ,Fasion
60,라코스테         여성 액티브 더블페이스 조거팬츠                      ,Fasion
61,나인 르웨이 셋업 헤어리 브이넥 자켓                ,Fasion
62,핸드메이드코트 카멜코트 여성울코트       ,Fasion
63,지컷     롱 라운드 넥 트위드 자켓           ,Fasion
64,슬립 이벤트속옷 란제리 야한 섹시슬립 섹시한속옷 허니문잠옷,Fasion
65,꼼빠니아 세이브존   세미오버 핸드메이드 모직코트             ,Fasion
66,실내 슬리퍼 쿠션 거실 실내화 린넨 푹신한 임산부 거실화,Fasion
67,수면 잠옷 빅사이즈 체리 겨울 잠옷 누빔,Fasion
68,실험복 실험가운 위생복 실습복 영양사 의사 약사 물리치료사 가운,Fasion
69,비너스 속바지 기모속바지 학생 겨울 면 텐셀 인견 모달 원피스 치마 웨딩 레이스 속치마,Fasion
70,허니제이 렝페 꽈배기 반집업 하이넥 니트,Fasion
71,탑텐 여성 리얼 라이트 다운 투인원           ,Fasion
72,듀엘 와이드 카라 빅포켓 코트           ,Fasion
73,조르쥬레쉬      시그니처 스트레치 기모 팬츠  종,Fasion
74,칼라거펠드 온플 칼라거펠트      하이넥 케이프코트,Fasion
75,                       올리브데올리브 언발란스 플리츠 스커트          ,Fasion
76,나인 리브드 니트 뷔스티에        ,Fasion
77,톰보이 후드더플코트           ,Fasion
78,탑텐 목폴라 터틀넥 목티 루즈핏 니트 캐시미어 겨울 여성 벨로아 긴팔 티,Fasion
79,씨씨콜렉트 퍼카라패딩점퍼           ,Fasion
80,에고이스트 전략 니트카라 핸드메이드 롱            ,Fasion
81,에잇세컨즈 벨벳 레이어드 원피스           ,Fasion
82,리바이스 여성 립케이지 스트레이트 앵클 데님팬츠           ,Fasion
83,리스트 코듀로이 부츠컷 팬츠,Fasion
84,라코스테      구스다운 리버시블 경량               ,Fasion
85,지컷       리브드 후드 니트 원피스           ,Fasion
86,나이키        써밋화이트 브라운 키높이 커플 여자 운동화       ,Fasion
87,크록스 퍼즈스트랩 털 크록스 라인드 클로그 퍼슈어 겨울샌들 방한화 양털슬리퍼 베이지,Fasion
88,폴햄 여성 경량 덕 다운 점퍼           ,Fasion
89,여성 겨울       기본 패딩 슬림일자 누빔 솜바지 방한 중년여성 밴딩팬츠       ,Fasion
90,리스트 밴딩 플리츠 스커트            ,Fasion
91,그레이 미엘 엘린 크롭 가디건     ,Fasion
92,겨울 몸빼바지 빅사이즈 융털 기모 고무줄 꽃무늬 엄마 할머니 바지 일바지,Fasion
93,보브     의류 벨티드 롱 구스다운 트렌치 코트          ,Fasion
94,로엠 싱글 퍼 자켓           ,Fasion
95,빈폴레이디스 울 캐시미어 벨티드 핸드메이드 롱 코트 카멜           ,Fasion
96,게스 여성  톤 기모 와이드         ,Fasion
97,꼼빠니아 조이너스 벨티드머메이드원피스                ,Fasion
98,커플잠옷 신혼부부 파자마 세트 빅사이즈 스위티드림,Fasion
99,엘칸토 여성 염소가죽 미들부츠        ,Fasion
100, 부  부 밴딩 모직 울 와이드 팬츠 슬랙스 도톰 통바지 키작녀팬츠,Fasion
101,퀸즈맥시 여자 모달 쉐이핑 속옷 보정팬티 품질보장,Fasion
102,    외 커플 수면 잠옷 세트 겨울 파자마 바지 남성 여성 극세사 기모 빅사이즈 밍크,Fasion
103,스튜디오 톰보이            데님 배기팬츠                        ,Fasion
104,몽돌         핸드메이드 울 벨티드 발마칸 코트 오트밀베이지               ,Fasion
105,올리비아하슬러      폭스퍼 구스 다운패딩 후드 롱 점퍼                   ,Fasion
106,로로스키니 양털 후리스 조끼 자켓 뽀글이       ,Fasion
107,나인 클래식 코듀로이 배색 퀼팅 점퍼       ,Fasion
108,여성 기모 조거 팬츠 융털 밴딩 바지 겨울       ,Fasion
109,         라라쎄 여성           플리츠 패딩 팬츠  종,Fasion
110,보내요 쉬즈미스     플리츠 브이넥 원피스            ,Fasion
111,     숲 핸드메이드 단직 롱 더플 코트        ,Fasion
112,르샵 핸드메이드 뒤 허리 스티링 울 코트              ,Fasion
113,캐시미어니트 여성니트티 루즈핏 브이넥 라운드 겨울니트 스웨터 아이보리,Fasion
114,시슬리 드랍 숄더 더블 롱 코트          ,Fasion
115,발레리 프론트훅 체인지 브라팬티 총   종,Fasion
116,나이스클랍            싱글 벨티드 핸드메이드 코트           ,Fasion
117,하루이 고급 타올천 오픈형 실내 슬리퍼,Fasion
118,지오다노 여     케이블 폴로 스웨터       ,Fasion
119,사자크 오리잠옷 신발포함,Fasion
120,브루노말리 슈즈 플랫폼 레더 첼시 부츠       ,Fasion
121,코듀로이팬츠 핑크 골덴바지 피그먼트 가을 겨울 골지 스트레이트 일자 통바지 네이비 흰색,Fasion
122,레코브 코듀로이 숏패딩점퍼             ,Fasion
123,잇미샤 더블 버튼 캐시미어 핸드메이드 코트           ,Fasion
124,라보라 여성 언더웨어 노와이어 브라팬티   종세트       ,Fasion
125,헤지스레이디스 헤지스 레이디스 캐시미어 라운드넥 니트          ,Fasion
126,게스 여성 카라배색 맨투맨         ,Fasion
127,밀렌 경량 퀼팅 후드 패딩 조끼,Fasion
128,모조에스핀 벨티드 트위드재킷           ,Fasion
129,              플리스하프집업맨투맨           ,Fasion
130,쫄깃탱글 핏최강 날씬핏 핀턱부츠컷밴딩팬츠 국내생산  컬러,Fasion
131, 만원 블루핏     폭스퍼 롱구스다운,Fasion
132,시야                                                        ,Fasion
133,캘빈클라인    여자속옷 삼각 비키니  장 팬티세트            ,Fasion
134,시야쥬 기모 골지 스웻 팬츠                 ,Fasion
135,행텐 여성 세미크롭 카라넥 하프집업 니트                    ,Fasion
136,제너럴아이디어 스몰 로고 코듀로이 세트                                             ,Fasion
137,              백밴딩원턱와이드데님                    ,Fasion
138,컬럼비아 여성 라이트 무빙 런닝형 끈형 브라탑  종,Fasion
139,코트 위   만장돌파 메리노울    퓨어다 핸드메이드 코트     더블버튼 구스내피,Fasion
140,쉬즈미스 미니멀 원버튼 울소재 핸드메이드 코트,Fasion
141,    겨울 잠옷바지 수면잠옷 극세사 피치기모 파자마 공주,Fasion
142,뮬라웨어 에어 소프트 웜 와이드 팬츠          ,Fasion
143,여자 융 기모스키니팬츠 밍크스판 여성 겨울바지  칼라,Fasion
144,크로커다일레이디 잔체크 옆밴딩 팬츠          ,Fasion
145,헤지스레이디스      탈착후드 구스다운 패딩점퍼            ,Fasion
146,리스트 베이직 라운드넥 니트 풀오버               ,Fasion
147,리스트 더블 핸드메이드 코트            ,Fasion
148,    데일리 포켓 지퍼 후드 패딩 점퍼           ,Fasion
149,미리주문 폭발 칼 라거펠트         슬립온,Fasion
150,샤틴 리얼 양털 시어링 자켓                      ,Fasion
151,나인 울 헤어리 부클 롱 코트        ,Fasion
152,케네스레이디 퍼 후드 벨티드 구스 다운 코트         ,Fasion
153,비비안        풀컵 와이어 몰드 브라        ,Fasion
154,쉬즈미스 캐시미어 벨티드 핸드메이드 코트            ,Fasion
155,에잇세컨즈           기모 부츠컷 데님팬츠  ,Fasion
156,모조에스핀 금장단추 자켓           ,Fasion
157,오르시떼 오르시떼 여성           보더체크 긴소매 상하,Fasion
158,  인증 무지에코백 에코백만들기 꾸미기 그림그리기     가방 린넨캔버스,Fasion
159,카라         까지 리얼밍크럭셔리케이프자켓         ,Fasion
160,  스튜디오 비지트인뉴욕 트렌치형 핸드메이트 코트        ,Fasion
161,스타일온에어 셀렙샵 에디션      세미와이드 텐션데님 셀렙샵에디션         ,Fasion
162,미니 보조가방 캔버스백 스마일 에코백     ,Fasion
163,올리브데올리브 후드 스트링 구스 다운 점퍼          ,Fasion
164,지지피엑스      폭스퍼트리밍허리스트링덕다운숏패딩점퍼              ,Fasion
165,스 울 리브 니트 가디건       ,Fasion
166,제너럴아이디어 지니아 버블 플리스          ,Fasion
167,에잇세컨즈 배색 스티치 턴업 와이드 데님 팬츠           ,Fasion
168,       로던      여성 메리노울    헤링본 자켓,Fasion
169,에고이스트 하이넥 크롭 다운         ,Fasion
170,     지방흡입 팔 겨드랑이 애교살 브라라인 압박복  체형보정속옷 지방 관리 압박복 씨앤씨메디칼,Fasion
171,앙고라 니트 카라 덕다운 이너 패딩 조끼 레이어드 오리털,Fasion
172,     울 블렌딩 하프코트,Fasion
173,에고이스트    포인트 볼륨소매  넥             ,Fasion
174,르캐시미어          캐시미어 홀가먼트 디테일 풀오버,Fasion
175,베네통 뒷밴딩 베스트핏 배기 데님 팬츠             ,Fasion
176,블랙 펄 뷔스티에 롱 트위드원피스 여성 봄 결혼식하객룩    하객 원피스,Fasion
177,편한 순면 여자트렁크 빅사이즈 텐셀 인견 여성사각팬티 네모팬티,Fasion
178,     여 클라우드 후드 푸퍼 점퍼,Fasion
179,킬리안 로아 나일론 카프스킨                     호보백 직장인 보부상가방,Fasion
180,행텐         여성 리버서블 패딩 보아                    ,Fasion
181,      몽몽 층간소음 실내화 슬리퍼       ,Fasion
182,리스트 백 밴딩 벨 보텀 팬츠            ,Fasion
183,바버 여성 애넌데일 퀼티드 자켓            ,Fasion
184,허즈아이 발편한 거실 층간소음 거실화 푹신한 여름 린넨 실내 슬리퍼 쿠션 실내화 사무실,Fasion
185,베라왕   베라왕      집업 니트셋업,Fasion
186,코데즈컴바인 코데즈컴바인 탈부착 퍼카라 퀼팅패딩            ,Fasion
187,크로커다일레이디    경랑덕다운 점퍼          ,Fasion
188,빈폴레이디스 치노 볼륨 스커트 애쉬           ,Fasion
189,제너럴아이디어 제너럴아이디어       울 케이블 카라 가디건           ,Fasion
190,온앤온 허리밴딩 샤 스커트          ,Fasion
191,         여성트레이닝세트 헬스복 운동복,Fasion
192,어그 여성 양털 부츠 클래식 울트라 미니           ,Fasion
193,어그     키즈 코지                ,Fasion
194,나이스클랍 라인변형 구스다운           ,Fasion
195,  지고트   지고트   지고트 배색 스캘럽 울 오리털 재킷           ,Fasion
196,클라이드앤 클라이드엔 여성 숏 다운 패딩 점퍼          ,Fasion
197,어그 미니 베일리 버튼    체스트넛                        ,Fasion
198,씨씨콜렉트 벨티드 핸드메이드 롱코트           ,Fasion
199,     여 이중지 코튼 플라워 파자마 세트,Fasion
