,titles,category
0,상품명            신타공  인용 등무팔무 대기실 대기용의자 의자 사무실의자 대기의자 로비의자 대기실의자 롱의,Interior
1,상품명             신타공  인용 등무팔무 대기실 대기용의자 의자 사무실의자 대기의자 로비의자 대기실의자 롱,Interior
2,상품명             신타공  인용 등무팔무 대기실 대기용의자 의자 사무실의자 대기의자 로비의자 대기실의자 롱,Interior
3,상품명            신타공  인용 등무팔무 대기실 대기용의자 의자 사무실의자 대기의자 로비의자 대기실의자 롱의,Interior
4,상품명        검정      신타공  인용 등무팔무 대기실 대기용의자 의자 사무실의자 대기의자 로비의자 대기실의,Interior
5,상품명 펠트 글자판 대  튤립           환경꾸미기재료 글자판 환경판 환경꾸미기 환경미화 펠트재료 펠트소품 꾸,Interior
6,상품명 투명 가림막 대형 가림판 칸막이 파티션 학교 수업   가림막 가림판 투명파티션 은행파티션 공공기관파티션,Interior
7,상품명 신멀티 회의용 회의실의자 사무용의자 의자 학원의자 경량의자 강의실 강의실의자 회의실 회의실의자 적층,Interior
8,상품명     만공한국사   종 세트 교육교구 학습교구 기타교구 한국사교구 교재교구세트 학습교재 한국사교재    ,Interior
9,상품명  호 중 회전 블루 사무용의자 회전의자 학생의자 책상의자 다용도의자 컴퓨터의자,Interior
10,상품명 벽걸이차트 개구리의하루 펠트 하루일과표 환경판 환경꾸미기 하루일과표 시간표 벽걸이차트 펠트일과표 학,Interior
11,상품명 펠트 글자판 소  둥근꽃           환경꾸미기재료,Interior
12,상품명 펠트 글자판 소  튤립           환경꾸미기재료,Interior
13,상품명 펠트 글자판 대  연필           환경꾸미기재료,Interior
14,상품명 펠트 글자판 소  풍선           환경꾸미기재료,Interior
15,상품명 펠트 글자판 소  크로바           환경꾸미기재료,Interior
16,상품명 펠트 글자판 소  방울꽃           환경꾸미기재료,Interior
17,상품명 펠트 글자판 소  연필           환경꾸미기재료,Interior
18,상품명 펠트달력 꼬꼬닭 환경꾸미기 달력,Interior
19,상품명  타입 수납함     플라스틱 투명 책상 정리함 서랍,Interior
20,상품명 신발정리대 검정 더블형,Interior
21,상품명 해피 서랍장 단 핑크 ,Interior
22,상품명 테이블 파티션 투명 아크릴 가림막 책상칸막이,Interior
23,상품명 에어메쉬대 회전  그레이,Interior
24,상품명 니드코 미니 서랍장  단 미니서랍장 플라스틱서랍장,Interior
25,상품명 아트사인 이름명패 파티션꽂이    단면         ,Interior
26,상품명 세이브 대  회의 고정  사무실의자 사무의자 업용의,Interior
27,상품명 사무실 병원 업무용 사무용 직원 컴퓨터 바퀴 의자,Interior
28,상품명 회의실 사무용 의자 학원 상담용 강의실 튼튼한 체,Interior
29,상품명 당일발송 브로몰딩 접이식테이블       ,Interior
30,상품명 학원용 책상  인용  학교 공부방책상 독서실책상 의자,Interior
31,상품명  인용 방역 비말차단 투명 칸막이 안전 가림막 비대면 회의칸막이 비말칸막이 투명가림막 가림판 학생가림,Interior
32,씽크체어 상품명 브로몰딩 원형테이블       가정 야외 행사 도매 야외,Interior
33,공식 상품 체어센스 상품명 아슬란 중역 사무용 책상 게이밍   방 컴퓨터의자,Interior
34,상품명 사무용책상 학생 공부 컴퓨터 사무실 멜론        ,Interior
35,상품명 사무실 책상정리 아이디어 책정리함 사무용품수납용품,Interior
36,퍼시스 상품명        퍼시스 학생 공부 책상 의자     수험생 바퀴 강의실 학원 메쉬,Interior
37,상품명 배송비 화물배송비 부가세포함,Interior
38,상품명 레인보우 쿠션 방석 블랙 연두천 의자 사무용의자 회의용의자 다용도의자 보조의자 간이의자 대기석의자 접,Interior
39,상품명 시스맥스 마이미니함  단             플라스틱서랍 수납서랍 디자인수납장 디자인서랍장 정리서랍장 정리,Interior
40,상품명 펠트 글자판 대  기차           환경꾸미기재료 글자판 환경판 환경꾸미기 환경미화 펠트재료 펠트소품 꾸,Interior
41,상품명 펠트 글자판 대  달맞이꽃           환경꾸미기재료 글자판 환경판 환경꾸미기 환경미화 펠트재료 펠트소,Interior
42,상품명 펠트 글자판 소  사과           환경꾸미기재료 글자판 환경판 환경꾸미기 환경미화 펠트재료 펠트소품 꾸,Interior
43,상품명 펠트글자판 대  둥근꽃           환경꾸미기재료 글자판 환경판 환경꾸미기 환경미화 펠트재료 펠트소품 ,Interior
44,상품명 펠트 글자판 대  튤립           환경꾸미기재료 글자판 환경판 환경꾸미기 환경미화 펠트재료 펠트소품 꾸,Interior
45,상품명 펠트 글자판 대  풍선           환경꾸미기재료 글자판 환경판 환경꾸미기 환경미화 펠트재료 펠트소품 꾸,Interior
46,하이솔로몬 상품명 튼튼 강의대        스탠딩책상 강연대 연설대 사회대 메뉴대 악보대 교단,Interior
47,상품명  인용 원룸 학생 접이식 책상 원룸책상 디자인책상 메탈책상 학생접이식책상 철제접이식책상 원룸책상 컴퓨,Interior
48,상품명 루나 블랙 고정의자  학생용  도서실  집중력향상  사무용  작업용 오래 앉아도 시원하고 편안한 고정의자,Interior
49,상품명 라온 블랙 높낮이 조절 책상 모니터 받침대 책상 모션데스크 모션책상 높낮이책상 높낮이조절책상 전동형책,Interior
50,상품명     만공한국사 조선 대동여지도 교육교구 학습교구 기타교구 한국사교구 교재교구세트 학습교재 한국사교,Interior
51,이스마트 상품명 와이즈  단 틈새 보조서랍 책상서랍장,Interior
52,상품명 사물함  칸 플라스틱서랍 수납서랍  칸수납장  칸서랍장 정리서랍장 정리수납장  칸사물함 수납장 사물함 ,Interior
53,상품명 공부집중칸막이 기본형 칸막이 파티션 종이칸막이 박스칸막이 조립형 간편한 가벼운칸막이 페이퍼칸막이 독,Interior
54,상품명 테이블 안전 칸막이  인용  칸막이 투명칸막이 안전칸막이 식당칸막이 휴게소칸막이 식탁칸막이 테이블칸막,Interior
55,상품명     만공한국사 대한제국 환구단 교육교구 학습교구 기타교구 한국사교구 교재교구세트 학습교재 한국사교,Interior
56,상품명     만공한국사 조선 태극기 교육교구 학습교구 기타교구 한국사교구 교재교구세트 학습교재 한국사교재   ,Interior
57,상품명     만공한국사 조선 광성보 용두돈대 교육교구 학습교구 기타교구 한국사교구 교재교구세트 학습교재 한국,Interior
58,상품명     만공한국사 조선 대동여지도 교육교구 학습교구 기타교구 한국사교구 교재교구세트 학습교재 한국사교,Interior
59,상품명  인용책상 일반형 원룸책상 디자인책상 메탈책상 학생접이식책상 철제접이식책상 원룸책상 컴퓨터접이식책,Interior
60,상품명 길이조절 서랍 칸막이 속옷 양말정리 파티션          서랍칸막이 서랍파티션 옷장칸막이 책장칸막이 서랍,Interior
61,상품명 칸막이 파티션 설치 고정 브라켓 받침대  자          파티션고정받침 파티션홀더 파티션고정 파티션지지대,Interior
62,상품명 칸막이 파티션 설치 고정 브라켓 받침대          파티션고정 파티션지지대 파티션받침대 파티션발 파티션,Interior
63,상품명 칸막이 파티션 설치 고정 브라켓 받침대  자          파티션고정받침 파티션홀더 파티션고정 파티션지지대,Interior
64,상품명 와인앤쿡 공간나눔 수납 파티션 북랜드 책장북앤드 책장칸막이 선반북앤드 선반칸막이 책상파티션 파티션칸,Interior
65,상품명 노피스 유리 아크릴 파티션 브라켓       가림막브라켓 칸막이브라켓 책상분리파티션브라켓 파티션브라켓 ,Interior
66,상품명 아트사인 아크릴칸막이         칸막이 생활칸막이 데스크칸막이 책상칸막이 테이블칸막이 다용도칸막이 아,Interior
67,상품명 아트사인 아크릴칸막이         칸막이 생활칸막이 데스크칸막이 책상칸막이 테이블칸막이 다용도칸막이 아,Interior
68,상품명 파티션          파티션 인테리어파티션 사무실파티션 다용도파티션 소품파티션 수납파티션 사무용파티션 ,Interior
69,상품명 투명 서랍형 멀티 박스  칸 브라운 플라스틱서랍 수납서랍 디자인수납장 디자인서랍장 정리서랍장 정리수납,Interior
70,상품명    비말가리대 가림막 비말가림막 학교 학원 가림판 급식칸막이 급식실칸막이 학생가림판 투명가림판 아크,Interior
71,상품명      파티션                  파티션   파티션 수납파티션 수납케이스   파티션케이스   파티션수납케이스,Interior
72,상품명 시스맥스 마이미니함  단             플라스틱서랍 수납서랍 디자인수납장 디자인서랍장 정리서랍장 정리,Interior
73,상품명 시스맥스 마이미니함  단           플라스틱서랍 수납서랍 디자인수납장 디자인서랍장 정리서랍장 정리수,Interior
74,상품명 시스맥스 마이미니함  단             플라스틱서랍 수납서랍 디자인수납장 디자인서랍장 정리서랍장 정리,Interior
75,상품명 시스맥스 마이미니함  단           플라스틱서랍 수납서랍 디자인수납장 디자인서랍장 정리서랍장 정리수,Interior
76,상품명 시스맥스 마이미니함  단             플라스틱서랍 수납서랍 디자인수납장 디자인서랍장 정리서랍장 정리,Interior
77,상품명 시스맥스 마이미니함  단           플라스틱서랍 수납서랍 디자인수납장 디자인서랍장 정리서랍장 정리수,Interior
78,상품명 시스맥스 마이미니함  단             플라스틱서랍 수납서랍 디자인수납장 디자인서랍장 정리서랍장 정리,Interior
79,상품명 시스맥스 마이미니함  단           플라스틱서랍 수납서랍 디자인수납장 디자인서랍장 정리서랍장 정리수,Interior
80,상품명 시스맥스       멀티박스  단 중형         멀티박스 수납함 정리함 보관함  단멀티박스  단수납함  단정리,Interior
81,상품명 멀티케이스  단 카파맥스  책상서랍 책상정리서랍 플라스틱서랍 소품보관함 소품정리함 소품수납함 멀티케,Interior
82,상품명 시스맥스 마이미니함  단             플라스틱서랍 수납서랍 디자인수납장 디자인서랍장 정리서랍장 정리,Interior
83,상품명 시스맥스 마이미니함  단           플라스틱서랍 수납서랍 디자인수납장 디자인서랍장 정리서랍장 정리수,Interior
84,상품명 시스맥스 마이미니함  단             플라스틱서랍 수납서랍 디자인수납장 디자인서랍장 정리서랍장 정리,Interior
85,상품명 시스맥스 마이미니함  단             플라스틱서랍 수납서랍 디자인수납장 디자인서랍장 정리서랍장 정리,Interior
86,상품명          베블 스텐 원형 테이블          하이퍼스테이블,Interior
87,상품명 라탄 오픈형  단 파티션               화이트  공간분리 파티션 가림막 폴딩 가벽 인테리어  단 라탄,Interior
88,상품명 레스트온 사무용 의자     블랙  사무용의자 의자 책상의자 테이블의자 팔걸이의자 쿠션의자 회전의자 등받,Interior
89,상품명 펠트 글자판 대  사과           환경꾸미기재료 글자판 환경판 환경꾸미기 환경미화 펠트재료 펠트소품 꾸,Interior
90,상품명 펠트 글자판 소  별           환경꾸미기재료 글자판 환경판 환경꾸미기 환경미화 펠트재료 펠트소품 꾸미,Interior
91,상품명 파티션          파티션 인테리어파티션 사무실파티션 다용도파티션 소품파티션 수납파티션 사무용파티션 ,Interior
92,상품명 펠트 글자판 대  방울꽃           환경꾸미기재료 글자판 환경판 환경꾸미기 환경미화 펠트재료 펠트소품 ,Interior
93,상품명 펠트 글자판 소  기차           환경꾸미기재료 글자판 환경판 환경꾸미기 환경미화 펠트재료 펠트소품 꾸,Interior
94,상품명 펠트 글자판 소  달맞이꽃           환경꾸미기재료 글자판 환경판 환경꾸미기 환경미화 펠트재료 펠트소,Interior
95,상품명 펠트 글자판 소  하트           환경꾸미기재료 글자판 환경판 환경꾸미기 환경미화 펠트재료 펠트소품 꾸,Interior
96,스툴 상품명 클레오 메쉬의자 화이트 컴퓨터의자 사무실책상의자,Interior
97,투버스 상품명 피닉스 침대형의자 중역 의자 리클라이너 프리미엄,Interior
98,상품명 공간활용 사무실 파티션 코너선반,Interior
99,상품명 선반 칸막이 공간 분리 랙 클립 옷장 파티션                  ,Interior
100,상품명 와이드 조립식 아크릴단상 강의대 연설대 강연대 교수대 사회대 무대 사회자 교회강대상 웨딩주례 학교교탁,Interior
101,상품명 신형 스마트포밍 테이블          회의용테이블 공방용케이블 작업대 작업테이블 사무용책상 행사용테이블,Interior
102,상품명 전국무료  상부유리 화이트 하이그로시 사무실파티션,Interior
103,파미가구 상품명 높이     사무실 파티션 칸막이 가림막 사무용 파티션 책상파티션 파티션가림막,Interior
104,상품명 환의자 원형 보조 간의 스툴 병원 진찰 미용실,Interior
105,쿠시체어 상품명 쿠시 코코 블랙 발받침 책상의자 학생의자 사무의자,Interior
106,쿠시체어 상품명 보스 사무용의자 사무실 컴퓨터 책상 공부 요추의자,Interior
107,상품명          일자 접이식 테이블 공부 사무용 식탁 회의 책상 탁자 작업대 다용도,Interior
108,상품명 원목 사무용 서랍장 틈새 미니 서랍 책상 선반 사무실 책장 보조 정리함 프린터 받침대 수납장 이동  루이지,Interior
109,상품명 발받침 컴퓨터 게이밍 의자 핑크화이트  편한의자,Interior
110,모아이 상품명 모아이 플랜비 실버 스틸 원목 의자 월넛그린,Interior
111,퍼시스 상품명 퍼시스 모션데스크 전동 높이조절 책상 스탠딩 서서일하는 키다리                                 ,Interior
112,퍼시스 상품명 퍼시스      반원형 다목적 학습 테이블        ,Interior
113,해외직구 상품 상품명 허먼밀러 뉴에어론 의자 풀체어   년보증  아틀라스 헤드레스트 포함  관부가세포함,Interior
114,상품명 책상  단 미니 핑크 서랍 학용품 보관 데스크 인테리어 플라스틱 부품 책상위,Interior
115,상품명 포어스신발정리대 단   족,Interior
116,상품명 아크릴 가림막 투명 테이블 책상 칸막이 식당 파티,Interior
117,상품명 홀리책장  단 블랙,Interior
118,상품명 강의실 오피스 회의실 사무실 사무용 의자 블랙,Interior
119,상품명 안티비말 칸막이  분조립  형  인용,Interior
120,상품명 사무실 사무용 가구 책상 수납 서랍장     이동서랍,Interior
121,상품명 자동차 등쿠션 메모리폼 편한자세 의자 사무실 교실,Interior
122,상품명 사무실 책상 데스크 정리  칸 서랍 수납함         ,Interior
123,상품명 학교 회사 사무실 강당 세미나 회의실 접이식 접의,Interior
124,상품명 리마솔 프라임 회의실의자 회의의자사무실사무용연,Interior
125,상품명 올리오 책꽂이  단 서랍 책꽂이 책상 서류 소품 정,Interior
126,상품명 우드 서랍함 철제 서랍 책상 화장품 작은 소품 정리,Interior
127,상품명 온누리다용도신발장  족,Interior
128,상품명 온누리지그재그신발장  족,Interior
129,상품명 모던일반신발장소 단,Interior
130,상품명 포어스신발정리대 단  족,Interior
131,상품명 해피 서랍장 단 블루 ,Interior
132,상품명 환의자 고정  사무실의자 사무용의자 병원의자,Interior
133,상품명 창신 서랍장 폴리우드    단               ,Interior
134,상품명 프리티서랍장 단 다용도서랍  단서랍 미니서랍,Interior
135,상품명  호중 팔무 회전 블랙,Interior
136,상품명  호중 팔무 회전 레드,Interior
137,상품명  호대회전 블루,Interior
138,상품명  호중회전 블루,Interior
139,상품명  호중회전 레드,Interior
140,상품명 플러키회의       블랙,Interior
141,상품명 플러키회의       블루,Interior
142,상품명 플러키회의       자주,Interior
143,상품명 플러키회의       레드,Interior
144,상품명 플러키회의       자주,Interior
145,상품명 플러키회의       블랙,Interior
146,상품명 플러키회의       블루,Interior
147,상품명 플러키회의       블랙,Interior
148,상품명 플러키회의       레드,Interior
149,상품명 플러키고정       블루,Interior
150,상품명 플러키고정       블랙,Interior
151,상품명 해피서랍장 단,Interior
152,상품명 진찰용  형  형오발 진찰의자,Interior
153,상품명 토끼화장품수납함 미니서랍 서류정리 책상 서랍 수,Interior
154,상품명 회사 카페 병원 사무실 로비 대기실 휴게실 장의자,Interior
155,상품명 갤러리 서랍장  단 다용도 수납장 협탁 소품 보관함,Interior
156,상품명 미소 휴대용안전가림막 중           하늘  갑   개,Interior
157,상품명 플러키고정       레드,Interior
158,상품명 플러키회전       오렌지,Interior
159,상품명 플러키회전       블루,Interior
160,상품명 플러키회전       블랙,Interior
161,상품명 플러키회전       자주,Interior
162,상품명 플러키회전       레드 블루,Interior
163,상품명 플러키회전       블루,Interior
164,상품명 플러키회전       블랙,Interior
165,상품명 플러키회전       그린,Interior
166,상품명 레인보우연결의자  인석  블랙,Interior
167,상품명 레인보우연결의자  인석  레드,Interior
168,상품명 레인보우연결의자  인석  레드,Interior
169,상품명 레인보우연결의자  인석  블루,Interior
170,상품명 메어메쉬대 도금  그레이,Interior
171,상품명 메어메쉬대 도금  레드,Interior
172,상품명 아르노 회사 사무용 회의실의자 사무실의자 철제의,Interior
173,상품명 아르노 회전의자 사무실의자 회사 책상의자 메쉬의,Interior
174,상품명 레인보우회전쿠션 레드 자주,Interior
175,상품명 알파고정 옐로우 블랙,Interior
176,상품명 알파고정 옐로우 옐로우,Interior
177,상품명 알파고정 아이보리 아이보리 학생의자,Interior
178,상품명    형 이동서랍 아카시아,Interior
179,상품명    형 사출이동서랍 망펄비취,Interior
180,상품명 올사출이동서랍 레드,Interior
181,상품명 올사출이동서랍 네이비,Interior
182,상품명 올사출이동서랍 그레이,Interior
183,상품명 올사출이동서랍 그린,Interior
184,상품명 올사출이동서랍 아이보리,Interior
185,상품명 플러키회의       블루 레드,Interior
186,상품명 플러키회의       오렌지,Interior
187,상품명 플러키회의      로라 레드 청색천,Interior
188,상품명 티코팔유로라 그레이,Interior
189,상품명 레인보우 쿠션방석 블랙 연두천,Interior
190,상품명 레인보우 쿠션방석 네이비 레드천,Interior
191,상품명 레인보우 회의용 블랙,Interior
192,상품명 레인보우 회의용 옐로우,Interior
193,상품명 레인보우 회의용 네이비,Interior
194,상품명 천연 솔방울 소나무 만들기 크리스마스 나무 공예,Interior
195,상품명 우드락 물감 스치로폼물감 우드락 낱색 스티로폼   ,Interior
196,상품명 우드락 물감 스치로폼물감 우드락 낱색 스티로폼   ,Interior
197,상품명 우드락 물감 스치로폼물감 우드락 낱색 스티로폼   ,Interior
198,상품명 우드락 물감 스치로폼물감 우드락 낱색 스티로폼   ,Interior
199,상품명 우드락 물감 스치로폼물감 우드락 낱색 스티로폼   ,Interior
200,상품명 우드락 물감 스치로폼물감 우드락 낱색 스티로폼   ,Interior
201,상품명 우드락 물감 스치로폼물감 우드락 낱색 스티로폼   ,Interior
202,상품명 우드락 물감 스치로폼물감 우드락 낱색 스티로폼   ,Interior
203,상품명 우드락 물감 스치로폼물감 우드락 낱색 스티로폼   ,Interior
204,상품명 우드락 물감 스치로폼물감 우드락 낱색 스티로폼   ,Interior
205,상품명 사무용 보관함 서랍장 파일 정리함 키 서류함  단,Interior
206,상품명 메쉬 컴퓨터 학생 오피스 의자,Interior
207,상품명 튼튼한 손잡이 계단식 태클박스 소품함,Interior
208,상품명 계단식 태클박스 화구박스 낚시함,Interior
209,상품명 다용도 소품 태클박스 화구박스 낚시함,Interior
210,상품명 라이프 바스켓    호 바구니 정리함 소품정리,Interior
211,상품명 이동식의자 바퀴의자 쿠션의자 사무실의자 블랙,Interior
212,상품명 리마솔 회의실의자 회의의자사무실사무용연수원강의,Interior
213,상품명 오피스 사무용 서랍장 서류 수납장 이동식 가구  단,Interior
214,상품명 우드락공      약    개       ,Interior
215,상품명 에어 메쉬 강당의자 보급형 체어 회의실 의자 블랙,Interior
216,상품명 세이브중 회전 자주천,Interior
217,상품명 메니저대 사무용의자 학생의자 회의용의자,Interior
218,상품명 플러키회전       자주천,Interior
219,상품명 레인보우 회전형 아이보리 회색천,Interior
220,상품명 레인보우 회전형 블랙,Interior
221,상품명 알파회전형 블랙,Interior
222,상품명 테트라 연결의자  인 사무실의자 회의용의자 학생의,Interior
223,상품명    형 이동서랍 월넛,Interior
224,상품명    형 이동서랍 아카시아,Interior
225,상품명    형 사출이동서랍 망펄비취,Interior
226,상품명 올사출이동서랍 레드,Interior
227,상품명 올사출이동서랍 네이비,Interior
228,상품명 올사출이동서랍 그레이,Interior
229,상품명 올사출이동서랍 그린,Interior
230,상품명 올사출이동서랍 아이보리,Interior
231,상품명 올사출이동서랍 옐로우,Interior
232,상품명 플러키회의       블루 레드,Interior
233,상품명 플러키회의       오렌지,Interior
234,상품명 플러키회의      로라 레드 청색천,Interior
235,상품명 티코팔유로라 그레이,Interior
236,상품명 레인보우 쿠션방석 블랙 연두천,Interior
237,상품명 레인보우 쿠션방석 아이보리 레드레쟈,Interior
238,상품명 레인보우 쿠션방석 네이비 레드천,Interior
239,상품명 레인보우 쿠션방석 옐로우 청색천,Interior
240,상품명 레인보우 회의용  블랙,Interior
241,상품명 레인보우 회의용  아이보리,Interior
242,상품명 레인보우 회의용  옐로우,Interior
243,상품명 레인보우 회의용  레드,Interior
244,상품명 레인보우 회의용 네이비,Interior
245,상품명 식당 투명 테이블 아크릴 칸막이 파티션 책상 가림,Interior
246,상품명 대형 투명아크릴 비말 가림막 비대면 파티션      ,Interior
247,상품명 사무실 회사 컴퓨터책상 넉넉한 수납  단 이동식 서,Interior
248,상품명 레인보우 회전형 블랙,Interior
249,상품명 알파고정 네이비 네이비 학생의자,Interior
250,상품명 알파고정쿠션 네이비 청색천,Interior
251,상품명 레인보우회전 레드 레드,Interior
252,상품명 레인보우회전 블루 블루,Interior
253,상품명 레인보우연결의자  인석  블랙,Interior
254,상품명 레인보우연결의자  인석  옐로우,Interior
255,상품명  호중 팔무 회전 블루,Interior
256,상품명 심플한 등받이 의자 회의실의자 카페의자 그레이,Interior
257,상품명 플러키회전       레드,Interior
258,상품명 에어메쉬대 회전  블랙,Interior
259,상품명 라이프바스켓    호 다용도수납함 다용도정리함 정,Interior
260,상품명 다용도정리박스 호 생활용품 다용도함 수납함 수납,Interior
261,상품명 씨디케이스 생활용품 다용도함 수납함 수납 정리함,Interior
262,상품명    수납함 가로 칸 세로 칸 투명 다용도서랍장 플,Interior
263,상품명 니드코 미니 서랍장  단 미니서랍장 플라스틱서랍장,Interior
264,상품명 니드코 미니 서랍장  단 미니서랍장 플라스틱서랍장,Interior
265,상품명 니드코 미니 서랍장  단 미니서랍장 플라스틱서랍장,Interior
266,상품명 심플한 사무용품 멀티박스 소      ,Interior
