,titles,category
0,클렌즈주스    쥬스 과일채소     블렌더주스,Food
1,새청무쌀      당일도정 백미 쌀  키로   년 햅쌀,Food
2,쌀     인기품종 모음전 백미 수향미 삼광 백진주 경기미 신동진 아끼바레 고시히카리,Food
3,오로바일렌 엑스트라버진 올리브오일 아르베키나      ,Food
4,청담뉴트리션 콘드로이친                정,Food
5,천일 천일사누끼 냉동우동면               개,Food
6,베네키드 트루업         포,Food
7,완도명가 구이김 선물세트  매   봉,Food
8,일동제약 비오비타 패밀리 미니정제           캡슐,Food
9,동서식품 현미녹차       업소용 ,Food
10,        미슐 전주비빔소스     만능양념장 볶음밥 소스,Food
11,   자연의품격 콘플레이크 콜라겐 천마차         개입,Food
12,네스프레소 캡슐 커피 정품 오리지널   종선택  스타벅스 신규입고,Food
13, 깐양파      업소용 소스용 다양한 크기선택 가능      수작업,Food
14,오복떡본가 현미 영양찰떡  종 아침 식사대용 개별포장,Food
15,고소한 알땅콩이 콕콕 서라벌 왕땅콩빵    개  땅콩빵,Food
16,엄마딸건강상회 진짜     국산 서리태가루      검은콩 콩국수가루,Food
17,신안천일염 프리미엄 소금 답례품    실버캡 결혼 결혼식 조문 조의 장례 장례식 교회 돌,Food
18,브래그 애플사이다비니거 유기농 사과초모식초 천연발효 애사비 다이어트 비네거 코스트코    ,Food
19,   굿즈  네스카페 돌체구스토 캡슐커피 아메리카노,Food
20,삼삼해물 돌문어 거제도 자연산 생물문어    ,Food
21,영암 세척 김의준 꿀고구마 베니하루카 무농약        ,Food
22,그래인스 쿠키 콜렉션 쿠키세트        종 선물 답례품 쇼핑백포함,Food
23,이경제 흑염소진액   포  박스 이경재,Food
24,대왕 참가리비     제철 왕 큰 가리비 캠핑 조개구이 홍가리비,Food
