,titles,category
272,공식 상품 대한민국농수산 상품명 지리산 순수혈통 흑돼지 삼겹살     수육용    국내  명 흑돼지명인,Food
273,상품명 국내산 돼지고기 특수부위 뽈살       ,Food
274,상품명 지리산농협 흑돼지 벌크     오겹살 최대  이상 할인 된 덩어리 지리산 흑돼지 버크셔,Food
275,상품명 생 앞다리살 불고기용           팩 ,Food
276,배터짐 상품명 왕덜미살     뒷고기 꼬들살 삼겹살 오겹살 돼지목살,Food
277,어니스트초이스 상품명 돼지고기 바베큐세트  대패삼겹살 벌집삼겹살 항정살  총     ,Food
278,상품명  보성녹돈  한돈 뒷다리살 찌개용          팩,Food
279,배터짐 상품명 듀록 돼지 고기 삼겹살 다짐육     오겹살 머리 목살,Food
280,홈쇼핑 상품 상품명 광림상회 국내산 한돈 꽃살       팩,Food
281,공식 상품 선비찬 상품명 선비찬 캠핑푸드 고추장삼겹살         팩,Food
282,상품명 한돈 강원도 한입 삼겹살         팩   국내산 돼지고기 집밥 삼겹,Food
283,상품명 베스트밀 한돈 뒷다리살 다짐육     국내산 돼지고기 후지,Food
284,상품명 이푸른 국내산 제주 흑돼지로 만든 양념왕구이        팩,Food
285,배터짐 상품명 특미 이베리코 수육용 삼겹살     돼지지방 많음,Food
286,배터짐 상품명 돼지 쪽갈비 돼지갈비    ,Food
287,배터짐 상품명 특미 이베리코 구이용 삼겹살    ,Food
288,상품명 국내산 한돈 대패삼겹살       목살        두삼겹      총     ,Food
289,상품명 코스트코 수지스 허브 닭가슴살      ,Food
290,상품명 제주양돈농협 프리미엄 제주 흑돼지 삼겹살 오겹살     ,Food
291,상품명 국내산 돼지고기 꽃삼겹살     ,Food
292,상품명  월   일 오전  시 결제건까지 설날 전 배송냉동우아한소 호주청정우    번대 꽃   갈비     ,Food
293,배터짐 상품명 국내산 돼지 아롱사태     돼지사태 앞다리살 고기,Food
294,삼다몰 상품명 삼다몰 제주 흑돼지 오겹살 가정용       팩 ,Food
295,삼다몰 상품명 삼다몰 제주 흑돼지 목살 가정용       팩 ,Food
296,삼다몰 상품명 삼다몰 제주 흑돼지 선물세트  호,Food
297,상품명 함양군 흑돼지 명인 박영식 까매요 지리산 앞다리살 수육용    ,Food
298,상품명 함양군 흑돼지 명인 박영식 까매요 지리산 삼겹살 수육용    ,Food
299,상품명 함양군 흑돼지 명인 박영식 까매요 지리산 앞다리살 구이용    ,Food
300,금천미트 상품명 동원 듀록 납작 삼겹살          팩,Food
301,삼다몰 상품명 삼다몰 제주 흑돼지 오겹살 숯불용       팩 ,Food
302,상품명 드라이에이징 목살      숙성 웰빙 구이용 돼지고기,Food
303,상품명 엄마손 왕돼지 갈비 국내산   박스        통   대,Food
304,상품명 선물세트 왕돼지갈비 국내산         통   대 갈비,Food
305,상품명 대용량 접이식 쇼핑 카트 핸드카트 바퀴장바구니 대용량 접이식 쇼핑 카트 핸드카트 바퀴장바구니,Food
306,상품명 돼지 고기  의식탁 캠핑 바베큐 스테이크 돈마호크     의식탁           ,Food
307,상품명 대용량 접이식 쇼핑 카트 핸드카트 바퀴장바구니 대용량 접이식 쇼핑 카트 핸드카트 바퀴장바구니,Food
308,상품명 바퀴달린 휴대용 장바구니 접이식 캐리어 쇼핑카트 바퀴달린 휴대용 장바구니 접이식 캐리어 쇼핑카트,Food
309,상품명 바퀴달린 휴대용 장바구니 접이식 캐리어 쇼핑카트 바퀴달린 휴대용 장바구니 접이식 캐리어 쇼핑카트,Food
310,상품명 미트팜 돼지양념 왕구이  대       미트팜 돼지양념 왕구이  대      ,Food
311,상품명 바퀴달린 휴대용 장바구니 접이식 캐리어 쇼핑카트 바퀴달린 휴대용 장바구니 접이식 캐리어 쇼핑카트,Food
312,상품명 송월타올 송월 제이드 호텔수건 고중량 세면타월   수       매,Food
313,상품명 송월타올 뱀부 뉴컬러무지 세면타월 기념수건 답례품  매      세트  ,Food
314,상품명 송월타올 스누피 프렌즈 세면타월 기념수건 답례품  매      세트  ,Food
315,상품명 이목원 배나무골 삼겹 바비큐 통      ,Food
316,상품명 대용량 접이식 쇼핑 카트 핸드카트 바퀴장바구니 대용량 접이식 쇼핑 카트 핸드카트 바퀴장바구니,Food
317,상품명 송월 테니스수건 스포츠 클럽 선물세트쇼핑백 타올  매,Food
318,상품명 스포츠타임타올 아이스쿨타올 매직 쿨 타월 세트      매입  ,Food
319,상품명 골퐁이 항균 골프수건 릴 골프공 타올  매      세트  ,Food
320,상품명 송월 테니스수건 스포츠 클럽 타올  매      세트  ,Food
321,상품명 송월타올송월 항균 에이스 세면타월 단체수건 답례품       매,Food
322,상품명 송월타올 뱀부얀 크리스마스 러블리 기념수건 답례품  매      세트  ,Food
323,상품명 쿨타올 습식타올 냉타올 스포츠      매입  ,Food
324,상품명 냉동목전지 수입 돼지목살 제육볶음용      냉동목전지 수입 돼지목살 제육볶음용     ,Food
325,상품명 국내산 돼지 김치찌개용 앞다리살 한돈 세절      국내산 돼지 김치찌개용 앞다리살 한돈 세절     ,Food
326,상품명 한돈 돼지 앞다리살 냉동돼지고기 불고기용      한돈 돼지 앞다리살 냉동돼지고기 불고기용     ,Food
327,상품명 한돈 돼지앞다리살 수육 보쌈용 고기      한돈 돼지앞다리살 수육 보쌈용 고기     ,Food
328,상품명 한돈 돼지고기 앞다리살 구이용      한돈 돼지고기 앞다리살 구이용     ,Food
329,상품명 한돈 돼지고기 목살 캠핑구이용      한돈 돼지고기 목살 캠핑구이용     ,Food
330,상품명 한돈 돼지목살 숯불 돼지고기 바베큐용      한돈 돼지목살 숯불 돼지고기 바베큐용     ,Food
331,상품명 한돈 보쌈고기 돼지목살 수육용      한돈 보쌈고기 돼지목살 수육용     ,Food
332,상품명 국내산 냉동삼겹살 수육 보쌈용 두툼한삼겹살      국내산 냉동삼겹살 수육 보쌈용 두툼한삼겹살     ,Food
333,상품명 수입산 냉동 돼지고기 수육용 삼겹살      수입산 냉동 돼지고기 수육용 삼겹살     ,Food
334,상품명 국내산 돼지고기 삼겹살 캠핑고기 바베큐용      국내산 돼지고기 삼겹살 캠핑고기 바베큐용     ,Food
335,상품명 미국산 대패 삼겹살 돼지고기      미국산 대패 삼겹살 돼지고기     ,Food
336,상품명 수입산 냉동 삼겹살 돼지고기      수입산 냉동 삼겹살 돼지고기     ,Food
337,상품명 맛의세상 수제어묵 어묵탕 부산오뎅 실속세트 호 오징어볼 치즈말이 고추중봉 잡채말이 문어손어묵 맛의세상,Food
338,상품명 대명축산식품 칠레산 오겹살     ,Food
339,상품명 국내산 돼지고기 다짐육     ,Food
340,상품명 가야촌 한돈 냉장 항정살      구이용,Food
341,푸드장 상품명 돼지고기 삼겹살 구이용 냉동 팜플로나      팩,Food
342,상품명 델리미트 이베리코 흑돼지 갈비살    ,Food
343,상품명 수제 불고기패티       개입 불고기버거 햄버거패티,Food
344,상품명 국내산 돼지불고기      개 양념불고기 제육볶음 반찬,Food
345,미트아울렛 상품명 항정살 원육        스페인산,Food
346,도드람한돈 상품명 도드람한돈 생 삼겹살 보쌈용     ,Food
347,공식 상품 프레시누리 상품명     고소한 목삼겹 보쌈용      ,Food
348,공식 상품 프레시누리 상품명  누리푸드 프리미엄 통삼겹 바베큐용 보쌈용     ,Food
349,상품명 돼지고기 왕목살 덩어리      원육  수입돼지고기,Food
350,미트아울렛 상품명 신선 삼겹살 구이용      ,Food
351,미트아울렛 상품명  미트아울렛  왕목살 원육  신선       미국산 목전지,Food
352,상품명 목전지 제육용      이지팩    인용 소포장,Food
353,상품명 목전지 보쌈용      이지팩 진공포장,Food
354,상품명 피에이미트마켓 돼지고기 다짐육            ,Food
355,상품명 성원 통살듬뿍새우패티 빅                개입 ,Food
356,상품명 국내산 돼지 머리고기 슬라이스      팩 국밥고기,Food
357,삼다몰 상품명 제주 흑돼지 목살 구이용       팩  가정용,Food
358,삼다몰 상품명 제주 흑돼지 오겹살 구이용       팩  가정용,Food
359,상품명 돼지고기 삼겹살 보쌈용     총     오스트리아산 ,Food
360,상품명  으뜸한돈  국내산 냉장 특수부위 구이선물세트      한돈  돼지고기 선물세트 무료배송,Food
361,상품명 왕목살 구이용           수입돼지고기,Food
362,상품명 왕목살 불고기 제육볶음용           수입돼지고기,Food
363,상품명 포뜬 생갈비 구이용     한돈 냉동 양념갈비 돼지고기,Food
364,상품명 돈뒷다리살 국거리 찌개용        국내산돼지고기,Food
365,상품명 돈뒷다리살 불고기 제육용         국내산돼지고기,Food
366,고기창고 상품명 통삼겹     씨즈닝   에어프라이어 숯불구이용,Food
367,       상품명 누리푸드     고소한 대패목삼겹       팩,Food
368,상품명 국내산 돈 등갈비 쪽갈비         립 바베큐 한돈 강원도 돼지고기,Food
369,상품명 국내산 돼지갈비     구이용   한돈 강원도 돼지 고기   갈비,Food
370,상품명  립    월 일 오전  시 주문건까지 명절전출고립   호주청정우  등급 찜갈비       선물세트 수입   ,Food
371,상품명 국내산 한돈 돼지 대패 삼겹살 구이용     냉동  개,Food
372,상품명 제주흑돼지 선물세트 미박삼겹 흑오겹     흑앞다리          인증,Food
373,삼다몰 상품명 제주 흑돼지 앞다리살 구이용       팩  가정용,Food
374,상품명 오늘자연 한돈 스페셜 구이세트  호        삼겹살 목살 앞다리살 ,Food
375,상품명 국내산 한돈 돼지 대패삼겹살      구이용 냉동  개,Food
376,배터짐 상품명 수육통 돼지 앞다리살    오겹살 삼겹살 항정살 목살,Food
377,배터짐 상품명 돼지갈비     찜갈비 돼지등뼈 오겹살 삼겹살 목살,Food
378,상품명 국산 한돈 돼지 앞다리살     수육용 보쌈용 냉장  개,Food
379,상품명 절단머리고기 돼지 부산물 슬라이스 절단머리고기     ,Food
380,배터짐 상품명 국내산 돼지껍데기     삼겹살 오겹살 목살 돼지갈비,Food
381,배터짐 상품명 삶은 돼지대창    돼지곱창 돼지막창 돼지내장 돼지간,Food
382,배터짐 상품명 돼지등뼈   수제간식 개간식 애견간식 개껌 강아지껌,Food
383,상품명 국내산돼지머리슬라이스           팩 ,Food
384,상품명 장흥토요시장 한돈 선물세트  호    ,Food
385,상품명 국내산  등급 이상 돼지 등심     돈까스용 한돈 등심   강원도 한돈 돼지고기 맥적,Food
386,백화점 상품 제주푸드마씸 상품명  롯데백화점 혼디축산 제주흑돼지 앞다리살       팩  구이용 냉장 ,Food
387,미트아울렛 상품명 신선 왕목살 목전지  구이용     미국산,Food
388,상품명 옛날냉동삼겹살         팩 총      한팩당    인분,Food
389,상품명 한돈 국내산  등급 이상 돼지 뒷다리살 다짐육       민찌 간고기 이유식 떡갈비 요리,Food
390,배터짐 상품명 돼지족발 앞족  개 돼지장족 삼겹살 오겹살 돼지머리,Food
391,배터짐 상품명 보쌈용 돼지 삼겹살 밑추리    오겹살 목살 돼지족발,Food
392,상품명 한돈 뒷다리살      제육볶음 불고기용 대용량 업소용,Food
393,상품명 도축  일내 닥터안스프레쉬 냉동 한돈 목살 대패 구이용     한입 목살 무항생제 돼지고기,Food
394,배터짐 상품명 삶은 돼지대창      돼지곱창 돼지막창 돼지머리 고기,Food
395,상품명 농협라이블리 한돈 삼겹살 수육용     ,Food
396,친절정육점 상품명 수입 목살      구이용 바베큐용,Food
397,배터짐 상품명 냉동 돼지막창   곱창 대창 돼지간 돼지머리 돼지내장,Food
398,상품명 수입 돼지 삼겹살 수육용     보쌈용   보쌈용 통삼겹 돼지고기 칠레 독일,Food
399,상품명 숙성 돼지고기 삼겹살    ,Food
400,상품명 한돈 강원도 돼지 뒷다리살 다짐육     간고기 민찌   국내산 돈후지 동그랑땡 미트볼 요리 집밥 이유식,Food
401,상품명 한돈 강원도 돼지 뒷다리살 잡채용       국내산 돼지고기 돈후지 채 볶음 요리 집밥,Food
402,상품명 한돈 강원도 돼지 뒷다리살 보쌈용     수육용   국내산 돼지고기 덩어리 집밥 김장,Food
403,상품명 그린 무항생제 목심       ,Food
404,상품명 그린 무항생제 삼겹살       ,Food
405,상품명 그린 무항생제 칼집 삼겹살       ,Food
406,배터짐 상품명 돼지갈비뼈   강아지 개간식 수제간식 개껌 애견간식,Food
407,상품명 히든포크 왕꼬들살 국내산 돼지고기 특수부위     ,Food
408,상품명 국내산 암퇘지 등뼈       감자탕  뼈해장국,Food
409,상품명 국내산 냉동대패 제육볶음 대패목살 대패목심    ,Food
410,상품명 대명축산식품 한돈 찌개용 돼지고기     ,Food
411,상품명 바먹 국내산 돼지 머릿고기 고급 특수부위 구이용 볶음용 캠핑요리 고기 꼬들살     ,Food
412,상품명 바먹 국내산 돼지고기 한돈 특수부위 모듬 구이용 밀키트 뽈살 두항정살 관자살 설하살 모둠     ,Food
413,배터짐 상품명 국내산 돼지 오돌뼈     삼겹살 갈비 등뼈 목살 직화,Food
414,미트컷 상품명 삼겹살 오스트리아  구이용    ,Food
415,미트컷 상품명 한돈 제육볶음용     ,Food
416,미트컷 상품명 한돈 돼지등뼈    ,Food
417,미트컷 상품명 돼지 등갈비 구이 찜     ,Food
418,배터짐 상품명 돼지 내장 갈매기살    뒷고기 삼겹살 항정살 오겹살,Food
419,상품명 국내산 돼지 냉장 한돈 유산균 돼지 갈비  찜용     ,Food
420,상품명 한입 큐브 삼겹살         팩 한입 크기 큐브 절단 소포장,Food
421,상품명 스페인 듀록 목살            컷팅     인분,Food
422,친환경팔도 상품명 보성녹차 먹인 한돈 구이 선물세트      ,Food
423,상품명 도드람한돈 칼집삼겹살구이용        팩   칼집목살구이용        팩 총    ,Food
424,상품명 대서푸드 돼지왕 양념구이 무뼈  대        팩  아이스박스 포장 ,Food
425,상품명 스테이커스 듀록삼겹살    ,Food
426,상품명 대명축산식품 국내산 전통 양념돼지갈비    ,Food
427,상품명 돼지다짐육 돼지민찌 뒷다리살     다짐육 돈민찌 돼지다짐육,Food
428,미트아울렛 상품명 보먹돼 냉장 삼겹살      구이용 캐나다산,Food
429,이푸른 상품명 보성녹돈 한돈 삼겹살  보쌈용          팩,Food
430,이푸른 상품명 보성녹돈 한돈 앞다리살  보쌈용          팩,Food
431,배터짐 상품명 듀록 돼지고기 삼겹살 다짐육    오겹살 항정살 목살,Food
432,상품명 국내산 한돈 목살 대패            한입구이,Food
433,상품명 녹차먹은 녹돈 돼지고기 선물세트       삼겹살 목살,Food
434,상품명 가야촌 매콤 불맛 오돌뼈     ,Food
435,상품명 왕 덜미살     국내산 돼지고기 왕꼬들살 덜미살   ,Food
436,상품명 제주 돼지 흑마늘고추장주물럭   팩,Food
437,상품명 빛나는밥상 냉동  통영 자연산 장어      소스증정 갓잡은 신선한 장어 밀키트 캠핑요리,Food
438,상품명 한돈  등급 돼지 실속 선물세트 구이 불고기용       삼겹     목살     앞다리살     ,Food
439,상품명 한돈  등급 돼지 삼겹 목살 구이 선물세트       삼겹     목살     삼겹     ,Food
440,농협안심한돈 상품명 농협안심한돈 한돈구이선물세트  호       삼겹살     목살     항정살     ,Food
441,푸른들 상품명 한마음팜 국내산 한돈 삼겹살 목살 선물세트  호       ,Food
442,상품명 지리산농협 흑돼지선물세트   구  실속형  중량        약 인분,Food
443,상품명 지리산농협 흑돼지선물세트   구  고급형  중량         약 인분,Food
444,상품명 짚불삼겹살       팩 친환경볏짚 초벌구이      ,Food
