,titles,category
296,공식 상품 동서가구 상품명      모던 아카시아 콤비      서랍 옷장 화이트 옷장 모음         ,Interior
297,공식 상품 한샘 상품명 한샘 샘베딩 베이직 거울옷장세트       높이       서랍형  종,Interior
298,공식 상품 한샘 상품명 한샘 바이엘 슬라이딩 옷장      화이트 행거형  종 택  ,Interior
299,공식 상품 한샘 상품명 샘베딩 클로즈 거울옷장세트        높이       서랍형,Interior
300,동서가구 상품명 릴리 화이트    싱글장,Interior
301,동서가구 상품명 동서가구 이즈 몽블      단서랍 옷장,Interior
302,공식 상품 한샘 상품명 바이엘 소프트 옷장 크림화이트      높이       선반형  타입,Interior
303,공식 상품 포더홈 상품명 스페이서     서랍 선반 옷장  추가구성 단독구매불가 ,Interior
304,장인가구 상품명 장인가구 코지      단서랍 미니 옷장 행거형,Interior
305,에넥스 상품명 밀크티 하이그로시 슬라이딩 붙박이장       고급형 ,Interior
306,에넥스 상품명 선셋 화이트 갤러리 붙박이장       고급형 ,Interior
307,공식 상품 한샘 상품명 샘베딩 파스텔 거울옷장      높이        단행거형  종,Interior
308,상품명 미니틈새옷장 얇은 사무실 책상옆 간이 겉옷 외투    ,Interior
309,아씨방 상품명 아씨방가구 도도 드레스룸     선반 옷장,Interior
310,핀란디아 상품명 오로라 월넛 원목  단 장롱,Interior
311,상품명     복합 선반수납장   칸             조립식옷장,Interior
312,동서가구 상품명 동서가구 키프 싱글 옷장 이불장 장롱             ,Interior
313,공식 상품 동서가구 상품명 칸나  서랍 싱글 옷장             ,Interior
314,상품명  텐바이텐 라움 하프 갤러리 붙박이장      ,Interior
315,상품명 케이컴퍼니 심플비        옷장세트     서랍옷장   긴문옷장이불장 ,Interior
316,공식 상품 마켓비 상품명       캐비넷 옷장                 라이트그레이          ,Interior
317,공식 상품 마켓비 상품명     캐비넷 옷장         화이트          ,Interior
318,동서가구 상품명 홈앤단독특가 베스트셀러 동서가구 아모르        콤비갤러리장롱         ,Interior
319,상품명  텐바이텐 일루일루 코모드  올인원 히든 행거 선반 옷가게 옷장행거,Interior
320,상품명 라움 화이트 보조장,Interior
321,상품명 심플한 원룸 옷 바지 정장 보관 정리 수납 간이 옷장,Interior
322,리바트 상품명 뉴트 붙박이장 누디베이지  자가실측           ,Interior
323,공식 상품 한샘 상품명 한샘 바이엘 채널 옷장세트 데일리서랍형             높이       화이트   종,Interior
324,더리체 상품명 착불배송 클레식 빈티지 엔틱가구 보노 엔틱 옷장,Interior
325,아이앤 상품명 아이앤 란티아     미니 옷장    ,Interior
326,상품명 포레 철제 회전 행거  단 원형행거 틈새옷걸이 스카프걸이,Interior
327,동서가구 상품명 동서가구 모던 클래스      전신거울 옷장세트         ,Interior
328,상품명 슈로 장롱 수납 이불장  통 옷장 싱글장 모던 입본장 안방 학생 엔틱 고급 장농     ,Interior
329,상품명 인우드 가구 젤리스   하이그로시 원서랍 옷장,Interior
330,상품명 월데코     복합 선반 수납장  칸 조립식 옷장,Interior
331,상품명 어린이집 유치원 개방형 원목 옷장 수납장  인용,Interior
332,상품명 신박한 정리  형 책상 옷장 세트     ,Interior
333,상품명 길몽드 아이언 원목행거             ,Interior
334,상품명 옷장 장 장롱 수납장 자석 빠지링,Interior
335,상품명 굿마켓 선반 옷장             칸  원룸옷장 조립식드레스룸 수납옷장 조립옷장 박스옷장,Interior
336,상품명 굿마켓     화이트 라인 선반 옷장            수납옷장 선반옷장 키낮은옷장  인용옷장 조립식옷장,Interior
337,상품명 굿마켓 선반 옷장            다용도옷장 조립식옷장 화이트수납장 화이트옷장 조립식수납장,Interior
338,상품명 하사 비키니옷장 모란봉옷장 장농 수납 부직포 커버,Interior
339,상품명 하사 비키니옷장 모란봉옷장 장농 수납 부직포 커버,Interior
340,상품명 커펜형  단 높이조절가능 간편설치 옷걸이 드레스장드레스룸선반 드레스룸세트 드레스룸수납장 드레스룸시,Interior
341,상품명 커텐형  단 높이조절가능 간편설치 옷걸이 드레스장드레스룸선반 드레스룸세트 드레스룸수납장 드레스룸시,Interior
342,상품명 굿마켓 선반 옷장            박스옷장 간편한옷장 좁은방옷장 가성비옷장  인가구옷장,Interior
343,상품명 굿마켓     수납장            원룸옷장  인가구옷장 간편한옷장 수납옷장 조립장롱,Interior
344,상품명 굿마켓 화이트 선반 옷장            원룸옷장  인가구옷장 조립식드레스룸 조립장롱 박스옷장,Interior
345,상품명 굿마켓 선반 옷장              칸 조립식드레스룸 박스옷장 수납옷장 조립장농  인가구옷장,Interior
346,상품명 굿마켓 선반 옷장              칸 조립식드레스룸 수납옷장 가성비옷장 박스옷장 원룸옷장,Interior
347,상품명 굿마켓 선반 옷장                칸  좁은방옷장 조립식드레스룸 간편한옷장 조립장농 조립장롱,Interior
348,상품명 굿마켓 선반 옷장            좁은방옷장 간편한옷장 박스옷장 원룸옷장 조립식드레스룸,Interior
349,상품명 굿마켓     선반 옷장  열 칸  조립옷장  인가구옷장 조립장농 조립장롱 원룸옷장,Interior
350,상품명 하사 비키니옷장 모란봉옷장 장농 수납 부직포 커버,Interior
351,상품명 핑크  칸 조립식옷장 자취방옷장 선반옷장 옷장    좁은방옷장,Interior
352,상품명 화이트  칸 조립식옷장 간이옷장 수납형옷장 선반옷장,Interior
353,상품명 화이트  칸 조립식옷장 선반옷장 간편옷장    옷장 조립형옷장,Interior
354,상품명 튀틀림없는 국산 모던 서랍형 옷장    ,Interior
355,상품명 앤틱 우드 장롱 키워드없음,Interior
356,상품명 독립형 드레스룸  ,Interior
357,상품명 도어락 철재 캐비넷 철제 수납장 산업 공구 케비넷   ,Interior
358,상품명 독립형 드레스룸  ,Interior
359,상품명  모먼트 조립식선반옷장 화이트             칸 이동식선반옷장 수납옷장 깔끔한옷장 옷장선반,Interior
360,상품명  모먼트 조립식선반옷장 화이트             칸 옷수납장 옷장선반    수납함 이동식선반옷장,Interior
361,상품명  모먼트 조립식선반옷장 화이트          칸 옷장선반 깔끔한옷장 조립옷장 옷수납장,Interior
362,상품명 도어락 철재 캐비넷 철제 수납장 산업 공구 케비넷   ,Interior
363,상품명  모먼트     선반수납장   칸           조립옷장    수납장    수납함 옷수납장,Interior
364,해외직구 상품 상품명 윈도우 커버 옷장 의류 먼지 보관 가방 부직포     가시 창 재킷 걸이식 오거나이저 방진,Interior
365,휴센 상품명 프리미엄          드레스룸 롤스크린 측판  단서랍함  튼튼 드레스룸 옷장 행거 ,Interior
366,공식 상품 한샘 상품명 샘베딩 베이직 옷장세트       높이       행거형  종,Interior
367,공식 상품 한샘 상품명 샘베딩 스테디 옷장세트       높이       서랍형   종,Interior
368,공식 상품 한샘 상품명 샘베딩 클로즈 옷장      높이       선반형,Interior
369,공식 상품 한샘 상품명 샘베딩 클로즈 옷장      높이       행거서랍형,Interior
370,공식 상품 한샘 상품명 샘베딩 베이직 거울옷장세트       높이       서랍형  종,Interior
371,공식 상품   매직하우스 상품명   윈도우커버    이불장 행거 장롱 조립식옷장 옷걸이,Interior
372,공식 상품 프리메이드 상품명 프라임 서랍 와이드 행거 옷장 드레스룸 시스템행거,Interior
373,공식 상품 한샘 상품명 샘베딩 클로즈 옷장세트       높이       선반형,Interior
374,공식 상품 한샘 상품명 샘베딩 클로즈 거울옷장      높이        단행거형,Interior
375,공식 상품 한샘 상품명 샘베딩 스테디 거울옷장      높이       행거서랍형,Interior
376,공식 상품 한샘 상품명 샘베딩 스테디 거울옷장      높이        단행거형,Interior
377,상품명 한샘 샘베딩 드레스룸 세트       높이        행거형,Interior
378,공식 상품 한샘 상품명 스테이 드레스룸 세트       서랍형,Interior
379,지베스 상품명 엘린 입본장세트,Interior
380,솜씨방 상품명 로즈모던     틈새옷장 이단봉형 ,Interior
381,공식 상품 포더홈 상품명 스페이서 슬라이딩 옷장      행거형  거울도어 ,Interior
382,와이디가구 상품명 드레스룸 선반 행거 시스템 옷장 조립식 장롱 수납장,Interior
383,장인가구 상품명 장인가구 탐스      전신거울 옷장 착불 ,Interior
384,상품명 해피아이 프랜즈     오픈형 수납장  옷장 장농 장롱 ,Interior
385,엘레아 상품명 에반 원목     옷장 장롱 장농 이불장 드레스룸,Interior
386,홈쇼핑 상품 에넥스 상품명 에넥스 페블스톤 슬라이딩 붙박이장      규격추가 ,Interior
387,장인가구 상품명 시클리 화이트 장롱세트,Interior
388,휴센 상품명 휴센 두배로      드레스룸 기본형,Interior
389,상품명 보네드 올리비아  단 서랍 고무나무 원목 옷장 장롱,Interior
390,공식 상품 한샘 상품명 샘베딩 파스텔 거울옷장      높이       선반형  종,Interior
391,공식 상품 한샘 상품명 샘베딩 마일드 파우더장      높이       수납형  종,Interior
392,상품명 달튼  서랍 장롱세트 도어형     ,Interior
393,공식 상품 동서가구 상품명 착불 엘거스 전신거울       서랍 옷장세트         ,Interior
394,공식 상품 동서가구 상품명 키큰 댐퍼경첩     수납 옷장         ,Interior
395,공식 상품 모던하우스 상품명 모던하우스 에브리 틈새  단 서랍장      투명 ,Interior
396,공식 상품 동서가구 상품명 이즈 클래스      옷장 세트         ,Interior
397,공식 상품 리바트 상품명 엘리아      키큰옷장 긴옷장,Interior
398,상품명 캐슬골드 오즈 가구손잡이 붙박이장  구 옷장손잡이,Interior
399,상품명 블랙골드 가구손잡이  구 옷장 서랍장 붙박이장손잡이,Interior
400,상품명 원형 크리스탈 직부등 샴페인골드 드레스룸조명,Interior
401,상품명 원터치 옷장 자석 서랍 교체 수선 가구부속품 빠찌링   ,Interior
402,상품명 나혼자생활 행거맨 붙박이장 타이 걸이 넥타이,Interior
403,상품명 간이 사무실 회사 화이트 서랍장 선반 옷장 의류 옷수납장,Interior
404,상품명 미우드  펠리드 옷장    ,Interior
405,상품명 도어락 철재 캐비넷 철제 수납장 산업 공구 케비넷   ,Interior
406,상품명 마리 쿠쿠시 하이그로시 미니 옷장    ,Interior
407,상품명 미우드  토리디 옷장    ,Interior
408,상품명 나만을 위한  칸큐브간이행거옷장,Interior
409,상품명 컬러 체어 가정 용품 디자인 옷장 광폭 행거 가구    ,Interior
410,상품명 수납 간이옷장 오픈형 옷정리함  단,Interior
411,상품명    철재락커  신발장 철재캐비넷 수납장  단 그린,Interior
412,상품명 고급 장롱 가구    코텍       문손잡이,Interior
413,상품명 사무용 캐비넷소 철재,Interior
414,상품명   코너행거 아파트드레스룸 코너형 철제행거,Interior
415,상품명 개인락커룸 철제 캐비닛 수납 개인사물함  단캐비닛,Interior
416,상품명 행거 드레스룸 조립식 맞춤형 스틸 단조립행거,Interior
417,상품명 행거 새집 침실 다용도 사무실 거실 사무용 드레스룸,Interior
418,상품명 미우드  토리디 이불장    ,Interior
419,상품명 미우드  메르미 옷장    ,Interior
420,상품명 미우드  안브르 서랍 옷장    ,Interior
421,상품명 미우드  루리드 옷장 이불장    ,Interior
422,상품명 철재 캐비넷 철제 수납장 산업 공구 케비넷 보관함   ,Interior
423,상품명 미우드  테리드 서랍 옷장    ,Interior
424,상품명 이동식 서랍달린 왕관 행거      ,Interior
425,상품명 행거 체어 꾸미기 용품 인테리어 방 드레스룸     ,Interior
426,상품명 미우드  안브르 옷장 이불장 수납장    ,Interior
427,상품명 도어락 철재 캐비넷 철제 수납장 산업 공구 케비넷   ,Interior
428,상품명 철재 서랍 사무용 캐비넷,Interior
429,상품명 도어락 철재 캐비넷 철제 수납장 산업 공구 케비넷   ,Interior
430,상품명 도어락 철재 캐비넷 철제 수납장 산업 공구 케비넷   ,Interior
431,상품명 행거 체어 인테리어 거실 침실 사무실 방 드레스룸,Interior
432,상품명    철재캐비넷  서류보관 사무용 업무용 대형,Interior
433,상품명   철재캐비넷  개인사물함 신발장 사무실락커  칸,Interior
434,상품명 미우드  루리드 서랍 옷장    ,Interior
435,상품명 드레스장 모던 인테리어      단    ,Interior
436,상품명 행거 꾸미기 용품 방 이사 인테리어 드레스룸    ,Interior
437,상품명 나만을 위한  칸큐브간이옷장,Interior
438,상품명 수납장 다용도 조립식옷장     간이옷장 선반장,Interior
439,상품명 가구 장롱 손잡이 서랍장 체리손잡이 모음 손잡,Interior
440,상품명 도어락 철재 캐비넷 철제 수납장 산업 공구 케비넷   ,Interior
441,상품명 락커 사무용 철제 캐비넷 옷장 사물함  단  인용,Interior
442,상품명   스틸행거  침실인테리어 조립식옷장 원룸 자취방,Interior
443,상품명 컬러 가구 인테리어 디자인 깔끔한 옷장 광폭 행    ,Interior
444,상품명 행거 용품 디자인 인테리어 가구 예쁜 드레스룸    ,Interior
