,titles,category
0,아이디어스터디 스터디스타 와이드      독서실책상 왼쪽선반,Interior
1,영림임업 영림 인테리어필름 우드 나무무늬 데코시트 셀프시공 인테리어시트지 모델명         ,Interior
2,모던  단      낮은책장 화이트,Interior
3,   별자리 오르골 보석함 지브리 하울의움직이는성 오르골 선물 생일 크리스마스 캐논 변주곡,Interior
4,마그네틱조명     라인조명 자석레일조명 트랙 매립형 직부형 확실한    ,Interior
5,더프리그 친환경 방염 타일카페트 사무실 거실 인테리어 시공 카펫타일        ,Interior
6,시디즈 사무용 의자     라이트,Interior
7,동서가구 해리스 리클라이너 침대형 사무용 사무실 중역 의자         ,Interior
8,이브자리 오가닉솔리드 매트리스커버             ,Interior
9,노르웨이숲 매트리스 접이식 침대 바닥 토퍼  단 자취  인용 수면매트       ,Interior
10,공간철학 라이노 오픈 파티션 책장,Interior
11,뜨개질 꽃다발 뜨개꽃 장미 백합     특이한,Interior
12,레일 액자걸이 와이어 사진걸이,Interior
13,박스판매   개 파나소닉                  주광색 퇴색방지 자외선감소 문화재,Interior
14,프리미엄 양면 호텔식 순면 홑겹 누빔 이불커버 싱글 더블 퀸,Interior
15,한일카페트 클로에 순면 워싱카페트,Interior
16,먼지없는 순수 모달이불      사계절 차렵이불 여름 알러지케어이불,Interior
17,헤즈로 미카엘  인용 무광 포세린 세라믹식탁 미드센츄리 모던 식탁세트 식탁의자 개,Interior
18,멜빵집게 멜빵클립 퍼터키퍼 집게   개,Interior
19,슈퍼홈 리처 티비다이      낮은 거실장   장,Interior
20,리바트 드레싱  인 가죽 식탁벤치의자,Interior
21,  로고 장식 뜨개 가방 부자재 핸드메이드,Interior
22,오꿈 족자만들기  ,Interior
23,    인조가죽 레자원단    민블랙,Interior
24,    한샘      디오 바체어        외 투웨이 홈바의자 식탁의자 카페의자,Interior
