,titles,category
0,라꾸라꾸 상품명  공식판매점  라꾸라꾸침대 싱글더블 온열 슈퍼 전동  모델선택요망 라꾸라꾸 싱글 본사직배송,Interior
1,동서가구 상품명 동서가구 무료배송 포미 견면  단 접이식토퍼    싱글,Interior
2,공식 상품 하포스 상품명 프리미엄 호텔    비건가죽 침대 매트리스 세트 퀸사이즈,Interior
3,공식 상품 더릭스홈 상품명  레이어 메모리폼 양면 침대 토퍼 바닥 매트리스     ,Interior
4,숙면연구소 상품명 베이직 토퍼매트리스 중간용      원룸 바닥 단단한 수면매트 자취 침대 라텍스 매트릭스 토퍼,Interior
5,공식 상품 노송가구 상품명 노송가구 국내제작    조명 종 수납  단서랍 침대 고급 볼레일 서랍,Interior
6,아씨방 상품명 아씨방가구 꿀잠프로젝트     볼라텍폼스 매트리스,Interior
7,상품명    홈쇼핑  에넥스 소피아     유로탑 수납 침대 수퍼싱글         ,Interior
8,세진침대 상품명 세진침대 레그노  존독립 천연라텍스    매트리스 ,Interior
9,동서가구 상품명 동서가구 엘로 호텔형 시그니처 일체형 투매트리스 침대            ,Interior
10,공식 상품 더릭스홈 상품명  단 접이식 매트리스      퀸    원룸 바닥 단단한 수면매트 접는 라텍스 토퍼,Interior
11,공식 상품 동서가구 상품명 편백 황토흙 돌침대 맥반석 돌소파 흙소파 황토 온열기능 건강침대  효도선물,Interior
12,상품명 침대깔판 매트리스깔판 침대 받침대 슈퍼싱글      ,Interior
13,아씨방 상품명 아씨방가구 저상형 침대 슈퍼싱글 퀸  매트리스추가 ,Interior
14,장수돌침대 상품명 장수돌침대       럭셔리 맥베드 퀸침대,Interior
15,라자가구 상품명 라자가구   오크    시크릿  멀티수납 침대세트    싱글  본넬매트리스,Interior
16,상품명 하모벨 편백 평상형 침대    헤드 슈퍼싱글 국내제작,Interior
17,상일리베가구 상품명 상일리베가구 토리 황토 온돌 온열  인용 흙침대 싱글 퀸,Interior
18,삼익가구 상품명 삼익가구      마레      단 수납 원목 침대    양모 라텍스  존 독립스프링,Interior
19,공식 상품 동서가구 상품명 인생매트리스 라텍스 볼라텍스 침대형 바닥형 토퍼 매트리스 슈퍼싱글 퀸          ,Interior
20,공식 상품 동서가구 상품명      프리미엄 가죽 퀸 흙침대 황토 볼보료           ,Interior
21,공식 상품 동서가구 상품명      프리미엄 황토 흙침대    황토볼보료 초특가         ,Interior
22,공식 상품 동서가구 상품명      프리미엄 가죽 슈퍼싱글 황토 흙침대         ,Interior
23,공식 상품 동서가구 상품명      이즈 비엘      단 수납원목  침대 독립매트         ,Interior
24,공식 상품    홈 상품명 바디서포트 토퍼 매트리스          단단한 토퍼 통폼 침대 바닥 수면매트        ,Interior
25,상품명 하모벨 편백 평상형 침대 무헤드 슈퍼싱글 국내제작,Interior
26,공식 상품 잠스쿨 상품명 폭탄 양면매트리스 침대 바닥 토퍼     슈퍼싱글,Interior
27,공식 상품 잠스쿨 상품명 폭탄 양면매트리스 침대 바닥 토퍼     퀸,Interior
28,공식 상품 잠스쿨 상품명 폭탄 양면매트리스 침대 바닥 토퍼      슈퍼싱글,Interior
29,상품명 밀라 편백나무  단   조명 콘센트 수납침대 슈퍼싱글     ,Interior
30,공식 상품 더릭스홈 상품명  단 접이식 매트리스      슈퍼싱글     원룸 바닥 단단한 수면매트 접는 라텍스 토퍼,Interior
31,공식 상품 동서가구 상품명 해피슬립          멀티싱글 슈퍼싱글 퀸 토퍼 매트리스,Interior
32,파미가구 상품명 탄성이 좋은 병원매트리스 병원침대 환자용 바닥침대 바닥매트리스 침대매트리스 싱글매트리스,Interior
33,공식 상품 동서가구 상품명 착불 이즈 카이   침대  독립매트            ,Interior
34,상일리베가구 상품명 상일리베가구 룬 원목 데이베드 무헤드 침대프레임 멀티싱글   슈퍼싱글   퀸,Interior
35,공식 상품 조은자리 상품명  최대혜택가      원 메모리폼 접이식 침대 토퍼 매트리스 바닥 매트 화이트 하드   ,Interior
36,상품명 밀라 삼나무 원목 저상형침대 매트리스깔판 슈퍼싱글   ,Interior
37,공식 상품 베스트리빙 상품명 윈저 원목 슈퍼싱글 침대    침대 프레임 매트리스 별도 할인,Interior
38,공식 상품 노송가구 상품명 노송가구 필로우탑 엔드리스 스프링 독립스프링 봉합매트리스 모든사이즈           ,Interior
39,공식 상품 동서가구 상품명      인기     조명 수납 서랍형 슈퍼싱글 수납침대            ,Interior
40,상품명 엔젤홈스  단 더블 쇼파베드 간이침구 바닥매트리스 쇼파겸용 제품,Interior
41,상품명 매트리스 포함 멀티 단    서랍 무헤드 수납침대  슈퍼싱글     본넬매트리스포함,Interior
42,동서가구 상품명 동서가구 사커 슈퍼싱글    양면 매트리스         ,Interior
43,백화점 상품 알레르망 상품명 알레르망 카이 퀼팅패드    킹 ,Interior
44,상품명 필굿 병원매트리스 허리에좋은 딱딱한 매트리스 허리디스크 의료용 병원 침대 허리통증에 좋은 탄성좋은,Interior
45,공식 상품 잠스쿨 상품명 떡실신매트리스 침대 바닥 토퍼      슈퍼싱글,Interior
46,상품명 디노 프리미엄 양면 침대 매트리스 슈퍼싱글 독립포켓,Interior
47,공식 상품 더릭스홈 상품명 딥슬립 에어릭스  단 접이식 매트리스     슈퍼싱글  허리에좋은 탄탄한 침대 바닥 사계절 토퍼,Interior
48,공식 상품 더릭스홈 상품명 베이직 단단한 바닥 매트리스          슈퍼싱글 ,Interior
49,동서가구 상품명 동서가구 라일 일체형 단면 슈퍼싱글    침대 매트리스 프레임  서랍미포함 ,Interior
50,엘레아 상품명 마스터 수납 슈퍼싱글 사이즈 침대 프레임    저상형 원룸 어린이 학생 싱글 매트리스  인 가구,Interior
51,공식 상품 베스트리빙 상품명 까밀레 무헤드 원목 퀸   침대 프레임 매트리스 미포함,Interior
52,공식 상품 베스트리빙 상품명 독립스프링      퀵 필로우탑 침대매트리스 슈퍼싱글매트리스 퀸 킹 메트리스 매트리스 롤팩매트리스 할인,Interior
53,굿모닝침대 상품명 협탁무료증정 우디     슈퍼싱글침대 일체형 단면매트리스포함,Interior
54,공식 상품 동서가구 상품명 프리미엄 소나무 통원목 키퍼 황토흙 돌소파 흙침대 돌침대 침대프레임 슈퍼싱글 퀸,Interior
55,상품명 흙마루 돌침대 흙침대 황토볼 카우치 소파 모음     ,Interior
56,홈쇼핑 상품 현대의료기 상품명     현대의료기 헤링본 황토흙침대 싱글   ,Interior
57,상품명 이음   수납헤드 슈퍼싱글침대세트 본넬양면매트리스 ,Interior
58,상품명 엔젤홈스  단 싱글 매트리스 바닥매트 슈퍼싱글 오염방지 발수원단 가공,Interior
59,공식 상품 잠스쿨 상품명 떡실신매트리스 침대 바닥 토퍼     슈퍼싱글,Interior
60,상품명 리타하우스 매트리스  단 저상형 퀸   깔판      ,Interior
61,상품명 디노 프리미엄 양면 침대 매트리스 싱글 본넬,Interior
62,상일리베가구 상품명 상일리베가구 큐브 틈새방지 저상형 가족 패밀리 침대,Interior
63,장인가구 상품명 프레쉬 편백나무 원목 평상서랍형 침대    본넬매트,Interior
64,동서가구 상품명 동서가구 힐링 수납헤드 편백나무 원목 퀸   침대  매트미포함          ,Interior
65,상품명 독일        퀸 매트리스,Interior
66,공식 상품 동서가구 상품명 동서가구 미암   흙침대   퀸 흙침대         ,Interior
67,삼익가구 상품명 삼익가구 롯데단독최저가 엔느     평상형 침대 매트제외 슈퍼싱글  착불배송,Interior
68,홈쇼핑 상품 상품명 휴가드 패밀리  개세트 프리미엄 삶아쓰는 경추베개,Interior
69,공식 상품 베스트리빙 상품명 로라     슈퍼싱글 침대    수납 서랍 침대 침대프레임 매트리스 별도구매,Interior
70,웰하우스 상품명 리에또 원목 서랍수납침대 프레임  ,Interior
71,라자가구 상품명 라자가구    오크    시크릿  멀티수납 침대세트    싱글  프레임,Interior
72,상품명  신우팜 클라우드 플러스 천연라텍스 토퍼 매트리스       슈퍼싱글,Interior
73,상품명 접이식 간이 침대 싱글  인용 야전 캠핑 이동식 베드 경량 휴대용 각도조절 보조 매트리스  펠리,Interior
74,상품명 디노 프리미엄 양면 침대 매트리스 퀸 본넬,Interior
75,상품명  단 수납 서랍형 슈퍼싱글 침대   존슬립매트리스   ,Interior
76,숙면연구소 상품명  단 접이식 마약매트리스 토퍼 바닥용      슈퍼싱글 원룸 바닥 단단한 수면매트 자취 침대 매트릭스,Interior
77,동서가구 상품명 고무나무원목 동서가구     단 수납 원목   침대 프레임,Interior
78,상품명 레드파인 평상마루형 슈퍼싱글 통원목 침대프레임,Interior
79,버지니아가구 상품명 라탄 원목 슈퍼싱글 침대프레임 엔틱화이트,Interior
80,상품명 라자가구 텐셀퓨어       매트리스 퀸 ,Interior
81,공식 상품 동서가구 상품명 베스트     수납침대   편백 수납헤드 원목 침대 슈퍼싱글 퀸 매트리스 서랍 침대,Interior
82,동서가구 상품명 동서가구 모던 클루 퀸 흙침대 황토볼보료 ,Interior
83,라자가구 상품명 라자가구더잠 그리다    침대세트      독립매트리스 ,Interior
84,동서가구 상품명 동서가구   매트   폼  단 접이식 슈퍼싱글    토퍼 매트리스         ,Interior
85,동서가구 상품명 동서가구 무료배송 포미   폼  단 접이식토퍼            ,Interior
86,동서가구 상품명 동서가구 팀버 삼나무 원목 침대 프레임    저상형 접이식 매트리스 깔판         ,Interior
87,라꾸라꾸 상품명 라꾸라꾸침대  인용 싱글  접이식 간이침대 온열선택,Interior
88,상품명 이음   수납헤드 슈퍼싱글침대세트 독립포켓토퍼매트 ,Interior
89,상품명 매트리스 포함 멀티 단    서랍 무헤드 수납침대  퀸    본넬매트리스포함,Interior
90,동서가구 상품명 동서가구 프리미엄 키퍼 소나무 통원목 황토볼 카우치 흙소파         ,Interior
91,가구야 상품명 가구야      큰서랍형 싱글침대   매트리스 포함,Interior
92,파로마가구 상품명 파로마 퍼스트 노아  존 유로탑 독립쿠션 오가닉양모   라텍스매트리스  ,Interior
93,세진침대 상품명 세진침대 레그노  존독립 천연라텍스    매트리스  ,Interior
94,럭스앤펀 상품명 고밀도    슈퍼싱글    천연 라텍스 매트리스 풀세트 토퍼,Interior
95,상품명 코코 기절초폼 매트리스 접이식 토퍼 멀티싱글       ,Interior
96,상품명 바닥  단 접이식 매트리스 토퍼 자취 침대       ,Interior
97,숙면연구소 상품명  단 접이식 마약매트리스 토퍼 바닥용      퀸 원룸 바닥 단단한 수면매트 자취 침대 매트릭스,Interior
98,숙면연구소 상품명 베이직 탄탄한 바닥 매트리스          슈퍼싱글 ,Interior
99,숙면연구소 상품명 베이직 탄탄한 바닥 매트리스         퀸 ,Interior
100,라꾸라꾸 상품명 공식판매점 라꾸라꾸  웰빙싱글 온열내장형   인용 본사직배송 확실한  ,Interior
101,상품명 피부미용베드 경락베드 마사지침대 병원베드 피부관리실 피부과,Interior
102,상품명  매쉬원    매쉬 돌침대매트 패드 쇼파매트        ,Interior
103,상품명    철재 층침대 기숙사침대 게스트하우스침대이단침대,Interior
104,칼루스 상품명 간이침대  단 각도조절 접이식 틈새보관 리클라이너 폴딩침대 사무실침대 야전침대 접이식침대 캠핑 차박,Interior
105,공식 상품 아이솔 상품명 몰덴 퀸    원목침대 프레임 평상형침대 소나무원목,Interior
106,신우팜라텍스 상품명  신우팜 매트리스 베개  세트 리엔아 고밀도 천연라텍스 매트리스        ,Interior
107,동서가구 상품명 동서가구 오웰     수납 호텔   침대 협탁    독립매트,Interior
108,동서가구 상품명 동서가구       프리미엄라인  존독립         퀸  매트리스         ,Interior
109,동서가구 상품명 동서가구 엘로 호텔형 시그니처 일체형 투매트리스 침대           ,Interior
110,상품명 피칸 프리미엄 평상형 침대 프레임  슈퍼싱글 퀸 라지킹 ,Interior
111,상품명 흙마루흙쇼파 황토볼 흙침대 카우치  인돌소파       ,Interior
112,상품명 프라임  단 매트리스 단단한 접이식매트리스 접이식 토퍼 군용 멀티싱글       런칭 초특가 할인,Interior
113,상품명 꾸민가 업마블  단 접이식 매트리스 단단하고 탄탄한  멀티싱글          년 두께업 버전 출시 ,Interior
114,상일리베가구 상품명 상일리베가구 릴리     조명 서랍 수납침대     ,Interior
115,상품명 침대 이스타일가구 심포니      칸서랍수납침대 프레임 퀸 ,Interior
116,홈쇼핑 상품 상품명 프랑켄스톨츠 셀솔루션 비스코 토퍼 매트리스  ,Interior
117,파로마가구 상품명 파로마 퍼스트 노아  존 유로탑 독립쿠션 오가닉양모   라텍스매트리스 ,Interior
118,세진침대 상품명 세진침대 레그노  존라텍스    이태리폼   매트리스 ,Interior
119,신우팜라텍스 상품명 느웰 천연라텍스 캠핑 차박 여행용 토퍼 매트리스 스트라이프        ,Interior
120,나가다 상품명  단 접이식 매트리스 퀸 소파베드 접이식침대 퀸,Interior
121,해외직구 상품 상품명      단 접이식침대 간이침대 야전침대            ,Interior
122,상품명 해피리빙 슈퍼싱글 고무나무 원목 침대 프레임   ,Interior
123,상품명 프라임  단 매트리스 단단한 접이식매트리스 접이식 토퍼 군용 슈퍼싱글       런칭 초특가 할인,Interior
124,더블샵 상품명 순수 메모리폼  단 접이식 매트리스 퀸    모던그레이,Interior
125,상품명 이음 서랍수납형 슈퍼싱글침대 프레임 매트없음 ,Interior
126,상품명 코코 기절초폼 매트리스 접이식 토퍼 슈퍼싱글       ,Interior
127,상품명 코코 기절초폼매트리스 접이식 토퍼 멀티싱글        ,Interior
128,숙면연구소 상품명 베이직 탄탄한 토퍼 매트리스          슈퍼싱글 ,Interior
129,상품명 부온디    에어쿠션  단 접이식 바닥 침대 토퍼매트리스 수면매트 싱글,Interior
130,동서가구 상품명 푹신   프리미엄 필로우탑    매트리스         ,Interior
131,상품명 엔젤홈스  단 접이식 매트리스 간이침구 오염방지 발수원단,Interior
132,아씨방 상품명 아씨방가구 릴렉스 발빠짐방지 저상형 패밀리침대 매트리스 선택  방수커버 선물 ,Interior
133,동서가구 상품명 동서가구 쿠션가죽헤드 슈퍼싱글침대 황토볼 흙침대         ,Interior
134,상품명 이음   수납헤드 슈퍼싱글침대세트 독립포켓매트리스 ,Interior
135,노아가구 상품명 신상품 잠이솔솔베드 모션침대 소파베드 쇼파베드 소파 쇼파  단각도조절 싱글침대,Interior
136,공식 상품 노송가구 상품명 국내제조 편백나무 원목침대 최대      리터 초대용량  서랍 원목 침대프레임  ,Interior
137,장인가구 상품명 슬립에잇 유로탑 매트리스   ,Interior
138,상품명  존 기절 매트리스 접이식 침대 바닥 토퍼 수면매트      ,Interior
139,상일리베가구 상품명 상일리베가구 제이든 원목 서랍 수납 침대      매트선택,Interior
140,공식 상품 하포스 상품명 유니티 하모니 통서랍     수납 침대 매트리스 세트 공장직송 특가,Interior
141,베드리움 상품명 금성침대   베드리움 베드리움 슈페르 프리미엄      매트리스 슈퍼싱글 ,Interior
142,장인가구 상품명 장인가구 피콜로   인용 가드형 데이베드 수납침대 프레임  착불,Interior
143,동서가구 상품명 동서가구 분리형 필로우탑  존 투매트리스  침대  존          ,Interior
144,동서가구 상품명 동서가구 이즈 카이 넬  가죽   헤드  단수납  침대 독립포켓         ,Interior
145,오키멧 상품명 퍼니엘 매트리스 모음 토퍼 바닥매트기절푹신한 포근한허리편한  퀸 슈퍼싱글 싱글       ,Interior
146,상품명 프라임  단 매트리스 단단한 접이식매트리스 접이식 토퍼 군용 퀸       런칭 초특가 할인,Interior
147,노아가구 상품명 신상품 잠이솔솔베드 모션침대 소파베드 쇼파베드 소파 쇼파  단각도조절 싱글침대 간이침대,Interior
148,베스트리빙 상품명 유로탑 매트리스 편안한 텐셀 필로우탑 독립스프링 침대매트리스 퀵 롤팩매트리스 메트리스       ,Interior
149,상품명 라클라우드  가구  호텔식 프리미엄 밀라노 패브릭 평상형 침대    ,Interior
150,삼익가구 상품명 삼익가구 롯데단독최저가 엔느     평상형 침대 파워 본넬스프링 매트리스 슈퍼싱글  ,Interior
151,홈쇼핑 상품 센스맘 상품명 센스맘        투사이드    에어매트리스 퀸  커버 색상선택 ,Interior
152,상품명 샘스톤 영스데이 비앙코카라라 돌침대      ,Interior
153,파로마가구 상품명 파로마 퍼스트 노아 유로탑 독립 오가닉이태리폼 매트리스  ,Interior
154,라꾸라꾸 상품명 라꾸라꾸온열침대  인용 싱글 접이식 간이 병원 침대,Interior
155,라온홈데코 상품명 싱글    쟈가드 단단한 견면 딱딱한 하드 매트리스,Interior
156,상품명 압축 견면 단단한 하드 토퍼 딱딱한 매트리스       ,Interior
157,상품명 압축 견면 단단한 하드 토퍼 딱딱한 매트리스        ,Interior
158,웰하우스 상품명 삼나무 원목  구 수납침대 슈퍼싱글 퀸침대 원목침대 평상침대,Interior
159,상품명 이음   수납헤드 침대모음 슈퍼싱글 더블,Interior
160,장인가구 상품명 장인가구 뉴피터   등급 저상형 데이베드 침대 일반형      존포켓 가드,Interior
161,베드리움 상품명 금성침대   베드리움 베드리움 블링     퀸 서랍침대 프레임 매트리스제외,Interior
162,베드리움 상품명 금성침대   베드리움 베드리움 더 스마트 무선충전 침대  듀얼쿠션유로탑,Interior
163,베드리움 상품명 금성침대   베드리움 베드리움 슈페르 프리미엄      매트리스 킹 ,Interior
164,백화점 상품 상품명 지누스 미드센츄리 침대 프레임  퀸 ,Interior
165,삼익가구 상품명 삼익가구 어라운드 원목 침대      독립스프링 매트리스 슈퍼싱글 ,Interior
166,홈쇼핑 상품 상품명 드모아    딥슬립 토퍼 매트리스 슈퍼싱글  색상선택 ,Interior
167,상품명 리얼트리 레드파인    평상형 원목침대프레임  슈퍼싱글 퀸  매트별매,Interior
168,상품명 흙마루 돌침대 리퍼브 황토볼 흙침대  인 카우치       ,Interior
169,파미가구 상품명  층침대 프레임 이층침대 철재침대 원룸침대 기숙사침대 게스트하우스침대 철제이층침대 이단침대 학생침대,Interior
170,라온홈데코 상품명 멀티싱글  인용 접이식 바닥 수면 토퍼 매트리스,Interior
171,상품명 도아르        쟈가드 원룸  인용 접이식 매트리스,Interior
172,상품명  존     멀티싱글 침대 토퍼 매트리스 수면매트  인용,Interior
173,상품명     멀티싱글 차박  인용 바닥 접이식 토퍼 매트리스,Interior
174,알뜨리 상품명 하이어 매트리스 받침대 싱글더블  높이조절 침대 깔판 프레임 바닥 매트,Interior
175,베드리움 상품명 금성침대   베드리움 베드리움 수납 슈퍼싱글 서랍 침대프레임    ,Interior
176,세진침대 상품명 파로마 세진침대 미네     모션침대 천연라텍스폼매트리스  ,Interior
177,베드리움 상품명 금성침대   베드리움 베드리움 하이 서랍침대   독립 자카드 착불 ,Interior
178,상품명 휴대용 접이식 침대  인용 소파베드 캠핑 간이침대 숙직실,Interior
179,베드리움 상품명 금성침대   베드리움 베드리움 컴포터블 에디션 라텍스탑 매트리스 ,Interior
180,웰하우스 상품명 리에또 높은수납침대 슈퍼싱글 퀸침대 원목침대 수납침대 평상침대,Interior
181,해강온돌흙침대 상품명 공장직판 세일전 효도선물 장수기원 흙침대 옥침대,Interior
182,상품명 동서가구 이즈 루카     원목 침대 본넬매트          ,Interior
183,홈쇼핑 상품 상품명 브로킹     프리미엄 방수 매트리스 커버  장,Interior
184,상품명 트리탑퍼니처 베리 싱글침대 슈퍼싱글침대 매트리스포함 일반형 서랍형침대 고시원 원룸 기숙사침대,Interior
185,웰하우스 상품명 보스코 구수납침대 삼나무침대 원목침대 평상침대 슈퍼싱글 퀸침대,Interior
186,홈쇼핑 상품 센스맘 상품명 센스맘 최신상 최고높이    베개커버 시그니처           매트리스 슈퍼싱글,Interior
187,아텍스 상품명        접이식침대  인용 폴딩 베드 이동식 원룸 간이 엑스트라 침대 좁은방 고시원 소형 사무실 접는,Interior
188,상품명 거실 매트리스  인용 소파베드 소파겸침대,Interior
189,럭스앤펀 상품명 초특가 통몰드고밀도    천연라텍스매트리스 해외고가,Interior
190,버플리 상품명 노스 원목     슈퍼싱글 사이즈 침대 프레임 매트리스,Interior
191,상품명 접이식 경락 미용 마사지 이동식 침대 베드,Interior
192,공식 상품 동서가구 상품명      모던 모노륨 황토 흙침대 싱글  흙판보료          ,Interior
193,공식 상품 동서가구 상품명 착불 케어 편백 수납헤드형 통원목   프레임         ,Interior
194,아씨방 상품명 아씨방 원목마루 평상형침대 프레임 ,Interior
195,상품명 무료배송 꺼짐없는 고탄성   접이식매트리스 퀸 싱글,Interior
196,상품명 접이식 미용 마사지 베드 침대 구멍없음,Interior
197,상품명 접이식 미용 마사지 베드 침대 구멍있음,Interior
198,상품명 무료배송   단 홑겹 누빔 접이식매트리스 소파베드 토퍼매트,Interior
199,자미스 상품명 접이식매트리스  단 토퍼 마블 레자 소사이즈,Interior
200,상품명 코코 기절초폼매트리스 접이식 토퍼 슈퍼싱글        ,Interior
201,상품명 우드퍼니쳐 침대 프레임 매트리스 깔판 저상형 패밀리 받침대       ,Interior
202,상품명 코알라가 좋아하는 친환경소재 텐셀 침대 포켓 매트리스 싱글      ,Interior
203,상품명 무료배송  단 접이식매트리스 접이식침대 간이침대,Interior
204,공식 상품 베스트리빙 상품명 퀸앤 화이트 엔틱 원목 침대 프레임   퀸 침대 매트리스 선택가능,Interior
205,공식 상품 이노센트 상품명 착붙 양면 본넬스프링 침대 매트리스                ,Interior
206,상품명 토퍼매트 접이식바닥토퍼매트 수면매트 매트리스,Interior
207,상품명 고운님 고탄성  단 접이식 매트리스 원룸 바닥 수면매트 자취 손님용 토퍼매트,Interior
208,공식 상품 이노센트 상품명 씨엘로     침대   독립포켓매트리스        ,Interior
209,공식 상품 베스트리빙 상품명 에어메쉬 워셔블 매트리스        ,Interior
210,상품명 이음수납헤드 슈퍼싱글침대세트 독립포켓매트리스 ,Interior
211,공식 상품 동서가구 상품명 이즈카이 편백원목    조명 수납 침대     독립매트리스          ,Interior
212,상일리베가구 상품명 상일리베가구 샐리 원목 분리형 어린이 이층침대 안전가드 서랍 ,Interior
213,엘레아 상품명 플로렌스 수납 슈퍼싱글 사이즈 침대 프레임    일반형,Interior
214,상품명  매쉬원    매쉬 돌침대 옵션선택 쇼파용    시리즈,Interior
215,라온홈데코 상품명         쟈가드 미니싱글 단단한 견면 압축 매트리스,Interior
216,공식 상품 이노센트 상품명 착붙 양면 본넬스프링 침대 매트리스               ,Interior
217,네이처월드 상품명 국민토퍼  단접이식 매트리스          원룸 바닥 편안한 수면매트 폭신한 접이식 침대 토퍼 나혼산 자취생,Interior
218,공식 상품 이노센트 상품명        호텔 수면 고급형 고밀도 토퍼 매트리스        모음전,Interior
219,공식 상품 노송가구 상품명 국내제조 고무나무 원목침대 최대      리터 초대용량  서랍 원목 침대프레임  ,Interior
220,공식 상품 수면도감 상품명 탄탄한 허리에 좋은  단 접이식 매트리스 침대 토퍼 바닥 수면매트   ,Interior
221,공식 상품 수면도감 상품명 에어코일  단 접이식 토퍼 매트리스 멀티싱글,Interior
