,titles,category
0,하이웨스트 여성 반바지 면 여자여름바지 썸머반바지  부  라인 숏팬츠 키작녀 화이트 블랙,Fasion
1,막스마라 폴도 울 코트          ,Fasion
2,시스티나 벨티드 슬림 덕다운 점퍼            ,Fasion
3,리스트 더블 버튼 하프 코트            ,Fasion
4,무배 컬러 세미크롭      스트라이프 긴후리조직 날개사 보트넥 풀오버 니트,Fasion
5,    컨셉 베어파우      양털 슬리퍼 초코           ,Fasion
6,보브 구스다운 폭스퍼 스퀘어 퀼팅 점퍼           ,Fasion
7,코듀로이와이드팬츠                 ,Fasion
8,시슬리        니트 후드 중경량 패딩            ,Fasion
9,폴햄 여성 패턴 베스트           ,Fasion
10,베어파우 베어파우         여성      버클 데일리 슬리퍼 레몬        ,Fasion
11,저스트원 최강따듯 밍크안감 골덴팬츠 숏 기본 롱        ,Fasion
12,듀엘 벨티드 구스다운 후드 롱 패딩 점퍼           ,Fasion
13,브라 캡 나시 브라탑나시 모달소재 노와이어,Fasion
14,비비안 리본 모티브 엠보싱 여성 면팬티 종세트       ,Fasion
15,리스트 골지 터틀넥 니트 풀오버           ,Fasion
16,부츠컷 여성 스판 하이웨스트 밴딩 슬랙스 빅사이즈 봄 여름 가을 겨울 기모 팬츠 바지,Fasion
17,     여 하찌 카라 집업 가디건           ,Fasion
18,푸마 스노우배 방한 부츠          ,Fasion
19,         크리스탈 하트 조거  ,Fasion
20,보브 롱패딩 시어링 카라 구스다운 패딩 점퍼                      ,Fasion
21,스팽스                 보정 탱크       ,Fasion
22,미소페 여성 세무로퍼            ,Fasion
23,올리비아로렌 폭스퍼 롱 덕다운 패딩점퍼 쇼핑점 쇼핑점            ,Fasion
24,마레몬떼 꽈배기 짜임 브이넥 니트            ,Fasion
25,나이키 코트 버로우 로우 리크래프트           ,Fasion
26,갭 여성   년      크루넥 코튼 가디건              ,Fasion
27,올리비아하슬러 아트윅 라운드  부 티셔츠                 ,Fasion
28,      수 끈런닝        ,Fasion
29,제임스딘 레이온 여성 내의 내복 하의 바지         ,Fasion
30,탑텐 여성 스마트 발열 중기장 점퍼           ,Fasion
31,보니스팍스 스트링 하이넥 롱 니트 원피스           ,Fasion
32,여성팬티 위생팬티 생리 방수 밤부 순면,Fasion
33,헤지스 헤지스레이디스 퍼피자수 면혼방 긴팔셔츠            ,Fasion
34,        마틸다 클래식   숄더백 쇼퍼 여자가방 여성가방  아이패드  보부상가방,Fasion
35,투투 여자 기모 슬랙스 겨울슬랙스 키작녀 스판 일자 부츠컷 빅사이즈      ,Fasion
36,지컷            폭스퍼후드 구스패딩점퍼           ,Fasion
37,지오다노 여 폭스 블렌디드 가디건                    ,Fasion
38,루시앙 루시앙 소프트 코듀로이 팬츠,Fasion
39,라코스테 여성 오픈카라 스웨터 원피스               ,Fasion
40,지오다노 여 코튼 카고 조거 팬츠       ,Fasion
41,     싱글 자켓        ,Fasion
42,허시파피 여성 키미 컴피 앵클부츠          ,Fasion
43,에잇세컨즈 중기장 부츠컷 데님 팬츠           ,Fasion
44,듀베티카 여성 벨라트릭스 시그니쳐 후디 다운 재킷 유광블랙              ,Fasion
45,시슬리 밴딩 폭스퍼 후드 구스다운 점퍼             ,Fasion
46,              플리츠 셔츠 레이어드 원피스             ,Fasion
47,                                                 여성 리퀴드 터치 푸쉬업 플런지 브라            ,Fasion
48,나이키 우먼 코르테즈 올 페탈 유나이티드           ,Fasion
49,여성면팬티 심리스팬티 생리팬티 순면 위생 비너스 비비안,Fasion
50,듀엘 페이크 양털 무스탕 점퍼           ,Fasion
51,포멜카멜레 패딩 슈레이스 부츠            ,Fasion
52,겨울 극세사잠옷 누빔 밍크 커플잠옷,Fasion
53,레스포색      여행가방 기저귀가방 레스포삭백팩 나일론백팩,Fasion
54,     원 제이슨우 코듀로이 와이드 팬츠  종,Fasion
55,잇미샤 트렌치 핸드메이드 코트           ,Fasion
56,스케쳐스 여성 고 워크 조이,Fasion
57,아날도바시니 세이브존   후드 니트 코트          ,Fasion
58,보브 벨티드 숏 트렌치 코트           ,Fasion
59,     무스탕 자켓        ,Fasion
60,플라스틱아일랜드 릴렉스 레귤러 데님 팬츠         ,Fasion
61,올리       셔링 패딩 아이젠 부츠 최종가,Fasion
62, 발롱  성인 유아 천 반가죽 발레슈즈,Fasion
63,올리비아로렌 라운드넥 핸드메이드 코트            ,Fasion
64,온앤온 루즈핏 스트라이프 풀오버          ,Fasion
65,기비      캐시퍼가디건           ,Fasion
66,휴양지원피스 시어서커 뷔스티에 여리여리 끈 나시 롱 원피스 휴양지룩        페미닌,Fasion
67,          후드 니트 셋업  종,Fasion
68,국내배송     코스 퀼티드 초 미니 백 구름 빵 왕 오버사이즈 퀼팅 메신저 가방 제니,Fasion
69, 닥스 액세서리            블랙 체크 미디움 버킷백            ,Fasion
70,제시뉴욕 와이드 카라 플레어 울 트렌치 코트             ,Fasion
71,      메달리스트 로우 고트스킨          ,Fasion
72,올리비아로렌      카라브라우스            ,Fasion
73,레노마레이디 메가 캐시 오버핏 롱 코트          ,Fasion
74,올리비아로렌      폭스 퍼 벨트 롱패딩            ,Fasion
75,로엠 하이넥 숏 다운           ,Fasion
76,베어파우         여성 양털부츠         종        ,Fasion
77,매우부드러운 아토피잠옷 신축성좋은 커플파자마 마약잠옷 백화점 잠옷브랜드 텐셀 블랙 하트,Fasion
78,폴로                         ,Fasion
79,헤지스 레이디스 솔리드 컬러 싱글 버튼 핸드메이드 하프 코트           ,Fasion
80,링클프리 여성 셔츠 블라우스 쉬폰 화이트 블랙 면접 정장 남방,Fasion
81,코데즈컴바인이너웨어 컴포트 푸쉬 브라 팬티 세트,Fasion
82, 쉬즈미스 프리미엄  캐시미어벨티드코트,Fasion
83,베어파우     컨셉 외             종           ,Fasion
84,레페토         플랫 릴리          ,Fasion
85,나이스클랍 포켓 절개 밴딩 팬츠           ,Fasion
86, 당일 겨울 아우터 원가 이하 세일,Fasion
87,보브     백 벨트 와이드 더블 자켓           ,Fasion
88,겨울 봄 슬랙스 여성정장바지 하이웨스트 핀턱 와이드팬츠 통바지 기모슬랙스,Fasion
89,      에블린 로맨티크 노와이어볼륨           ,Fasion
90,          라티젠 컬러블록 니트 집업                         ,Fasion
91,빈폴레이디스 미디엄 트렌치 다운 코트           ,Fasion
92,잠뱅이 여 노멀워싱 일자핏 데님          ,Fasion
93, 오트당일 런던플랏 르메르 핸드메이드 코트                재진행,Fasion
94,지컷       골든 버튼 구스다운 퀼팅 자켓           ,Fasion
95,글램모먼트 스킨핏 히트 기모 브라탑 런닝     캡 내장 기모 나시 여자 발열 겨울,Fasion
96,원      김서룡 핸드메이드 롱 코트              ,Fasion
97,잔스포츠 라이트팩 백팩            ,Fasion
98,폴햄 여성 소프트테리 스웨트 조거 팬츠           ,Fasion
99,베어파우 남성 방수 패딩 앵클 부츠                        ,Fasion
100,비비안 기본 하프슬립  부 속치마       ,Fasion
101,지센 여성 폭스카라 헤링본 핸드메이드 포멀 롱 코트  컬러         ,Fasion
102,케네스레이디 투비스 테일러드 자켓 부천점           ,Fasion
103,에잇세컨즈           부클레 라운드넥 카디건   레몬,Fasion
104,      가니 여성 알파카 울 브이넥 가디건 차콜          ,Fasion
105,     배색 원피스        ,Fasion
106,케네스레이디 케네스레이디 후드 폭스 퍼 다운자켓           ,Fasion
107,온플 까사렐      울블렌디드 핸드메이드 하프 코트,Fasion
108,오조크      스탠카라 레더 숏 자켓            ,Fasion
109,프로스펙스      퍼중기장 헤비다운 여성 퍼 중기장 헤비다운            ,Fasion
110,국내 매장판 당일발송 뉴발란스     화이트 스틸 그레이 베이지 실버 메터 빈티지 블루,Fasion
111,시에라덕다운벨트롱패딩           ,Fasion
112,슈펜              쭈언니슬링백               ,Fasion
113,로엠 부츠컷 슬랙스 기모           ,Fasion
114,써스데이아일랜드                 자수 프릴 원피스            ,Fasion
115,오조크 크롭 와이드 슬랙스            ,Fasion
116,쉬즈미스          프리미엄 벨티드 플랩 포켓 핸드메이드 울 코트,Fasion
117,클라이드앤 클라이드엔 안감기모 여성 스마일 후드 집업          ,Fasion
118,나인 해비코튼 빅 포켓 미디 스커트        ,Fasion
119, 도티       여성 스트레치 웜 기모 팬츠  종      ,Fasion
120,       여성 스마트 발열 하이넥 롱 점퍼           ,Fasion
121,씨씨콜렉트 핸드매이드 세일러 더블코트           ,Fasion
122,트라이 여자 기능성 내복 히트업 히트텍 여성 내의 상의  부,Fasion
123,롱샴 르 플리아쥬 그린 탑핸들백           ,Fasion
124,     숲 기본 카라 탈착 타이 블라우스        ,Fasion
125,케네스레이디 카라 버튼다운 트위드 플레어 원피스           ,Fasion
126,에잇세컨즈           자수 기모 터틀넥 티셔츠           ,Fasion
127,아수라 여름 린넨  부 여성 반바지 밴딩,Fasion
128,버커루 여성 스판 와이드 카고 팬츠           ,Fasion
129,포멜카멜레 베스티 심볼 장식 포인트 청키로퍼     종            ,Fasion
130,지컷       지컷     드로스트링 나일론 후드 점퍼           ,Fasion
131,셀렙샵에디션   셀렙샵 에디션      휘메일 풀스킨 밍크 후드베스트,Fasion
132,    홀가먼트 캐시미어 래글런 니트           ,Fasion
133,폴햄 여성 소프트테리 스트레이트 팬츠           ,Fasion
134,베어파우 칼라 베어 우먼즈            ,Fasion
135,포티체 기모 후드 롱티셔츠          ,Fasion
136,소고 세이브존   렉스 안감 밍크 트리밍 롱 코트          ,Fasion
137,어그     여성 클래식  미니 부츠 양털 스웨이드 방한 털신,Fasion
138,폴햄 여성 포그니 멀티멜란지 풀오버 니트           ,Fasion
139,     숏 코트        ,Fasion
140,아틀리에 나인  시그니처 울 베이직 슬림 니트                         ,Fasion
141,린 엘리나 체크 원피스           ,Fasion
142,베네통 뉴베케르 후드 폭스퍼 구스 패딩             ,Fasion
143,씨씨콜렉트 버클 포인트 벨티드 싱글 롱 코트           ,Fasion
144,유니클로 울트라 라이트 롱패딩코트 여성 경량 다운자켓  종,Fasion
145,나인 루이 카라넥 케이블 니트                     ,Fasion
146,올리비아로렌 보아퍼패치다운점퍼                       ,Fasion
147,에잇세컨즈 보더 스트라이프 칼라넥 니트           ,Fasion
148,지오다노          여 브러시드 슬림스트레이트 데님       ,Fasion
149,듀엘 듀엘 자켓 세트 플리츠 원피스                  ,Fasion
150,더아이잗 라인 배색 트위드 재킷          ,Fasion
151,닥스 하우스체크 경판 가죽 백팩                     ,Fasion
152,         사계절 게스 여성 날씬해 보이는 다리가 길어보이는 예쁜 바지 세미 와이드 핏 일자 통 청바지 부츠컷 연청 진청 생쥐 데님 팬츠,Fasion
153,                   시티 나일론 투 포켓 플랩           ,Fasion
154,겨울 백 레터링 프린트 기모 크롭후드티 키작녀 데일리룩      꾸안꾸,Fasion
155,마리끌레르 울 캐시미어 블렌드 핸드메이드 롱 코트           ,Fasion
156,카미 패딩 슬리퍼 신발 방한화       ,Fasion
157,   후드 버튼 스트링 덕다운 점퍼           ,Fasion
158,첸드 하이넥 기모 트레이닝 세트,Fasion
159,자체제작 고퀄 자수 밍크 조거팬츠,Fasion
160,스파오 패딩 코듀로이 푸퍼 숏패딩 골덴 자켓 점퍼 남자 여성 커플,Fasion
161,지컷 퍼 카라 구스다운 퀼팅 자켓           ,Fasion
162,   오버핏 벨티드 롱코트          ,Fasion
163,쉬즈미스 핸드메이드 후드 벨티드 숏 코트            ,Fasion
164,탑텐 여성 리얼 라이트 다운 투인원 점퍼           ,Fasion
165,여성 구김없는 실켓 스판 와이셔츠 모음  화이트 블랙 롱 블라우스 남방,Fasion
166,뮬라웨어 포켓 포인트 패딩          ,Fasion
167,버버리 다이아몬드 퀼팅 재킷        ,Fasion
168, 당일발송 백화점 폴로 보이즈 케이블 니트 꽈배기 스웨터 남녀공용,Fasion
169,          여성 보아 더플 반코트             ,Fasion
170,안나루스 천연소가죽 양털안감 스웨이드 울트라 숏 트리밍부츠,Fasion
171,베스띠벨리 싱글투버튼코트              ,Fasion
172,제너럴아이디어            퍼프 반팔 티셔츠              ,Fasion
173,     지지피엑스 리얼 양가죽 벨티드 구스다운 롱 점퍼           ,Fasion
174,나인 시그니처 윈터 부츠컷 팬츠                         ,Fasion
175,시슬리 벨티드 롱 코트          ,Fasion
176,여성 기모 트레이닝 세트 맨투맨 조거팬츠 키작녀 트레이닝복,Fasion
177,    우먼 빅 트위치 부클 크롭 기모 맨투맨,Fasion
178,론칭가 가이거 쏘네 앵클 부츠       ,Fasion
179,     막스마라 마누엘라 여성 울 벨트 코트                        ,Fasion
180,       좋으니 소가죽 펌프스 유니화 발편한 승무원 면접구두 여성구두        ,Fasion
181,캘빈클라인    언더웨어 코튼 여성 트라이앵글 브라렛 스포츠 브라탑            ,Fasion
182,데이지베어       자체제작 하트 베어 프리미엄 극세사 겨울 커플 수면 잠옷,Fasion
183,  년리바이스 액티브 레이서백 브라팬티 세트,Fasion
184,올리비아하슬러 심플 밴딩 슬랙스          ,Fasion
185,                ,Fasion
186,      에블린 수면잠옷 꽈배기 투피스 파자마           ,Fasion
187,원      유럽산 리버시블 무스탕 코트              ,Fasion
188,언더아머 언더아머바지     여성         오픈 헴 팬츠            ,Fasion
189,   비비안 잡화   기모레깅스         ,Fasion
190,써스데이아일랜드                 오버핏 투버튼 자켓            ,Fasion
191,탑텐 여성 플리스 그래픽 하프 집업           ,Fasion
192,           에르노       마리아 하이넥 다운 코트,Fasion
193,        여성 코튼 스트레치 팬츠                     ,Fasion
194,린 센티아 더블 자켓           ,Fasion
195,쉬즈미스 포멀 데일리 슬림 슬랙스 팬츠,Fasion
196,    뉴욕씨 맨투맨,Fasion
197,밀라 기모 모달 티블라우스  종                 ,Fasion
198,  지고트 더블 버튼 장식 울 블렌드 재킷                       ,Fasion
199,리스트 레더 버튼 라운드넥 재킷            ,Fasion
