,titles,category
259,상품명 에어소파 세트네이비 원룸소파 스툴  인용,Interior
260,상품명 이시아르 각도조절 좌식 소파 브라운,Interior
261,상품명 빈백 세트베이지비 에어소파 스툴 원룸소파  인용,Interior
262,상품명 라이프홈 각도조절 좌식 소파 등받이 조절 바닥 의자,Interior
263,상품명 인텍스 풀아웃 매트 소파베드 더블,Interior
264,상품명 까페의자 신멀티 인테리어 용품 새집 거실 사무실,Interior
265,상품명 산나무 원목 무빙벤치         ,Interior
266,상품명 에스제이엠메디컬 데일리 마일드 젤 클렌저        개,Interior
267,상품명 손철물 침대다리 소파다리 싱크대 책상 선반 다리      매입  ,Interior
268,상품명 이레 스포츠    컬러 빈백  세트   개입            ,Interior
269,상품명 빈백 에어소파 야외 캠핑소파 거실소파,Interior
270,상품명 에어소파 스툴 룸메이트 세트  인용 네이비,Interior
271,상품명 에어소파 룸메이트 세트 스툴  인용 레드,Interior
272,상품명 컬러 에어소파 룸메이트  인용       네이비,Interior
273,상품명 컬러 룸메이트 에어소파  인용 레드      ,Interior
274,상품명 장난감 정리 수납 의자 겸용 이동 아동 벤치         ,Interior
275,상품명 쿠션 에어쇼파  인용 퍼플,Interior
276,상품명 다용도 삼각형 평철 꺽쇠 연결브라켓 목공 부자재          매입  ,Interior
277,상품명 인텍스에어소파스툴세트그레이 인용카우치소파,Interior
278,상품명 샤워랑 화이트플로랄 비누       개입      세트  ,Interior
279,상품명  형 거실 야외 캠핑 에어소파,Interior
280,상품명 무궁화 알로에 비누            개입        ,Interior
281,상품명 미니 접이식 좌식 소파  인용 블루,Interior
282,상품명 좌식 소파 미니 접이식 핑크  인용,Interior
283,상품명 각도 소파 조절 높이  인용 그레이,Interior
284,상품명 소파 굿라이프 조절 좌식 각도 라이트 블루,Interior
285,상품명 소파 각도 조절  인용 아이보리,Interior
286,상품명 각도 세트 조절 소파 스툴 네이비  인용,Interior
287,상품명 라이프홈 조절 각도 좌식 소파 화살표,Interior
288,상품명 각도 소파 조절 레드  인용,Interior
289,상품명 미니 소파 좌식 접이식  인용 레드,Interior
290,상품명 조절 각도 세트 스툴 소파 그레이  인용,Interior
291,상품명 룸메이트 원룸쇼파 에어소파레드 일인소파  인용,Interior
292,상품명 소파 라이프인 각도 조절 좌식 브라운,Interior
293,상품명 빌한슨 빔백 빙백 벌룬 에어 빈백 의자 일인 쇼파,Interior
294,상품명 세트 각도 높이 스툴 조절 소파  인용 블루,Interior
295,상품명 세트 스툴 각도 소파 조절 그린  인용,Interior
296,상품명 각도 소파 조절 세트 스툴 옐로우  인용,Interior
297,상품명 다크 세트 소파 스툴  인용 블루,Interior
298,상품명 세트 스툴 다크 소파 브라운  인용,Interior
299,상품명 접이식 좌식 소파 미니 블랙  인용,Interior
300,상품명 빌한슨 빔백 빙백 일인 쇼파 에어 벌룬 빈백 의자,Interior
301,상품명 유럽풍 소파의자 벨벳  인 그레이,Interior
302,상품명 소파 거실 아이보리        인용,Interior
303,상품명 가리비 소파 옐로우 베이지  인용,Interior
304,상품명 스툴 만족 감성 가죽 세트 소파 빈백 그레이,Interior
305,상품명 수납형 벤치 소파 원라인 그린     ,Interior
306,상품명 미니 좌식 소파 접이식 브라운  인용,Interior
307,상품명 조절 좌식 베드 소파 각도       그레이  인용,Interior
308,상품명 이이 보리 오렌지 거실 소파  인용      ,Interior
309,상품명 소파 스툴 세트  인용 옐로우,Interior
310,상품명 소파 조절 각도 블루  인용,Interior
311,상품명 소파 벤치 수납형 원라인      그린,Interior
312,상품명 소파 각도 조절 높이 블루  인용,Interior
313,상품명 소파 거실 오렌지        인용,Interior
314,상품명 스툴 가죽 소파 만족 빈백 감성 세트 오렌지,Interior
315,상품명 스툴 소파 세트 그레이  인용,Interior
316,상품명 각도 조절 굿라이프 소파 좌식 그레이,Interior
317,상품명 각도 소파 좌식 라이프홈 패턴 조절,Interior
318,상품명  형 유럽풍 소파 의자  인 오렌지,Interior
319,상품명 선반 베이직 벤치 화이트  의자 블랙      ,Interior
320,상품명 거실 등받이 유럽풍 소파 의자 그린,Interior
321,상품명 소파 스툴 세트 높이 조절 각도 옐로우  인용,Interior
322,상품명 소파 각도 베드 좌식 조절 베이지       인용,Interior
323,상품명 소파 의자 유럽풍  인 그린,Interior
324,상품명 소파의자 다크 유럽풍 그레이  인,Interior
325,상품명 유럽풍 벨벳 소파의자 블루  인,Interior
326,상품명  형 유럽풍 소파 의자 아이보리  인,Interior
327,상품명 유럽풍 등받이 소파의자 거실 그레이,Interior
328,상품명 가죽 소파의자 유럽식 인조  인용 옐로우,Interior
329,상품명 소파의자 거실 유럽풍  인용 브라운,Interior
330,상품명 빈백 에어소파 노르딕 캠핑소파,Interior
331,상품명 스툴 세트 소파 감성 빈백 가죽 만족 화이트,Interior
332,상품명 소파의자 유럽풍  인 그레이,Interior
333,상품명 조절 좌식 소파 각도 굿라이프 블루,Interior
334,상품명 의자 유럽식 소파 인조 가죽 오렌지  인용,Interior
335,상품명 파스텔 가죽 소파     인용,Interior
336,상품명 인조 가죽 유럽식 소파 의자  인용 블랙,Interior
337,상품명 소파 클라우드     ,Interior
338,상품명 거실 소파 아리 보리 브라운  인용      ,Interior
339,상품명 노르딕 빈백 에어소파 스툴 펌프 세트,Interior
340,상품명  인용 좌식쇼파 쿠션 좌식소파 폴딩 바닥형 소파,Interior
341,상품명 가죽 소파 파스텔    인용,Interior
342,상품명 다크 유럽풍 소파의자 벨벳  인 그레이,Interior
343,상품명 소파 리클라이너 소가죽  인용     ,Interior
344,상품명 베드 소파  인용 그레이      ,Interior
345,상품명 거실 소파       그레이  인용,Interior
346,상품명 샤워랑 핑크로즈 비누       개입      세트  ,Interior
347,상품명 소파 조절 베드 좌식 각도       네이비  인용,Interior
348,상품명 스툴 소파 세트 그린  인용,Interior
349,상품명 원라인 수납형 벤치 소파 그린      ,Interior
350,상품명 좌식 베드 소파 조절 각도       베이지  인용,Interior
351,상품명 메모리폼 접이식 매트리스 소파,Interior
352,상품명 원라인 수납형 벤치소파      브라운  소파벤치 수납벤치 소파 의자,Interior
353,상품명 휴대용 야외빈백 캠핑 에어쇼파 에어빈백 소파  인용,Interior
354,상품명  인용 좌식 쇼파 소파 리클라이너 안락 빈백  인 의,Interior
355,상품명 말랑말랑 미니 땅콩 빈백  종,Interior
356,공식 상품 레이디가구 상품명  최종결제가       원  카누 원목소파  인용 소파,Interior
357,동서가구 상품명 동서가구 모던         인용 가죽소파오토만 세트           ,Interior
358,자코모 상품명 모드 천연면피 헤드레스트,Interior
359,리빙엠 상품명  인 좌식쇼파  종 소파 쇼파베드 안락의자 빈백 쿠션,Interior
360,공식 상품 보니타빈백 상품명 보니타 빈백 초대형 세인트       스웨이드 소파  풋스툴세트      컬러 입고,Interior
361,공식 상품 동서가구 상품명 테라 천연가죽  인용소파 스툴         ,Interior
362,까사미아 상품명              까사미아   바이노만 코모도  인 리클라이너 카멜,Interior
363,서광퍼니처 상품명 서광퍼니처 엘렌   라텍스 패브릭  인용 소파,Interior
364,하쥬르 상품명 하쥬르 키높이 유아 어린이 식탁 의자 방석   중안전장치    강아지,Interior
365,썬퍼니처 상품명       인용 홈바형 전동 리클라이너 소파 아이보리,Interior
366,상품명           헤르디  인용 스타일클린 워셔블 패브릭소파              ,Interior
367,퍼니코 상품명 쿠잉 홈카페 골드 벨벳소파  인         쿠션증정 ,Interior
368,파로마가구 상품명 애덤 리클라이너  인 이지클린 가죽 소파   ,Interior
369,공식 상품 레이디가구 상품명  최종결제가       원  끌레망 천연소가죽 면피쇼파  인용 스툴,Interior
370,미즌하임 상품명 미즌하임 모노폴리  인소파,Interior
371,미즌하임 상품명 미즌하임네모 라탄 라운지 의자  색상선택 ,Interior
372,상품명 클라임 암 체어 카페 커피숍 인테리어 디자인 의자,Interior
373,에보니아 상품명 에보니아      라인 패브릭 방수원단 독립형 등받이  인 소파베드,Interior
374,에보니아 상품명 즉시할인 레스트 에어레더 라운지 회전소파의자  인 리클라이너 부모님선물,Interior
375,홈쇼핑 상품 보루네오 상품명 보루네오 마르스 헤드틸팅 천연소가죽 소파  인용 스툴 소파테이블 쿠션   ,Interior
376,홈쇼핑 상품 보루네오 상품명 보루네오 마르스 헤드틸팅 천연소가죽 소파  인용 스툴 소파테이블 쿠션   ,Interior
377,공식 상품 보니타빈백 상품명  풋스툴세트  보니타 빈백 초대형 코쿤       스웨이드 소파 세트,Interior
378,공식 상품 동서가구 상품명 뉴제라 천연가죽  인 소파 스툴         ,Interior
379,자코모 상품명 헤드레스트 개 무료 모드    인 깊은형 스위브 소파,Interior
380,공식 상품 보니타빈백 상품명  풋스툴세트  보니타 빈백 초대형 파우치      에어매쉬 소파 세트 센스 있는 연말 선물,Interior
381,상품명 보니타 빈백 주니어 코미         빈백 에어매쉬,Interior
382,아이와비 상품명 허그 생활방수 패브릭 접이식  인용 소파베드        ,Interior
383,자코모 상품명 스툴무료 신세계 상품권  만원 라니아    인 슈렁큰 천연면피 소가죽   ,Interior
384,스스디 상품명 착불 웨이 생활방수 패브릭 소파베드  인용 카우치,Interior
385,더젠 상품명 더젠 리스토 바체어,Interior
386,상품명 아텍스 올스테인레스  단 수건걸이 다용도 욕실걸이,Interior
387,장인가구 상품명 브람스  인 천연가죽 소파,Interior
388,홈쇼핑 상품 에넥스 상품명 에넥스 슈렁큰 통가죽 소파  인소파  테이블 쿠션  개,Interior
389,상품명 싱글  인용 소파 모던 심플 철제 가죽 스틸 미니멀 깔끔,Interior
390,리바트 상품명 오브니 패브릭 부클레  인 소파 와이드,Interior
391,상품명 오브니 패브릭  인 소파 와이드,Interior
392,상품명 로지 패브릭  인 소파 피시 본 화이트,Interior
393,우아미가구 상품명 오로라  인 코브라 스윙 갤럭시 패브릭 소파,Interior
394,하모벨 상품명 신드       칸 서랍형 수납 벤치 현관 의자 소파 쇼파,Interior
395,하모벨 상품명 신드       칸 도어형 수납 벤치 현관 의자 소파 쇼파,Interior
396,홈쇼핑 상품 상품명 핀잭슨 엘리 빈백,Interior
397,상품명       보니타 빈백 보니타 빈백 초대형 멜란지       소파,Interior
398,공식 상품 한샘 상품명 한샘 스노어 패브릭 소파  인,Interior
399,상품명 가정용 카페 도서관 발코니 소파 레저용 야외용 빈백 실내용 업소용 휴식용 의자,Interior
400,풍원 상품명  단 참숯 퀸 접이식 매트리스  인 쇼파베드 원룸침대,Interior
401,풍원 상품명  단 참숯 메모리폼 싱글 접이식 매트리스 소파베드,Interior
402,도토로 상품명 인텍스 풀아웃 싱글매트 에어소파  접이식 소파침대,Interior
403,상품명 세계로가구 엠버 아쿠아텍스  인용 패브릭 소파 생활방수 이지클린 쇼파 스툴 선택 ,Interior
404,상품명 세계로가구 마노아  인용 아쿠아텍스 패브릭 소파,Interior
405,상품명 침대식쇼파 베드형소파 침대용쇼파 쇼파용침대 싱글,Interior
406,상품명 에어쇼파  인용 공기 에어의자 에어빈백     ,Interior
407,상품명 에어쇼파  인용 공기 에어의자 에어빈백     ,Interior
408,상품명 에어쇼파  인용 공기 에어의자 에어빈백     ,Interior
409,상품명 에어쇼파  인용 공기 에어의자 에어빈백     ,Interior
410,상품명 에어쇼파  인용 공기 에어의자 에어빈백   ,Interior
411,상품명 침대식쇼파 베드형소파 침대용쇼파 쇼파용침대 더블,Interior
412,도토로 상품명  인용 린넨 디자인 패브릭 소파베드  다크그린       ,Interior
413,도토로 상품명  인용     접이식 패브릭 소파베드  다크그린       ,Interior
414,에코프라자 상품명 미소가 라우미 엔틱가구 원목 벤치 장의자 의자 다용도의자 엔틱의자 엔틱벤치 원목의자,Interior
415,상품명 룸메이트  인용 캠핑 빈백 거실 에어소파 스툴 세트,Interior
416,상품명 이지리치  인용 각도조절 소파 스툴세트 그레이  인용리클라이너소파  인용소파 리클라이나쇼파 소파스툴세,Interior
417,상품명 에어 소파,Interior
418,상품명    에어 소파 캠핑에어매트 캠핑소파 캠핑쇼파,Interior
419,상품명 컬러  인용 에어소파       레드 미니소파  인용쇼파,Interior
420,상품명 가구샘 테라스 카페  인 소파      ,Interior
421,상품명 가구샘 테라스 카페  인 소파      ,Interior
422,상품명 인텍스 풀아웃 더블매트 소파베드 접이식 에어쇼파,Interior
423,상품명 헤링본 워싱면  인용 소파패드 쇼파 거실 매트,Interior
424,상품명 캠핑 낚시 접이식 등받이 리클라이너 의자 블랙 ,Interior
425,상품명 캠핑 낚시 접이식 등받이 리클라이너 의자 블루 ,Interior
426,상품명 에어쇼파 빈백 원룸 쇼파 캠핑용  인용쇼파,Interior
427,상품명 피카소 그레이 그랑데소파 패브릭 인테리어소파,Interior
428,상품명 빈백소파      포토 카드홀더 반짝이 스타 카드 슬리브 아이돌 필름 보호대 보관 케이스    개,Interior
429,상품명 카페야외의자 라탄  인용 원목 흔들의자 인테리어 안락의자,Interior
430,상품명 요기보 드롭 스탠다드  인용 좌식 빈백 소파         ,Interior
431,상품명 리클라이너 전용 쿠션 의자쿠션 의자커버 의자패드,Interior
432,상품명 패리스독 베어빈백 핑크,Interior
433,상품명 패리스독 스누피 빈백 화이트,Interior
434,상품명 에어 소파 쇼파  인용 빈백 스툴 침대 캠핑 의자,Interior
435,공식 상품 동서가구 상품명      패브릭  인용소파 스툴 세트         ,Interior
436,플로바움 상품명 플로바움 라비아  인용 쇼파,Interior
437,블루밍홈 상품명 보노쇼파베드  소파베드 쇼파 소파  인용쇼파 싱글,Interior
438,플로바움 상품명 플로바움 바브린노    인 대형 카우치소파,Interior
439,상품명  플레인홈 에단 수납 벤치 소파 도어형     ,Interior
440,썬퍼니처 상품명      에어레더 리모콘 전동  인용 리클라이너 허리쿠션,Interior
441,모리프 상품명 레더 카우치형 인조가죽 소파 쇼파,Interior
442,자코모 상품명 모어  인 스위브 모듈  좌식 일반 ,Interior
443,상품명 아이앤 클랜 가죽  인용 소파   ,Interior
444,이케아 상품명           인용 패브릭 소파  무료배송,Interior
