,titles,category
0,에뛰드 디어 달링 워터젤 틴트    ,Makeup
1,볼륨바이태양 볼륨 앤 샤인 헤어 볼류머      ,Makeup
2,크리니크 린스 오프 포밍클렌저      ,Makeup
3,설화수 옥용팩       신형 ,Makeup
4,오하이오후 리 쥬스 부활초     ,Makeup
5,에크멀 논 섹션 글로이 틴트   ,Makeup
6,설밤 입욕제 배쓰밤 거품입욕제 바스볼 버블바 거품목욕 아로마 반신욕 탄산 체리블라썸,Makeup
7,암웨이 새티니크 스무드 모이스처 샴푸      ,Makeup
8,꽃을든남자 크리닉 칼라 염색약     ,Makeup
9,바이레도 라튤립 오드 퍼퓸     ,Makeup
10,청미정 박하 쿨 샴푸      ,Makeup
11,클리오 킬 커버 픽서 쿠션  본품 리필  파운데이션 쿠션 팩트 선물 화장품  ,Makeup
12,제이킨 고급 해면 화장품 클렌징 스펀지 개별   포장    ,Makeup
13,바이레도 블랑쉬 바디 로션      ,Makeup
14,디에이지 레드 애디션 콘트롤 크림      ,Makeup
15,브링그린 티트리 시카 트러블 클렌징 폼      ,Makeup
16,존바바토스 아티산            개,Makeup
17,퀸즈헤나  봉지 구매시  봉지 더 천연 염색약    ,Makeup
18,닥터자르트 세라마이딘 스킨 베리어 모이스처라이징 크림     ,Makeup
19,세븐피엠 남자 옆머리 누르기 다운펌 기계 매직모히칸    사이즈 ,Makeup
20,포엘리에 옴므 올인원 퍼펙트 로션      ,Makeup
21,라운드랩 자작나무 수분 크림      ,Makeup
22,페리페라 잉크 블랙 카라   ,Makeup
23,제로이드 이지워시 마일드 선크림            ,Makeup
24,아발론 비오틴 비 컴플렉스 샴푸      ,Makeup
