,titles,category
0,오직 한팀만 해운대요트투어 예약은 요트랜드,Trip
1,비발디파크 스키장 렌탈샵 스마일 렌탈 대명 비발디,Trip
2,런던 해리포터스튜디오 입장권 식사권,Trip
3, 새해빅세일  해운대구 부산 해운대 엘시티레지던스 와이컬렉션,Trip
4,스페인 바르셀로나 투어 몬세라트 시체스 푸니쿨라 근교투어,Trip
5,프랑스 파리 루브르박물관투어 가이드랩,Trip
6,하이엔드렌탈샵 평창 휘닉스파크리프트권    신상명품의류,Trip
7,오사카 난카이 간사이공항 라피트 티켓  편도권 왕복권 ,Trip
8, 즉시확정  일본 후쿠오카 유후인    북큐슈 레일패스   일 성인가 ,Trip
9,프랑스 파리 몽생미셸 에트르타 옹플뢰르 버스 일일 당일투어 인디고트래블 ,Trip
10,라스베가스 그랜드캐년 헬기투어 웨스트림  착륙  ,Trip
11, 박 일 치앙마이골프 태국골프여행 노스힐   그린 숙소 식당 최상,Trip
12, 콤보  조호바루 레고랜드   워터파크   씨라이프 입장권  씨라이프 말레이시아  일 패스 어린이권  ,Trip
13,강원도 태백 초보 오투리조트  박 일 스키캠프 어린이 안전 스키강습,Trip
14,지산리조트스키장렌탈샵 브라더스 이용권 지산리프트권,Trip
15,  라우터 프리미엄    차량용와이파이 무선인터넷,Trip
16,비발디파크 리프트 스키 보드 장비 의류 렌탈 대여 패키지 리더스스키,Trip
17,서울 성동구 공유오피스 소호사무실 비상주사무실,Trip
18,가족여행 북유럽 아이슬란드에 패키지 유럽 노르웨이 핀란드 크루즈 오로라투어,Trip
19, 국내당일배송 일본교통카드 이코카        엔 일본전지역 사용,Trip
20,한국 선불유심 전화 데이터     무제한   일,Trip
21,루브르 감성 투어 소수정예 쪽집게 인문학 강의,Trip
22,가평 강촌 춘천 강촌북청레저     사륜바이크  스쿠터  서바이벌  자전거,Trip
23,홍천 대명 비발디파크 스키장 리프트권 패키지 야간 밤샘권 새벽권 패키지 새벽스키,Trip
24,로얄캐리비안크루즈 인천출발 연말  박 일 효도여행 세미패키지,Trip
