,titles,category
0,프로에잇청담 리퀴드 디파인 라이너      ,Makeup
1,요거트젤 탕후루 시럽젤네일 단품,Makeup
2,바이옴액티베이트 멀티 밤 스틱    ,Makeup
3,메디큐브 제로 폼 클렌저      ,Makeup
4,메이크프렘 세이프 미 릴리프 모이스처 클렌징 폼      ,Makeup
5,에네스티 믹스 베리 약산성 샴푸       ,Makeup
6,나어릴때 엣지홀릭 브러쉬 아이라이너     ,Makeup
7,이솝 로즈 오 드 퍼퓸,Makeup
8,더페이스샵 디자이닝 아이브로우      리필 ,Makeup
9,모도루 헤어 리쥬브네이팅 솔루션 트리트먼트      ,Makeup
10,비욘드 엔젤 아쿠아 모이스처 클렌징 폼      ,Makeup
11,라로슈포제 에빠끌라 울트라 컨센트레이티드 세럼     ,Makeup
12,조성아   슈퍼 핏 커버 스틱파운데이션  엑스            ,Makeup
13,플란투어   파이토 카페인 토닉      ,Makeup
14,시세이도 서브리믹 아쿠아 인텐시브 손상 모발용 샴푸      ,Makeup
15,엘렌실라 에스카르고 슈퍼리페어 크림     ,Makeup
16,리프팅밴드 얼굴 주름 마사지 브이라인 땡기미 기구 이중턱 턱살 닥터 땡김이 일반형 그레이,Makeup
17,아크네스 더마 릴리프 모이스쳐 폼 클렌져      ,Makeup
18,아이오페 에어 쿠션  세대 내추럴            ,Makeup
19,식물나라 세안비누          개   비누 세수,Makeup
20,오가니스트 체리블라썸 샴푸      ,Makeup
21,스케다 남자 올인원 데일리 프레시      ,Makeup
22,셀퓨전씨 토닝   잡티 세럼     ,Makeup
23,한율 송담 탄력  종 세트,Makeup
24,뉴트로지나 비져블리 리뉴 바디 로션      ,Makeup
25,동국제약 기미 앰플 맥스 홈쇼핑 마데카 멜라캡쳐 앰플 시즌  멜라캡처  박스,Makeup
26,엔모먼트 올인원 남자비비크림  남자파운데이션           ,Makeup
27,자담유 맥틴 맥주효모 비오틴 탈모완화 샴푸      ,Makeup
28,라마망 천연 아로마 에센셜 꿀잠 오일     ,Makeup
29,이브로쉐 모링가 리프레시 헤어식초        두피 진정 딥클렌징 ,Makeup
30,      바름 네일 앤 큐티클 리페어 에센스 오일 펜,Makeup
31,    비바스 약산성     클렌징 오일       메이크업 립 아이 세안 폼 피부 각질 블랙헤드,Makeup
32,닥터포헤어 폴리젠 실크 트리트먼트 가는 손상 모발용      ,Makeup
33,미용실 다운펌     ,Makeup
34,하트자석네일 네일철사 자석네일전용철사 와이어,Makeup
35,달바 비건 폼 클렌저       개   최대       이탈리아 딥 클린 클렌징   쫀쫀거품,Makeup
36, 현대미아점   키엘      키엘 수분크림 스틱 밤 세트,Makeup
37,하루 브이 리프팅밴드 얼굴 마사지 브이라인 땡기미 팔자주름 이중턱 마사지기구  개,Makeup
38,에뛰드 재창조 메이커   ,Makeup
39,토니모리 더 촉촉 그린티  종 세트,Makeup
40,어바웃미 숲 진정 수분 세럼     ,Makeup
41,아카보쿠쥬우 헤어 컬러       ,Makeup
42,닥터큐먼 콜라겐 크림팩 시즌  프리미엄 타입원 보습 광채 콜라겐팩 홈쇼핑      개 스파출라,Makeup
43,닥터그루트 마이크로 바이옴 앰플 트리트먼트      ,Makeup
44,비타스틱 비타민담배 금연보조제 금연초 금연 스틱 파이프 피우는비타민 편의점 약국 비타센스,Makeup
45,이자녹스 에이지포커스 옴므  종 세트,Makeup
46,에센허브 티트리    클리어 바디 미스트      ,Makeup
47,설화수 퍼펙팅쿠션  호 본품 리필         ,Makeup
48, 듀오  촉촉밀착  더툴랩 해피림 메이크업 스펀지 퍼프 하이드로 파운데이션 똥퍼프 물방울  개입  팩,Makeup
49,리프팅 부스터 고함량 앰플                  ,Makeup
50,마몽드 포어 슈링커 바쿠치올 패드      ,Makeup
51,디올뷰티 립 글로우 오일    ,Makeup
52,에클리스 피디알엔   퍼센트 바이알 앰플     ,Makeup
53,시세이도프로페셔널 서브리믹 아쿠아 인텐시브 손상 모발용 트리트먼트         ,Makeup
54,코르테 더모 에센셜 리치 엠 크림      ,Makeup
55,       울트라 파워프루프 리퀴드 라이너   ,Makeup
56,무슈제이 밀크 톤업 올인원      ,Makeup
57,더랩바이블랑두 올리고 히알루론산 카밍 플러스 크림     ,Makeup
58,니베아 립케어 히알루론 모이스쳐 플러스         개   립밤,Makeup
59,    글로우 립 컬러   ,Makeup
60,메이크업포에버 에이치디 스킨 파우더 파운데이션    ,Makeup
61,우르오스 스킨 워시      ,Makeup
62,       노 리터치 보정 카라     ,Makeup
63,자민경 크레마카라콜 프리미어 달팽이 크림     ,Makeup
64,아모스 발효곡물 펌      ,Makeup
65,동화약품 후시드 크림     ,Makeup
66,버츠비 레몬 버터 큐티클 크림    ,Makeup
67,투쿨포스쿨 아트클래스 디자이닝 브러쉬 키트 혼합 색상  세트,Makeup
68,스킨베네핏 퀵커버 헤어 컬러 마스카라   ,Makeup
69,아트릭스 대용량 핸드 앤 네일 케어 모이스처라이저          개 크림 로션,Makeup
70,퍼퓸 핸드크림       개   더블유드레스룸 끈적임 없는 보습 핸드크림    ,Makeup
71,몽블랑 익스플로러 울트라 블루 오 드 퍼퓸,Makeup
72,메디필 엑스트라 슈퍼  플러스 액티브 스틱    ,Makeup
73,베네피트 구프 프루프 브로우 펜슬      ,Makeup
74,비욘드 클래식 핸드크림 딥모이스처      ,Makeup
75,까탈릭 나르시스 무드레이어 립스틱      얼루어핑크       개,Makeup
76,탬버린즈 라레 퍼퓸,Makeup
77,닥터 멜락신 시멘리트 칼슘 볼륨  종 골조 아이라인 세트,Makeup
78,코코퐁 코털왁스 셀프왁싱 남자 코털제거 턱 수염 눈썹 왁싱 제모 재료     ,Makeup
79,아모스 에너지 오일 세럼     ,Makeup
80,시세이도 엔리치 염색약    ,Makeup
81,비레디 블루 쿠션           ,Makeup
82,닥터지 프레스티지 마유 토너      ,Makeup
83,블리스텍스 립 릴리프 크림   ,Makeup
84,온더바디 해피 브리즈 퍼퓸 바디 워시      ,Makeup
85,에프에프 호호바 딥 클렌징 오일      ,Makeup
86,에이지    팩트 아이디 에센스 커버 팩트    다이아에디션 리필  개 리필   호,Makeup
87,닥터지 블랙 스네일 레티놀 앰플     ,Makeup
88,아리아나그란데 땡큐 넥스트 우먼 오 드 퍼퓸,Makeup
89,에뛰드 룩 앳 마이 아이즈   ,Makeup
90,다슈 프리미엄 메가 홀드 슈퍼 스프레이      ,Makeup
91,더마팩토리 나이아신 히알루론     세럼     ,Makeup
92,     입생로랑 르 쿠션 엉끄르드 뽀 쿠션 팩트   호 미니     세트,Makeup
93,디젤 울트라 본더    ,Makeup
94,      블랙 유자 빈 밀크 클렌져 헤브블루,Makeup
95,포맨트 코튼 배쓰 퍼퓸,Makeup
96,웨이크메이크 믹스 블러링 볼륨 쉐딩    ,Makeup
97,닥터디퍼런트     모이스처라이저       중건성 ,Makeup
98,닥터지 그린 마일드 업 스킨 선 로션             ,Makeup
99,   최초공개  클리오 뉴 마그넷팩트 윈터 트위드 에디션,Makeup
100,탑클래스 더 콜라겐 리프팅 헤리티지 크림     ,Makeup
101,헤라 소프트 피니시 루스 파우더    ,Makeup
102,메디플라워 퍼퓸 핸드크림     모음,Makeup
103,김정문알로에 큐어 피토 그린 앰플 에스     ,Makeup
104,토니모리 백젤 아이라이너     ,Makeup
105,청담남자 올인원 프리미엄 왁스     ,Makeup
106,바이오큐틴 레귤레이터 에이전트 두피 케어 영양 잔머리 앰플      ,Makeup
107, 듀이셀  필터링크림                     ,Makeup
108,  도미나스 멀티밤    ,Makeup
109,클리오 킬커버 스킨픽서 픽서 쿠션 기획 본품 리필  퍼프 매,Makeup
110,더페이스샵 컨실러 듀얼 베일     ,Makeup
111,로라메르시에 앰버 바닐라 핸드크림     ,Makeup
112,클리오 붕세권 에디션 쉬폰 블러 틴트     ,Makeup
113,젤존감 트리트먼트 칼라 크림     ,Makeup
114,바이오힐보 리프팅 괄사 마사저,Makeup
115,조 말론 런던 잉글리쉬 페어 앤 프리지아 바디 크림      ,Makeup
116,려 함빛 극손상 앤 영양 컨디셔너      ,Makeup
117,이솝 시트러스 멜란지 바디 클렌저      ,Makeup
118,오휘 더 퍼스트제너츄어  종 스킨 로션 기초세트 수분 보습 안티에이징,Makeup
119,다슈 맨즈 아쿠아 딥 워터풀 올인원 로션      ,Makeup
120,아이레놀 아이 크림     ,Makeup
121,언제나  여드름 저자극 세안제 아침 순한 버블 모공 어린이 청소년 초등학생 중학생 사춘기,Makeup
122, 행사  유즈미 바디젤 링크젤  개묶음행사 교차가능,Makeup
123,    퍼펙팅 래스트 파운데이션            ,Makeup
124,레뜨레 듀얼 핏 컨실러      ,Makeup
125,폴텐 비듬샴푸      ,Makeup
126,헤라 하이드로 리플렉팅 토너      ,Makeup
127,세리오 큐티클 리무버      ,Makeup
128,메이크업포에버 프리시젼 파우더 브러쉬    ,Makeup
129,     마이스트롱 오토 아이브로우      ,Makeup
130,산다화 순한 클렌징 동백 오일      ,Makeup
131,알앤비 피톤 테라피 하드 헤어스프레이      ,Makeup
132,바디판타지 프레시 화이트 머스크 바디 미스트      ,Makeup
133, 디올      포에버 쿠션 케이스 앤드 리필,Makeup
134,비욘드 엔젤아쿠아 모이스처 플럼핑 립세린     ,Makeup
135,헤라 센슈얼 누드 글로스    호 란제리         ,Makeup
136,티르티르 마이 글로우 크림 쿠션           ,Makeup
137,마뉴팍투라 맥주 샴푸      ,Makeup
138,셀퓨전씨 토닝 썬쿠션            ,Makeup
139,네일 우드화일 우드파일,Makeup
140,라메종 스칼프샴푸 대용량       ,Makeup
141,페리페라 잉크 더 에어리 벨벳 물복딱복 컬렉션   ,Makeup
142,로레알파리 헤어 스파 딥 너리싱 샴푸       ,Makeup
143,탈젠 플러스 샴푸     ,Makeup
144,스와로브스키      브이컷 크리스탈        알 젤네일파츠 네일스톤 셀프 네일아트재료,Makeup
145,아모스 녹차실감 볼륨 미스트      ,Makeup
146,일리윤 울트라 리페어 딥 모이스춰 워시      ,Makeup
147,     어딕트 라커 스틱     ,Makeup
148,    배쓰앤바디웍스 향기로운 핸드솝 손세정제 핸드워시 손청결제,Makeup
149,속눈썹 연장 패치 하이드로겔,Makeup
150,헤라 스킨 래디언트 글로우 쿠션 본품    ,Makeup
151,리포브 알이피 홀바디 스틱    ,Makeup
152,헤이미쉬 올 클린 밤      ,Makeup
153,     시즌  달바 화이트 트러플 프라임 미스트 세럼 한혜진 승무원 세럼       개,Makeup
154,라라로즈데이 이너퍼퓸  존 케어 질냄새 제거 오일 향수 올영 여성청결제    ,Makeup
155,닥터원더 악어발팩    ,Makeup
156,호랑이 괄사,Makeup
157,비오템 라이프 플랑크톤 피부강화 에센스 로션     ,Makeup
158,    롤러 더마 홈케어 마이크로니들     ,Makeup
159,조르지오아르마니 립 파워     ,Makeup
160,뉴트로지나 딥클린 젠틀 포밍 클렌저       민감성 ,Makeup
161,모로칸오일       헤어 오일 에센스 모르칸 미용실 아르간 수분,Makeup
162,어노브 딥 데미지 리페어 샴푸     ,Makeup
163,파이토신 재생 크림 레이저 피부과 시술후 트러블 홍조          브이큐엠 코나피딜,Makeup
164,리즈케이 퍼스트  세럼 시즌  비타민 씨 앰플  개입,Makeup
165,비겐 크림톤 염색약     새치염색 염모제    코스트코,Makeup
166,인셀덤 스노우 엔자임 클렌저      ,Makeup
167,실크테라피 본드 앤 리페어 에센스     ,Makeup
168,루이본 비건 누드 쌍꺼풀 테이프 티안나는 단면 쌍테   회분,Makeup
169,       컬러핏 스틱 섀도우     ,Makeup
170,피지오겔 프로 인텐시브 크림         ,Makeup
171,히스토랩 하이드로겔 리제너레이팅 센텔라 크림     ,Makeup
172,이자녹스 커버 수프림 리치 에센스 투웨이 팩트           ,Makeup
173,나스 립스틱     ,Makeup
174,에스트라 더마 유브이     톤업 선크림             ,Makeup
175,베르뷔 곤약 스크럽 바디워시      ,Makeup
176,랩시리즈 올인원 디펜스 로션            ,Makeup
177,설화수 순행클렌징폼       오일        리뉴얼 주황 신형  택 ,Makeup
178,뉴트로지나 포밍   증정 뉴트로지나 딥클린 클렌징 오일         ,Makeup
179,데이셀 닥터비타 프리미엄 비타민   크림     ,Makeup
180,닥터바이오 에코 올인원 클렌저      ,Makeup
181,마몽드 크리미 틴트 컬러 밤 인텐스     ,Makeup
182,화장품 소분 리필 공병 크림용기   화이트   ,Makeup
183,토소웅 리얼 콜라겐 핏    ,Makeup
184,데이지크 섀도우 팔레트    뮤티드 넛츠     ,Makeup
185,라카 러브 실크 블러쉬     ,Makeup
186,마메온 롤빗 블랙 열판 브러쉬 뿌리볼륨 머리빗  호            ,Makeup
187,라입 리페어 헤어 트리트먼트 러블리       ,Makeup
188,아멜리 플랫립스     ,Makeup
189,데미 염색약 어솔트 아리아     퓨저니스트      미용실 눈썹 뿌리 새치 산화제 일본,Makeup
190,시드물 닥터트럽 스킨 리터닝 징크 크림     ,Makeup
191,뉴스킨    도 프렙 앰플           개입,Makeup
192,견미리 팩트 티니올 디 오리지널 크리미 커버 쿠션 크림형 파운데이션 리필       ,Makeup
193,릴리바이레드 나인 투 나인 서바이벌 펜 라이너     ,Makeup
194,린제이 진정약초 모델링 팩     ,Makeup
195,오로지 세라믹 미니괄사 세트,Makeup
196,동구밭 올바른 고체 샴푸바       종 ,Makeup
197,롬앤 한올 플랫 샤프 브로우         한올라인,Makeup
198,아이디얼포맨 블레미쉬커버 비비크림              ,Makeup
199,달바 에이지리스 링클 코렉팅 멀티 밤    ,Makeup
