,titles,category
0,     막스마라 마누엘라 여성 울 벨트 코트                        ,Fasion
1,쉬즈미스 핸드메이드 후드 벨티드 숏 코트            ,Fasion
2,          기모 유로센스 레깅스,Fasion
3,여성 구김없는 실켓 스판 와이셔츠 모음  화이트 블랙 롱 블라우스 남방,Fasion
4,올리비아하슬러 심플 밴딩 슬랙스          ,Fasion
5,베어파우 베어파우                양털부츠       ,Fasion
6,탑텐 여성 더 웜 벨로아 조거 팬츠           ,Fasion
7,부드러운 캐시미어 크롭 가디건 숏 라운드 니트가디건 여성 가디건 가을 간절기 레드 핑크,Fasion
8,밀라 기모 모달 티블라우스  종                 ,Fasion
9,듀엘 러플 소매 자수 포인트 원피스           ,Fasion
10,린 리엔카  라인 원피스           ,Fasion
11,     챔피온 스트랩 벨벳 메리제인             ,Fasion
12,나인 디안 울 셋업 핸드메이드 스커트                ,Fasion
13,네모팬티 뉴베이직 여자사각팬티 드로즈 심리스,Fasion
14,메일리 시원한 여름 시스루 커버업 비치웨어 루즈핏 여자 여성 긴팔 롱 셔츠 남방 블라우스,Fasion
15,헤지스레이디스 헤지스 여성       몰                턱장식 팬츠            ,Fasion
16,지오다노 여      브이넥 립 가디건       ,Fasion
17,올리       셔링 패딩 아이젠 부츠 최종가,Fasion
18,올리비아로렌 퀼팅 숏 패딩            ,Fasion
19,라코스테      코튼 스트레치 팬츠               ,Fasion
20,잠뱅이     가을 여자 진청 일자 스판 청바지          ,Fasion
21,              라글란 헤링본코트           ,Fasion
22,리스트 코듀로이 배기 밴딩 팬츠,Fasion
23,쿠키 곰돌이 순면 누빔 커플 잠옷 긴팔 가을 겨울 수면 잠옷 파자마 홈웨어,Fasion
24,비너스 비너스오르화 왕뽕브라 햄팬티세트                ,Fasion
