,titles,category
412,상품명    화이트  드림책꽂이   서랍형 책정리꽂이 미니책꽂이 책정리대 책정리선반 책정리꽂이 서랍식책꽂이 책,Interior
413,상품명    엔틱  드림책꽂이   서랍형 책정리꽂이 미니책꽂이 책정리대 책정리선반 책정리꽂이 서랍식책꽂이 책상,Interior
414,상품명    월낫  드림책꽂이   서랍형 책정리꽂이 미니책꽂이 책정리대 책정리선반 책정리꽂이 서랍식책꽂이 책상,Interior
415,상품명  네이비  시스맥스 마이룸 책꽂이  단 북앤드 정리함 화일꽂이 파일꽂이 책꽂이 책정리 잡지정리 인테리어,Interior
416,상품명  민트  시스맥스 마이룸 책꽂이  단 북앤드 정리함 화일꽂이 파일꽂이 책꽂이 책정리 잡지정리 인테리어소,Interior
417,상품명  쿨그레이  시스맥스 마이룸 책꽂이  단 북앤드 정리함 화일꽂이 파일꽂이 책꽂이 책정리 잡지정리 인테리,Interior
418,상품명  블랙  책상 책장 서류 정리 수납 마이룸 책꽂이  단 책정리 접이식책꽂이 서류정리 책상정리 책꽂이칸막이,Interior
419,상품명  화이트  책상 책장 서류 정리 수납 마이룸 책꽂이  단 책정리 접이식책꽂이 서류정리 책상정리 책꽂이칸막,Interior
420,상품명  아이보리         심플 접이식 철재  인용 라운드 책상                컴퓨터책상 게이밍책상 사무용책상,Interior
421,상품명  블랙        심플 접이식 철재  인용 라운드 책상                컴퓨터책상 게이밍책상 사무용책상  인,Interior
422,상품명  블랙         심플 접이식 철재  인용 라운드 책상                컴퓨터책상 게이밍책상 사무용책상  인,Interior
423,상품명  단 책꽂이 회색 책상정리 책상책꽂이 사무실책꽂이 서류꽂이 플라스틱책꽂이 북앤드 북엔드 미니책꽂이 오,Interior
424,상품명 심플리 원목 북앤드책꽂이       원목 책칸막이 책선반 책꽂이 우드책꽂이 원목책꽂이 인테리어책꽂이 인테,Interior
425,상품명 멀티책꽂이  단       시스맥스  책꽂이 꽂이 다용도꽂이 문구용꽂이 책정리 책장 책보관 책정리함 서류꽂,Interior
426,상품명 책꽂이겸용결재함         도이  책꽂이 꽂이 다용도꽂이 문구용꽂이 책정리 책장 책보관 책정리함 서류꽂,Interior
427,상품명   포유데어  단 서랍 책꽂이      간이책꽂이 책꽂이 기본책꽂이 책상책꽂이 테이블정리 책상정리 사무용품,Interior
428,상품명 트린지 각도 높이 조절 미니 좌식 식탁 탁자 테이블 접이식테이블 각도조절테이블 높이조절테이블 좌식탁자,Interior
429,상품명    높이조절 각도조절 다용도 접이식 테이블         테이블 노트북테이블 침대테이블 베드트레이 침대용케,Interior
430,동화속나무 상품명 스텐드 미니 책꽂이,Interior
431,상품명 공구없이 조립하는 종이책장  형 단    ,Interior
432,상품명 공구없이 간단히 조립하는 골판지 책장  형 단,Interior
433,상품명 페이퍼팝 종이 책장  단  형,Interior
434,상품명   코리아 책고정대       북스탠드 색상랜덤,Interior
435,상품명 영오피스  칸 화일박스 서류분류 책꽂이,Interior
436,상품명 모던 접이식 책꽂이 길이조절 자바라책꽂이,Interior
437,상품명 어반 원형프레임 접이식 책꽂이 자바라책꽂이,Interior
438,상품명 화이트 펜슬 북엔드   세트 화이트  철재책꽂이,Interior
439,상품명 오피스 서류보관 학생 공부집중 공간활용  칸 책꽂이,Interior
440,상품명   마타 지붕책장    ,Interior
441,상품명   마타  칸 지붕책장    ,Interior
442,상품명 플렉스박스    핑크       다용도정리함,Interior
443,시스맥스 상품명 시스맥스 마이룸 책꽂이  단 그레이      ,Interior
444,상품명   포유데어  단 서랍 책꽂이     ,Interior
